text,label
พม่าทำงานที่.นึง แต่ พักอาศัย อีกแห่งนึง อย่ามองข้ามนะเจ้านาย และ ชาวพม่าวันหยุดเขามักจะไปทำบุญ ที่วัดครับ และไปเที่ยวหาญาติ รวมถึง พม่าที่ทำงานเป็นเด็กติดรถ แต่มีทีพักเดียวกับผู้ติดเชื่อ รวมถึง ล้งแกะกุ้ง.มีกระจ่ายทั่วจังหวัด,1
เชื้อที่ติดไปกับอาหารทะเล...ที่หยุดการขายแล้วเอาไปแช่แขงวันนี้.. เชื้อคงไม่ตายรอขายใหม่เหรอ... พม่านำเชื้อเข้ามา คนใทยวิจารและกัดกันเยี่ยงสุนักจนตรอก,1
Surakarn Chaipach ตายอยู่แต่บ้านจะเอาอะไรแดก เนี่ยบริษัทจ่ายครึ่งเดียว ค่ารถค่าบ้าน ตัดไฟแต่ต้นลมไม่ตัด แรงงานพม่าเจอ ก็ให้มันกลับประเทศเลยคนลักลอบอย่าไปส่งสารมัน มันเอาภัยบิบัติมาให้ ส่วนคนที่เขามาถูกต้องเขาก็ไม่ได้ติดอะไร นะ,1
เราเห๊นใจคะแต่เรากลัวโรคติดต่อมาให้ถุกต้องกันนะคะตรวจก่อนแล้วค่อยมาช่วยบอกเพื่อนหรือพี่น้องชาวพม่าอย่าหลบกันนะคะออกมาให้เขาตรวจใม่ต้องกลัวประเทศใม่ใจร้ายคะ,0
ประวัติศาสตร์จะต้องจารึกพวกพม่าอีกรอบไทยไม่เคยเบียดเบียนใครนะที่ผ่านมามีแต่ประเทศอื่นมาอาศัย ถามผู้นำมันหน่อยว่าถ้าโคตรเง้ามันจะตายแบบนี้มันมีปัญญาช่วยลูกหลานมันใหม สร้างปัญหาให้คนอื่นตลอดเลยคนบุเรงนอง,0
มึงจะเอาพม่าเข้ามาอีก60000คนทำเหี้ยไรคนไทยกะฆ่าตัวตายรายวัยอยู่ตกงานไม่มีงานทำเห็นแก่เงินค่าหัวแล้วทำเค้าเดือดร้อนหมด,1
สงสารรรร ถ้าไม่มีพม่า แรงงานก็ไม่มีใครทำ,0
ช่วงนี้พม่าล่าอาณานิคม ไล่ยึดที่ดินทำกินพี่น้องชาติสิบพันธุ์ หลายคนต้องการหนีภัยสงคราม หนีความอดอยาก ไม่ต้องถามเข้าจะหนีไปพึ่งใบบุญที่ไหน,0
ในขณะที่ประเทศไทยกำลังหนีตายจากโรคโควิด-19 ปิดร้านปิดกิจการ คุณพม่าจะมาทำงานอะไร รัฐบาลคะจะรับพม่ามาหรือคะ,1
กุขอให้มึงตายห่าให้หมดอีพม่า,1
สู้ๆๆๆๆๆคับผมยุประจวบติดด่านสิงขรเราจะระวังตัวพวกคุณชาวพม่าก็ดูแลตัวเองนะคับสู้ๆๆอย่าท้อ ท้อเอาไว้ให้ลิงถือนะ,0
ยิงแม่งทิ่ไปไอ้พม่าชิบหาย,1
พม่าข้ามเข้ามายิงทิ้งเลยเชือดไก่ให้ลิงดูบ้าง,1
ใครจะเอาพม่าเข้าในไทยมันตายแน่,1
ยุภา บัวเมือง เราใช้แม่บ้านพม่ามานานแล้วบาคนรักเราเหมือนแม่เคยกราบเท้าเวลาเราช่วยเหลือ มารยาทก็อ่อนน้อมเวลาให้ของรับแบบสุภาพ,0
มึงจะบ้าปาวอีพวกเหี้ยพม่า. มึงตายอยุ่บ้านมึงดีแล้ว,1
ผมขอบอกตามตรงนะว่าใครที่ยังไม่เคยสัมผัสตัวตนที่แท้จริงของชาวพม่าจะไม่รู้หรอกว่ากพวกเค้าเป็นอย่างไรผมเคยทำงานร่วมกับชาวพม่าในสมัยที่ผมออกทะเลไปกับเรืออวนลากเดี่ยวที่ปากน้ำชุมพรพม่าที่ดีก็มีที่ไม่ดีก็มีเพราะฉนั้นอย่าไปเหมารวมว่าเค้าไม่ดีทั้งหมดพม่าที่ผมเคยออกทะเลมาด้วยกันส่วนมากนิสัยดีมีน้ำใจและเป็นมิตรที่ดีตอนนี้เราควรหาวิธีช่วยเหลือและแก้ไขมันจะดีกว่านะ,0
พม่าบุกกรุง ยกทัพมาทางตะวันตกของกรุงแล้ว ชาวกรุงเตรียมรับศึกครั้งนี้ยิ่งใหญ่นัก อาจจะตายเป็นเบือ,1
พม่าเผากรุงแบบเนียนๆ,1
คนเมียนมาร์ก็มีหัวใจ พม่าไทยเราพี่น้องกัน เอื้ออาทรต่อกันนะคะ เป็นกำลังใจให้ทุกคนค่ะ,0
ที่ไหนมีพม่าที่นั้นมีโควิดตายยยยยย,1
อันนี้เป็นสื่อเรื่อง covid-19 ภาษาพม่า ที่เพื่อนจ่าเขาทำให้หน่วยงานที่เกี่ยวข้องอยู่ รบกวนช่วยพ่อแม่พี่น้องที่อ่านภาษาพม่าออก ช่วยพรูฟหน่อย ว่าคำถูกต้อง เนื้อหาโอเคมั้ย ถ้าโอเคจะได้ประชาสัมพันธ์เลย ปล มีคนฟีดแบคมาว่า คนที่มาทำงานบ้านเรา เป็นไทยใหญ่ก็เยอะ ซึ่งใช้คนละภาษากับชาวพม่า ควรทำเอกสารพวกนี้ภาษาไทยใหญ่ด้วย ว่าแต่ใครอ่านเขียนภาษาไทยใหญ่เป็นมั่งครับเนี่ย,0
คิดว่าคุมยากกว่ารอบแรกค่ะ เพราะพม่ามียุทุกที่ หากมีคนติดเดินทางไปหาเพื่อน หาญาติ เราก็ไม่สามารถรู้ได้ ดูแลตัวเองด้วยนะค่ะ,0
พม่ามีทั่วในเขตอุตสาหกรรมของประเทศไทย น่ากลัวนะแบบนี้ อีกอย่างพวกมันชอบเคี้ยวหมาก ชอบบ้วนน้ำหมากทิ้งไปทั่วเป็นการกระจายเชื้อได้อย่างรวดเร็ว อีกอย่างตอนนี้อากาศหนาวเย็นเชื้อตายยาก,1
รับมาทำเหี้ยรัยค่ะ คนประเทศมึงเค้ายังผลักดันออกมา แล้วผลักส่งมาที่ประเทศไทย น่าจะจับแม่งมาเผาดูดิแม่งใครจะมาอีก พม่าบ้างคนทำตัวกร่าง เดินจะครองจังหวัดอยู่แร้ว ชิวไม่ใส่หน้ากาก พวกเหี้ยกูเกลียดพวกมึง,1
รักท่านคะขอให้ท่านประสบความสำเร็จในการดูแลประชาชนชาวสมุทรสาครเป็นกำลังใจให้พี่น้องชาวสมุทรสาครและเพื่อนบ้านชาวพม่าค่ะ,0
ก็บอกแล้วตั้งแต่มีนา63 ให้คุมเข้มแรงงานพม่า ไม่รับเพิ่ม ขนเงินกลับไปเยี่ยมบ้านแล้วไม่รับกลับ ต้องเข้มใจต้องแข็ง อย่ายอมนายทุน ยอมเฉือนเนื้อสักก้อน เพื่อรักษาเนื้อส่วนใหญ่ พลาดจนได้เพราะไม่เชื่อ เพื่อนบ้านอิจฉา ขนาดโควิดระบาด ไทยก็ควบคุมได้ ก็ต้องส่งคนมีเชื้อเข้ามาบ่อนทำลายเศรษฐกิจเราโดยรวม,0
ส่งกลับประเทศได้ก็สงไปเถอะครับ จะออกหน้าบังพวกพม่าทำไมครับ เรื่องมันจบก็ค่อยมาใหม่ได้นิ คุณคิดว่าตอนนี้เขาจะยังทำงานยุหรอ คนเขากลัวตายกันทั้งประเทศ คิดหน่อยคิด ตอนนี้มันไม่ได้เป็นปกตินะครับ ที่จะเรียกร้องให้เห็นความเป็นธรรม,1
พวกปันญาอ่อนโควิคกำลังระบาดอีกรอบก็มาจากพม่า พวกมึงยังจะหน้าด้านขอเข้ามาไทยในช่วงคนกำลังติดเชื้อเยอะๆนี้นะ ตายห่าอยู่บ้านพวกมึงนั้นแหละ,1
สมัยก่อนเสียกรุงให้พม่า ตอนนี้จะตายเพราะพวกพม่าอีกแล้วรึ,1
จริงอยู่คับที่คาเงินเราสูงกว่าเช่น1บาทเราเท่า100เขา เเต่สินค้าเขาก็สูงเหมือนกัน แบบใข่บ้านเรา5บาท. บ้านเขา500. เเต่ที่ไทยมีงานให้ทำไม่ลำบากมาก (เพื่อนที่เป็นพม่าบอกมา),0
ไม่มีแต่พม่าหลอกค่ะแถวนั้นก็คนไทยหลายยุสู้ๆๆค่ะ,0
เห็นพม่าเขามาแจกขัาวสาร..อาหารแหังมาแจกกันเยอะมาก.เลยเขาช่วยเหลือกันดีมากเลย,0
คนไทยก็จะผูกคอตายกันหมดแล้ว ถ้าจะเปิดรับเข้ามาน่ะฉีดยาตายทั่วประเทศซะดีกว่ามั้งไม่ต้องทรมาน นายยกโง่ๆก็เอาไปปล่อยพม่าซะ เหนื่อยใจประชาชน,1
เราสงสารนะคนพม่าเมียนมา,0
ล็อตสมุทรสาครตั้งแต่ตรวจเจอคนแรกที่แพกุ้ง ล้อมกรอบห้ามออกนอกจังหวัด คนนอกห้ามเข้า ทั้งคนไทยและพม่า ชดเชยรายได้ให้คนสมุทรสาคร ตั้งแต่ตอนแรก มันไม่น่าจะลามมากขนาดนี้ ตอนนี้จะเอาอยู่ใช่ไหม ปีใหม่คนพื้นที่สีแดงก้อไปเที่ยวกลับบ้านในจังหวัดพื้นที่สีเขียว แล้วเอาเชื้อไปติดอีก ลามกันไปหมด สงสารคนทำมาหากิน คนไม่ทีเงินเดือนจะทำอย่างไง??????,0
ขอบคุณที่คุณหมอได้พูดแทนคนไทย ไม่ใช่คนไทยทุกคนที่รังเกียจคนพม่า เราก็คนเหมือนกัน ต้องช่วยกัน ก่อนจะมาเป็นไทยเราก็ญาติพี่น้องกัน เพียงแค่มีอนาเขตกั้นเท่านั้น เช่นเดียวกับคนลาว และกัมพูชา คนพม่าก็เพิ่งน้อยใจคนไทยครับ คนไทยส่วนใหญ่ก็ไม่ได้รังเกียจคุณ ขอให้ผ่านพ้นไปด้วยกัน ขอให้คนพม่าทุกคนเข้ามาแล้วช่วยกันทำตามกฎหมาย และไม่ก่อความวุ่นวายก็พอ ขอบคุณชาวพม่าทุกคนที่ท่านมาเป็นส่วนหนึ่งของประเทศเราทุกวันนี้ สู้ๆครับชาวเมียนม่า,0
ถ้าจะปิดจริงๆ ต้องไปจับคน ที่ไปขนเอาพม่าใส่รถตู้มา พวกมันเห็นแก่เงิน บ้านบ้านเมืองโควิดระบาด ต้องไปจับคนค้ามนุษย์ เลวบ้านเดือดร้อน เพราะคนเห็นแก่ตัว,0
Rmuay Goiiy ลูกครึ่งพ่อจีนแม่พม่า นะจ๊ะ นะจ๊ะ เพื่อนฉัน แหมถ้าลูกครึ่งฝรั่งนางจะสวยกว่านี้ อ้าวนอกเรื่อง. โทธๆ,0
ไอ้ชิปหาย มัวแต่เอาทหาร ตำรวจ มาปราบม๊อบ พม่าลอบตีกรุงศรี ตายห่าหมด,1
ไอ่พวกพม่ามันใหญ่มาจากไหนอย่าให้เข้ามาคนไทยจะอดตายอยู่แล้วยิ่งกว่ายังเอาโควินมาแพร่ในประเทศไทยเนาอีกไม่น่ารับเลยนะค่ะสารคนไทยให้มากๆๆค่ะ,1
ผมเข้าใจหัวอกคนพม่าบางคนเลย(โดยเฉพาะคนที่ไม่ติดแล้วโดนเหยียด) คนที่ไม่ได้ติดกลับต้องโดนพวกคนไทย(ใจดำ)บางจำพวกทำนิสัยเเย่ๆใส่ เพราะผมเรียนอยู่อังกฤษ ผมก็โดนไล่ออกจากร้าน ไม่ขายอาหารให้ผม ด่าผมว่าผมอย่างกะหมูกะหมา เพราะมันคิดว่าผมเป็นคนจีน นำโควิดเข้ามาประเทศมัน ผมโดนเหยียดสารพัดสิ่งทั้งๆที่ก็บอกไปแล้วว่าผมเป็นไทยไม่ใช่จีน แต่ผมยังดีแค่โดนเหยียด แต่เพื่อนคนลาวผม เดินอยู่ดีโดนชกเข้าหน้าอย่างจัง แล้วมันด่าว่ Go back ur fukin country ? แล้วมันก็วิ่งหนีไปเลย,0
ไม่ต้องคิดมากครับไม่ว่าใครจะไปอยู่ที่ไหนไปอยู่ประเทศอะไรแม้แต่คนไทยไปอยู่ที่ประเทศอื่นก็ต้องเจอเหมือนก้นไม่มากก็น้อยครับคนเราร้อยพ่อพันแม่ความคิดไม่เหมือนกันครับเราขอเป็นกำลังใจให้เพื่อนๆ พม่าทุกคนครับเพราะเราคือพี่น้องร่วมโลกใบเดียวกันครับ สู้ สู้ ครับ,0
ควยคนไทยตกงานเป็นล้านไม่มีงานทำ ไม่จ้าง แต่ไปเอาพม่ามาทำงาน อยากให้คนไทยอดตายหรอ แล้วให้พวกต่างดาวมาอยู่,1
* ข่าวจาก mgronline * ท่าขี้เหล็ก - จนท.สาธารณสุขพม่า ตั้งโต๊ะคัดกรอง 20 คนไทย หนีเข้าเมืองทำงานบ่อน สถานบันเทิง ก่อนส่งกลับไทย พบติดเชื้อโควิด-19 จำนวน 1 ราย แถมสอบสวนโรคเบื้องต้นเจอแม่บ้านส่งอาหารชาวพม่า และญาติป่วยด้วย https://mgronline.com/local/detail/9630000130086,0
ต้องแยกออกสองประเด็นครับ 1.เราไม่ควรรังเกียจหรือดูถูกเพื่อนมนุษย์ด้วยกันเพราะความเป็นคนย่อมมีค่าความเป็นคนเท่ากันในทุกตัวบุคคล 2.เรื่องนี้เป็นเรื่องของความปลอดภัยครับ เราต้องยอมรับอย่างนึงว่าคนงานพม่ากลุ่มแรกคืนกลุ่มที่ปลอดภัยไม่เสี่ยงต่อการเป็นโควิดคือกลุ่มที่ป้องกันตัวเหมือนคนไทยทั่วๆไป คนพม่ากลุ่มที่สองคือกลุ่มคนที่ทำงานในพื้นที่สุ่มเสี่ยงและหนีการกักตัว หากคนกลุ่มสองหนีมาอยู่กับคนกลุ่มแรกแสดงว่าคนกลุ่มแรกก็มีความเสี่ยงเช่นกัน แล้วทีนี้เราแยกออกได้ยังไงว่าใครเสี่ยงหรือไม่เสี่ยง เราคยไทยก็มีสิทธิกลัวครับ แล้วทีนี้จะแก้ยังไง ผมว่าภาครัฐควรหยุดมองว่าแรงงานถูกหรือผิดกฎหมายก่อน แล้วหาวิธีตรวจโควิดคนเหล่านี้ใครผ่านก็ให้มีใบการันตีให้ หากใครหลบหนีการตรวจก็ต้องใช้มาตรการเด็ดขาด หรือจับได้ก็ส่งตัวกลับประเทศ ดูแล้วยุ่งยากใช่ไหมครับ ฉะนั้นทางเดียวที่ผมทำได้ตอนนี้คือเลี่ยงการพบเจอคนพม่าครับ ถ้าต้องเจอก็ต้องป้องกันตัวเองไม่ใช่เฉพาะคนพม่านะครับคนไทยกันเองยังต้องระวังกันเลย ผมจึงมองว่าคนที่กลัวพม่านั่นไม่ผิดแต่ต้องกลัวในแบบที่ไม่ไร้ศีลธรรมครับ,0
ยิงทิ้งเลยครับ พวกพม่า,1
คุณก็ช่วยพูดกับเพื่อนๆๆพม่าทุกคนว่าต้องปฏิบัติอย่างไรและช่วยกัน..สู้..ข้ามพ้นโควิตไปด้วยกัน,0
ไอ้บอย คาร์เตอร์ พม่ารึค่ะเรื่องเหมือนกันหัวหมอฉลาดจะตายค่ะคนที่จ้างแค่ราคาค่าแรงถูกกว่านิดๆเท่านั้นพม่าฉลาดเก่งขี้ฟ้องเรื่องเยอะค่ะเห็นกับตาค่ะ,1
"ทหารปล่อย พม่าข้ามชายแดน ค้ามนุษย์ หรือป่าว??? EU ,US แม่งรุมกินโต๊ะแน่ๆ",0
เสียกรุงศรีฯครั้งแรกให้พระเจ้าบุเรงนอง เสียกรุงศรีฯครั้งที่สอง โดนเผาไม่เหลือ เพราะมีไส้ศึกเปิดประตูเมือง?ให้ เพราะเห็นแก่ยศ และเงินทอง คราวนี้เสียสมุทรสาคร ก็เพราะเห็นแก่เงินทอง พาไส้ศึกเข้ามาอีก คงอีกเพียงแค่ชั่วเคี้ยวหมากแหลก พม่ารามัญคงเข้าตีกรุงเทพฯได้สำเร็จเป็นแน่แท้ เพลานี้พวกเจ้าจงเร่งเตรียมผ้าปิดปากแลเจลแอลกอฮอร์ให้พร้อมรับศึกอันใหญ่หลวงเถิด สาธุจ้า #?คณาธิป,1
สงสารประชาชนที่ต้องทนฟังพวกปากหมามา5-6ปี.ยุคที่ด้อยถอยหลังโกงกินกัน ตรวจสอบไม่ใด้ พม่า ลาว เวียดนามแซงความเจริญไปถึงไหนแล้ว.มองตัวเองเป็นคนเก่งดนดีตลอด.แม่งฉลาดกว่าควายนิดเดียว.!!,0
สู้ๆๆนะค่ะทุกคน จะเป็นคนไทย หรือพม่า ก้อต้องช่วยกันป้องกันนะค่ะ โรคมันเกิดขึ้นแล้ว จะไปโทดคนโน้นคนนี้ทำไมกัน พม่าเขาก้อรักเมืองไทย ไม่รักเขาไม่มาทำงานบ้านเราหรอก คนไทยทุกคนต้องป้องกัน รักตัวเองนะค่ะ ทั่วโลกเขาก้อเป็นทุกประเทศ รักกัน รักชาติ ดีกว่าชังชาติ ชังกัน ไม่ดีค่ะ,0
เป็นงานของ.พี่น้องพม่า.เขาไงครับ,0
