text,label
ไอ้เหี้ยๆๆๆๆ กุด่าหมดอ่ะทั้งไอ้เหี้ยนายทุนคนพาเจ้ามาทั้งไอ้เหี้ยพม่าคนที่ติดแล้วหนี ส้นตีนมาก ทำไมไม่ตายๆไปเลยว่ะ พวกกุผิดอะไรทำไมค้องมารับกรรมกับความเลวของพวกมึงด้วยอ่ะ เหี้ยทั้งหมด สัสเอ้ย,1
เอามาฆ่าทำลูกชิ้นส่งขายพม่า.....ตอนยุคกรุงศรีพวกมันเผาเมืองเราซะไม่เหลือคำว่าแผ่นดินทอง.....เห้อ....เบิ้ดคำสิเว้า,1
รับเข้ามาเลยอีก60000คนให้มันตายเลยคนไทยเลี้ยงพม่าไว้มันเป็นพ่อมึง.เหี้ยจริงๆๆ,0
ยิงทิ้งไปเลยมาอยู่ในประเทศเราสร้างความเดือดร้อนให้คนไทยแต่ไหนแต่ไรแล้วพวกพม่ารามัน,1
กลับพม่าไป เป็นโควิดแล้วโอกาสตายสูงกว่าเป็นอยู่ไทยนะ,1
ทำไม่ป่อยไห้ต่างด้าวเขาไทยเยะทีสุดส่วนมามีแตคนไม้มีบรัตอะไร่เลย กรัมพูชาบางพม่าบางตายๆแน่ๆคนไทยเรา,1
ไม่น่าเชื่อว่าคนไทยเราจะไร้น้ำใจ ใจดำกับพวกเขาได้ขนาดนี้ในฐานะเพื่อนมนุษย์ด้วยกัน ถ้าเกิดเป็นไอ้ฝรั่งตาน้ำข้าวล่ะก็ ผมว่าจัอ้าแขนรีบวิ่งเข้าไปกอดและจูงจมูกมันเข้ามากินข้าวเลยล่ะม้าง มองกลับกันนะ ถ้าคนไทยเราไปตกทุกข์ได้ยากที่ไหส จะมีใครมาสนใจ ให้ความช่วยเหลือเราได้มากกว่าไปเกิดขึ้นที่พม่าไหมล่ะ จะบอกให้ คนพม่านี่ล่ะมีเงินเท่าไรทำบุญกับพระพุทธศาสนามากเท่านั้น จิตใจพวกเขานั้นยังเป็นบุญสูงกว่าคนไทยจอมปลอมอีกเยอะ สังเกตุงานบุญในเขตที่มีแรงงานพม่าเยอะๆสิ จะมีพวกเขามาทำบุญกันตลอด เวรกรรมที่ทำกับมนุษย์ด้วยกันนั้นหนักนักนะครับ,0
สุธน เจตนา ฆ่ามานนนนพวกมานเผากรุงศรีพวกพม่ารามัน,1
Flim Fuse ไม่เคยรังเกียจนะ.ที่อยู่ไทยมานาน.เห็นใจ..ส่วนพวกที่แอบเข้ามา..ส่วนมากก็คนไมยนี่ละพามา..แถวบ้านก็มี.คนพม่า.ยังบอกไม่ต้องหนีเลย..แค่อยู่กะที่ทำงานไป..,0
เสียกรุงให้พม่า พม่าเผากรุงอีกแล้วหน๋า,1
สมควรออกเอง ไม่ต้องสร้างดราม่าให้คนเห็นใจ อำนาจเต็มอยู่ในมือแท้ๆยังปล่อยให้ระบาดได้ในจังหวัดตัวเอง ชาวบ้านรู้กันทั่วว่าพม่าเข้ามาผิดกฎหมายมาลงที่จังหวัดนี้ ทำไมไม่ขอความร่วมมือกับผู้ประกอบการ และหรือกับชาวพม่าให้ช่วยประกาศคนพม่าที่มีความเสี่ยงอย่าพึ่งเข้าไทยเพราะมันจะทำให้ชิปหายกันหมด,0
สู้ๆนะรักทุกทุกคนนะค่ะเราจะสู้ไปด้วยกันม่วาจะไทยพม่าเราก็เปนคนเหมีอนกันรักขีวิตเหมีอนกันใช้มัยค่ะสู้ๆจร้า,0
คนไทยเดือดร้อนเพราะพม่าเอาโควิดเข้ามารอบนี้แล้วยังจะขอเข้ามาอีกหรือถ้ารับเข้ามาอีกเมืองนี้คงเป็นซอมบี่หมดละจะอดตายและจะเป็นโรคตายกันหมดละ,1
ชื้นชมครับผม.พี่น้องพม่าก็สู้ๆนะเป็นกำลังใจให้,0
ตายล็อกดาวน์มาก่อนเคาว์ดาวพม่าตีแตกอีกครั้งเวรกรรมไทยแลนด์,1
สงสารพม่าจังเลย,0
ไอ้พวกพม่าถ้ามันทำตัวไม่อยู่ในกฎเกณจะหาทางหลบหนีเหมือนพวกผีดิบห้อสไนเปอยิงแม่งทิ้งเลยไอ้พวกพม่าที่ปล่อยเชื้อโควิดที่ทั้งหลายถ้ามันหนีออกมายิงแม่งทิ้งเลย,1
พวกนี้มันฆ่าคนไทยทางอ้อมรู้มั่ย..ต่อไปพม่ายึดแน่...,1
ส่งทหารไปอยู่ชายแดนค่ะ. อย่าให้พม่าเข้ามาอีก ถ้าเขามาก้อยิงทิ้งไปเลย เด็ดขาด,1
