text,label
หลวงพ่อพุกกะยาภรณ์มณีศรีปทุมพระพุทธรูปทรงเครื่อง ที่ใหญ่ที่สุดในโลก ?? ชมความสวยงามอลังการ พระทรงเครื่อง ที่สวยและใหญ่ที่สุดในโลก ซึ่งตั้งอยู่ภายในวัดพระธาตุจอมศีล ตำบลบ้านถ้ำ อำเภอดอกคำใต้ จังหวัดพะเยา เป็นพระพุทธรูปที่มีความสวยงาม ศิลปะเชียงแสน สิงห์ 1ประดับทรงเครื่องด้วย แก้ว เพชรนิลจินดา ปิดด้วยทองคำเซรามิคพร้อมกับติดองค์พระพุทธรูปและเทพพนม อย่างยิ่งใหญ่อลังการและเป็นที่เคารพนับถือของชาวพะเยา พระครูสุนทรวุฒิคุณ เจ้าอาวาสวัดพระธาตุจอมศีล ตำบลบ้านถ้ำ อำเภอดอกคำใต้ จังหวัดพะเยา นำผู้สื่อข่าวเข้าชมพระทรงเครื่อง ที่มีการกล่าวขานกันว่าเป็นพระทรงเครื่องที่สวยและใหญ่ที่สุด ในประเทศไทย โดยองค์พระสร้างด้วย ปูนปั้นปิดทอง เซรามิครวมทั้งเพชร นิล จินดาที่ได้มาจากจังหวัดจันทบุรีและประเทศพม่า ซึ่งประดิษฐานในอุโบสถวัดพระธาตุจอมศีล ที่ตั้งอยู่บนเนินเขาสูง ในตำบลบ้านถ้ำ อำเภอดอกคำใต้ จังหวัดพะเยา พระครูสุนทรวุฒิคุณ เจ้าอาวาสวัดพระธาตุจอมศีล เจ้าคณะตำบลบ้านถ้ำ กล่าวว่า ที่ผ่านมาได้มีตำนานว่าเจ้าเมืองในพื้นที่จังหวัดพะเยาได้เกิดการล้มป่วยลงและใน นิมิตให้มีการจัดสร้างพระทรงเครื่องขึ้น แต่เดิมได้ประดิษฐาน ที่บริเวณวัดหลวงในหรือวัดหลวงราชสัณฐาน อำเภอเมืองพะเยา แต่ต่อมาพระพุทธรูปองค์ดังกล่าวได้สูญหายไปจากเมืองพะเยา ทางอาตมา พร้อมด้วยคณะศรัทธาญาติโยม จึงได้มีแนวคิดที่จะจัดสร้างพระพุทธรูปทรงเครื่องขึ้น แต่ก็ขาดปัจจัยโดยตนเองจึงได้เดินทางไปประเทศอินเดียและอธิฐานจิตขอให้มีการก่อสร้างพระพุทธรูปทรงเครื่องให้ได้ ต่อมาก็มีผู้มีจิตศรัทธารับเป็นเจ้าภาพในการจัดสร้างพระพุทธรูปทรงเครื่องดังกล่าว จนประสบผลสำเร็จซึ่งพระทรงเครื่ององค์นี้เป็นศิลปะเชียงแสน สิงห์ 1 หรือหลวงพ่อพุกกะยาภรณ์มณีศรีปทุม ที่ประดับด้วย แก้ว เพชรนิลจินดา ปิดด้วยทองคำเซรามิคพร้อมกับติดองค์พระพุทธรูปและเทพพนม อย่างละ 108 องค์ กับองค์พระทรงเครื่องด้วย โดยองค์พระพุทธรูปมีความสูง 7 เมตร หน้าตักกว้าง 5.50 เมตร ใช้งบประมาณในการก่อสร้างจำนวน 1.7 ล้านบาท เริ่มก่อสร้างเมื่อปี พ.ศ.2545 ต่อมาเมื่อ วันที่ 4 มิถุนายน พ.ศ.2559 พระเจ้าหลานเธอ พระองค์เจ้าอทิตยาทรกิติคุณ ได้เสด็จเป็นองค์ประธานตัดหวายลูกนิมิตอุโบสถ และทรงกราบไหว้ พระทรงเครื่อง ที่ประดิษฐาน ในอุโบสถ หลวงพ่อพุกกะยาภรณ์มณีศรีปทุมพระพุทธรูปทรงเครื่อง ที่ใหญ่ที่สุดในโลก,0
ช่วยกันได้นะแต่รับผิดชอบร่วมกันเหี้ยพวกกูมีอำนาจอะไรไปจำกัดหรือสกัดแรงงานพม่าได้มึงอนุญาติให้กูยิงได้เปล่ารับรองกูยอมแต่รอบนี้ให้2คำ ควยเหอะ,1
มึงเป็นเหี้ยอะไรกัน ทำไมมึงต้องสร้างความเดือดร้อนไปทั่วแบบนี้ มึงกักตัวมึงจะตายห่ากันมั้ย หรือหลบหนีเข้าเมืองมา แม่งวุ่นวายไปหมด แล้วเมื่อคืนนี้กูอยู่บางพลี นายจ้างก็เสือกขนเอาแรงงานพม่าจากสมุทรสาครที่ทั้งมีบัตรและไม่มีบัตร เอามาทิ้งไว้แถวนี้อีก นายจ้างแม่งก็เหี้ยเกิ๊น,1
สงสารผู้ประกอบ..ที่มีรัฐบาลเฮงซวยเช่นนี้ ไม่ล่าตัวเจ้าหน้าที่กระทำผิดที่มีการลักลอบพม่าเข้ามา,0
คนเหมื่อนกันครับคิเไรมากมาย บ่อมีไผผิดบ่อมีไผถุกบ่อต้องรังเกรียดเค้าไทยหรือพม่าคนคือกัน ครับพี่น้อง,0
ยิงทิ้งให้หมดพม่า,1
ไม่น่าเชื่อว่าคนไทยเราจะไร้น้ำใจ ใจดำกับพวกเขาได้ขนาดนี้ในฐานะเพื่อนมนุษย์ด้วยกัน ถ้าเกิดเป็นไอ้ฝรั่งตาน้ำข้าวล่ะก็ ผมว่าจัอ้าแขนรีบวิ่งเข้าไปกอดและจูงจมูกมันเข้ามากินข้าวเลยล่ะม้าง มองกลับกันนะ ถ้าคนไทยเราไปตกทุกข์ได้ยากที่ไหส จะมีใครมาสนใจ ให้ความช่วยเหลือเราได้มากกว่าไปเกิดขึ้นที่พม่าไหมล่ะ จะบอกให้ คนพม่านี่ล่ะมีเงินเท่าไรทำบุญกับพระพุทธศาสนามากเท่านั้น จิตใจพวกเขานั้นยังเป็นบุญสูงกว่าคนไทยจอมปลอมอีกเยอะ สังเกตุงานบุญในเขตที่มีแรงงานพม่าเยอะๆสิ จะมีพวกเขามาทำบุญกันตลอด เวรกรรมที่ทำกับมนุษย์ด้วยกันนั้นหนักนักนะครับ,0
ไม่ว่าเขาว่าเรา คนน่าสงสารก็น่าสงสาร คนไม่น่าสงสาร ก็ไม่น่าสงสาร เวลานั้นพูดว่าประเทศไทยเป็นไปติดมาเองมาโทษ พม่า มันน่าสงสารหมัยคนแบบนี้,0
เรามีเพื่อนทั้งคนไทยและพม่า? ลาว? เราให้เกียรติซึ่งกันเสมอพม่าบางท่านนิสัยดีๆเขาจากบ้านจากบ้านเมืองมาไม่มีใครเหรอที่อยากจะไม่สบาย? เหมือนเราที่เวลาไม่สบายยังคิดถึงครอบครัวพวกเขาก็เช่นกัน? เราจะสู้ไปด้วยกัน? ไม่ว่่าคุณจะเป็นคนไทย? พม่า? ลาว? กัมพูชา? หรือประเทศอะไรก็ตามเราคือมนุษย์ที่อยู่ร่วมโลกกันเราต้องช่วยกันเพื่อให้ผ่านไปให้ได้สู้ๆ,0
เหลือแต่ประเทศไทยที่ปล่อยแรงงานพม่าเข้ามาใช่ไหมค่ะตายด้วยโรคระบาดกันทั้งประเทศก่อนหรือค่อยแก้ไข,1
เห็นไหมทำไมเกาหลี..เค้าถึงได้จริงจังและลงโทษอย่างรุนแรง.อดคิดไม่ได้ว่าพม่าตั้งใจเข้ามาแพร่เชื้อให้คนไทยรึเปล่าแต่ที่แน่ๆทางการพม่าคงไม่ใจดีรักษาแบบไทยหรือไม่%การรักษาไม่หาย.คือเป็นละตาย..ถึงเวลาเราควรจะผลักดันแรงงานเหล่านั้นกลับประเทศรึยังปีนึงๆพม่าเข้าไทยมากี่หมื่นคนรัฐเคยควบคุมหรือไม่.เอาละสิหรือพม่าตีกรุงศรีเช่นในอตีด,0
ขอบคุณแทนพี่น้องชาวพม่าด้วยค่ะ ขอให้รวยๆเจริญรุ่งเรืองนะค่ะ,0
คิดที่จะบิน อย่าลืมดินที่เคยเดิน เป็นผมก่มาครับ อยู่พม่าถ้าติดรอเวลาตาย แต่ถ้าข้ามมาได้ ทั้งตรวจฟรี รักษาฟรี อยู่ฟรีกินฟรีอีกคัยมันจะไม่มา555,1
Arit Chanachai มรึงก้อไปกู้ชาติซะซิ ไล่ฆ่าพม่าให้หมดประเทศไทย กอบกู้เอกราชให้กรุงศรี,1
เริ่มรู้สึกอยากจะเห็นข่าวหนุ่มคลั่งกราดยิงชาวพม่าแล้วเนี่ย....สถานการณ์สร้างวีรบุรุษ...จัดไปพี่น้อง,1
และแล้วพม่าก็ตีกรุงแตกอีกรอบได้สำเร็จ,1
ชีวิตมนุษย์ ผ่านมาเพื่อพบเจอ ผมแค่แปลกใจ ที่พม่าปล่อยให้ปกครองตนเอง ทั้งที่เมืองอื่น พม่าไม่ปล่อยครับ,1
นักแสดงชาย อาร์ต พศุตม์ ได้ลงมือเข้าครัวทำผัดกะเพรา 352 กล่อง เพื่อนำไปแจกให้กับแรงงานชาวเมียนมา ที่ถูกกักตัวที่สนามกีฬาจ.สมุทรสาคร ที่กำลังได้รับผลกระทบอยู่ในขณะนี้ . ซึ่งหนุ่มอาร์ต ได้โพสต์คลิปในอินสตาแกรมส่วนตัว พร้อมเขียนแคปชั่นว่า วันนี้ไปให้แรงงานพม่าที่ ที่ถูกกักตัวสนามกีฬาสมุทรสาครคับ #ทำดีสร้างภาพ #โควิท #covid_19 ซึ่งมีแฟนๆเข้ามาคอมเมนต์ ชื่นชมในความใจดีมีน้ำใจช่วยเหลือเพื่อนมนุษย์ในยามประสบภาวะวิกฤต . ภาพจาก IG: @art_phasut98 #อาร์ตพศุตม์ #อาร์ต #พศุตม์บานแย้ม #โควิด19 #โควิด,0
เสียกรุงให้พม่าของแท้,1
ผลของการนำ ไส้ศึกเข้าประเทศของคนขายชาติ..ก้าวหาคนไทยด้วยกันว่า...ขี้เกลียด บ้างละ เลือกงานบ้างละ....เพื่อเป็นข้ออ้าง ของการนำ เข้าแรงงานพม่า..ทั้งผิดและถูกกฏหมาย บอกว่า พม่า ขยัน....ในความจริงแล้ว เขาทำงาน ก็ปกติเผลอๆขี้เกียดด้วยซ้ำ เพี่ยงแต่ใอ้คนที่พูดมันมีนัยแอบแฝง.......คนอดยากอดตาย อย่างพม่า(ไม่ใด้ดูถูกแต่เอาความจริงมาเล่าสู่ฟัง)เมื่ออยู่ที่เมือง พม่า..เมือใด้มาอยู่ ที่ที่แสนสบายอย่างเมืองไทย ก็สุดยอดสิครับ .ทั้งอาหารการกิน เครื่องอุปโภค บริโภค.ความสะดวกความสบาย ครบครันทำงานใด้เงืนเยอะกว่าอยู่ที่ พม่าอีกต่างหาก .... บางคนบางกลุ่ม อาจจะไม่ใด้ตรวจโรคด้วยซ้ำ.....อีกไม่นานคุมไม่อยู่.สมุทรสาคร. กลายเป็นเมือง สำรอง ของเมียนมาร์ไปโดยปริยาย.....คุณเชื่อไม่ว่า..ห้องเช่าบางแห่งมี 200 ห้อง...มีแต่เมียนม่าร์ เต็มหมดเลย......จริงหรือเท็จ ไปดูเอา.,1
แล้วแรงงานต่างด้าวพม่าที่ติดเชื้อต้องจ่ายค่ารักษาเองไหมหรือส่งกลับ ไม่อยากเชื่อเลยไทยจะมาตกม้าตายตอนจบเพราะพม่าก่อนหน้านี้นักท่องเที่ยวที่เขาจะเอารายได้เขาประต้องมีมาตการณ์โน้นนี่นั้นออกค่าใช้จ่ายในการกักตัวมีประกันจ่ายค่ารักษาเอง,1
เริ่มผวาอิกรอบโควิดหนักเลยรอบนี้ทีีสำคัญพม่าเต็มทุกพื้นที่นายจ้างบางคนก็ยังไม่พาตรวจให้ทำงานปกติมันเสี่ยงจริงๆกับคนรอบข้างบางทีเพื่อนฝูงพม่ามาหาแบบนี้เข้าๆออกๆต้องเข้มงวดกับเรื่องต่างด้าวละรัฐบาล,0
สงสารพี่น้องชาวพม่า ไวรัสไม่มีใครต้องการให้มันเกิดหรอก ถ้าจะเกลียดควรจะเกลียดต้นตอที่มันปล่อยออกมา,0
ทำไหมชอบมาสั่งแต่ประชาชน. สั่งรัฐบาลก่อนไหมคับหมอ. บอกให้มันปิดประเทศก่อน. รักษาคนในประเทศก่อนแล้วก็ขนพวกพม่าให้กลับประเทศตัวเองไปก่อน ดูแลคนไทยก่อนเพราะคนไทยไม่ใช่ต้นเหตุกับโควิดรอบนี้ (ผมก็ไม่ยากโทษพี่น้องชาวพม่านะ แต่ต้นเหตุมันก็มาจากพวกพม่าจริงๆๆถ้าอยากจะแสดงความรับผิดชอบ ขอแนะนำให้กลับประเทศท่านไปก่อน. เหตุการดีขึ้น ค่อยกลับมาทำไหม,0
เป็นไงละบอกเอาอยู่ ที่นี้ประชาชนจะอดตายกันแล้ว มาตรวจแถวหนองแขมบ้างนะเมื่อไม่นานมานี้พม่ามหาชัยเหมารถมาจัดงานที่แถวบ้านบ่อยมากคะ,1
ยิงทิ้งให้หมดเลยเหี้ย.คนไทยพูดง่ายรู้เรืองช่วยเหลือ.แต่นี้ไอ้พม่า.มาก่อกวนสร้างความเดือดร้อนแล้วยังไม่ฟังคำสั่งอีก,1
เมื่อก่อนพม่าไม่พอใจไทย เมื่อไทยสั่งปิดโรงงาน มีแรงงานชาวพม่าเดินทางกลับประเทศ แต่เหตุที่ชายแดนมีทหารพม่ายิงแรงงานพม่าที่จะข้ามด่านเพื่อกลับประเทศของตน.....บัดนี้ไทยควรเอาเยี่ยงทหารพม่าครั้งนั่นเสีย!!555555555 (กรรมนี้กรรม),1
ติดตายโหงหมดไอสัสหมาเย็ดแม่ไอพม่าหนีเอาเชืัอมาปล่อยให้ติดคนไทย,1
พวกพม่าไม่ต้องรักษามันหรอกเปลืองงบคนไทยแถมเอาเชื้อมาแพร่ให้คนไทยอีกปล่อยให้พวกมันตายไป,1
แรกๆเราก็เห็นใจเค้าเหมือนกันนะแต่เมื่อวานไปไหว้พระที่บวรนิเวศเห็น ผู้หญิงเดินคุยโทรศัพท์ไม่ใส่แมสมาแต่ไกล สำเนียงพูดไม่ใช่คนไทยน่าจะเป็น พม่าและเจอผู้ชายอีกคนบนภูเขาทองวัดสระเกศก็ไม่ใส่แมสเหมือนกันพูดโทรศัพท์อยู่สำเนียงไม่ใช่คนไทยไม่เข้าใจเลยคนไทยแท้แท้ใส่แมสกันเป็นแถวป้องกันระวังตัวกันอย่างดีแต่คนพวกนี้กลับไม่สนใจอะไรเลยแย่จริงๆ,0
ทำไมชอบไปเอาพวกพม่ามาทำงานก้อรุ้ว่าประเทศพม่าโควิดระบาดก้อไปเอามาใช้งานอีกคนเถื่อนพวกมึงก้อรับเดียวมันก้อฆ่าคนจ้างหรอก555555555555,1
เราให้พี่พม่าอย่าทอสู้ๆๆค่ะ,0
คนไทยไม่รับทำงานจะเอาแต่พม่าเป็นไงละจะตายก้อเพราะพม่ากรรม,1
คาเซอิ โอบะกิ คนไทยแท้ๆที่ถูกแบ่งแยกดินแดนไปก็มีเยอะเช่นคนไทยใหญ่ไม่เห็นรัฐบาลไหนนึกถึงและเข้าไปช่วยเหลือและนำเค้ามาทำงานและดูแลพวกเค้าเลย ถ้ารัฐบาลไทยจะรอให้รัฐบาลพม่าส่งแรงงาน MOU เข้ามา รัฐบาลพม่าก็ต้องเลือกเอาแต่คนพม่าของเค้า คนไทยใหญ่ไม่มีหวังหลักค่ะ ตังแต่ไหนแต่ไรมาละ เดี๋ยวนี้พม่าจะมาครองเมืองไทยอยู่แล้วค่ะ แถมเดี๋ยวนี้ยังมีเพจที่แอบอ้างว่าเป็นคนไทย แต่หน้าตาและโคตรเหง้าสายเดี่ยวไม่ใช่ไทยละ ยังมีน่ามีวิจารรัฐบาล ไม่ดีโน่นนี่นั่นอีก แบบนี้มันเข้ามาก่อกวนชัดๆ ไม่แน่รัฐบาลเค้าอาจสอนให้มาก่อกวนในประเทศไทยก็เป็นได้ค่ะ อยากให้ระหวังให้ดีให้พวกพม่านี้ เวลาประเทศเราแข็งแกร่ง พวกมันจะทำตัวอ่อนแอมาขอความช่วยเหลือ แต่เมื่อไหร่เราอ่อนแอพวกมันพร้อมกันจะเหยียบซ้ำเราได้ทุกเมื่อเลยนะค่ะ,0
**เสียกรุงศรีฯครั้งแรก ให้พระเจ้าบุเรงนอง **เสียกรุงศรีฯครั้งที่สอง โดนเผาไม่เหลือ เพราะมีไส้ศึกเปิดประตูเมืองแค่เห็นแก่ยศ และเงินทอง **ครานี้เรามาเสียสมุทรสาคร ก็เพราะพวกเห็นแก่เงินทอง พาไส้ศึกเข้ามาอีก !!!!!!จากนี้ชั่วเคี้ยวหมากแหลก พม่ารามัญคงเข้าตีกรุงเทพฯได้สำเร็จเป็นแน่แท้ ท่านออกยา เพลานี้ให้พวกเจ้าจงเร่งเตรียมผ้าปิดปากแลเจลแอลกอฮอร์ให้พร้อมรับศึกอันใหญ่หลวงครั้งนี้ให้เร็วพันด้วยเถิด?? # ออกยาทั่วทีปทั่วแดน # อุ้ยเสี่ยวป้อ และ ออเจ้า,0
