text,label
พม่าคงรอการระบาย ให้เขามาในไทย พี่ไทยใจดีอยู่แล้ว อ้าแขนรับไว้เลย ตายแน่,1
เจอพม่าที่ไหนยิงกระบาลมัมเลยดูชิว่ามัมจะกล้าอยากมาอีกไหมไทย,1
1.พูดได้เหมือนมาก เสียงสวรรค์คืออะไร ประชาชนไหน? 2.ชอบธรรมคืออะไร อย่าฟังมาพูด ธรรม คือ อะไร ธรรมะหรือ ธรรมชาติ ประเทศปกครองโดยอะไร ชอบธรรม ธรรมของใคร ธรรมะของพระพุทธเจ้า รึป่าว และท่านพูดถึงสว.ไม่ชอบธรรมอย่างไร(พูดด้วยเหตุผลแบบปัญญาชนที่ต้องคิด วิเคราะห์ ไม่ได้กวนหรือจำมา) -รัฐธรรมนูญออกมาเพื่อเรา เป็นคำพูดของคนๆเดียว ที่จริงหรือเปล่าไม่รู้ แต่เหมือนเป็นศาสดา ศักดิ์สิทธ์ใช้ขยายผลได้ ถ้าคนๆนั้นพูดอะไรอื่นๆอีกจะเชื่อถือหรือเลือกเชื่อที่เฉพาะเป็นประโยชน์ 4.ประเทศประชาธิปไตยไหน ที่โดยข้อเท็จจริงไม่ใช่ในความฝันณ.ปัจจุบันนี้ ที่บอกว่าเสียงทุกคนดังเท่ากัน โปรดยกตัวอย่างชัดๆสักประเทศ อย่าพูดลอยๆ 5.ประเทศไหนๆก็มีทีมงานของรัฐ ไม่ว่าทหาร หรือข้าราชการ เป็นระบบวิธีการปกตรองที่ลอกเลียนกันมา แม้แต่สังคมนิยม การกล่าวหาว่าจะทำการรัฐประหารอีก ก็เป็นเรื่องอนาคต ที่ไม่มีใครรู้ความจริง อาจเกิด หรือไม่เกิด ซึ่งทำได้หรือไม่สำเร็จ เป็นการพูดโดยคิดเอาเอง ใส่ร้ายใครก็ได้ 6.รัฐ ละเมิด คนธรรมดา ไม่ว่าระบอบไหน ปชต.หรือไม่ เช่นแม้แต่ในอเมริกา ที่รัฐโดยตำรวจ ละเมิดประชาชนผิวสี ถึงแก่ชีวิต ใครพูด พูดที่ไหนก็ถูก เพราะเกิดทุกที่แต่เขาก็มีกฏหมายจัดการไม่ใช่ทำได้โดยกฏหมายยอมรับ 7.รัฐธรรมนูญฉบับปัจจุบัน ไม่ได้มีข้อห้ามการตั้งพรรคที่มีอุดมการณ์สังคมนิยม และรัฐไทยตั้งแต่มีรัฐธรรมนูญมาก็เคยมีพรรคสังคมนิยมแห่งประเทศไทยมาแล้ว ลงเลือกตั้งแต่ประชาชนไม่นิยมเอง ศึกษาก่อนมั้ย ส่วนปัจจุบันก็ถกเถียงกันอยู่ ก็ยังไม่มีใครตัดสิน เพราะก็มีทั้งคนเห็นด้วยและไม่เห็นด้วย ก็ต้องดูคนส่วนใหญ่ ถ้าในระบบเขาชนะก็ต้องยอมรับว่าในปัจจุบัน คนไทย(ที่ไม่ได้โง่อย่างใครว่า)เขาเลือระบบไหนในการปกครอง ทุกสิ่งเปลี่ยนแปลงได้ ประชาชนส่วนใหญ่(เน้น) เมื่อใช่เวลา 8. เรื่องเสียโอกาสในการแข่งขันก็พูดไปกันเอง ไม่มีข้อมูลทางวิชาการที่เป็นที่ยอมรับของสากล ถ้าเราเปิดกว้างและศึกษาเหตุผลข้อมูลที่เป็นจริง ประเทศไทยหลายปีมานี้ แม้จะมีวิกฤติโลก ที่ยากลำบากมากมาย แต่ถ้าดูจากการวัดผลที่ใช้ข้อมูลไม่ได้ใช้ใจ ไทยมีความเจริญก้าวหน้า พัฒนา เป็นที่ยอมรับ มากมายจนไม่สามารถยกตัวอย่างได้หมด ถ้าสนใจจริงลองศึกษาดู ถ้าเราไม่ดี ดูผลที่เห็นด้วยตา ไม่ต้องวิจัย ก็รู้ว่าคนพม่า เขมร ลาว เข้ามาทำงานกี่ล้านคน เป็นล้านๆทั้งถูกกฏหมายและผิดกฏหมาย(ที่เป็นปัญหาตอนนี้) เพราะอะไร เพราะเศรษฐกิจมันดี มันเจริญ มันถึงมีงานทำ เขาถึงอยากมาตายเอาดาบหน้า เขาส่งเงินกลับประเทศไปช่วยเหลือครอบครัวและประเทศเขาถ้านับก็ควรจะคูญ4-5เท่า ถ้ามันแย่ใครจะมา จะมีงานที่ไหนครับ คิดดูจริงๆ ประเทศไทย ติดอันดับประเทศ ที่น่าลงทุน ติดอันดับประเทศที่ดีๆต่อเศรษฐกิจ สังคมประเภท1ใน10ของโลกมากมาย พูดด้วยข้อมูลและเหตุผลไม่ได้จำๆกันมานะครับ,0
ผวา! ต่างด้าวซุกบ้านเช่าดอนเมือง ติดโควิดถึง 7 คน | ข่าวเที่ยงอมรินทร์ | 6 ม.ค.64เพื่อนบ้านเล่าถึงเหตุการณ์ระหว่างที่มีกลุ่มแรงงานต่างด้าวทยอยเข้ามายังบ้านเช่าหลังดังกล่าว เกือบ 20 คน มาทราบผลปรากฏว่า ติดเชื้อโควิด-19 ถึง 7 คน จากกรณี ที่ตลาดใหม่ดอนเมือง ประชาชน-พ่อค้า-แม่ค้า กำลังหวาดผวา หลังทราบข่าวว่าเมื่อวันที่ 4ม.ค ที่ผ่านมา เจ้าหน้าที่ตรวจคนเข้าเมืองได้เข้าตรวจสอบและจับกุม แรงงานชาวพม่า เป็นชายและหญิงรวม 18 คน ในบ้านเช่าแห่งหนึ่งหลังตลาดใหม่ดอนเมือง หลังจากชาวบ้านได้ให้ข้อมูลมาว่าบ้านหลังดังกล่าวน่าจะเป็นที่พักพิงของแรงงานข้ามชาติ ------------------------------------------------------------------------------------ ติดตามอมรินทร์ ทีวี ได้ที่ ทีวีดิจิทัล หรือ กล่องดิจิทัลทีวี ช่อง 34 Website : http://www.amarintv.com Facebook : https://www.facebook.com/AMARINTVHD Twitter : https://twitter.com/amarintvhd Instagram : https://www.instagram.com/amarintvhd Youtube : https://www.youtube.com/c/amarintvhd Dailymotion : https://www.dailymotion.com/amarintvhd Line : https://lin.ee/w1gOqNl ติดต่อโฆษณา 02-422-9191 ต่อ 2505 และ 092-280-0782 #ข่าวเที่ยงอมรินทร์ #AmarinTV34,0
Zar Chi Win ก้อเพราะประเทศไทยไม่ยิงสิค่ะ พม่าเลยไม่ให้ความร่วมมือ ทำคนอื่นและบ้านเมืองเดือดร้อน นเราสมควรมีจิตใต้สำนึก และสามันสำนึกความรับผิดชอบต่อสังคม ไม่ใช่เขาให้กักตัวแต่ลักรอบหนีออกมา แบบนี้สมควรไม่ค่ะ หรือคุนว่าไม่สมควร,1
ติดจากพวกพม่าที่เข้ามาล่ะ....ป้ามีลูกจ้าพม่าเปล่า ถ้าเอาเข้ามาล่ะ สมน้ำหน้า 67 ปี ตายไว ดีล่ะ ชอบเอาเข้ามากันนัก เวรกรรมสนอง มีแต่คนสมน้ำหน้าแน่นอน,1
คนไทยไปดักจับครับกลัวพม่าหนีกลับประเทศพ่อมึงตาย,1
คือมีเพื่อนเป็นพม่าอ่า กูจะซื้อไอโฟน12โปร์ มันรู้ว่าเราจะซื้อเลยให้พาไปด้วยมันก็จะซื้อพอดี ถามมันเอารุ่นไหนมันบอก12โปร์แม็ก เลยว่าจะให้มันไปซื้อเอง อายมัน5555,0
สู้ๆคะไม่ว่าคนไทยคนพม่าเขาก๊คนอย่ามั่วมาโทษกันอยู่เลยเรามาร่วมือกันให้โรคร้ายมันหายไปจากประเทศไทยดีกว่าคะถ้าเราช่วยกันมันต้องผ่านไปได้สู้ๆคะทุกคน,0
"??2 ที่สุดท้าย กรุ๊ปเดินทาง เตรียมเก็บกระเป๋าลาข้างบ้าน ?? เที่ยวปีใหม่ เปิดประตูสู่ด้ามขวาน เส้นทางใต้สุดแดนสยาม สงขลา ยะลา ปัตตานี เบตง 4 วัน 3 คืน ไทยสไมล์ เดินทาง 31 ธันวาคม  3 มกราคม 2564 ราคา: 16,900 ?? เดินทางโดย : สายการบินแอร์เอเชีย (FD) โรงแรมที่พัก : แกรนด์แมนดารินเบตง / เซนทาราหาดใหญ่ หรือที่พักระดับใกล้เคียงตามมาตราฐาน เดินทางโดยรถตู้ นำเที่ยว VIP 8 ท่านออกเดินทาง ?? ไหว้พระขอพร ณ วัดช้างไห้ นมัสการ พระพุทธไสยาสน์ ณ วัดคูหาภิมุข สัมผัสความงดงามของทะเลหมอก ยอดเขาไมโครเวฟ ชมงาม เจดีย์สแตนเลส ณ วัดพระมหาเจดีย์ไตรภพไตรมงคล ?? นมัสการ บรรจุพระบรมสารีริกธาตุ วัดพระมหาธาตุเจดีย์พระพุทธธรรมประกาศ เที่ยวชม สวนดอกไม้เมืองหนาว หรือ สวนหมื่นบุปผา แวะเก็บภาพทะเลหมอก สะพานไอเยอร์เวง ณ เบตง ??เที่ยวเกาะยอ กลางทะเลสาบสงขลา เดินเที่ยวชม ย่านเมืองเก่าสงขลา ตึกคลาสสิกสไตล์ชิโนโปรตุกีส สัมผัสความงามของ น้ำตกโตนงาช้าง น้ำตกขึ้นชื่อแห่งหนึ่งของภาคใต้ ชม อุโมงค์ปิยะฉัตร ของเก่าน่าค้นหา เก็บภาพความสวยงามของ มัสยิดกลางประจำจังหวัดสงขลา ?????????????????????? ขายตั๋วเครื่องบิน รับจัดกรุ๊ปทัวร์ กรุ๊ปส่วนตัว กรุ๊ปดูงาน ประกัน เดินทาง ขอวีซ่า ทิ้งเมลล์ หรือ INBOX ขอรับรายละเอียดเพิ่มเติมได้เลยนะ โทรสอบถามรายละเอียดเพิ่มเติม หรือ ขอรับโปรแกรมได้ที่ เจน 094-196-9459 LINE : jane_pimnapat ใบอนุญาติ ททท.11/08772 https://www.facebook.com/goodbuddytour/ https://www.facebook.com/MineJourneyTravel/ ?#ทัวร์ต่างประเทศ #อัพเดท #ทัวร์สุดคุ้ม ?#ทัวร์จัดเต็ม #ทัวร์ลดราคา #ตั๋วหลุด?#ทัวร์ดีดี #ทัวร์ถูกมาก #เที่ยวทั่วโลก #ทัวร์น่าเที่ยว#ปรับราคา #SALE ?#PROMOTION #จัดกรุ๊ปส่วนตัว? #จองตั๋วเครื่องบิน ?#ทัวร์ไฟไหม้ ?#โปรไฟไหม้ ? #ทัวร์ยุโรป #ทัวร์พม่า?#ทัวร์ตะวันออก#ทัวร์เกาหลี#ทัวร์ญี่ปุ่น?#ลดราคา ?#ลดจัดหนัก#ทำ",0
เปิดใจเจ้าของร้านใจบุญ ประกาศให้แรงงานเมียนมากินข้าวฟรี หลังคนในพื้นที่ไม่ขายให้เจ้าของร้านอาหารตามสั่ง ย่านประชาอุทิศ เห็นใจ แรงงานพม่า ไม่มีใครขายข้าวให้ ประกาศ ให้มาที่ร้านถ้าไม่มีเงินให้กินฟรี หลังเกิดสถานการณ์แพร่ระบาดโควิด-19 ระลอกใหม่ และผู้ติดเชื้อเพิ่มต่อเนื่องในหลายจังหวัด กระทบถึงแรงงานเมียนมาถูกมองเหมารวมว่า เป็นต้นเหตุการแพร่ระบาด เจ้าของเฟซบุ๊กรายหนึ่ง ได้โพสต์ถึงแรงงานเมียนมา ที่อาศัยอยู่ในละแวกร้านอาหารของเธอ ว่าสามารถมาทานที่ร้านได้ โดยมีเนื้อหาว่า ให้แรงงานเมียนมา ที่อาศัย ในเขตถนนวัดคู่สร้าง -ประชาอุทิศ ไม่มีเงินซื้อข้าวกิน หรือ อยากซื้อข้าวกิน แต่ไม่มีใครขายให้ ท่านมาที่ร้าน ครัวเมืองเพชร ได้เลย ตลอดทำการ 06:00น. ถึง 19:00น. ไม่มีเงิน เราให้กินฟรีค่ะ ร้านครัวเมืองเพชร ยินดีช่วยเหลือค่ะ ผู้สื่อข่าวลงพื้นที่ ไปพบ นางฉัจธมน สิงห์ตาลกง เจ้าของร้านอาหารตามสั่งครัวเมืองเพชร บอกว่า สาเหตุที่เธอประกาศถึงชาวพม่า เนื่องจากมีผู้มาโพสต์ว่า แรงงานเมียนมาไปซื้อข้าว หรือ อาหารที่ไหนก็โดนปฏิเสธ จึงคิดช่วยเหลือเพราะเห็นใจเพื่อนมนุษย์ด้วยกัน อยากให้คิดถึงใจเขาใจเรา เขามีเงินซื้อทำไมถึงไม่ขายให้เขา ได้ทานข้าว ซึ่งมองว่า หากประเทศเราตกอยู่ในภาวะลำบากบ้าง ประเทศเขาก็คงช่วยเหลือเรา เราต้องช่วยเหลือกันผ่านวิกฤตไปด้วยกัน อย่าซ้ำเติมกัน อ่านข่าวเพิ่มเติมที่นี่ : https://ch3thailandnews.bectero.com/news/224532 -------------------------------------------------------------------- รายการ #เรื่องเด่นเย็นนี้ ออกอากาศ ทุกวันจันทร์ - ศุกร์ ทางช่อง 33 HD เวลา 15.45 น. - 16.45 น. สามารถรับชมรายการย้อนหลังได้ที่ https://ch3thailandnews.bectero.com,0
สะใจยัง ชิปหายยัง ระวังแทบตาย ยังจะให้แรงงานต่างด้าวเข้ามาอีก คนพวกนี้เพื่อนฝูงมันอยุ่ไหนมันไปหากันทั่วล่ะ เหี้ยพม่านี้,1
คนขับรถตู้ถ้าเป็นคนไทย ยิงแม่ง พร้อมพม่าเลย,1
