text,label
"*PTL-EV02* *ทัวร์รถตู้ อุดรธานี 3 วัน 1 คืน* *วังนาคินทร์คำชะโนด* เดินทาง ม.ค. - มี.ค. 64 ราคาเริ่มต้น 3,988 บาท วัดป่าภูก้อน วัดผาตากเสื้อ วัดโพธิ์ชัย (หลวงพ่อพระใส) ตลาดท่าเสด็จ วังนาคินทร์คำชะโนด พิพิธภัณฑ์เมืองอุดรธานี โปรแกรม : shorturl.at/BDIS6 ?????????????????????? ขายตั๋วเครื่องบิน รับจัดกรุ๊ปทัวร์ กรุ๊ปส่วนตัว กรุ๊ปดูงาน ประกัน เดินทาง ขอวีซ่า ทิ้งเมลล์ หรือ INBOX ขอรับรายละเอียดเพิ่มเติมได้เลยนะ โทรสอบถามรายละเอียดเพิ่มเติม หรือ ขอรับโปรแกรมได้ที่ เจน 094-196-9459 LINE : jane_pimnapat ใบอนุญาติ ททท.11/08772 https://www.facebook.com/goodbuddytour/ https://www.facebook.com/MineJourneyTravel/ ?#ทัวร์ต่างประเทศ #อัพเดท #ทัวร์สุดคุ้ม ?#ทัวร์จัดเต็ม #ทัวร์ลดราคา #ตั๋วหลุด?#ทัวร์ดีดี #ทัวร์ถูกมาก #เที่ยวทั่วโลก #ทัวร์น่าเที่ยว#ปรับราคา #SALE ?#PROMOTION #จัดกรุ๊ปส่วนตัว? #จองตั๋วเครื่องบิน ?#ทัวร์ไฟไหม้ ?#โปรไฟไหม้ ? #ทัวร์ยุโรป #ทัวร์พม่า?#ทัวร์ตะวันออก#ทัวร์เกาหลี#ทัวร์ญี่ปุ่น?#ลดราคา ?#ลดจัดหนัก#ทำ",0
พวกมึงไปตายที่พม่าพวกกูไม่ไห้อยู่ประเทศไทยไอ้พวกเปรต,1
ไม่มีแต่พม่าหลอกค่ะแถวนั้นก็คนไทยหลายยุสู้ๆๆค่ะ,0
พม่า เมียนมาจะฆ่าคนไทยแล้ว,1
ทุกคนป้องกันตัวเองและครอบครัวมาเกือบปีเจอพม่าเข้าไม่กี่วันมาตายทั้งประเทศ,1
เสพติด การอยู่คนเดียว เสียกรุงศรีฯครั้งแรกให้พระเจ้าบุเรงนอง เสียกรุงศรีฯครั้งที่สอง โดนเผาไม่เหลือ เพราะมีไส้ศึกเปิดประตูเมืองให้ เพราะเห็นแก่ยศ และเงินทอง คราวนี้เสียสมุทรสาคร ก็เพราะพวกเห็นแก่เงินทอง พาไส้ศึกเข้ามาอีก คงอีกเพียงแค่ชั่วเคี้ยวหมากแหลก พม่ารามัญคงเข้าตีกรุงเทพฯได้สำเร็จเป็นแน่แท้ เพลานี้พวกเจ้าจงเร่งเตรียมผ้าปิดปากและเจลแอลกอฮอร์ให้พร้อมรับศึกอันใหญ่หลวงเถิด ??,0
ไอ้เปรตนายกทำโควิทระบาดตรงใหนพม่าโน้นแม่ค้าขายกุ้งโน้นเปรตด่าทุกอย่างที่เขาช่วยเหลือประชาชนทีนายกตัวเองโกงจนประเทศจะฉิบหายชาวนาฆ่าตัวตายแมร่งอยู่เฉยปากอมค...ย.อยู่สงสัย,1
เข้มแข็งพุเดียวพุ้นสิเป็นประสาทละ หึย เก่งแต่คำเว้า ประเทศกะบ่ปิด มักไห้คนประเทศอื่นเข้ามา กะว่าละเจ้ามีเงินใช้น้อ ประชาชนนิติจักหนี้รถค่าน้ำค่าไฟ งานกะอยากเหด โควิดกะย้าน ตายก่อนพอดี งึดพวกบริหารประเทศบ่เป็น,0
ตู่อำนาจที่มึงมีอยู่ในมือ มึงทำได้แค่นี้รึ มึงสั่งใช้ยาแรงได้แล้ว จับได้ยิงทิ้ง ลักลอบเข้ามายิง ยิงทุกวันๆไม่เกิน2อาทิตย์ รับรองไม่มีโผล่เข้ามาหรอก มึงปล่อยมันเข้ามาได้งัยวะทั่วประเทศรวมแล้วประมาณ2ล้านกว่าคน ที่เข้ามาถูกต้องแค่2-3แสน หรือมึงกลัวพม่าวะ เก่งแต่คนไทยด้วยกันงั้ย #ควายตู่,1
วิธีป้องกันโควิด19 ภาษาเมียนมาร์(พม่า) . มันเกิดขึ้นแล้วจะย้อนเวลากลับไปแก้ไขก็ไม่ได้ แต่สิ่งที่ทำได้ คือ สิ่งที่เราเคยทำตอนระบาดรอบแรก และพากันก้าวผ่านมาแล้ว เราต้องดูแลตัวเองและผู้อื่น เราป้องกันเขาป้องกัน เราเขาปลอดภัย . สู้ๆ ?,0
ตายตายครั้งนี้เจอศึกหนักประเทศไทย หนักกว่าครั้งแรก พม่ามาทำลายประเทศกูแล้ว,1
น่าจะมีกฎหมายนี้ในไทยบ้าง พม่าเข้ามาเอาเชื้อมาแพร่คนไทย ยิงทิ้งได้เลย,1
พม่ามันรู้มันหัวดีกว่าคนไทยมันรู้ว่ามันติดโรคโควิดมันก็เลยหนีเข้ามาอยู่ในไทยถ้ามันอยู่ประเทศพม่าเขาไม่ช่วยเหลือมันถ้ามันอยู่ไทยคนไทยต้องรักษามันหายที่นี่ประเทศไทยหรือประเทศพม่ามันเอาเชื้อมาแพร่ให้คนไทยเดือดร้อนยังต้องรักษามันอีกเหรอแม้แต่คนไทยแท้ๆยังเอาตัวเองไม่รอดอยู่มันพาความเดือดร้อนมาให้ฆ่ามันทิ้งซะ,1
รู้วันเกิด ไม่รู้วันตาย น่าจะให้พวกพม่านี้ไปทำงานที่ทำเนียบรัฐบาลน่ะ...มันจะได้ติดกันทั้งมำเนียบแล้วมันเอามากักตัวให้เปลืองข้าวเปลืองน้ำทำไมทำไมไส่ส่งกลับประเทศพม่าไป,1
พม่าตีกรุงศรีแตกอีกครั้ง,1
พ่องมึงตาย..ไอ้ควาย..เอาเข้ามาทำพ่อมึงเหรอ..ไอ้แรงงายพม่านะ,1
มันก็ขึ้นอยู่กับคนไทยชอบจ้างแรงงานพม่า ด่าว่าคนไทยด้วยกันขี้เกียจ มันก็มีทั้งดีและไม่ดี ต้องให้โอกาสคนไทยบ้าง พม่ามันก็ไม่ได้ดีทั้งหมด บทมันโหดมันฆ่าเจ้านายปล้นเจ้านายก็มีน่ากลัวจะตายพม่าน่ะ,1
เราเห๊นใจคะแต่เรากลัวโรคติดต่อมาให้ถุกต้องกันนะคะตรวจก่อนแล้วค่อยมาช่วยบอกเพื่อนหรือพี่น้องชาวพม่าอย่าหลบกันนะคะออกมาให้เขาตรวจใม่ต้องกลัวประเทศใม่ใจร้ายคะ,0
พม่ารามัญ มันเอาโควิด มาล้อมเราไว้ แล้ว...ตายๆๆๆ,1
เอ็นดูพม่า ระวัง...ตายกันทั้งจังหวัด(ครึ่งประเทศ),1
พี่เป็นคนไทยคนนึงที่เห็นใจพี่น้องชาวพม่าทุกท่าน ที่เข้ามาทำงานในเมืองไทย ไม่มีใครอยากให้เกิดเหตุการณ์นี้ อดทนนะคะ เรามาร่วมแรงร่วมใจกันฝ่าวิกฤตครั้งนี้ไปด้วยกันค่ะ ?,0
สาวเจ้าของร้านอาหารเห็นใจแรงงานต่างด้าว โพสต์ประกาศ ไม่มีเงินมากินฟรีได้เจ้าของร้านอาหารตามสั่ง ย่านประชาอุทิศ เห็นใจแรงงานพม่าไม่มีใครขายข้าวให้ ประกาศให้มาที่ร้าน ถ้าไม่มีเงินให้กินฟรี โดยเจ้าของร้านอาหารโพสต์ผ่านเฟซบุ๊กของตนเองว่า ประกาศ! แรงงานพม่า ที่อาศัย ในเขตถนนวัดคู่สร้าง -ประชาอุทิศ ไม่มีเงินซื้อข้าวกิน หรือ อยากซื้อข้าวกิน แต่ไม่มีใครขายให้ ท่านมาที่ร้าน ครัวเมืองเพชร ได้เลย ตลอดทำการ 06.00น. ถึง 19.00น. ไม่มีเงิน เราให้กินฟรีค่ะ ร้านครัวเมืองเพชร ยินดีช่วยเหลือค่ะ ทางเจ้าของร้าน ระบุว่า สาเหตุที่เธอประกาศถึงชาวพม่า เนื่องจากมีผู้มาโพสต์ว่าชาวพม่าได้รับผลกระทบอย่างหนัก จากการระบาดของโควิด-19 เมื่อพวกเขาไปซื้อข้าว หรือ อาหารที่ไหนก็โดนปฏิเสธ จึงคิดช่วยเหลือเพราะเห็นใจเพื่อนมนุษย์ด้วยกัน อยากให้คิดถึงใจเขาใจเรา เขามีเงินซื้อทำไมเราถึงจะไม่ขายให้เขา หากมองว่าประเทศเราตกอยู่ในภาวะลำบากบ้าง ประเทศเขาก็คงช่วยเหลือเราเช่นกัน เราต้องช่วยเหลือกันผ่านวิกฤตนี้ไปได้ อย่าซ้ำเติมกัน อ่านข่าวเพิ่มเติมได้ที่ : https://ch3thailandnews.com/news/224622 -------------------------------------- รายการ #ข่าววันใหม่ ทางช่อง 33ออกอากาศ วันอังคาร-วันอาทิตย์ เวลา 00.35-01.30 น. ติดตามความเคลื่อนไหวอื่น ๆ ได้ที่ BECTERO.tv : http://bit.ly/2FtJIc9,0
เห็นใจเหมือนกันค่ะ วันก่อนไปตลาดผัก มีคนวิ่งชนเกือบล้มเขาว่าตรวจจับพม่าที่เข้ามาผืดกฏหมาย ตอนนี้ไม่กล้าไปตลาดอีกแล้วค่ะ เข้าใจเห็นใจทุกคนค่ะ,0
พวกคนไทยจะอดตายเพราะพม่าตอนนี้คิดไหม เห็นแก่ตัวที่สุด,1
มันยู่ที่จ้าวนายคนไทยเห็นพม่ามันทำเป็นขยันต่อหน้ารีบรับเข้ามาทำงานต่อๆมาพอทำงานรู้ดีมากขึ้นก็อยากจะหัวหมอ.ก็ดีแล้วละที่ชอบที่หลงพม่าจนลืมพี่น้องคนไทย.ไม่เจ็บก็ไม่สำนึกจ้าวนายที่โชคร้ายก็อาจถูกพม่ามันฆ่าเพื่อเอาเงินทองดีไม่ดีพม่าอาจจะข่มขืนจ้าวนายด้วยซ้ำแล้วฆ่าจ้าวนายทิ้ง.ได้โปรดอย่าพี่น้องคนไทยเลยครับ.ไม่รับพม่ามาทำงานปัญหาทุกๆอย่างก็จะดีเห็นไหมติดโรคโควิคเพราะใครไม่ไช่พม่านั้นหรือที่เอาเชื้อโรคมา.เวรกรรม.,1
ติดจากพวกพม่าที่เข้ามาล่ะ....ป้ามีลูกจ้าพม่าเปล่า ถ้าเอาเข้ามาล่ะ สมน้ำหน้า 67 ปี ตายไว ดีล่ะ ชอบเอาเข้ามากันนัก เวรกรรมสนอง มีแต่คนสมน้ำหน้าแน่นอน,1
มันจะเนี่ย ช่วยกั๋นเป็นหู เป็นตา ให้เจ้าหน้าที่ตวยเน้อ .....ที่จังหวัดชลบุรี ชาวเมียร์มา หนีมาจากสมุทรสาคร 3 คน ไปหาเพื่อนที่ห้องแถวบริเวณพันเสด็จนอก ชลบุรี ซึ่งเป็นพม่าด้วยกัน ขณะนี้ทางเจ้าหน้าที่ได้ล็อกตัว ไปตรวจคัดกรองหาเชื้อโรคแล้ว ---- cr.ประภาส มหาเมฆ  ไม่พลาดข่าวเพจนี้ CM108 การตั้งค่าการติดตาม - รายการโปรด คุณจะเห็นโพสต์แสดงอยู่สูงกว่าในฟีดข่าวของคุณ รับรองไม่พลาดเรื่องราว-ข่าวสารจากเพจนี้ ---------  ข่าวย้อนหลัง : CM108.com  กลุ่มเฟซบุ๊ก CM108 : https://www.facebook.com/groups/cm108/  LINE CM108 : line.me/ti/g2/OGUXX9M6K3  Instagram : instagram.com/chiangmai108/  YouTube : youtube.com/channel/UCCPu1rZLTp9Y0eMlrTStULQ/  Tiktok : www.tiktok.com/@cm108.com,0
วันก่อนบอสฉีกหน้าอัยการ วันนี้โควิดฉีกหน้าบ่อน พม่าฉีกหน้าค้ามนุษย์,0
ฉิ๊ปหายละคราวนี้คนไทยตายแน่พม่ามายึดประเทศไทยแล้วคราวนี้,0
แข็งแรงๆนะพี่น้องพม่า ทุกคน ถ้าไม่มีคุณ. งาน ก็ไม่เดิน. หายไวๆ เราคนไทยเป็นกำลังใจให้ ทุกคนที่เป็นรึไม่เป็นโควิค ให้กำลังใจทั้งคนไทยและ พม่า,0
สาวพม่าสวยมาก ขอเป็นกำลังใจให้นะคับสู้ๆคับ,0
ประเทศไทยปิดกิจการปิดโรงเรียนปิดโรงงาน สงสารคนไทยบ้างใหม เอาโรคมาทำไม ช่วงนี้เป็นช่วงโควิดก็รู้อยู่ คนต่างด้าวไม่ควรมา ไม่มีใครรังเกียจหรอกแต่กลัวโควิด เข้าใจน่ะ พม่ามาทำคนไทยเป็นโรคเยอะขนาดนี้ สำนึกผิดบ้างใหม่,1
คือเห็นใจนะพม่าดีก็มีใส่แมสดูแลตัวเองแต่ที่ไม่ดีก็มีไม่ดูแลตัวเอง แต่ถ้าขนาดรังเกียจไม่ขายข้าวให้เขาๆจะกินอะไร?แยกแยะกันนิดนึง,0
จ้างโจรใต้ยิงพม่าดิรัฐบาล,1
"Gravity Game Tech เปิดให้บริการเกม THE LORD เรียกข้าว่าท่านลอร์ด เอาใจคอ Strategy RPG พร้อมเปิดลงทะเบียนต้อนรับผู้บุกเบิกรับไอเทมล่วงหน้า =========== Gravity Game Tech ผู้ให้บริการเกมชื่อดังอย่าง Ragnarok Online เปิดให้บริการเกมใหม่ Mobile Version กับเกม THE LORD เรียกข้าว่าท่านลอร์ด เอาใจสาวกเกมแนว Strategy RPG ชวนคุณมาสวมบทบาทวางแผนเพื่อช่วงชิงความเป็นที่ 1 ขึ้นเป็นท่านลอร์ดปกครองอาณาจักร ด้วยจุดเด่นเนื้อเรื่องที่ไม่เคยพบเห็นมาก่อนกับธีมเกมแนวตะวันตกยุคกลาง ภาพกราฟฟิคคุณภาพสวยสะดุดตา ระบบเกมที่หลากหลายพร้อมด้วยตัวละครกว่า 70 คาแรคเตอร์ให้เลือกสรร เปิดลงทะเบียนล่วงหน้าเป็น ผู้บุกเบิกรับไอเทมสุด Exclusive เตรียมยึดอำนาจชิงบัลลังก์ คอนเทนต์เกมเบื้องต้น ดังนี้  ระบบว่าราชการ แสดงความเป็นหนึ่งด้านการบริหารที่ยอดเยี่ยม  ระบบเลดี้ ที่จะได้ครอบครองสาวงามจากทั่วโลก  ระบบทายาท สร้างความสัมพันธ์กับตระกูลต่างๆ เพื่อขยายอำนาจให้กว้างขวาง  ระบบสภา ระบบการค้า ดูแลบริหารทรัพยากรของอาณาจักรให้อุดมสมบูรณ์  ระบบด่านสู้รบ แสดงศักยภาพทางทหารให้รู้ว่าอาณาจักรของเรายิ่งใหญ่เกรียงไกร เพียงคุณร่วมลงทะเบียนเป็นผู้บุกเบิกได้ที่ https://www.thelord-sea.com/#sec-preregister จะได้รับไอเทมพิเศษเลยทันที จำนวน 8 ไอเทม . และถ้าคุณเชิญเพื่อนมาเป็นผู้บุกเบิกอีก 5 ท่านก็จะได้รับไอเทมพิเศษเพิ่มอีก จำนวน 5 ไอเทม ไม่เพียงเท่านั้นหากมีผู้ลงทะเบียนเป็นผู้บุกเบิกครบตามจำนวนที่กำหนด ผู้บุกเบิกทุกท่านจะได้รับไอเทมเพี่มฟรีอีกยกเซิฟเวอร์ . ประเทศที่เปิดให้บริการเกม THE LORD เรียกข้าว่าท่านลอร์ด มีทั้งหมด 8 ประเทศ ดังนี้ - ประเทศไทย - ประเทศกัมพูชา - ประเทศลาว - ประเทศฟิลิปปินส์ - ประเทศบรูไน - ประเทศมาเลเซีย - ประเทศสิงคโปร์ - ประเทศพม่า . ร่วมสวมบทบาทเป็นอัศวินผู้กล้ายึดครองอาณาจักร ช่วงชิงความเป็นที่ 1 แห่ง The Lord . ติดตามรายละเอียดเพิ่มเติมได้ที่ [Official Website] : https://www.thelord-sea.com/#sec-preregister [Official Facebook Fan page] : https://www.facebook.com/TheLord.THAI [Official Instagram] : https://www.instagram.com/gravitygametech_official/ . ที่มา ข่าวประชาสัมพันธ์ Gravity Game Tech Co.,LTD.",0
ไอ่พม่าควยสัสพ่องตายเหิ้ย,1
