text,label
รอบแรกกลัวติดหนีกลับประเทศกัน. รอบนี้ไทนติดมีหน้ามาขอเข้า.. ก้อไม่พม่าหร่อที่เอาเชื้อข้ามมาให้คนไทยเดือดร้อน... อดตายอยุ่บ้านมึงเถอะ...,1
บางทีกุก้คิดนะ โควิดมารอบนี้ พบคนติดเชื่อเปนพม่า ทีเดว 5 ร้อยกว่า แต่ไม่เหนข่าวคนพม่าเข้ารักษาตัวรึกักตัวดูอาการที่โรงบาล รึสถานกักกัน แร้วไม่เหนบุคลากรทางการแพทย์ตื่นตระหนกขอความช่วยเหลือขอโน่นนี่นั่น ไม่เหมือรอบแรก อืมมมม สงสัยกุคิดมากไปเองแหละ คัยคิดไม่เหมือนกุก้ไม่ต้องมาเม้นด่ากุนะ,0
พม่าก้อคือชีวิตคนเหมือนกันนะคะ น่าสงสาร ไม่มีใครอยากจะเป็นโควิตหรอกค่ะ แม่ค้าดีนะคะมีจิตใจที่ดี คนเรามีจิตเมตตา น้ำใจ ก้อเป็นบุญทั้งผู้ให้และผู้รับนะคะ,0
บ้าหราลุงพูดมาได้งัยโทษใดรไม่ได้ก็เพราะมีผู้นำประเทศเเบบนี้พวกพม่ามันถึงเข้ามา แพร่ เชื้อโควิดคนไทยจะอดตายก็เเย่อยู่เเล้วมาเจอโควิดอีก ระบาดตายกันหมดเเน่,0
พม่าหนีตายมา แทรกซึมอยู่ที่บ้านเราทั่วประเทศ จะโทษใครล่ะ ถ้าไม่ใช่การจ้างแรงงานต่างด้าวผิดกฎหมาย,1
สู้ๆๆคับพี่น้องชาวพม่า..เราก็คนเหมือนกัน..,0
เส้นทางหากินแถบนี้มีมาตั้งไม่รู้กี่สิบปี? เคยจับได้ก็เคย? ด่านความมั่นคงก็หลายด่าน? ด่านทางธรรมชาติก็มาก? เหมือนใส้ศึกเปิดประตูเมืองทัพพม่าเข้าตีอยุธยา? เผาอยุธยาวอดวาย? โตป่านนี้ยังเคืองมันไม่หาย? ครั้งนี้มันจะตีได้กี่เมือง? ยิ่งขุนพลเง้าๆทั้งนั้น? โควิทกระจอก,0
พม่าเค้าก้กลัวเหมือนกันกับเรานี่แหละแยกแยะกันหน่อยคนที่เปนก้ว่าไปจะไปรังเกียจทั้งหมดมันก้ไม่ถูกใจเขาใจเราแถวบ้านก้มีแรงงานพม่าลูกเล็กเดกแดงเค้าก้อยุ่ส่วนเค้าเราสงสารเดกยังซื้อขนมไปให้เลย..ไหว้แล้วไหว้อีกเค้าถามว่าไม่รังเกียจเค้าเหรอ..อ้าวก้ไม่ได้เปนโควิคนี่จะรังเกียจทำไม..จิงมั้ย,0
ผมชอบคําผูดนายท่านออกมาผูดดีที่สุดขอไห้คนไทยเข้าใจน่อยได้ไหมกรุณาอย่าดูถูกคนแรงงานข้ามชาติอยู่ในเมืองไทยมาทํางานไห้คนไทยมีเงินมีทองบ้านเมืองเจริญผมก็เป็นแรงงานข้ามชาติชาวกะเหรียงคนหนึงไม่อยากเขี่ยนเยอะครับท่านอ่านภาษาไทยได้หมดขอโทษด้วยครับคนไทยอย่าดูถูกผู้อื่นเลยโลกใบนี้ไม่แน่ไม่นอนอีกไม่นานประเทศพม่าอาจจะเจริญได้ดีกว่าไทยเยอะน่ะเวรกรรมมีจริงๆอย่าดูถูกคนเพื่อนบ้านส่งข้อความอ่านได้เขี่ยนได้ภาษาไทยอย่าดูถูกผู้อื่นเลยคนไทย,0
ที่บ้านสามีที่จังหวัด?กาญจนบุรี?แรงงานพม่าขยันและประหยัดแต่ถ้าเกิดเป็นไข้หรือว่าป่วยจะไม่กล้าไปหาหมอสิ่งนี้แหละเราควรจะ?บอกให้เขาเข้าใจว่า1คนเป็นโควิด19แต่คนรอบข้างติดเราเป็นสิบเป็นร้อยเป็นพันรวมทั้งคนไทยที่เป็นโควิดด้วยไปตรวจร่างกาย?เพื่อลดจำนวนคนติดขอความเห็นใจจากคนไทยและคนร่วมโลก,0
คิดที่จะบิน อย่าลืมดินที่เคยเดิน เป็นผมก่มาครับ อยู่พม่าถ้าติดรอเวลาตาย แต่ถ้าข้ามมาได้ ทั้งตรวจฟรี รักษาฟรี อยู่ฟรีกินฟรีอีกคัยมันจะไม่มา555,1
คนไทยไม่กลัวเกิดอุบัติเหตุตายปีละหลายร้อย Covic ตายยังไม่ถึงร้อย โรคโควิด คนถ้ารู้จักระมัดระวังมันก็จะลดการระบาดได้ จงมองคนพม่าก็เป็นคน ไม่มีใครอยากเกิดโรคหรอก เขามาช่วยทำงานให้เรา เพราะคนไทยจ้างงานเขา เวลาเขาทุกข์เราต้องเห็นใจเขา เราตัดขาดจากการจ้างงานคนพม่าทำงานไม่ได้หรอก เพราะคนไทยเลือกงาน ถึงไม่มีงานทำคนไทยก็ไม่อยากทำงานแบบนี้,0
ให้มันตายโลดพวกพม่านั้นลักลอบเข้ามาดีคักคนไทยกะเป็นใจให้มันดีคัก,1
เราเป็นมนุษย์ด้วยกันทำไหมถึงเกี่ยงพม่านะขอบคุณคนที่เห็นใจมนุษย์ด้วยกันขอบคุณด้วยจากใจจริงๆนะครับขอบให้พี่แม่ค้าสุขภาพแข็งแรงตลอดไปครับ,0
ต้องเสียงบประมาณอีกเท่าไหร่ ที่ต้องตรวจ และรักษาพวกแรงงานต่างพม่า.....เพราะบางคนป่วยแล้วหนีเข้ามาเมืองไทยได้ก็รอดตายแล้วทำยังไงไทยก็ต้องรักษาพวกมันอยู่แล้ว,1
นายจ้างกับนายหน้าคือตัวนำเชื้อไม่ใช่พม่าหรืเพื่อนบ้านเรา,0
เดินสู้ๆๆครับนายกจะล็อกดาวอีกแล้วเพื่อนายกจะเอาพม่าเขาเพิ่มอีกครับและมันจะต่างม็อบไม่ให้เดินขบวนครับ,0
Siam Mattitanont คนไทยก็จะอดตายกันอยู่...เห็นแต่ตัวมากพม่า,1
คุณหมอไทยเราใจดี มีน้ำใจเราเป็นคนไทยยังฃึ้งนำ้ใจคุณหมอให้กำลังใจพวกเขาไม่ว่าจะเป็ชาติไหนคะ่สงสารพวกเขาพม่าสู้ๆขอให้หายเจ็ษป่วยไวๆคะ่???,0
พม่าสกปรกจะตายถุยนำ้ลายไปทั่ว,1
ไอ้ที่เห็นติดเป็นพันนั้นมันแรงงานต่างด้าวทั้งนั้นคนไทยนับได้มีแค่ไม่ถึงร้อย ต้องล็อคดาวน์ชายแดนให้หนักทุกจุดแต่ถ้าไม่เด็ดขาดมันก็ลักลอบเข้ามาอยู่ดีจะใช้ความรุนแรงก็ว่าเกินไปทำเหมือนเกาหลีทำคือเข้าใกล้เขตแดนยิงทิ้งอย่างเดียว และต้องส่งเรื่องไปหารัฐบาลพม่าให้เขาดูแลประชากรเขาอย่าให้หนีเข้ามาไม่งันจะหาว่าเรารุนแรงไม่ได้ถ้าทไปได้นะ,1
กลัวแถบภาคเหนือแทบตาย กูอุตส่าด่าพวกกรี่จนคอแหบแห้ง เห็นข่าวสมุทราสาครแล้วแทบช็อค พม่าฝ่ามาโจมตีใจกลางชาติกูตั้งแต่ตอนไหน อีเหี้ย!! จัญไร๊!!! อีเปร๊ต!! #โควิดสมุทรสาคร #โควิดสมุทรปราการ,1
นี่แหละครับมนุษย์โลกเป็นแบบนี้คนเราทำไมไม่รู้จักแยกแยะใช่ว่าคนพม่าจะติด covid ทุกคนเราต้องแยกแยะให้ออกมีเหตุและผลอย่าไปอคติกับเขาพม่าน่ะก็เหมือนอย่างเราครับคนไทยติดโควิชแล้วคนไทยทุกคนต้องน่ารังเกียจหรือเปล่าเอาใจเขามาใส่ใจเราด้วยเขาก็คนเหมือนกันกับเราบ้านเราเป็นเมืองพุทธต้องมีจิตใจโอบอ้อมอารี เห็นอกเห็นใจเขา,0
เข้าใจนะคะขอให้ทุกคนเห็นใจพม่าด้วยเราก็คนเหมือนกันอย่ารังเกียจหรืออะไรเขาเลย,0
Nott Chom ยังไงมันก็อยากมาครับ มีโอกาสได้งานและดำรงชีวิตได้ ดีกส่าอดตายหรือไปประเทศ?อื่น? เพราะคนไทยใจดีใจกว้างกับพม่ามาก ทำเหี้ยกับคนไทยแค่ไหนคนไทยก็ไม่โกรธ?ไม่เอาคืน เป็นผมเป็นพม่า ผมก็มาแม้ไม่มีคนจ้างในทันทีก็ตามแต่เชื่อว่าต้องได้งานทำละอย่างน้อย คนไทยขี้สงสารพม่่าและต่างด้าวที่สุดอยู่แล้ว?,0
เราคือเพื่อนบ้านพม่าไทยลาวกัมพูชาแจกกันเป็นโรคโควิคไทยรับเต็มศูนย์กลางของเพื่อนบ้าน,0
พม่ามันจะเหยียบตีนกู?อยู่แล้วควายปล่อยมันเข้ามาเยอะๆๆไอ้ฉิปหายปล่อยแม่มันตายโลดซุมพม่าเหี้ยๆๆแบบนี้บ้านกูกะบ่ได้กลับย้อนพวกเหี้ยๆๆอย่างพวกมึงควายล้วน,1
"นี้ไงเห็นใจพม่าไงถึงติดโควิดเกือบ2,000?คน",1
ถึงไม่ล๊อกก็ไม่กินหรอกอาหารทะเลความเสี่ยงสูงพม่าทำสกปรกจะตายไม่รู้มันถุ้ยน้ำลายใส่ด้วยหรือเป่ลาก็ไม่รู้,1
พม่าพวกมึงมาทำให้ประเทศกูลำบากแถมเอาโรคมาให้ประเทศกุอีก..มึงรีบกลับไปประเทศมึงเลยสัสไปตายยุบ้านมึงโน้นอย่ามาสร้างความเดือดร้อนให้ประเทศกุ,1
สยามแลน แต่ก็ไม่ได้แปลว่าคนไทยเด้อ พม่า เวียดนาม ลาว กัมพูชาในไทยเยอะแยะพี่น้องเราทั้งนั้น ร่วมกันดู,0
พม่ามันรู้มันหัวดีกว่าคนไทยมันรู้ว่ามันติดโรคโควิดมันก็เลยหนีเข้ามาอยู่ในไทยถ้ามันอยู่ประเทศพม่าเขาไม่ช่วยเหลือมันถ้ามันอยู่ไทยคนไทยต้องรักษามันหายที่นี่ประเทศไทยหรือประเทศพม่ามันเอาเชื้อมาแพร่ให้คนไทยเดือดร้อนยังต้องรักษามันอีกเหรอแม้แต่คนไทยแท้ๆยังเอาตัวเองไม่รอดอยู่มันพาความเดือดร้อนมาให้ฆ่ามันทิ้งซะ,1
พม่าเอยมึงก็เห็นใจไทยบ้างสิ กัแต่จะเอาเข้ามาแรงงาน,1
ประเทศใครประเทศมันก่อนได้ใหมอะไรนักหนาเอะอะจะมาแต่ไทยอยู่ที่พม่าก็คงไม่อดตายหรอก,0
อยุธยามันเผากำแพงรัตนโกสินมันพังกำแพงมันจะอะไรนักน่าไอ้พวกพม่ารามัน,0
พม่าทำแสบ..ตายๆๆ,1
สมัยก่อนเผาบ้านเผาเมืองชาตินี้ยังจะมาอะไรกันอีกไอ้พม่า,1
มรึงไปเรียกร้องจากนายหน้าพวกมรึงเรย? รอไม่ได้โปรดตายไปพรางๆก่อน พวกกรุเดือดร้อนกันทุกหย่อมหญ้า?เพราะอีพวกพม่ามักง่ายอย่างมรึง ?,1
สุดยอดน้ำใจ!แม่ค้าร้านตามสั่ง มอบน้ำใจ แรงงานเมียนมาไม่มีเงิน ไม่มีใครให้ข้าวกิน มารับข้าวฟรี !! ที่ร้าน เพจเฟสบุ๊ก ฉัจธมน สิงห์ตาลกง ได้โพสต์ข้อความ : ประกาศ !!!!!!! แรงงานพม่า ที่อาศัย ในเขตถนนวัดคู่สร้าง - ประชาอุทิศ ไม่มีเงินซื้อข้าวกิน หรือ อยากซื้อข้าวกิน แต่ไม่มีใครขายให้ ท่านมาที่ร้าน ครัวเมืองเพชร ได้เลย ตลอดทำการ6:00น. ถึง19:00น. ไม่มีเงิน เราให้กินฟรีค่ะ .... โทร.061-7731741 ร้านครัวเมืองเพชร ยินดีช่วยเหลือค่ะ......,0
กรุงแตกเพราะพม่า แต่ก็อาจจะเพราะคนไทยเนี้ยแหละ ลักลอบเอาคนงานเข้ามา ใครจะรู้ครับ ฝากทางการใครฝ่าฝืน ยิงโลด กระสุนชายแดนเก็บไว้ทำไมเยอะ,0
สบายมากเอาจีนเข้ามาดับบลิวทีโอได้ ทำไมจะเอามันออกไปไม่ได้ละ ให้จีนมันคบค้าสมาคมกับปท.พี่น้องมัน ไทย ลาว เขมร พม่า,0
จะว่าไปก็คล้ายๆสมัยเสียกรุงศรีที่มีไส้ศึกแอบเปิดประตูเมืองให้พม่ามาเผาเมืองชักเสียวละสิ,0
กฏหมายน่าจะออกมาใหม่ใครเจอพม่าฆ่าได้หัวล่ะ5000น่าจะหมดไปจากประเทศไทยไวยุน่ะ,1
มุทิตาครูบาบุญชุ่มโด่งดัง13ชีวิตติดถ้ำหลวงขุนน้ำนางนอนพร้อมเรื่องน่าสนใจ ทีมข่าวกองบรรณาธิการหนังสือพิมพ์คัมภีร์นิวส์ ขอแสดงมุทิตาสักการะวันคล้ายวันเกิด ครูบาบุญชุ่ม วันที่ 5 มกราคม ของทุกปี ครูบาบุญชุ่ม ญาณสํวโร แห่งวัดพระธาตุดอนเรือง เมืองพง รัฐฉาน ประเทศพม่า ท่านเคยโด่งดังเมื่อครั้งทำพิธีเปิดทางเพื่อช่วยเหลือเด็กๆ และโค้ช 13 ชีวิต ที่ติดอยู่ในถ้ำหลวง วนอุทยานถ้ำหลวง-ขุนน้ำนางนอน อ.แม่สาย จ.เชียงราย และ 13 ชีวิตก็รอดตายราวปาฏิหาริย์ #หนังสือพิมพ์คัมภีร์นิวส์ #kampeenews #ร้านพระเครื่องเอกคัมภีร์ มุทิตาครูบาบุญชุ่มโด่งดัง13ชีวิตติดถ้ำ,0
เกลียดพม่าส่งพวกมันกลับไปตายบ้านมัน,1
พวกพม่ามันรวมหัวกันเจ้าหน้าทีไม่ทันพวกมัน..มันไม่ยอมหัยกักตัวจับใด้ส่วพวกมันหัยไปตายในประเทศมันเลย.ในต้องกักตัวพวมมันเอาใว้ในประเทศไทย,1
พม่ามาก ยิงทิ้งบ้างครับ,1
