text,label
ผมเป็นไทใหญ่ที่เปนชวนกลุ่มน้อยในประเทศพม่าผมมีภาษามีประเพณีเป็นของตัวเอง ผมไปโตที่ไทยผมอยุ่ที่ไทน15ปีตอนนี้ผมอายุ20เรียนม.1. ผมเคยถูกคนไทยรังเกดูถูกเหยียดหยามจนผมทนไม่ไหวร้องไห้ขอไห้ขอไห้พ่อแม่พากลับบ้าน เกิด ผมขอฝากไว้พี่น้องไทใหม่ของผมไม่เคยดูถุกกันมีแต่ ช่วยเหลือกัน แล่วคุณละคุณเป็นึนไทยไหนบอกว่าคนไทยเปนคนมีน้ำใจในวันนี้คุณเหมารวมหมดเลยว่สพวกผมผิดพวกผมไม่ดี,0
#พื้นที่สีแดงคะ!!เพิ่มไปเรื่อยๆ แล้วยังงี้คนที่ไม่ได้ป่วย!!คนที่ ได้รับผลกระทบคนที่พักอาศัย ในพื้นที่สีแดงไม่แย่ก่อนเหรอ!! ทำอะไรก็ไม่ได้!!เริ่มเคลียดแล้วเนี้ย!! พม่าดูแลกันจัง!!กับคนไทยไม่มี อะไรเลย!!ไร้ซึ่งคำตอบอะ!! #ส่วนรวมเราก็เห็นใจทำตามอย่างเคร่งคัด!!ใจเขาใจเรา??!!#แต่ส่วนตัวพวกเราหล่ะจะต้องไห้ทำยังไง!!.ออกนอกพื้นที่ไม่ได้/ขายของไม่ได้/ไปใหนไม่ได้!!.. ..,0
คนเขาหมดหวัง หมดศรัทธาแล้ว รอบแรกทุกคนให้ความร่วมมือเป็นอย่างดี อาจจะลดการ์ดลงบ้างแต่ไม่ถึงกับการ์ดตก แต่สิ่งที่ทุกคนรักษากันมาตลอดจนในประเทศไม่มีการติดเชื้อได้เป็น 100 วัน กลับมาพังทลายลงเพราะพวกข้าราชระยำ รู้ทั้งรู้พม่า อินเดีย โรฮิงญา กำลังระบาดรุนแรง ยังเสือกโลภ ปล่อยให้เกิดการค้ามนุษย์ ค้าแรงงานข้ามชาติ (เถียงมาสิว่าไม่มี) ปล่อยให้คนพวกนี้เข้ามาเพียงเพราะผลประโยชน์เล็กน้อย ( ตรวจสอบละยัง? มีบทลงโทษมั้ย?? ) หนำซ้ำยังมีการระบาดจากบ่อนพนันที่ทุกคนรู้ Google รู้ แต่ตำรวจระดับผู้กำกับไม่รู้ (หรือทำอะไรไม่ได้ก็ไม่รู้) แล้วสุดท้ายลุกลามจนปัจจุบัน กูบอกเลยตอนนี้ใจคนไทยแมร่งล้มระเนระนาด พัง แหลกสลายไม่เหลือชิ้นดีไปแล้ว กูคุยกับหลายๆคน เค้าไม่แคร์แล้ว จะติดก็ติดช่างแมร่ง เสียความรู้สึก นี่คือคำพูดจากปากเค้าเลย คำถามเดียวจากกูนะ ระหว่างบทลงโทษข้าราชการเลว กับรายงานสถานการณ์โควิดรายวัน มึงว่าคนไทยอยากได้ยินอันไหนมากกว่า ??? สวัสดี,0
"ผบ.ตร.ลงพื้นที่จังหวัดสมุทรสาคร ร่วมกับรองผู้ว่าราชการจังหวัด เจ้าหน้าที่สาธารณสุข และฑูตแรงงานเมียนม่า เพื่อดูแลประชาชนและติดตามสถานการณ์ Covid พล.ต.ต.ยิ่งยศ เทพจำนงค์ โฆษก ตร. เปิดเผยว่า วันนี้ 22 ธ.ค. 63 เวลา 14.30 น. พล.ต.อ.สุวัฒน์ แจ้งยอดสุข ผบ.ตร. พร้อมด้วย พล.ต.อ. ดำรงศักดิ์ กิตติประภัส รอง ผบ.ตร., พล.ต.ท.ธนา ชูวงษ์ ผบช.ภ.7 , พล.ต.ท.สมพงษ์ชิงดวง ผบช.สตม., พล.ต.ท.โสภณรัชต์ สิงหจารุ นายแพทย์ใหญ่โรงพยาบาลตำรวจ ร่วมกับ นายสุรศักดิ์ ผลยังส่ง รองผู้ว่าราชการจังหวัดสมุทรสาคร และทีมแพทย์ โรงพยาบาลตำรวจ พร้อมเจ้าหน้าที่ที่เกี่ยวข้อง อาทิ สาธารณสุขจังหวัดสมุทรสาคร ร่วมประชุมแบบบูรณาการเพื่อช่วยเหลือประชาชน จากสถานการณ์การแพร่ระบาดของเชื้อไวรัส COVID-19 ในพื้นที่จังหวัดสมุทรสาคร โดยที่ประชุมมีข้อสรุปแนวทางการปฏิบัติดังนี้ -ให้ดูแลจัดระเบียบสถานที่ควบคุมแรงงานพม่าให้อยู่ในความเรียบร้อย ปลอดภัย โดยคำนึงถึงมาตรการด้านโควิดเป็นสำคัญ -ให้จัดเก็บข้อมูลคนต่างด้าวโดยระบบเทคโนโลยีสารสนเทศ เพื่อสะดวกในการตรวจสอบข้อมูล -เน้นย้ำเจ้าหน้าที่ให้ร่วมกันปฏิบัติงาน มีการประสานข้อมูลอย่างใกล้ชิด -ให้ปฏิบัติหน้าที่ด้วยความระมัดระวัง และสวมใส่อุปกรณ์ป้องกันการเเพร่ระบาดฯ ทุกครั้ง ต่อมา พล.ต.อ.สุวัฒน์ฯ ผบ.ตร.พร้อมด้วยคณะได้มอบอุปกรณ์ เช่น หน้ากากอนามัย แอลกอฮอล์เจล ถุงมือ และ face shield และได้ลงพื้นที่ตรวจเยี่ยมตลาดกลางกุ้งเพื่อดูแลความเรียบร้อยแก่พี่น้องประชาชน และสร้างขวัญกำลังแก่ผู้ปฏิบัติงานในพื้นที่อีกด้วย พล.ต.ต.ยิ่งยศฯ โฆษก ตร.ยังได้เปิดเผยอีกว่า พล.ต.อ.สุวัฒน์ฯ ผบ.ตร.มีความห่วงใยกำลังพลฯ จึงได้สั่งการให้ศึกษาแนวทางการทำประกันสุขภาพ เพื่อดูแลด้านสวัสดิการให้แก่ข้าราชการตำรวจผู้ปฏิบัติงาน และทีมแพทย์ พยาบาลที่ปฏิบัติงานในพื้นที่เสี่ยงอีกด้วย ทีมโฆษก ตร.",0
ผมไม่เข้าใจ?ว่าทำไมตอนไปตรวจหรือตอนล็อกดาว? ทำไมรัฐไม่บอกพวกพี่น้องชาวพม่า? ว่าพวกที่ลักลอบเข้ามาจะไม่มีความผิดเพราะว่าใหนๆก็มาเเล้วจะได้ไม่ต้องทุบกำแพงหนี? ป่านนี้คงจะทำควบคุมโรคได้ง่ายกว่านี้คงไม่บานปายกว่านี้แล้ว,0
จ้างโจรใต้ยิงพม่าดิรัฐบาล,1
สาธุค่ะเราต้องช่วยเหลือเกื้อกูลกันดีกว่าอย่าแบ่งว่าเป็นไทย ลาว พม่า เลยค่ะไม่ว่าชนชาติไหนก็มีสิทธิ์เป็นโรคได้หมดพวกเค้าลำบากเค้าถึงต้องดิ้นรนมาหาเงินไปจุนเจือครอบครัวจับมือกันสู้ไปด้วยกันผ่านมันไปให้ได้ดีกว่าค่ะ,0
แล้วตอนนี้ที่ยังไม่มีโรงบาลสนาม..พม่าที่ติดเชื้อแยกอยู่ที่ใหนค่ะ..หรือยังรวมกันอยู่กับคนที่ไม่ติดเชื้อในหอพักค่ะ..หน้าเห็นใจทุกด้าน,0
วอนผู้เกี่ยวข้อง ทำไมไม่ส่งกลับประเทศให้หมดเลย ไม่รู้พม่าบางคนเข้าใจหรือเปล่าว่าโรคโควิดมันร้ายแรงขนาดไหน ส่งกลับบ้านไปเถอะหายแล้วค่อยกลับมาใหม่ก็ได้ แครักษาคนไทยนี่ก็เยอะพออยู่แล้วผู้ติดเชื้อเพิ่มทุกวัน ไม่มีลดเลย หรือจะมีมาตรการอะไรก็รีบๆทำเถอะคะ,0
น้องๆคนพม่านะ ไม่ต้องเกรงใจเกิ๊น จับได้ หยิบได้เลย ตามสบาย พี่อนุญาต?เองใครมีปัญหา ก็ให้ค่อยๆแก้โจทย์? พี่ส่งใจช่วยนะน้องๆ สู้ๆ??,0
Amlin Lalarila คิดเยอะครับเหมือนผมคนสมุทรสาครน่ารังเกียจอ่ะ..แทนที่จะให้กำลังใจกันนี่เสือกทำคลิปเอาฮา..มันบ้าปะล่ะทุกวันนี้ทำมาหากินก็ลำบากแย่ละยังเสือกมาทำคลิปให้คิดเยอะพวกคุนอาจจะขำแต่เราไม่ขำด้วยหรอกนะ..โรคมันมาจากคนกลุ่มนึงทีเหนกะเงินเล็กน้อยปล่อยให้ไอ้ต่างด้าวพวกนี้ลักลอบเข้ามา. แพร่จนเปนเรื่องราว .ทำไมไม่แต่งเพลงพม่าทำฮาล่ะ..ขำไปกันเหอะไม่ตกอยุ่ในห้วงนี้ค้าขายไม่ได้รายได้ไม่มีลุกเมียพ่อแม่พี่น้องจะเอารายจ่ายที่ไหนมากินของเก่าจะหมดอดกันตายห่าแล้ว..ไม่จำละครับเครียด. มาเจอไอ้สัสนี่ทำคบิปหยียดอีก,0
ทุกวันนี้ยังเห็น พม่า ไม่ใส่ผ้าปิดจมูกอยู่เลย เราอยู่สมุทรสาคร เคยทำงานกับพม่า ตอนระบาดแรกๆ ตอนนี้ออกมาจากโรงงานนั้นแล้ว ไม่มีความสะอาดเลย อยากถุยน้ำลายก็ถุยไปทั่ว ตอนนั้นต้องนั่งทานข้าวในห้องทำงานคนเดียวไม่ไปกินกับใคร รอดมาได้ก็ต้องมาเจออีกระลอก สู้ๆค่ะคนไทย,0
ให้พม่ากลับบ้านมันไปเถอะอย่าเอาไว้เลย,1
ใกล้บ้าละคนพม่าก็คนนะเขาไม่ได้เป็นทุกคนไม่มีใครอยากเป็นเห็นใจกันเอาไว้,0
ดีคับหมอจะได้ทำงานหนักหน่อยเอาใจรัฐบาลเงินจะได้เข้าเยอะๆถึงตัวตายเงินไม่ได้ใช้สักบาทหมอก็ยอมทำเพื่อพี่น้องญาติๆต่างด้าวและญาติฝรั่งของหมอๆทั้งหลายปลอดภัย ส่วนคนไทยปล่อยละเลยตายชั่งมัน ต่างด้าวฝรั่งสำคัญกว่าเพราะชาติไทยยุ่มาได้ถึงทุกวันนี้ ไม่ใช่คนไทย แต่เป็นพม่าเขมรลาวต่างด้าวต่างๆช่วยไว้ ?????,0
พวกพม่าที่ลักลอบเข้ามาผิดกฎหมาย จับได้ยิงเป้าทิ้งให้หมด ถือเป็นภัยคุกคามประเทศชาติ,1
ตอนนื้พม่ากำลังตีเมืองไทยแล็วตายคัก,0
ประเทศใครประเทศมันก่อนได้ใหมอะไรนักหนาเอะอะจะมาแต่ไทยอยู่ที่พม่าก็คงไม่อดตายหรอก,0
ตรวจเม้งให้หมดพม่า คนไทยปล่อยเม้งให้ตายกันหมด.คคคคคค,1
"ผู้ว่าฯสมุทรสาคร ได้แถลงพบติดเชื้อโควิด-19 เพิ่มอีก 3 ราย รวมเป็น 7 คน เร่งเช็คไทม์ไลน์ . จากกรณี พบหญิงไทยวัย 67 ปี เจ้าของแพกุ้ง ใน จ.สมุทสาคร ติดเชื้อโควิด-19 สามารถยืนยันเชื้อได้ เมื่อวันที่ 17 ธันวาคม ที่ผ่านมา . ตอนนี้ได้ตรวจเชื้อ โควิด-19 ลูกชายกับเพื่อนลูกชาย ผลออกมา ไม่พบติดเชื้อ ส่วนการตรวจเชื้อผู้ใกล้ชิดอีก 5 ราย พบว่า พี่สาว,มารดา,น้องสะใภ้ ของหญิงวัย 67 ปี พบติดเชื้อโควิด-19 . และล่าสุด ราว 19.30 น. ของวันนี้ (18 ธ.ค.) นายวีระศักดิ์ วิจิตร์แสงศรี ผู้ว่าราชการจังหวัดสมุทรสาคร แถลงพบผู้ติดเชื้อโควิด-19 อีก 3 ราย คือ ลูกจ้างชายชาวพม่า อายุ 40 ปี เสมียนวัย 24 ปี พ่อค้าขายกุ้งในตลาดกลาง อายุ 42 ปี ทางจังหวัดกำลังตรวจสอบไทม์ไลน์ . . #กรุงเทพธุรกิจ #กรุงเทพธุรกิจออนไลน์ ------------------------------- ติดตาม กรุงเทพธุรกิจ ผ่านช่องทางต่างๆ ได้ที่ Line: https://line.me/R/ti/p/%40rvb8351i Twitter: https://twitter.com/ktnewsonline Website : http://www.bangkokbiznews.com Youtube: https://www.youtube.com/user/KrungthepTurakij Blockdit : https://www.blockdit.com/bangkokbiznews Instagram: https://www.instagram.com/bangkokbiznews Tiktok : https://www.tiktok.com/@bangkokbiznews Soundcloud: https://soundcloud.com/njqvvip1pkff Spotify: https://open.spotify.com/show/7ugjo1HAyJ7aU4VEuuX7vs",0
Thanipong Prathumwan ก็คงต้องไปถามนายจ้างนะคะว่าทำไมถึงทำให้ไม่ถูกต้อง เพราะคนพม่าที่เข้ามา เค้าก็เสียค่าหัว ค่านายหน้า ต้องถามคนที่พาเค้าเข้ามาทำไมไม่เดินเรื่องให้เค้า อีกอย่างนะคะอันนี้พูดตามจริง ขนาดคนไทยที่ลักลอบไปต่างประเทศเช่นเกาหลี ทางเกาหลียังช่วยดูแลตรวจโควิดให้เลยค่ะ แล้วค่อยส่งกลับไทย แล้วนี่ประเทศเราขึ้นชื่อเป็น สยามเมืองยิ้ม มองถึงความเป็นคน มีคนอดข้าวหิวข้าวเดินมาขอข้าวกิน คุณจะใจดำไม่ช่วยเหลือเค้าหรอ?,0
รับมาอีกค่ะพม่าจะได้แพร่เชื้อให้มากกว่านี้สงสารพม่าแต่ไม่สงสารคนไทย,0
ชีวิตมนุษย์ ผ่านมาเพื่อพบเจอ ผมแค่แปลกใจ ที่พม่าปล่อยให้ปกครองตนเอง ทั้งที่เมืองอื่น พม่าไม่ปล่อยครับ,1
ต้าย ต้าย ตาย อย่างเขียด บัคพม่าหมู่นี้เป็นตาย่านแทะ,1
คนไทยรึพม่าก็ตากช่วยเหลืองกันดีแร้ว,0
ศึกนี้ใหญ่หลวงนัก พม่าบุกตีกรุงแตก เพราะความเห็นแก่ตัวของนายหน้า และเจ้าหน้าที่ผู้เห็นแก่เงิน,1
เมืองประมง ดงโรงงาน ลานเกษตร เขตประวัติศาสตร์ ตลาดน้ำท่วม ศูนย์รวมพม่า คนไทยตายห่า พม่าครองเมือง,1
เจ้าของร้านอาหารครัวเมืองเพชร ย่านประชาอุทิศ ประกาศผ่านเฟซบุคส่วนตัว ให้แรงงานพม่าที่อาศัยในเขตถนนวัดคู่สร้าง-ประชาอุทิศ ที่ไม่มีเงินซื้อข้าวกิน หรืออยากซื้อข้าวกินแต่ไม่มีใครขายให้ ให้มาที่ร้านครัวเมืองเพชรได้ตลอดเวลาทำการ 06.00-19.00 น. และยังระบุว่า หากไม่มีเงินก็จะให้กินฟรี ร้านครัวเมืองเพชรยินดีช่วยเหลือ https://mgronline.com/travel/detail/9630000131248,0
ไม่เป็นไรคับไม่ต้องห่วงคนไทยเอาใจช่วยพี่น้องชาวพม่าให้มากๆก็แล้วกัน,0
เข้ามาตายเหมือนพม่าแน่,1
มึงจะเพ่นพล่านทำไมวะพม่าอยู่เฉยๆได้ไหมกูเครียดจะตายอยู่แล้วเพราะพวกมึงเยอะไปหมด,1
ประเทศไทยยุคพม่าสงสารหมอบ้างเถอะรัฐบาลเราไม่เคยเป็นพี่น้องกับพม่าหมอมิน่าคนไทยไปทำใบขับขี่แต่ให้คนไทยทำที่หลังให้พม่าทำก่อน,1
เราก็ประสานไปให้ทางการพม่ามารับพลเมืองเค้ากลับประเทศไป ไม่ได้รึคะ เหมือนที่เราไปรับพลเมืองของเรา กลับประเทศ ตอนอู่ฮั่นระบาด ใคร? อยากกลับไปตายบ้านเกิด ก็แจ้งมา ส่งเค้ากลับไป แค่เรือข้ามฟากเองค่ะ..ไม่เปลืองงบป่ะมาณด้วย,1
คนที่สงสารพม่าน่ะ? สงสารตัวเองก่อนเถอะจ้า,0
ที่ไทยเป็นแบบนี้เพราะพวกพม่าลักลอบเข้ามา ใครเข้ามายิงทิ้งให้หมด ดูสิจะกล้าเข้ามาไหม,1
สันดานเหี้ย คนไทยช่วยกันแทบตาย เสียเพราะพวกพม่าเห็นแก่ตัว ชาติชั่วจริงๆ,1
พม่ากำลังจะฆ่าไทยด้วยโควิด,1
ตามจับตายแม่งซะไม่งั้นแพร่เชื้อบานเลย ระบมันเข้ามาเยอะๆแล้วเป็นไงละ ไอ้พม่าระยำ,1
พม่าบุกโจมตีไทยด้วยยุทธวิธีโควิด19ผ่านแนวธรรมชาติ,1
ทำงานหนักมากเลยอีสัดชายแดนเนี่ย พม่าพกไม้ขีดคนละก้านเผาเมืองมึงได้เลย,0
ขอให้ปลอดภัยทุกคนค่ะ ไม่ว่าจะเป็นคนไทยรึแรงงานพม่า ยังไงก็มนุษย์ร่วมโลกเหมือนกัน ในเมื่อมันเกิดขึ้นแล้วก็ควรช่วยกันแก้ไขปัญหา อย่ามัวแต่โทษใครคนใดคนนึง เอาใจช่วยทุกคนนะคะ เพราะทางนี้ก็หนักเหมือนกันค่ะ #กำลังใจจากระยองค่ะ,0
ตายสะ พวกพม่า? ทำให้ประเทศคนอื่นเขาเดือดร้อน,1
พม่าเอาโรคมาคนไทยป้องกันแทบตายจะคุมอยู่ไหมเนี้ย,1
คนไทยไม่ได้ขี้เกียจนะคะแต่นายจ้างชอบกดขี่ข่มเหง.เอาพม่ามาเป็นลูกน้องสั่งทำสากกะเบือยันเรือรบแต่ดีนะคะ.ข่มเหงมันมากๆมันถึงบาดคอนายจ้างตาย.เห็นข่าวเกือบทุกวันรับมันเข้ามาเยอะๆ,1
