text,label
"`ปิดกรุ๊ป ไปไม๊ปายยย...แม่ฮ่องสอน` `#ไทยเที่ยวไทย #เที่ยวได้ปลอดภัย #เที่ยวไทยไปกับทัวร์` ???? *ITH74 แม่ฮ่องสอน 4วัน 2คืน* *พักปาย1คืน แม่ฮ่องสอน1คืน* *เดินทางโดยรถโค้ชปรับอากาศ* ปาย คอฟฟี่อินเลิฟ จุดชมวิวหยุนไหล ถนนคนเดิน ปายแคนยอน ปางมะผ้า บ้านจ่าโบ่ บ้านรักไทย ปางอุ๋ง โปรแกรม https://th.city/130e *??30ธ.ค.-2ม.ค.6,900฿ -- 9ที่ *คอนเฟิร์มเดินทาง* ???? *ITH07 ปาย แม่ฮ่องสอน 3วัน2คืน* *??บิน Viet Jet Air (VZ)* *พักปาย1คืน แม่ฮ่องสอน1คืน* อาหาร 6มื้อ(พิเศษ??อาหารยูนนาน) โปรแกรม https://bit.ly/3khXGmm ??30ธค.-1ม.ค.9,888฿--WL/3ที่สุดท้าย ?????????????????????? ขายตั๋วเครื่องบิน รับจัดกรุ๊ปทัวร์ กรุ๊ปส่วนตัว กรุ๊ปดูงาน ประกัน เดินทาง ขอวีซ่า ทิ้งเมลล์ หรือ INBOX ขอรับรายละเอียดเพิ่มเติมได้เลยนะ โทรสอบถามรายละเอียดเพิ่มเติม หรือ ขอรับโปรแกรมได้ที่ เจน 094-196-9459 LINE : jane_pimnapat ใบอนุญาติ ททท.11/08772 https://www.facebook.com/goodbuddytour/ https://www.facebook.com/MineJourneyTravel/ ?#ทัวร์ต่างประเทศ #อัพเดท #ทัวร์สุดคุ้ม ?#ทัวร์จัดเต็ม #ทัวร์ลดราคา #ตั๋วหลุด?#ทัวร์ดีดี #ทัวร์ถูกมาก #เที่ยวทั่วโลก #ทัวร์น่าเที่ยว#ปรับราคา #SALE ?#PROMOTION #จัดกรุ๊ปส่วนตัว? #จองตั๋วเครื่องบิน ?#ทัวร์ไฟไหม้ ?#โปรไฟไหม้ ? #ทัวร์ยุโรป #ทัวร์พม่า?#ทัวร์ตะวันออก#ทัวร์เกาหลี#ทัวร์ญี่ปุ่น?#ลดราคา ?#ลดจัดหนัก#ทำ",0
ท่าฉลอม กับมหาชัย. จะคิดทำไมว่าไกล. เชื่อมความรักไว้ดีกว่า.... ...สาธารณะสุขสมุทรสาครแจ้งข่าวว่า ผู้ติดเชื้อพันกว่าราย กำลังจะหายแล้วครึ่งหนึ่ง ...เหมือนที่ผมนำเรียน ถ้าเราสุขภาพแข็งแรง การต้านทานต่อโรคย่อมดีกว่า คนที่สุขภาพไม่แข็งแรง ...ตราบใดที่การใช้แรงงานของประเทศ ยังไม่มีมาตรการมาตรฐานใดๆมารองรับให้ดี แรงงานต่างด้าวก็ไม่มีวันหมดจากประเทศไปได้ อีกอย่างเขามาใช้แรงงานหาเลี้ยงชีพเพื่อตัวเขาและครอบครัว เราอย่าไปรังเกียจหรือแอนตี้เขาเลยครับ ถ้าทำผิดกฏหมายค่อยว่ากันไปตามกระบวนการ ...แรงงานพม่าส่วนใหญ่ก็มาทดแทนแรงงานไทยที่แรงงานไทยไม่อยากทำเช่นการประมงเป็นต้น ก็ต้องอาศัยแรงงานเพื่อนบ้าน ไม่งั้นอาชีพนี้ก็ไปไม่ได้ดี เราไปประเทศเขาได้ ไปไหว้พระขอพรหลวงพ่อทันใจขอให้มีโชคมีลาภ ร่ำรวยเงินทอง เขาก็มาทำงานให้มีโชคมีลาภ ร่ำรวยเงินทอง ที่ประเทศเราได้ไม่ต่างกัน ...ใครที่รังเกียจแรงงานต่างด้าว ลองคิดดูนะครับว่าแรงงานไทยก็ไปเป็นแรงงานต่างด้าวที่เกาหลี ญี่ปุ่น ไต้หวัน อาหรับ ยุโรป อเมริกา มันก็ไม่ต่างกัน เอาใจเขามาใส่ใจเรา ...โรคโควิด มันต้องช่วยกัน สาธารณะสุขต้องเข้มแข็งในทั้งเชิงรุกและเชิงรับ ซึ่งตั้งรับอย่างเดียวไม่พอ ต้องป้องกันด้วย ...เป็นกำลังใจให้บุคคลากรทางการแพทย์ทุกท่านครับ,0
โฆษก ศบค.วอนสวมใส่หน้ากาก 100 เปอร์เซ็นต์ #new18 #นิว18 #newtv #นิวทีวี #ตรวจพบ #โควิด_19 #ติดเชื้อ #งานเลี้ยง #บิ๊กไบค์ #พม่า #แรงงานพม่า #แรงงานต่างด้าว #สมุทรสาคร #สาธารณสุข #มหาชัย #แรงงาน #แรงงานติดเชื้อ #รัฐสภา #ฉายารัฐสภา #รัฐบาล https://www.newtv.co.th/news/72485,0
กลับพม่าไป เป็นโควิดแล้วโอกาสตายสูงกว่าเป็นอยู่ไทยนะ,1
สงสารแต่คนพม่าที่เขาปฏิบัติตามกฏเราทุกอย่างแต่มาเสียเพราะกลุ่มคนที่มันเห็นแก่ตัวนี่แหละ,0
ถ้าปล่อยพม่าเข้ามากะชั่วชั่ม หมาละบักใด เปิดประเทศให้เขามา แต่นี้กะสิพากันตายดับเบิ่ดละ,1
ส่งกลับประเทศไปเลยไม่ต้องตรวจเเล้ว เห็นบอกพม่าแม่งหนีจากที่กักตัวอีก ภาระประเทศกูชิปหาย แค่การเมืองก็ก็จะตายห่าเนี่ยต้องมาเครียดกับพวกมึงอีก ส่งมันประเทศมันไปเลย,1
พม่าก็พูดแบบนี้นะครับ คือกลัวอดตาย ถ้าคุณต้องไปเสี่ยงทำงานแล้วญาติพี่น้องต้องมาเสี่ยงก็ทำไปเถอะครับ,0
สงสาร ชาวพม่าจังเลย,0
รอบแรกโดนพม่าเผากรุงศรี รอบนี้โดนโควิด,0
เกลียดพม่า เผากรุงศรีไม่พอ ยังจะมาตีเมือง มหาชัยอีก,0
สู้สู้นะคับพี่น้องชาวพม่าผมขอเป็นกำลังใจให้นะครับ,0
"จุมพล เมืองด้วง สลิ่ม คือชื่อเรียก ขนมหวานหลากสี ถูกเอามาเปรียบ เรียก กลุ่มชน ผู้มีวินิจฉัยเสีย มนุษย์พันธ์ สลิ่ม.. อธิบายได้ดังนี้ เป็นคนประเภท ศรัทธาจริตสูง .. เกิดจากความรัก ศรัทธา..ความเชื่อ ในมายาคติ หลายอย่าง จนสติหลุด คับข้อง โทสะ ในใจมาก พวกนี้ ฝักไฝ่ อำนาจนิยม และ อนุรักษนิยม ถือจารีด ใครไม่ทำตาม จารีตประเพณี ..ในแบบพวกเขา .. พวกเขาจะ เดือดร้อน มาก ชอบสังคมชนชั้น หลงไหลแซบซุ้ง ระบอบเทวนิยม มองคนไม่เท่ากัน ถือระบบ Sotus เชิดชูบุคคล มากกว่า เอาระบบ(System) ..ภูมิใจนิทาน ประวัติศาสตร์ กอบกู้ชาติ ของบรรพบุรุษ แบบไม่สงสัย.. เขาว่ามา.. คลั่งชาติ โดย เกลียดชัง ชาติอื่น ประวัติศาสตร์ของพวกเขา เป็นเส้นตรง มีแค่ สุโขทัย อยุธยา รัตนโกสินทร์ เท่านั้น พอ ลังกาสุกะ ลานนา หรือ อาณาจักรล้านช้าง จะใบ้แดรก.. หลงตัวเอง อยู่ในสังคมปิด เป็นทาสที่ปล่อยไม่ไป ไร้อิสรภาพแบบไม่รู้ตัว ..พวกนี้มัก ยัดเยียดความเชื่อ ของตนให้คนอื่น พอเขา ไม่อินด้วย ก็โกรธ ว่าเขาเนรคุณ ไล่ออกนอกประเทศ.. ..คนประเภทนี้ อยากได้ใครสักคน อะไรสักอย่าง ที่จะเป็น ศัตรู.. เพื่อที่ จะได้มีความรู้สึกร่วม ในการ ปกป้องตัวเอง และ พวกพ้อง.. เพื่อ จะได้ดราม่ากับชีวิต เหมือน มีเป้าหมายยิ่งใหญ่.. ..อาจเติบโตมากับ โฆษณาชวนเชื่อ ทำลายล้าง คอมมิวนิสต์ เชิดชู ชนชั้นสูง แบบไม่ ลืมหูลืมตา จากทุนของอเมริกา ต้นกำเนิด.. เก้าอี้ฟาดปกป้องสถาบันสนามหลวง ในตำนาน.. ..พวกนี้หลงไหล ฮีโร ใน แบบมายาคติ ปกป้องคนดี ทำลายขบวนการร้าย ผิดคือผิด ถูกคือถูก..โลกนี้มี ขาวดำ ชั่วและดี เท่านั้น ...ไม่ชอบแม้วโกง แต่ตัวเองว่า มีสิทธิพิเศษ มีคุนภาพ กว่า คนบ้านนอก.. ไม่ชอบแม้ว เอื้อพวกพ้อง ..แต่ ในวัง ในกองทัพ เครือข่าย อำนาจลึกลับ ลูกน้องท่าน คนของท่าน เพียบ .. สลิ่มเงียบ.. มันย้อยแย้ง เห็นแก่ตัวแปลก ๆ ไงไม่รู้ ..เท่าที่เจอจะ มีอารมณ์ขัน แบบฝืด ๆ บางทีต้อง แกล้งทำตลก ตามมัน จริงจัง ซีเรียส ดราม่า อ่อนไหว ไปหมดในชีวิต.. โยน มุขลึกๆ บางที คิดไม่ทัน .. ..สลิ่มคือ พวกไม่มีวิชั่น มองอนาคต ไม่ออก ไม่เข้าใจ Liberalism , Dataism , Humanism คือ สิ่งมีชีวิตใกล้สูญพันธ์ ที่ ไม่มีใครอยากอนุรักษ์สืบต่อ หาเหตุผลของการ คงอยู่ในยุค ต่อไปไม่พบ เนื่องจาก คนรุ่นใหม่ไม่ได้ ถูกสะกดจิตจาก การสื่อสารทางเดียว ทีวี วิทยุ โปสเตอรติดตามเสาไฟฟ้า เหมือนสมัยก่อน ..เพราะ คนรุ่นใหม่ สื่อสารสองทาง โต้ได้ถามได้ สงสัยค้นได้ ทางอินเตอรเนท เจอแล้วไม่เชื่อก็ได้ แนวคิดเสรีนิยม ข้อมูลข่าวสาร ทุนนิยม คนมีสิทธิ เลือกได้ ถาโถมในทุกวัน..อะไรถ้าไม่ดีจริง โฆษณาชวนเชื่อ ใช้ ไม่ได้ผล อีกต่อไป.. พวกนี้ถ้าทำธุรกิจ ไม่น่าจะเก็งกำไร อะไร ได้ดีนัก หรือถ้าทำธุรกิจอยู่ ลองสังเกตุ ธุรกิจ ของสลิ่ม ถึงไม่เจ้งก็ไม่พุ่งทยาน เพราะ เห็นคนไม่เท่ากัน หรือ ประกาศว่า ไม่เอาประชาธิปไตย ดู จะได้ รู้ว่า เหลือลูกค้ากี่ คน.. มนุษย์พันธุ์ คล้ายสลิ่ม..มีอยู่ในแทบทุกสังคม ในประวัติศาสตร์ของ มนุษยชาติ ในอินเดียมี ระบบวรรณะ.. เยอรมันมีนาซี..มุสลิมมี วะฮาบี..อเมริกามี KKK ..ในแฮรี่พอตเตอร์ มีพวกเลือดบริสุทธิ์ Pure Blood ... ..ไทยมี สลิ่มชาตินิยม เกลียดพม่า เกลียดคนลาว คนเหนือ ดูถูก คนบ้านนอกว่า ไร้การศึกษาปล่อยให้เลือกตั้งไม่ได้.. เกลียดไปหมด...มีที่ไม่เกลียด อยู่ คือ..ไม่เกลียด..ความน่าเกลียดน่าชังในใจตัวเอง..",0
เราก้ไม่เคยรังเกรียจพม่าเขมรลาวแต่ก่อนเราเคยทำงานร่วมกับคนต่างด้าวค่ะคนไหนไม่สบายเราก้พาไปหาหมอคนไหนท้องเราก้พาไปฝากท้องเรามีเพื่อนเป็นต่างด้าวหลายคนค่ะพวกเขาทำงานเก่งค่ะดีกับเราทุกคนเลยค่ะ,0
พม่าฆ่าไทย,1
ผลของการนำ ไส้ศึกเข้าประเทศของคนขายชาติ..ก้าวหาคนไทยด้วยกันว่า...ขี้เกลียด บ้างละ เลือกงานบ้างละ....เพื่อเป็นข้ออ้าง ของการนำ เข้าแรงงานพม่า..ทั้งผิดและถูกกฏหมาย บอกว่า พม่า ขยัน....ในความจริงแล้ว เขาทำงาน ก็ปกติเผลอๆขี้เกียดด้วยซ้ำ เพี่ยงแต่ใอ้คนที่พูดมันมีนัยแอบแฝง.......คนอดยากอดตาย อย่างพม่า(ไม่ใด้ดูถูกแต่เอาความจริงมาเล่าสู่ฟัง)เมื่ออยู่ที่เมือง พม่า..เมือใด้มาอยู่ ที่ที่แสนสบายอย่างเมืองไทย ก็สุดยอดสิครับ .ทั้งอาหารการกิน เครื่องอุปโภค บริโภค.ความสะดวกความสบาย ครบครันทำงานใด้เงืนเยอะกว่าอยู่ที่ พม่าอีกต่างหาก .... บางคนบางกลุ่ม อาจจะไม่ใด้ตรวจโรคด้วยซ้ำ.....อีกไม่นานคุมไม่อยู่.สมุทรสาคร. กลายเป็นเมือง สำรอง ของเมียนมาร์ไปโดยปริยาย.....คุณเชื่อไม่ว่า..ห้องเช่าบางแห่งมี 200 ห้อง...มีแต่เมียนม่าร์ เต็มหมดเลย......จริงหรือเท็จ ไปดูเอา.,1
ประเทศไทยปิดกิจการปิดโรงเรียนปิดโรงงาน สงสารคนไทยบ้างใหม เอาโรคมาทำไม ช่วงนี้เป็นช่วงโควิดก็รู้อยู่ คนต่างด้าวไม่ควรมา ไม่มีใครรังเกียจหรอกแต่กลัวโควิด เข้าใจน่ะ พม่ามาทำคนไทยเป็นโรคเยอะขนาดนี้ สำนึกผิดบ้างใหม่,1
อยากเห็นข่าวผู้ประกอบการออกมาช่วยกันทำโรงครัวทำอาหารแจกพวกเขาเหล่านั้นเราเคยอยู่ในสถานะการแบบนี้มาก่อนที่ภูเก็ตมีชาวบ้านร้านค้าช่วยๆกันทำอาหารแจก แจกหมดไม่ว่าคนไทยหรือพม่าต่างชาติ นี่คือน้ำใจคนไทยอย่าเห็นแก่ตัว. ช่วยเหลือพวกเขาเรารู้ว่ามันคงอีกนานกว่าจะดีขึ้น,0
เลิกแนวทางเอาชีวิตคนอื่นมาเดิมพันเถอะ ถ้าพูดแบบนี้ไปเยี่ยมแรงงานพม่าเพื่อนบ้านเราในสมุทรสาครที,0
555555555 ไอ่พม่า นี้เผากรุงศรีไม่พอ เองจะยกพลมาตีแถบภาคกลางเลยเชียวรึ,0
เจอพม่าจับกระทืบให้ตายคาตีนไปเลย ให้กักตัวไม่กักแบบนี้,1
สู้ๆครับพี่ๆน้องๆชาวพม่า?เราจะสู้ไปด้ว?ยกัน?เราต้องเป็นกำลัง?ใจให้กันและกัน,0
ตอนนี้ พวกกูจะตายห่าก็เพราะพวกมึงเลย อีพม่า,1
เปิดใจเจ้าของร้านตามสั่งแจกข้าวต่างด้าว เผยเห็นใจเพื่อนมนุษย์ | ข่าวเที่ยงอมรินทร์ | 24 ธ.ค.63เปิดใจเจ้าของร้านตามสั่งโพสต์ให้แรงงานพม่ากินฟรี ลั่นไม่อยากให้แบ่งแยกเพราะเป็นคนเหมือนกัน กรณีผู้ใช้เฟซบุ๊กฉัจธมน สิงห์ตาลกง ได้โพสต์ข้อความ เชิญชวนให้แรงงานชาวเมียนมาร์ในพื้นที่ ถนนวัดคู่สร้าง - ประชาอุทิศ มาซื้อข้าวที่ร้านตัวเองได้ หากไม่มีใครขายให้ หรือหากไม่มีเงินก็สามารถมากินฟรีได้ จนมีผู้แชร์โพสต์และชื่นชมเป็นจำนวนมาก ------------------------------------------------------------------------------------ ติดตามอมรินทร์ ทีวี ได้ที่ ทีวีดิจิทัล หรือ กล่องดิจิทัลทีวี ช่อง 34 Website : http://www.amarintv.com Facebook : https://www.facebook.com/AMARINTVHD Twitter : https://twitter.com/amarintvhd Instagram : https://www.instagram.com/amarintvhd Youtube : https://www.youtube.com/c/amarintvhd Dailymotion : https://www.dailymotion.com/amarintvhd Line : https://lin.ee/w1gOqNl ติดต่อโฆษณา 02-422-9191 ต่อ 2505 และ 092-280-0782 #ข่าวเที่ยงอมรินทร์ #AmarinTV34,0
เห็นด้วย ออกกฏหมายห้ามพม่าอาศัยในประเทศ จับได้ประหาร รับรองไม่นานพม่าหนีกลับหมด,1
เอื้อพม่าเอ็นดูพม่า ก็ตายเพราะพม่า,1
พี่ขอให้มันผ่านไปได้ไม่ว่าพม่าคนไทยขอเป็นกำลังใจให้ทีมแพทย์หมอทุกคนที่ต้องเจอโควิคสู้ๆกันจ้า,0
