text,label
ตายสมุทรปราการจะเหลือใหม พม่าเดินให้เพ่นพ่าน,1
ส่งมันกลับไปตายพม่าจะใด้ไม่เสียเงินคนไทย ไม่ต้องไปจับคนขับรถตู้ นึกถึงตอนเอามันมาสิมายังไง,1
จากไทยชนะ ถูกพม่าตีกรุงแตก ยึดพื้นที่สมุทรสาครได้สำเร็จ ก็เลยเปิดเว็บใหม่เป็น หมอชนะ นักลบเสื้อกราว กู้เมืองให้สำเร็จนะครับ สู้ๆ,0
#แชร์ให้ถึงนายก #ช่วยด้วย #โควิด19 #โควิดสมุทสาคร #โควิดสมุทปราการ #ประยุทธ์ #ลุงตู่ ถึงนายก ควรมีการตรวจสอบที่ชายแดน ประกาศ ปรับกฎหมายใครทำผิด จับปรับ 1 ล้านให้หมดเอาเงินเข้าประเทศใครไม่มีตังค์ก็ยิงเป้า *ความเห็นแก่ตัวและความโลภพวกนี้ -พม่าหวังหนีตายมารักษาที่ไทยและแอบลักลอบทำงาน -ทั้งนายหน้าค้ามนุษย์ -เจ้าหน้าที่(รับสินบน) -เจ้าของธุรกิจที่รู้เห็นรับพวกมันเข้ามา ประเทศไทยต้องเดือดร้อนเพราะพวกมัน พวกพม่ามันไม่ระวังตัว ไปทั่วถ่มน้ำลาย ไม่สวมแมท เอาเชื้อมาแพร่ชาวไทย และมาแย่งงานคนไทยอีก ((บางทีชื่นชมการทำงานทรัมนะเค้าเด็จขาด)),1
ตายแน่พม่าเต็มโรงงาน,1
จากกรณี การแชร์ว่า พม่าพังกำแพง ที่ตลาดกุ้ง สมุทรสาคร นั้น แอดมิน ตรวจสอบไปยังเพื่อน ผู้สื่อข่าว ที่สมุทรสาครแล้วพบว่า พม่า ไม่ได้พังกำแพง แต่กำแพง พังอยู่แล้ว พังมา 10 กว่า ปีแล้ว โล่งอกกันได้ ข่าวปลอมครับ แต่ข่าวจริงคือ มีพม่าหนีออกมาจริง กี่คนยังไม่รู้ เพราะช่องที่กำแพงพังอยู่นี้ คือช่องที่พม่า ใช้หนี เวลาตำนวจไปตรวจบัตรต่างด้าว จะมาถึงพิจิตร มั๊ย แอดมิน ไม่รู้ ๆแต่ การ์ดอย่าตก ขอบคุณ ข้อมูล จากเพื่อน แมว มหาชัย,0
อ่อนนุช66 พม่าเยอะมาก โรงงานเหรียญทอง โรงงานกระดาษ แค้มก่อสร้างอีก ให้ตายเถอะ #กูติดโควิดยังว่ะ,0
ปล่อยพม่ามาแพร่เชื้อจนจะตายทังประเทศแล้วผลกระทบวงกว้างอย่าให้พม่าเข้ามาเด็ดขาด,1
พวกมึงไปตายที่พม่าพวกกูไม่ไห้อยู่ประเทศไทยไอ้พวกเปรต,1
แอร์อัดจะตาย มีแต่พม่าอยู่,1
อยู่ประเทศตัวเองป่านนี้ตายหมดแล้วเพราะเค้าไม่รักษาให้ฟรี..สู้หนีมาเมืองไทยดีกว่าติดโควิดไทยรักษาให้ฟรี...มีข้าวให้กิน..อยู่ดีกินดี...ไม่ใช่เราใจร้ายนะควรจะผลักดันกลับไปให้หมดเลย...บ้านเรากำลังจะดีเจออีพวกพม่าเข้าไปเดือดร้อนกันอีก,1
พม่าเขาก็เป็นคนเหมือนเขาแค่เลือกเกิดเป็นคนไทยไม่ได้ คนที่รังเกียจเขา. ลองย้อนมาดูตัวเองถ้าคนเกียจแบบนั้นจะรู้สึกอย่างไง. เห็นใจเขาหน่อย. สู้ๆๆๆนะ,0
ถ้ายังให้มีพม่ายุโควิดก็จะมาเรือยๆพม่าฆ่าคนไทยโดยงายๆแล้วตอนนี้,1
ยิงทิ้งแม่งเลยดันให้มันกลับเดียวมันก็มากันอีกอย่าปรานีนักเลยคนพม่าเสร้างความเดือดร้อนให้กับประเทศ,1
รู้วันเกิด ไม่รู้วันตาย น่าจะให้พวกพม่านี้ไปทำงานที่ทำเนียบรัฐบาลน่ะ...มันจะได้ติดกันทั้งมำเนียบแล้วมันเอามากักตัวให้เปลืองข้าวเปลืองน้ำทำไมทำไมไส่ส่งกลับประเทศพม่าไป,1
กลับลำพัลวัน หลังโดนถล่มเละ! ดราม่าแอปหมอชนะ 'บิ๊กตู่' ยันเอง ไม่โหลดไม่ถือว่าผิดรัฐบาลต้องออกมากลับลำ หลังถูกถล่มเละ บังคับประชาชนติดตั้งแอปหมอชนะ หากไม่มี ถือว่าผิดกฏหมาย พ.ร.ก.ฉุกเฉิน โดยนพ.ทวีศิลป์ วิษณุโยธิน ระบุช่วงหนึ่งของการแถลง บอก 5 จังหวัด ยกระดับบังคับเข้มข้น ในพื้นที่ควบคุมสูงสุดและเข้มงวด ซึ่ง นพ.ทวีศิลป์ ย้ำว่า พ.ร.ก.ฉุกเฉิน ฉบับ 17 ยกระดับมาตรการป้องกันโรค ชี้ หากป่วยแล้วตรวจพบว่า ไม่มีแอพพลิเคชัน หมอชนะ ถือว่ามีความผิด ภายหลังแถลง เกิดเสียงวิพากษ์วิจารณ์ การขู่ใช้บังคับกฎหมาย ทั้งที่ชาวบ้านบางคนอาจไม่มีโทรศัพท์สมาร์ทโฟนใช้ โดยเฉพาะผู้สูงอายุที่เป็นกลุ่มเสี่ยง ล่าสุดนพ.ทวีศิลป์ ได้โพสต์ขออภัยบนเฟซบุ๊ก More ทวีศิลป์ ระบุว่า ขออภัยครับ หากทำให้เข้าใจผิดว่าไม่มีแอปถึงติดคุก ในข้อความเต็มคือ หากท่านติดเชื้อและปิดบังข้อมูล.. รวมถึงไม่พบแอป หมอชนะ มีความผิดตามข้อกำหนดครับ ด้าน พลเอกประยุทธ์ จันทร์โอชา นายกรัฐมนตรีและรัฐมนตรีว่าการกระทรวงกลาโหม จัดรายการผ่านพอดแคสต์ระบุ มีการคนร้องเรียนว่าไม่มีสมาร์ทโฟน ไว้โหลดแอปพลิเคชันไทยชนะ และหมอชนะ ซึ่งหากไม่มีแล้ว จะมีความผิด โดยนายก ยืนยัน ไม่มีความผิดอะไร หากใครไม่มีแอปพลิเคชัน ก็ยังสามารถลงทะเบียนได้ ทำข้อมูลส่วนตัวไป พร้อมติงข้อมูลทำแตกตื่น ขอประชาขน อย่าไปอ่าน อย่าไปฟังเรื่องราวที่ไม่ใช่ข้อเท็จจริง ใครมีสมาร์ทโฟนก็โหลดไว้ ซึ่งตนก็ไม่รู้คนที่ไปเขียน ก็ไม่รู้ว่าต้องการอะไร ขณะที่ นายอนุทิน ชาญวีรกูล รมว.สาธารณสุข แจงวุ่นผ่านเฟซบุ๊กยืนยันว่า การไม่โหลดแอปหมอชนะ ถือว่าไม่มีความผิด พร้อมนำเรียนนายกฯทราบถึงปัญหา ให้มีการแก้ไขคำสั่งให้เป็นการใช้เอกสารแทน แต่ในเวลาต่อมานายอนุทินลบโพสต์ดังกล่าว โดยระบุว่าให้ทีมงานลบ เพราะกลัวประชาชนจะสับสน และให้ฟังประกาศจากโฆษก ศบค. ซึ่งประเด็นดังกล่าว มีมุมของนักกฎหมายอย่าง ดร.พรสันต์ เลี้ยงบุญเลิศชัย โพสต์เตือน การติดตั้งระบบแอปพลิเคชั่นที่ภาครัฐกำหนด อาจเป็นมาตรการที่ไม่ชอบด้วยรัฐธรรมนูญได้ เป็นการเพิ่มภาระ หรือจำกัดสิทธิหรือเสรีภาพของประชาชนเกินสมควรแก่เหตุตาม อันเป็นการขัด หรือแย้งต่อมาตรา ๒๖ ของรัฐธรรมนูญ ขณะที่คนบันเทิงอย่าง แทค ภรัณยู ได้โพสต์วิจารณ์ดุเดือดว่า คือ ผมเข้าใจนะครับ ทุกคนต้องโหลดแอปฯ แต่คนที่ใช้มือถือรุ่นเก่าละครับจะยังไง เพราะมันมีจริงๆ นะที่ยังใช้อยู่ จะพูดอะไร จะคิดอะไร เห็นใจคนหาเช้า กินค่ำบ้างนะครับ พวกคุณหยุด พวกคุณยังมีเงินเดือนกิน แต่พวกเราหยุด เราไม่มีกินนะครับ ฝากเปลี่ยนชื่อแอปด้วยนะว่าเป็น เราชนะ ไม่ก็ กูชนะ รายละเอียดเพิ่มเติม https://ch3plus.com/news/category/226539 ------------------------- #เรื่องเล่าเช้านี้ (Morning News) 08 มกราคม 2564 ติดตามความเคลื่อนไหวข่าวสารได้ก่อนใครได้ที่นี่ เรื่องเล่าเช้านี้.com : https://morning-news.bectero.com facebook : https://www.facebook.com/MorningNewsTV3 Twitter : https://twitter.com/MorningNewsTV3 Official LINE : @ruenglao YouTube : https://cutt.ly/MorningnewsTV3,0
ประกาศ!!!!!!! แรงงานพม่า ที่อาศัย ในเขต ถนนวัดคู่สร้าง -ประชาอุทิศ ไม่มีเงินซื้อข้าวกิน หรือ อยากซื้อข้าวกิน แต่ไม่มีใครขายให้ ท่านมาที่ร้าน ครัวเมืองเพชร ได้เลย ตลอดทำการ6:00น. ถึง19:00น. ไม่มีเงิน เราให้กินฟรีค่ะ .... โทร.061-7731741 ฉัตรธมล ร้านครัวเมืองเพชร ยินดีช่วยเหลือค่ะ...... ที่มา : ฉัจธมน สิงห์ตาลกง,0
ถ้าพม่าบุกเข้ามาตายกันหมดแน่ชายแดนไม่มีรั้ว..ใส้ศึกกลับชาติมาเกิดบนแผ่นดิน,0
พม่าเขายังส่งคนไทยกลับแต่พี่ไทยคนพม่าติดเชื้อใว้คิดๆแร้วนี้รัฐบาลนี้มันยังไงจะให้คนไทยติดเชื้อหมดละมั้งตายๆแบบนี้,1
มันคนละเรื่องกับการเห็นใจ แต่ประเด็นคือไม่ควรย้ายมา นี่คือโรคระบาดรุนแรงคุมไม่อยู่ยอดพุ่งสูงทุกวันนับประวัติศาสตร์ของโลกก็ว่าได้ การปัองกันการแพร่กระจายทึ่ดีที่สุดคือกักบริเวนห้ามเคลื่อนย้ายค่ะ หากเคลื่อนย้ายจริงรัฐบาลน่าจะเจรจารัฐบาลพม่าให้ช่วยรับภาระพลเมืองเขากลับคืนรักษาในประเทศเขาจะดีกว่า เพราะตอนนี้บุคลากรทางการแพทย์และอุปกรณ์ไนประเทศไทยเองก็ไม่พอ และเป็นการป้องกันบุคลากรทางการแพทย์ของเราติดเชื้อด้วยค่ะ ตัวอย่างในต่างประเทศในการแก่ปัญหามีให่เห็นกันอยู่,0
หากินบลหลังเขาสงสารเขานะแรงงานพม่า,0
ไอ้บอย คาร์เตอร์ พม่ารึค่ะเรื่องเหมือนกันหัวหมอฉลาดจะตายค่ะคนที่จ้างแค่ราคาค่าแรงถูกกว่านิดๆเท่านั้นพม่าฉลาดเก่งขี้ฟ้องเรื่องเยอะค่ะเห็นกับตาค่ะ,1
ศึกคร้งนื้ไหญั่หลวงน้กพม่าโจมตืแน่แท้แล้วกุจะได้กลับบ้านได้ไหมพ่อ-แม่ก้อคอยโควิดก้อมาเอาไงดืละชืวิตปืละคร้ง,1
คนไทยเดือดร้อนเพราะพม่าเอาโควิดเข้ามารอบนี้แล้วยังจะขอเข้ามาอีกหรือถ้ารับเข้ามาอีกเมืองนี้คงเป็นซอมบี่หมดละจะอดตายและจะเป็นโรคตายกันหมดละ,1
น้องๆพม่าต้องช่วยกันดูแลเพื่อนเข้ามาให้ถูกต้องด้วย,0
ส้ๆคับพี่น้องจะไทยหรือพม่าก็คนเหมือนกันคับโควิค19ใครๆก็ไม่ยากเป็นหลอกคับเป็นกำลังให้ทุกๆคนคับเราจะสู้กับโควิคไปด้วยกันคับ,0
แค่ที่มีอยู่มันก้อจะเหยียบกันตายแล้วทุกวันนี้ ที่อยู่ทุกวันร่วมมาเห็นทุกมุมของพม่าเลย บางคนสะอาดมีความเกรงใจแต่ส่วนใหญ่สรกปก ถ่มน้ำลายน้ำหมากลงพื้นเสียงดัง รวมกลุ่ม ไม่มีความเกรงใจเลยค่ะ ถ้าสิ่งที่ระบาดคือการสัมผัสจากน้ำลาย น้ำเชื้อต่างๆ ส่วนหนึ่งที่ระบาดไวคงเป็นการถ่มน้ำลายน้ำหมากของคนพม่าด้วย,1
Kriengkrai Hui Wiriyaakradecha ทุกประเทศ สร้างขึ้น และเป็นปึกแผ่นได้โดยทหารครับ แต่ไม่มีสักประเทศ ที่สร้างจากนักวิชากาว นักเขียน หรือนักศึกษา ทหาร ไม่ใช่ (แค่) รั้วของชาติ : หน้าที่อันดับ 1 ของทหาร ไม่ใช่การปกป้องศัตรูจากภายนอกครับ แต่คือการ ขจัดศัตรูจากภายใน เพื่อคงความเป็นปึกแผ่น และดำรงความมีขือ-มีแปของชาติ . หากกองทัพหมดอำนาจ ประเทศจะแตกออกเป็นเสี่ยงๆ และรบกันเอง (เช่น อิรัก ลิเบีย พม่า เขมร เวียนามยุคก่อน ฯลฯ) . ประเทศไม่ได้สร้างจากนักเขียนนิยาย แต่ประเทศสร้างจากทหาร ... ไม่ว่าประเทศใดๆก็ตาม . ทหารจึงเป็นจิตวิญญาณของชาติ . เปรียบเหมือนร่างกายคนเรา -- เราไม่ได้รวมเซลล์ทุกเซลล์จากการคิดสมอง หรือความสมัครใจของแต่ละเซลล์ หรืออวัยวะ . แต่เรามีโปรแกรม ... . ที่บางศาสนาเรียกว่า ดวงจิต/ดวงวิญญาณ คอย Run ระบบให้ร่างกายสมานเป็นหนึ่ง ตั้งแต่เรายังไม่มีเส้นประสาท และสมอง . ระบบต่างๆ จะทำหน้าที่เฉพาะของมัน โดยที่ไม่ได้เกิดจากการคิด แต่เกิดจากระบบวิญญาณ -- ดังนั้นเซลล์ของเรา จะทำงานอัตโนมัติ -- และเมื่อถึงเวลาที่เราตาย เราก็จะถูกกำหนดให้ตาย (วิญญาณไม่อาจจะคิดเองว่า เออ ไม่ตายดีกว่า กลับสู่ร่างและสตาร์ทเครื่องใหม่ดีกว่า) . การเกิดขึ้นของกองทัพ จึงเป็นการกำเนิดของสังคมมนุษย์ . ... เพราะหากสังคมใดไร้กองกำลัง สังคมนั้นก็จะพินาศไป ถูกกลืน ถูกเข่นฆ่าจนหมดไปเอง . ทหาร คือกำแพงเหล็กของกฎหมาย . เพราะกฎหมายไม่ใช่เพียงถ้อยคำ แต่มันคืแอกองกำลังที่อยู่เบื้องหลัง หากวันหนึ่ง มาเฟียตั้งกองทัพและพิชิตตำรวจได้ ทหาร ก็ต้องรบกับคนพวกนั้น ยุติจลาจล และผนึกชาติขึ้นมาใหม่อีกครั้ง . หากไม่สำเร็จ ชาตินั้นๆก็จะแตกเป็นเสี่ยงๆ และรบกันเอง -- USA ก็เคยเกิดขึ้นมาแล้วในปี 1860 คนตายไปอย่างมหาศาล ... ในรอบ 1 ร้อยปีชาติใดๆ ก็เคยเกิดสงครามเช่นนี้ . แต่ทหารไทยทำหน้าที่เป็นภูมิคุ้มกัน เป็นเม็ดเลือดขาวที่ได้กลิ่นเร็ว จับศัตรูได้ตรงจด และยุติมันก่อนจะลุกลาม -- การรัฐประหหาร ในแง่หนึ่ง ก็คือระบบภูมิคุ้มกัน เราจึงเห็นว่า ประเทศไทยไม่ต้องสังหารหมู่หลักแสนๆ-ล้านๆ เช่นที่เกิดในเวียดนาม ลาว อินโดนีเซีย จีน โซเวียต หรือแม้แต่อเมริกา,0
ไม่ อาภัพ เหมือนในเพลงหรอกนะครับพี่น้องชาวพม่า หรือชาวไหนก็คนเหมือนกัน พวกคนไทยที่ทุจริต นายจ้างที่เห็นแก่ตัว น่ารังเกียจกว่าเยอะ เป็นกำลังใจกัน พึ่งพาอาศัยกัน? ถ้าเป็นผู้ประกันตนในระบบประกันสังคมเชิญร่วมเข้ากลุ่มนี้ได้เลยนะครับ https://www.facebook.com/groups/244623610094315/?ref=share #ขอคืนไม่ได้ขอทาน,0
คนไทยหรือพม่าใครทำผิดกม.ก็ต้องว่าไปตามผิดแต่ถ้าเขาไม่ผิดทุกคนก็ต้องให้เกียรติ?ซึ่งกันและกัน?อย่าดูถูกเหยียดหยามกันและกันคิดเสียว่าเพื่อนร่วมโลกคนหนึ่ง,0
ตัดภาพมาพม่าเข้าไทยสิควรปล่อยตายแบบนี้? เข้าใจไหม,1
น่าจะมีกฎหมายนี้ในไทยบ้าง พม่าเข้ามาเอาเชื้อมาแพร่คนไทย ยิงทิ้งได้เลย,1
มึงมีสิทธิ์อะไรมาเรียกร้องพวก พม่าส้น คนไทยจะอดตายกันแล้ว,1
เอาพม่าออกไป ให้คนให้ได้ทำมาหากิน ไม่ใช่ปิดตายปากท้องแบบนี้ ใครแบกรับค่าใช้จ่าย ตอบที พม่าหรอ,1
ติดเชื้อไปทั่วแล้วพม่าตีไทยแตกอีกรอบ_รอบนี้หนักกว่าเดิมแน่เตรียมอดตายรอบ2,1
