text,label
พม่าจะมาไทยเมื่อรัยก้อได้ แค่มีเงินจ่าย อย่าโลกสวย นี้มันโรคโคิด 555,1
ปากดีนักเห็นพม่าฆ่านายจ้างมาเท่าไรแล้ว,1
สงสารรัฐบาลจริงๆทั้งมอบทั้งพม่า,0
เจอพม่าที่ไหนยิงกระบาลมัมเลยดูชิว่ามัมจะกล้าอยากมาอีกไหมไทย,1
คนไทยเราไม่ได้รังเกืยจพม่าหร่อกนะแต่ถ้าใครรู้ตัวว่าติดโควิดแล้วอย่าหนีอย่าเดินทางไปใหนต่อใหนอีกเลยเข้าพบตํารวจหรือหมอก็ได้เขาจะรักษาให้พอมันหายจากโรคโควิดแล้วพวกเราก็จะได้ทํางานกันต่อขอให้พีน้องพม่าทุกคนสู้ๆ,0
สักแต่ว่าตะหานทัย...ถามคำ..เคยไหมที่เรารบชนะพม่า...ทีจะซื้อเรือดำน้ำ..ค้านกันจัง..นี่ถ้าเรามีเรือดำน้ำนะ พม่าลักลอบข้ามแม่น้ำมา..จะเอาตอปิโดยิงแม่งเลย.....เข้าใจตรงกันนะ...หยุดโทดตะหานทัยได้แล้ว,1
มันเข้าอยู่ในไทยรวมๆแล้วปะมาณ2ล้านกว่าคน ที่เข้ามาถูกต้องมีแค่ปะมาน2-3แสนคน ภาครัฐไม่คิดจะทำอะไรบ้างเลยรึ หรือต้องให้คนไทยไล่ฆ่าพม่า ใครเป็นพม่ายิงทิ้งได้เลย หรือประเทศไทยกลัวประเทศพม่าวะ รถถังอาวุธที่ซื้อไว้เพื่ออะไร หรือเก่งแต่คนไทยในประเทศด้วยกันวะ #ควายตู่,1
ส่งพม่ากลับบ้านบรรพบุรุษมันด่วน ลงโทษพวกนำแรงงานผิดกฎหมาย พวกเวรนี้สร้างความบรรลัย,1
จังหวัดที่ล็อคดาวน์พื้นที่หลักๆคือ สมุทรสาคร และสมุทรสงคราม ในลักษณะจำกัดเวลาและควบคุมพื้นที่ แต่ยังสามารถเดินทางข้ามจังหวัดได้โดยแจ้งจนท.#ไม่มีการปิดเมือง _____ ส่วนพื้นที่พบผู้ติดเชื้อ จะจำกัดเฉพาะจุดเสี่ยง ดังนั้นการเดินทางข้ามจังหวัดในทุกจังหวัดยังสามารถดำเนินการได้ แต่หากสามารถหลีกเลี่ยงไปยังพื้นที่พบผู้ติดเชื้อได้ก็แนะนำให้หลีกเลี่ยงก่อน ______ รถโดยสารสาธารณะ รถไฟ เครื่องบิน ยังเปิดให้บริการปกติ _______ ขอให้มั่นใจมาตรการและบุคลากรด้านสาธารณสุข หน่วยงานที่เกี่ยวข้อง ประเทศไทยผ่านช่วงวิกฤติมาได้แล้ว และจะต้องผ่านช่วงเวลานี้ไปได้อีกครั้ง _______ #สิ่งสำคัญที่สุดคือประชาชน ไปจังหวัดเสี่ยงโปรดแจ้งเจ้าหน้าที่ และจำกัดพื้นที่ของตนเอง ได้โปรดอยู่บ้าน ออกจากบ้านเท่าที่จำเป็น สวมหน้ากากอนามัย เว้นระยะห่างจากทุกคนแม้กระทั่งคนในครอบครัว เป็นระยะเวลา14วัน #อย่าปกปิดข้อมูล สำหรับพื้นที่ชายแดนไทย-มาเลเซีย ...กลับมาต้องเข้ากักตัวที่ศูนย์กักกันที่รัฐจัดให้ทุกครั้งคุณหลบเจ้าหน้าที่ได้ แต่มันจะเป็นตราบาปในใจคุณ หากคุณนำเชื้อมาติดคนในครอบครัวหรือคนในประเทศ และอาจถูกสังคมรังเกียจเหมือนที่แรงงานชาวพม่ากำลังเผชิญอยู่ __________ ถึงเวลาของคนในครอบครัวที่ต้องช่วยปกป้องเพื่อนบ้านของคุณและคนในสังคม อย่าปล่อยให้คนในครอบครัวที่ไม่ผ่านการกักตัวมาพักอาศัยในบ้าน...เพราะหากพบผู้ติดเชื้อจะถือเป็นความผิดร่วม,0
ถ้าประเทศไทยยังจะรับพม่าเข่ามาอีกก็คงตอ้งเรียกว่าโง่ประเทศของมันก็มีก็ไห้พวกมันตายที่บา้นเมืองของม้นเอาเข่ามาก็จะมาสางควมเดือดไห้คนไทยอีก,1
คงต้องเสียเมืองให้พม่าซะแล้วพี่น้องชาวไทย,0
"30,000 ของอาณาจักรชูลู ที่ใช้หอก.โล่ เข้าตีอังกฤษจนชนะ...(ทำไมชอบว่าจังว่าดาบสู้ปืน) ตอนแรก พม่าเกือบจะว่าได้คือเกือบชนะแล้วนะครับ ตีทหารอังกฤษถอยร่นไปถึงจิตตะกองเลย แต่อังกฤษก็หัวดีแก้ไขด้วยใช้ปืนใหญ่ที่ทันสมัยเข้าสู้แทน และตีไปถึงหลายปีเลยจึงจะยึดพม่าได้ มีเหตุการณ์หนึ่งกษัตริย์พม่าส่งทูตไปหาราชินีอังกฤษก็โดนมองว่าเป็นตัวตลก น่ารังเกียจจน คณะทูตคนนั้นไปร้องไห้ให้กับคณะทูตไทยฟังเลย น่าสงสารพม่าแท้ตอนนั้นพี่แกไม่ได้คิดจะยึดสยามแล้ว พี่เน้นไปปราบปรามทางเหนือคือแคว้นอัสสัม หรือ มณีปุระ .. อ้อมีครั้งหนึ่ง กษัตริย์พม่ามองกษัตริย์สยามว่า ทำไหมน้อ.ไม่มาช่วยเราพี่น้องชาวเอเชียด้วยกัน กับไปเสพสุข เป็นมิตรกับไอ่ฝรั่ง",0
ไม่ต้องให้แดก ให้อดตายกันไป ยุ่บ้านมึงดีๆ เสือกข้ามมาบ้านกุ พาพวกกุอดตายไปด้วยงี้หรอ โควิดเอาสงกรานต์กุไปไม่พอ ยังจะเอาปีใหม่กุไปอีก #กุไม่ได้ใจดำ #อย่าโลกสวย อดตายก้ให้ตายไป ตัวเองเป็นเชื้อโรค แทนที่จะหยุดที่ตัวเอง เสือกพามาปล่อยให้คนอื่น,1
ทุกวันนี้ยังเห็น พม่า ไม่ใส่ผ้าปิดจมูกอยู่เลย เราอยู่สมุทรสาคร เคยทำงานกับพม่า ตอนระบาดแรกๆ ตอนนี้ออกมาจากโรงงานนั้นแล้ว ไม่มีความสะอาดเลย อยากถุยน้ำลายก็ถุยไปทั่ว ตอนนั้นต้องนั่งทานข้าวในห้องทำงานคนเดียวไม่ไปกินกับใคร รอดมาได้ก็ต้องมาเจออีกระลอก สู้ๆค่ะคนไทย,0
พม่าเผาประเทศกูอีกแร้ว,1
ติดจากพวกพม่าที่เข้ามาล่ะ....ป้ามีลูกจ้าพม่าเปล่า ถ้าเอาเข้ามาล่ะ สมน้ำหน้า 67 ปี ตายไว ดีล่ะ ชอบเอาเข้ามากันนัก เวรกรรมสนอง มีแต่คนสมน้ำหน้าแน่นอน,1
ปิดพรมแดนด้านพม่าทุกจุดเข้า ยิง,1
เอาจริงนะ..คนงานพม่าที่เข้ามาอย่างถูกกฎหมาย ควรที่จะต้องโกรธคนงานที่ลักลอบเข้ามาแบบผิดกฎหมาย และยังนำมาซึ่ง covid ทำให้พวกตนเองซึ่งมิได้มีส่วนเกี่ยวข้องกับโรคระบาดซึ่งเมืองไทยเราควบคุมมันได้ และที่ชั่วร้ายที่สุดก็คือ ผู้ที่ค้ามนุษย์ถือว่าเป็นกลุ่มบุคคลที่เหี้ยที่สุดในเหตุการณ์นี้,0
ตะวัน สุดปรายฟ้า จะติดโควิทตายห่าเพราะพวกพม่าเอาโควิทมาแพร่กันหมดประเทศอยุ่แล้วยังมีหน้ามาห่วงจะมีคนทำงานนี้ไหมทีแต่ก่อนไม่มีพม่ามาทำงานนี้ไทยก็ยังอยุ่มาได้แสดงว่าคุณคิดว่าถ้าไม่มีพวกต่างด้าวพวกนี้ประเทศจะอยุ่ไม่ได้เหรอเลิกห่วงเรื่องกลัวไม่มีคนทำงานเหอะเอาตัวเราเอาประเทศให้รอดจากโควิทก่อนดีกว่าไหมคะคิดสิคิด,1
คนไทยจะตายหมด จะเหลือแต่คนพม่าแล้ว,1
มีข่าวเตือนกันมาเป็นระยะๆว่าโควิคอาจกลับมาเพราะพม่า แถมมันจะเร็วขึ้นแบบไม่ทันตั้งตัว ในที่สุดก็เป็นจริง ไอพวกที่แอบลักรอบหรือสมรู้ร่วมคิดขนพม่าเข้ามา ยิงแม่งเลย ไอ้พวกเห็นแก่เงินเห็นแก่ตัว,1
เข้ามาทำหัวดออะไรที่นี่ประเทศไทยไม่ใช่ประเทศพม่า พวกมึงมีสิทธิ์มาเรียกร้องด้วยเหรอ ที่จะเข้าประเทศไทย ถ้ามึงทำ ตามกฎหมาย ทำใบเดินทางและตรวจ covid เขาคงไม่ว่าอะไร แต่ถ้าพวกมึงลักลอบเข้ามากูว่ายิงทิ้งเถอะ,1
เป็นกำลังให้พี่น้องชาวพม่าทุกๆคนครับ เราร่วมสุขก็ต้องร่วมทุกข์ด้วยครับ... หายแล้วก็ลุยงานกันต่อครับ... รักษาสุขภาพกันด้วยครับ,0
แบบพม่าเผากรุงศรี,1
อันนี้ที่พม่า.เข้าได้..เพราะคนจัญไร.เห็นแก่ได้มันเอาเข้ามา..จะมาเปรียบกันได้ไงละ..ลงหัวข้อข่าวไม่สร้างสรร..คนดีแก้ไข..แต่คนจัญไรมันทำพวกเห็นแก่ตัว.ไม่สนใจเพื่อนร่วมชาติ..เลวๆ,0
ใอพวกพม่าเดนมนุษย์,1
พม่ามันสกปรกจะตาย ไม่มีหรอกที่คนนึงติดแล้วจะอีกหลายร้อยคนไม่ติดอะ เกียจ,1
ทุกคนป้องกันตัวเองและครอบครัวมาเกือบปีเจอพม่าเข้าไม่กี่วันมาตายทั้งประเทศ,1
จริงๆคนพม่าไม่ผิดหรอก คนที่ลักลอบพาเค้ามาแบบผิดกฎหมายอะผิดเพราะคนเหล่านั้นคงไม่ได้ผ่านการตรวจหรือคัดกรองใดๆทั้งสิ้น คนพม่าก็คิดว่าเข้าไทยมาแบบผิดๆจะลดต้นทุนในการเข้ามาทำงานแต่ไม่เลย ผมเห็นมีพวกคอยส่องละหิ้วปีกพม่าขึ้นรถไปโครตบ่อยสงสารเขานะต้องมาโดนรีดไถ อยากแนะนำให้เข้ามาแบบถูกกฎหมายจะดีกว่าตรวจโรคคัดกรองแบบชัวๆ เดินตามทางเท้าก็ไม่ต้องกลัวรถมาเฟียสีดำมาหิ้วปีกขึ้นรถไปไถตังแบบนี้ด้วย,0
มีหน่วยงานไหนเข้าไปรับผิดชอบไปดูแลชาวพม่าบ้างล่ะสงสารเขาอยู่นะ,0
ผมถามเพื่อนคนพม่าเขาบอกว่าเจ้าหน้าที่ไทยนี้ละที่จัดหาเอาเข้ามาได้กินค่าหัวหัวละ5000ให้มาทำงานในไทยมีเจ้าของโรงงานรู้เห็นด้วย,0
ยังมีคนไทยอีกหลายคนที่พร้อมจะปกป้อง และดูแลพวกเธอ ให้ดี เหมือนกับเป็นญาติคนหนึ่ง อดทนหน่อยนะ อย่าเชื่อตำรวจ ถ้าเค้ายอกว่าจะพาพวกเธอกลับบ้าน ขอให้พวกเธอ ติดต่อกงศุลพม่า ประจำประเทศไทยทันที แล้วบอกเค้า ว่าอยู่ที่ไหน เบอร์โทร มีอยู่ในกูเกิ้ลและด้านหลังของปกพาสปอร์ต อย่าร้องนะ ยิ้มสู้,0
ครั้งเเรกกับวัดกุฎีดาว..มาเที่ยวกับที่ทำงาน โดยมีนักวิชาการมาบรรยายความรู้..ทราบว่าวัดนี้สร้างโดยท่านโกษาปาน เพราะมีบันทึกของฝรั่งว่าวัดเจ้าพระยาพระคลัง เเตกต่างจากพิธีกรรายการผีว่าสร้างในสมัยสมเด็จพระเจ้าเอกทัศน์ ส่วนเจดีย์ล้มพังเองสมัย ร.5 ต่างจากรายการผีบอกว่าโดนพม่ายิงจนหัก https://t.co/tne60xX8w0,0
สู้ๆครับพี่ๆน้องๆชาวพม่า?เราจะสู้ไปด้ว?ยกัน?เราต้องเป็นกำลัง?ใจให้กันและกัน,0
แต่ก่อนไทยเสียกรุงให้พม่าเพราะคนไทยเป็นฆ่าศึกเอง แต่ตอนนี้ไทยกำลังเสียกรุงให้ให้พม่าอีกครั้ง โดยที่ไทยมัวแต่รบกันเอง พม่าจึงส่งชาวพม่ามาพร้อมกับโควิดอะคะ,0
ความซวยกำลังมาเยือน เอาไม่อยู่หลอกพม่ามันดื่อรั้นจะตาย ให้กับบ้านมันไปให้หมด,1
ดังใหญ่ละ กับรูปน้อง Swal Swal ที่กลายเป็นกลอนขำขันในกลุ่มไลน์ต่างๆ ช่วงข้ามคืน กลอนมีอยู่ว่า... เมียโทรมา ขอร้อง ว่าที่รัก คนรู้จัก ขอให้ช่วย จะช่วยไหม กูถามกลับ ฉับพลัน ช่วยอันใด เขาอยากฝาก คนใช้ ไว้สักคน . มีพม่า หนีเข้าเมือง เรื่องโควิด เขากลัวติด ด่านกักตัว ทั่วแห่งหน มาอ้อนวอน อย่างมาก ฝากไว้คน เขาอับจน หนทาง ทำอย่างไร . กูก็เลย ต่อว่า บ้าหรือเปล่า มึงเห็นข่าว โควิด ที่ติดไหม พวกพม่า รามัญ อันตราย มหาชัย รูรั่ว เนี่ยตัวดี . มึงไปบอก เขาไป ว่าไม่รับ ส่งตัวกลับ ไงก็ได้ อย่าให้หนี พูดไม่จบ ไลน์เด้งพลัน ในทันที เด็กคนนี้ นี่ไง เขาให้ดู . พอกูเห็น รูปปั๊บ กลับเสียงอ่อย ขอคิดหน่อย ดูอีกที ดีกว่านู๋ คนพม่า เพื่อนบ้านไทย ใช่ศัตรู ให้มาอยู่ ได้ทันที พี่โอเค อย่าโกรธคนพม่ากันเลยนะครับเราพี่น้องกัน และหวังว่าน้องจะเป็นทูตสันถวไมตรีในครั้งนี้ #โพสนี้ไม่ได้ลบหลู่ดูถูกนะแต่เอ็นดูน้อง #แอดหม่อง,0
ปิดประเทศ?แทบตาย? สุดท้ายมาตายเพราะพม่า? ????? #โควิด #งดเที่ยวปีใหม่ #สู้โควิดด้วยกัน,1
มีทุกที่แหละค่ามนุษย์เพิ่มสินก็มีเขตสายไหมแขกขายโรตีพาพม่าเขามา,0
น่าสงสาร ใช่คนพม่าจะติดโควิดทุกคน ขอให้ทุกคนปลอดภัย,0
อะไรๆๆ ก็มาหยุดแทนที่คนไทยจะได้สนุกสนานพบปะพ่อแม่พี่น้องต่างจังหวัด กับมาจอดอยู่ที่โรควิด เพราะไอ้พม่าตัวเดียว และคนไทยจังไรเห็นแก่ประโยนช์ส่วนตัว ทำให้คนไทยลำบากมากกว่าเดิมทั้งที่จะดีอยู่แล้ว ไล่กลับประเทศพม่าไปเลยและเอาผิดคนไทยที่รับส่วย และโรงงานรับแรงงานผิดกฎหมายเอาให้หนักๆๆ แรงๆๆ เสียความรู้สึกมากจะไปไหนมาไหนก็มาระวังกันอีก,0
พม่าสกปรกจะตาย..บ่วนน้ำหมากเกลื่อนเมือง อย่างนี้ใส่แมส มีความหมายอะไร,1
พม่าลักลอบและพวกที่เห็นแก่ตัวผิดที่สุดค่ะ ขอประนามคนพวกนี้ มีบทเรียนแล้วไม่รู้จักจำ ทุกคนก็อยากมีงานมีเงิน แต่พวกนี้เปนพวกช้างเน่าตัวเดียวตายทั้งฝูง,1
สมัยนี้พม่ายังตีไทยอีกนะ,1
ไม่ตื่นได้งัยต่างชาติฆ่าคนไทยมาเอาพม่าที่โรงงานไก่ไปตรวจทีมันไปมหาชัยมาแล้วนิ้งเฉยอยู่ช้วยหน่อย,0
อดีตพม่าบุกเผาเมือง ปัจจุบันพม่าบุกแพร่เชื้อ,0
พม่าเผาเมืองเพราะคนไทยเห็นแก่ได้แท้ๆ,1
ประเทศไทยควรรักษาคน ในประเทศไทยก่อนไม่ควรให้พม่าเข้ามาเวลาประเทศไทยเป็นโควิดหนีตายกลับบ้านพอประเทศเองเป็นจะหนีตายเข้าประเทศเพื่อน เห็นแก่ตัวแรง ถ้าเป็นคนไทยไปอยู่ประเทศมันกดขี่ขมแหงแรงกว่าที่อยู่ประเทศเราอีก รัฐบาลอย่าให้เข้ามา คนไทยไม่ตอนรับคนเห็นแก่ตัว,1
ชอให้อภัยโทษให้กับนักโทษม112ทุกคน แล้วเราจะรักพระองค์ให้มากขึ้นเอาบังเหียนออกจากลุงตู่ด้วยอยากได้ม้าตัวอื่นที่วิ่เก่งและฉลาดจะได้ไม่ล้าหลังอายพม่าและเพื่อนบ้านมากตอนนี้,0
ประชาชนคนไทยจะติดเชื้อตายเพราะพม่าเนี้ย,0
กูอดตายแล้วตอนนี้ ไอพม่าเห้ย ไม่ต้องทำมาหาแดกแล้ว แล้วม่แพร่เชื้อใกล้ที่กูอยู่ด้วย กลับบ้านมึงกันไปเถอะไอพม่า สัสสส,1
