text,label
สู้ๆทุกคน อดทนหน่อย พ่อเขาเป็นพม่าก็จริง แต่ก็เป็นมนุษย์เหมือนเราไหม อีกอย่างถ้าเขาไม่รักประเทศไทย เขาคงไม่มายืนอยู่จุดจุดนี้หรอก น้ำใจคนไทย มันหายไปไหนหมด ถึง เขาจะเป็นยังไง ผมเชื่อว่าคนไทยทุกคน จะไม่มีวัน ทิ้งกันแน่นอน สู้ๆ รักพี่ ที่อยู่พม่า ผมเอาใจช่วย????????,0
ไอ้ห่า..คนไทยจะตายห่าเพราะพม่า ..มึงเป็นใครมาขอให้ประเทศไทยช่วยมึง..ตอนนี้คนไทยจะไม่มีรายได้เพราะพวกมึงนั้นแระ ไปขอร้องผู้นำประเทศมึงสิ,1
ตายๆๆ. คนไทยนะมัดระวัง. ปิดจมุก. พม่าเดิน เพล่นผ้าน. เยอะแยะเต้มไปหมด. ผ้าปิดจมุกก่ไม่ใส่. ครวมีกฏหมายบังคับ. แรงงานพวกนี้ให้เข้มงวดกว่านี้ค่ะ. ประเทศชาติ. พังเสียหาย. คนไทยจะแย่กันหมดล่ะ,1
พูดไม่ฟังก็ยิงทิ้งซะ. ทำให้เหมือนประเทศพม่าเลย,1
ขอบคุณสำหรับการที่คุณหมอรู้สึกได้ว่าคนพม่าเปรียบเสมือนญาติพี่น้อง แต่อยากจะให้ทุกเสียงส่งต่อภาระกิจขอให้รัฐบาลมีการช่วยเหลืออย่างเข้มค้นและเร่งด่วนค่ะ โดยนำผู้ป่วยโควิตเข้าสู่ขบวนการรักษา โดยให้เจ้าหน้าที่แห่งรัฐไม่ว่าจะเป็นผู้ใหญ่บ้าน กำนัน ส.ส. สจ. ตำรวจ ทหารและประชาชนที่เป็นพลเมืองดี จิตอาสา มูลนิธิ ได้มามีส่วนร่วมในกิจกรรมสำคัญค่ะ ส่วนพม่าที่นายจ้างเอาไปทิ้งไว้ข้างทาง ตามป่าเขาและสถานที่ต่างๆ วอนขอให้รัฐได้จัดการให้พวกเขาเหล่านั้นได้มีพักพิงชั่วคราวค่ะ แล้วตรวจหาโควิตและนโยบายส่งกลับหรือกักตัวเพื่อระวังการระบาดก็สุดแต่จะพิจารณา วอนขอให้ได้เร็งเห็นความสำคัญในการแก้ปัญหาอย่างเร่งด่วนค่ะ ขอขอบคุณอย่างจริงใจ เพราะพม่าก็มีชีวิตจิตใจเหมือนคนไทยเช่นกันค่ะ,0
ปืนใหญ่อยู่ไหน รีบเอามาเลยจะยิงทับพม่า ไห้พ่ายไป,1
เสียกรุงให้พม่าอีกแล้ว จากใส้ศึกเห็นแก่ตัว,1
เอามาทำห่าอะไรทุกวันนี้มันยังไม่พังพออีกเหรอจะให้มันพังไปถึงเมื่อไหร่เอาเข้ามาไม่ใช่มันมันจะดีทุกคนนะบางคนก็เข้ามาก่อการร้ายมั้งฆ่าปล้นชิงทรัพย์แล้วแถมที่ ร้าย เข้าไปอีก มึงเอาเชื้อโควิดเข้ามาเพื่ออะไรอ้างตัวเองไม่รู้ทุกวันนี้คนไทยจะไม่มีงานทำกันอยู่และโดนพม่าโดนต่างชาติแย่งหมดไม่ได้เหยียดนะครับแต่มันควรจะพอเหมาะพอควรแรงงานต่างชาติเข้ามาเปิดร้านค้าเข้ามาเปิดร้านตัดผมเข้ามาเปิดร้านขายของชำเข้ามาตัดหน้าราคาอาหารทุกอย่างแล้วคนไทยจะอยู่ได้ยังไงผมพูดไม่ใช่เห็นแก่ตัวแต่มันควรพอเหมาะพอควรเปล่า,1
Fstopman Channiwet นี่อยู่สมุทรสาครเหมือนกัน แต่คิดว่าตอนนี้เชื้อมันแพร่ได้ดีกว่าเก่าเพราะคนละสายพันธ์ และทนความร้อนได้ดีขึ้นทำให้แพร่กระจายอย่างรวดเร็ว นี่เป็นคนที่ไม่เห็นด้วยกับการล็อคทุกอย่างมันเป็นไปไม่ได้ ตราบใดที่เพื่อนบ้านยังติดทั้งพม่าและมาเลย์ จะล็อครอบที่ร้อยก็เหมือนเดิม,0
"โควิดมา...ก็เพื่อนายทุนใหญ่ เพจ Paisal Puechmongkol ? โคขวิดระบาดเที่ยวนี้ มาจากอินเดีย สู่บังคลาเทศเข้าพม่า ระบาดเข้าทางภาคเหนือของไทย และ ศูนย์กลางการระบาดคือสมุทรสาครและโกดังในเครือข่ายภาคตะวันออก!!! 1 โคขวิดเดินทางมาเอง โดยไม่มีใครขนแรงงานเถื่อนเข้ามาที่ภาคเหนือจนถึงสมุทรสาคร 2 โคขวิดไม่ได้เดินทางจากบ่อนภาคตะวันออก แต่เป็นการเดินทางออกจากโกดังหลายแห่ง เพราะประเทศไทยไม่มีบ่อน 3 โคขวิดเลือกระบาดเฉพาะ กับประชาชนทั่วไปไม่ระบาดกับกิจการ ขนาดใหญ่ของ 5 นายทุนของชาติ 4 สาเหตุ ที่โคขวิดระบาดเพราะประชาชนการ์ดตก ไม่เกี่ยวกับรัฐบาล 5 แม้ประกาศการใช้ยา ลงวันที่ 29 มีนาคม เคยพิสูจน์ความสำเร็จในการรักษา covid หายมาแล้ว 3,500 รายในเวลาราวเดือนเดียว แต่เราก็ ยกเลิกประกาศนั้นเสียและใช้ประกาศ 1 พฤษภาคม 63 ซึ่งใช้ยารักษาปอดบวมแทนที่ยาค้อกเทล 6 แม้โรงพยาบาลเอกชนที่มีมาตรฐานจะสามารถนำเข้าวัคซีนได้ทันที แต่เราก็จะรอวัคซีน ที่ได้จองซื้อจากฝรั่งไว้ 20 ล้านโดส เราต้องเสียสละรอวัคซีนนั้น จะป่วยจะตายสักเท่าใดก็ต้องเสียสละ นี่คือสภาพที่เป็นอยู่ในบ้านเมืองของเราในขณะนี้ ...................... Paisal Puechmongkol 3? เพื่อหยุดยั้งหายนะของชาติ จากการระบาดของโคขวิดขอเรียกร้องดังนี้ 1 ให้รีบนำประกาศการใช้ยาของกระทรวงสาธารณสุขลงวันที่ 29 มีนาคม 63 กลับมาใช้ใหม่เพราะมีผลพิสูจน์แล้วว่ารักษาให้หายได้เร็วมาก ช่วงเดือนมีนาคม 2563 มีผู้ป่วย 3,500 คนรักษาหายในเวลาราวเดือนเดียว และให้ยกเลิกประกาศลงวันที่ 1 พฤษภาคมทันที เพราะผลการรักษาพิสูจน์แล้วว่าหายช้ามาก ทั้งนี้โดยใช้ยารักษาปอดบวมเป็นตัวสำคัญ 2 รีบทำความเข้าใจกับประชาชนว่าโคขวิดเป็นโรคระบาดที่รักษาให้หายได้ในเวลาเพียง 48 ชั่วโมงถึง 4 วัน โดยให้นำตัวเลขการหายป่วยของทั่วโลกและของประเทศไทย มาทำความเข้าใจโดยรวดเร็ว เพื่อลดความแตกตื่นตกใจ ที่กำลังทำลายบ้านเมืองอยู่ในขณะนี้ 3 ใช้อำนาจพิเศษตามกฎหมายฉุกเฉิน อนุญาตให้สภากาชาดไทย โรงพยาบาลของรัฐและโรงพยาบาลเอกชนที่มีมาตรฐานนำเข้าวัคซีนจากต่างประเทศมาใช้ทันที เพราะโรงพยาบาลทั้งหลาย มีพันธะในการค้ำประกันการรักษาผู้ป่วยอยู่แล้ว และมีความรู้ความสามารถในการหายาและใช้ยาไม่แพ้หน่วยงานใด!!!! จะต้องไม่ใช้ความคิดเอาชีวิตคนไทยเป็นตัวประกัน หรือความคิด ที่จะทำมาหากินกับชีวิตและหายนะของชาติทันที",0
*พม่าโควิดรามัญ มันล้อมกรุงศรีอยุธยา* บ้านเมืองวิกฤต *แม่ทัพตู่ แม่ทัพป็อก แม่ทัพป้อม* *อย่า!!ทำงาน หยุดเสาร์-อาทิตย์* ประชาชน ใจคอ ไม่ดีเลย ลุงตู่!! ประชุมแม่ทัพ นายกอง หมอพยาบาล *วางแผนยุทธวิธีการรบใหม่* กรุงศรีอยุธยา!! ห้ามแตกครั้งที่ 3 *พระเจ้าตากสิน ท่านไปนิพพานแล้ว* ไม่มีท่าน มาช่วยเหลือน่ะลุงตู่ *คนไทย 67 ล้านคน* ต้องดูแล *ลูกเมีย พ่อแม่ปู่ย่าตายายตนเอง* ท่านจะติดเชื้อ ปอดเป็นรูพรุนๆ เสียชีวิต ง่ายมาก เช้าวันจันทร์ *แก๊งโควิด คงนั่งรถไฟฟ้า BTS MRT เต็มขบวนรถแล้ว* คนไทยต้องดูแลครอบครัวตนเอง *ใส่หน้ากาก N95 หน้ากาก P100 สวมแว่นตาครอบแว่นสายตา และ ล้างมือแอลกอฮอล์บ่อยๆ* หลีกเลี่ยงคนเยอะๆ,0
ชิบหายแทนที่ปีใหม่เขาจะได้กลับบ้านกลับช่องกัน สงกรานต์ก็ทีแล้ว ไอ้เวร แทนที่การค้าขายจับจ่ายใช้สอยของประชาชนจะดีขึ้นในช่วงปีใหม่ มึงเสือกปล่อยให้โควิดระบาด พ่อค้าแม่ค้าตายเรียบ ของเน่าเต็มตลาด แทนที่จะถูกซื้อกระจายออกชนบท มึงจะช่วยเขายังงัย ปล่อยให้ขนแรงงานต่างด้าวกันโครมๆ ไม่สนเหี้ยอะไรเลย เอะอะ ก็ล๊อคดาวส์ ไม่มีแผนเหี้ยอะไรสักอย่าง ปิดไปก่อน ปิดเอาเท่ห์ ปิดงั้นๆ ปิดแบบไม่มีมาตรการห่สเหวอะไรเลย ไม่สนใจอะไรทั้งนั้น พม่ารามันที่ผิดกฎหมาย ผลักด้นมันออกไปมั้ง หรือกลัวมันรุมกันประท้วงแฉข้าราชการรับเงืนจากมัน หัวละ 3000 เลยไม่กล้า ไอ้เวร,1
แรงงานพม่า ขอความเห็นใจหลังถูกตราหน้านำโควิด19เข้าไทย ลั่นไม่อยากให้เกิดเรื่องแบบนี้เหมือนกัน(คลิป) #คมชัดลึก,0
ยากครับที่พม่าจะทำเพราะไทยก็มีเพื่อนมิตรกับกองกำลังชมกลุ่มน้อยในประเทศพม่าหลายกลุ่ม,0
จากสมุทรสาครค่ะ กลับมาอยู่แบบล็อคดาวน์กันอีกรอบ สงสารทั้งคนไทยคนพม่าในจังหวัดนี้ ได้รับผลกระทบกันหมดค่ะ,0
ตอนนี้ทั่วโลกก็จิตตกเพราะโควิด19 แรกๆก็โทษกันไปมา แต่สุดท้ายแล้ว ก็ต้องร่วมด้วยช่วยกันป้องกันให้ดีที่สุดเท่าที่จะทำได้ ไม่มีใครอยากให้เกิดหรอกจ้า โรคมันไปทั่วโลกแล้วมันยากเกินที่จะควบคุมอยู่ อย่ามัวแต่โทษกันเลยจ้า ต้องร่วมด้วยช่วยกันดูแลสุขภาพและควบคุมขั้นเบื้องต้นให้ดีที่สุด คนพม่าไม่ต้องตกใจหรือกังวลหรอกจ้า เชื่อว่าคนไทยอีกหลายล้านคนเขาเข้าใจดีและเขาไม่โทษคนพม่าหรอจ้า รวมทั้งเราด้วย เราจะสู้ไปด้วยกัน ไม่ว่าชาติไหนต้องช่วยกันควบคุมโรคไปด้วยกันเท่าที่จะทำได้จ้า สู้ๆๆเด้อทุกคน????,0
เอาจริงๆพม่าที่หนีโควิดซ้ำแล้วซ้ำเล่า ต้องยิงทิ้งหน่ะมันตาย3 คนกับแพร่เชื้อไปเรือยอีกเป็นร้อยเป็นพันหน่ะ,1
วันนี้อาจจะตายยังจะนิยมพม่าอีกรึ คิดได้งัย ทุกอย่างอาจจะพังหมด ยังจะนิยมพม่าอีกอย่างงั้นรึ ควรจะจับนายจ้างด้วยที่ทำให้ทุกคนเลือดร้อนกันมาก,1
มันจะเกินไปแล้วครับ.. ถ้าไม่มีแอฟน่ะ.. แอฟ.. ก็เลิกสามีนานแล้ว ???? บังคับใจกันเกินไปน่ะพ่อหมอ.พี่น้องพม่า..คนนี่,0
"ที่,สมุทปราการ.วัดไข่ขิง.นครปฐม.และพัทยา.พม่า.เขมร.เยอะมากๆๆเลยอย่าเอาโรคมาแพร่เลยขอรอ้งละไปบา้นใครบา้นมันน่ะดีที่สุด.ตอนนี้ประเทศไทยเองก้อจะเอาตัวไม่รอดละ.อย่าเลยน่ะ.หรือจะมาตายในประเทศไทยค่ะ.ตายๆจะบ้าบอคอแตกกับพวกรักทำงานในไทย",1
เป็นกำลังใจให้นะครับสู้ครับ ไม่เคยรังเกียจชาวพม่าหรือประเทศใหนเลยครับสู้ๆครับ,0
ไล่พวกพม่าเขมรกลับบ้านมันไปให้หมดตัวแพร่เชื้อคนในประเทศจะตายห่ากันหมดเพราะพวกแม่งกุเกลียด,1
เห็นใจมากสงสารเขาก้อคนเหมือนกันเป็นกำลังให้คนพม่าทุกคนสู้ๆ,0
เสียกรุงครั้งที่3 หลังจากคนชั่วเปิดประตูให้พม่ารามัญ บุกยึด สมุทรสาคร เรียบร้อยแล้วครับ,1
Nontawat Youngsawat อีดอกพม่านี่มันร้ายยิ่งนัก ได้ตัวมาต้องจับจุดเผาบนตะแลงแกง,1
ฆ่าเลยครับล้างพม่าออกจากประเทศไทยเลย,1
พม่าลาวกัมพูชา ผมคนไทย ในคติผมเราคือพี่น้องกัน มิตรหาง่ายถ้าคุณเปิดใจยอมรับเขา,0
สงสารหมอ พยาบาล เพราะพวกพม่าเข้ามาบ้านเขาก้อมาสร้างความเดือดร้อน คนไทยป้องกันแทบตาย มาพังเพราะพวกเฮียนี่ ทำกุอดเที่ยวปีใหม่เลย,1
กูจะตามไปกะทืบพม่าที่หนีให้ตายคาตีนเลย555555555,1
ยิงหัวพม่าพร้อมคนขนพวกเขาลักลอบเข้าเมือง จบ,1
คนไทยเราไม่ได้รังเกืยจพม่าหร่อกนะแต่ถ้าใครรู้ตัวว่าติดโควิดแล้วอย่าหนีอย่าเดินทางไปใหนต่อใหนอีกเลยเข้าพบตํารวจหรือหมอก็ได้เขาจะรักษาให้พอมันหายจากโรคโควิดแล้วพวกเราก็จะได้ทํางานกันต่อขอให้พีน้องพม่าทุกคนสู้ๆ,0
หากยิงพม่าแล้วไม่ผิดกฎหมายไม่ติดคุกหน่วยงานไหนไม่กล้ายิง ผมขอสมัครยิงให้,1
@ดา รัน เมืองไทยมันก็มีโรคไวรัสโควิค 19 อยู่แล้วนี่อย่างพม่าลาวกัมพูชาก็เป็นเมืองพุทธอย่างพวกเราแต่คนไทยบางพวกที่ไม่เจริญกลับไปรังเกียจคนพุทธด้วยกันศาสนาพุทธองค์พระสัมมาสัมพุทธเจ้าไม่ให้สร้างความแตกแยกหรือว่าคุณไม่ใช่เมืองโพสต์ อย่าไปโหยหาอดีต อย่าไปวิตกกังวลกับอนาคต ให้ทำปัจจุบันให้ดีที่สุดแล้วทุกอย่างจะผ่านไปแล้วอย่าไปดูถูกเหยียดหยามคนชาติอื่นเขาเขาก็เป็นมนุษย์เหมือนเรา,0
สู้ๆนะทุกคน เรื่องแบบนี้ไม่มีใครอยากหั้ยมันเกิด ในเมื่อมันเกิดขึ้นแล้ว ก็ต้องช่วยกันแก้ไขในสิ่งที่เกิดขึ้น เป็นกำลังใจหั้ยทุกคนนะ ทั้งไทยและก็พม่า สู้ๆค่ะ,0
สู้ๆนะคะ ชาวพม่าที่ดีที่เข้ามาอย่างถูกกฎหมาย แต่ที่พวกเขาว่าเขาว่าพม่า ที่ลักลอบเข้ามาอย่างไม่ถูกกฎหมายเขาว่า เจ้าของกิจการที่มักง่าย รับคนผิดกฎหมาย และเจ้าหน้าที่ ที่ ปล่อย พวกผิดกฎหมายเข้ามา เพราะพวกเขาเหล่านี้ทำให้ประเทศชาติฉิบหาย ทราบค่ะว่าอยากมาหารายได้มาทำมาหากิน แต่ควรจะเข้ามาอย่างถูกต้อง,0
ยิงมันทิ้งไห้หมดพวกพม่า ที่ลักรอบเข้ามาอ่ะ,1
แก้ไขไปตามขั้นตอน..เดี๋ยวเราก็ผ่านไปได้ทุกคนได้รับผลกระทบทั้งนั้นเราต้องช่วยกันสามัคคีกันเห็นอกเห็นใจเค้าด้วยเค้ามาทำงานให้เรา..คุณหมอพูดได้ดีมากทราบซึ้งแทนคนงานชาวพม่าเลย..เค้าจะรักเราประทับใจคนไทยค่ะ,0
สงสารคนไทย สงสารตัวเอง ต้องมาเดือดร้อนเพราะแรงงานพม่าแบบนี้,0
ไทย. พม่าคือเพื่อนร่วมโลกกันครับ แต่รัฐบาลทำใมไม่แก้ปัญหาที่ต้นเหตุละ,0
พม่าฆ่าไทยเป็นไงทีนี้ชอบมั้ยเอาเข้ามาเยอะๆอัดกันเข้ามา,1
ยิงแม่งให้หมดพม่า,1
