text,label
ประเทศพม่าคะ? ผู้นำประเทศ? ช่วยดูแลประชาชนของท่านอย่าให้ข้ามแดนอย่างผิดกฎหมายเข้าประเทศไทยดูแลป้องกันการเข้าประเทศไทยด่วนๆๆๆ?นะ? พม่าที่อาศัยในประเทศไทยห้ามและปรามพี่น้องเพื่อนๆที่พม่าอย่าเข้ามาทำความเดือดร้อนใหคนไทย? เราเป็นเพื่อนบ้านกันนานอย่าทำให้เรารู้สึกรังเกียจ?พม่าด้วยเหตุนี้?,0
คนไทยหางานแทบตายสวนทางกับพม่ามีงานทำแผ่นดินไครกันแน่,0
พม่าสมัยก่อน มันใช้ดาบฆ่าคน พม่าสมัยนี้ ใช้โควิดแพร่เชื้อ,1
สู้ๆน๊าา...ทุกคน..พี่ๆน้องๆพม่าอย่าหนีน๊าา...กักตัวป้องกันโรคให้ปลอดภัยก่อนน๊าาสำคัญสุดๆ.จ่ะ,0
อย่าให้พม่าเข้ามาได้นะพวกเราคนไทยจะ พลวยตายกันหมด,0
ไม่ต้องทำมาหากินกันแล้วเพราะไอ้พวกเหี้ย..พม่า.กระเหรื่ยงอีกตายๆจะพากันอดตายอีกแล้ว,1
พม่าฆ่าศึกตีป้อมเมืองแล้ว,1
พม่าและคนไทยผิด พม่าก็ลักลอบเข้ามา คนไทยก็ค้ามนุษย์ พม่าก็อาจนำโควิดมาที่ประเทศไทย เพราะช่วงนี้สมุทรสาครเชื้อโควิดมันแรง,1
"เปิดไทม์ไลน์ เจ้าของแพปลามหาชัย ติดเชื้อโควิด พบไม่ชอบใส่แมสก์ - กักตัวคนใกล้ชิดเสี่ยงสูง 18 รายวานนี้ (17 ธ.ค.) นายวีระศักดิ์ วิจิตร์แสงศรี ผู้ว่าราชการจังหวัดสมุทรสาคร พร้อมด้วย นายแพทย์ชาติชาย กิติยานันท์. นายแพทย์สาธารณสุขจังหวัดสมุทรสาคร และหน่วยงานที่เกี่ยวข้อง ร่วมกันแถลงข่าวสถานการณ์ไวรัสโคโรน่า 2019 โดยพบผู้ป่วยติดเชื้อโควิด-19 ในพื้นที่จังหวัดสมุทรสาคร 1 ราย โดยผู้ป่วยรายนี้เป็นหญิงอายุ 67 ปี อาชีพค้าขาย (เจ้าของแพปลา) ในตลาดกุ้ง จ.สมุทรสาคร เริ่มต้นเมื่อวันที่ 13 ธันวาคม 2563 มีอาการปวดเมื่อย จมูกไม่ได้กลิ่น จึงเข้ารับการตรวจที่โรงพยาบาลเอกชนแห่งหนึ่งพบว่ามีผลเป็นบวก จึงส่งมาเข้ารับการรักษาต่อที่โรงพยาบาลสมุทรสาคร และจากการสอบสวนโรคอย่างต่อเนื่อง จนกระทั่งเมื่อวานนี้ (17 ธ.ค.) การตรวจ 2 ครั้งจากโรงพยาบาลสมุทรสาคร และ ศวก.ที่ 5 สมุทรสงคราม พบผลเป็นบวก แพทย์ยืนยันว่าติดเชื้อโควิด-19 ขณะนี้อยู่ในระหว่างการกักกันรักษาตัวอยู่ที่โรงพยาบาลสมุทรสาคร ทั้งนี้ทางเทศบาลนครสมุทรสาคร ก็ได้ลงมาทำการล้างแพกุ้ง แพปลากว่า 30 แพ และฉีดยาฆ่าเชื้อ ในพื้นที่ตลาดกุ้งสมุทรสาคร ที่เป็นสถานที่ซื้อขายกุ้งแม่น้ำขนาดใหญ่แห่งหนึ่งของประเทศแล้ว หลังจากที่ได้รับการยืนยันว่า มีผู้ติดเชื้อโควิด-19 จำนวน 1 ราย และในวันนี้ (18 ธ.ค.) ผู้ว่าราชการจังหวัดและเจ้าหน้าที่จะลงพื้นที่มาล้างตลาดซ้ำอีกครั้งใน เวลาประมาณ 10.00 น. เพื่อเป็นการสร้างความเชื่อมั่นให้กับผู้บริโภค และผู้ที่ทำงานอยู่ในบริเวณดังกล่าว ถึงการป้องกันและควบคุมการระบาดของเชื้อโควิด-19 ทั้งนี้ตลาดแพกุ้ง ที่อ.มหาชัย จ.สมุทสาคร แห่งนี้นั้น ถือเป็นตลาดซื้อขายกุ้งแม่น้ำขนาดใหญ่แห่งหนึ่งของประเทศ โดยแต่ละวันมีผู้แห่แหนกันมาคึกคัก นายวีระศักดิ์ วิจิตร์แสงศรี ผู้ว่าราชการจังหวัดสมุทรสาคร เปิดเผยอีกว่า ผู้รายนี้นั้นเป็นเจ้าแพปลาในตลาดแห่งนี้ มีการแวะเวียนเข้ามาที่ตลาด กลับบ้านเพื่อไปดูแลแม่ มีลูกน้องที่ทำงานในแพปลาจำนวนหนึ่งซึ่งเป็นแรงงานชาวเมียนมา นอกจากนี้ยังพบว่ามีพฤติกรรมไม่ชอบสวมใส่หน้ากากอนามัยอีกด้วย และตอนนี้อยู่ระหว่างการสอบสวนโรคอีกครั้ง สำหรับไทม์ไลน์ในเบื้องต้น ระบุว่า วันที่ 1-13 ธ.ค.63 ผู้ป่วยขายของที่แพปลา เวลา 06.00-11.00 น.ทุกวัน โดยใกล้ชิดกับ 1.ลูกชายคนที่ 1 อายุ 39 ปี (รอผลกักกันที่รพ.) 2.ลูกจ้างพม่า 1 เป็นชายอายุ 40 ปี และ 3.ลูกจ้างพม่าเป็นชายอายุ 48 ปี อยู่ระหว่างติดตามมาเก็บตัวอย่างและกักกัน จากนั้นในวันที่ 13 ธ.ค. เริ่มป่วยด้วยอาการปวดเมื่อย จมูกไม่ได้กลิ่น จากนั้นวันที่ 16 ธ.ค. บุคลากรทางการแพทย์ 8 ราย เก็บตัวอย่างส่งตรวจ ผลไม่พบเชื้อ วันที่ 17 ธ.ค. เวลา 02.30 น. ผู้ป่วยมาแยกกักกันที่รพ.สมุทรสาคร และเวลา 08.00 น. ส่งตรวจยืนยันอีกครั้งผลพบเชื้อ ส่วนผู้ใกล้ชิดที่ถูกกักกันตัวไว้เพื่อเฝ้าดูอาการด้วยนั้นมีด้วยกัน 4 กลุ่มทั้งหมดรวม 18 คน ประกอบด้วย กลุ่มที่ 1 ลูกชายคนที่ 2 (ชาย 31 ปี) กับ เพื่อนลูกชาย (หญิง 25 ปี) ผลไม่พบเชื้อ กักกันที่รพ.สมุทรสาคร กลุ่มที่ 2 มารดาผู้ป่วยติดเตียง (หญิง 95 ปี) ,น้องชายผู้ป่วย (ชาย 57 ปี), น้องสะใภ้ (หญิง 57 ปี) , พี่สาวคนโต (หญิง 73 ปี) , แม่บ้าน (ไป-กลับ) (หญิง 56 ปี ) ทั้งหมดอยู่ระหว่างรอผล กักกันที่บ้าน กลุ่มที่ 3 เป็นกลุ่มที่สัมผัสกับผู้ป่วยในช่วงขายของ คือ ลูกชายคนที่ 1 (ชายอายุ 39 ปี)กักกันตัวที่โรงพยาบาล , ลูกจ้างพม่าชาย 40 ปี กับ ลูกจ้าพม่าชายอายุ 48 ปี อยู่ระหว่างติดตามมาเก็บตัวอย่างและกักกัน ส่วนกลุ่มที่ 4 กลุ่มบุคลากรทางการแพทย์ 8 ราย เก็บตัวอย่างส่งตรวจแล้วไม่พบเชื้อ นอกจากนี้มีรายงานว่า ตำรวจจะต้องเข้มในเรื่องมาตรการจับปรับผู้ที่ไม่สวมหน้ากากอนามัยก่อนออกจากบ้าน โดยใช้มาตรการตามที่ จ.สมุทรสาคร เคยประกาศใช้ ปรับไม่เกิน 20,000 บาท สำหรับผู้ที่ฝ่าฝืน และมีข้อมูลว่าเจ้าของแพกุ้งที่ติดเชื้อไม่ค่อยชอบใส่หน้ากากอนามัย รายละเอียดเพิ่มเติม https://ch3thailandnews.com/news/223547 ------------------------- #เรื่องเล่าเช้านี้ (Morning News) 18 ธันวาคม 2563 ติดตามความเคลื่อนไหวข่าวสารได้ก่อนใครได้ที่นี่ เรื่องเล่าเช้านี้.com : https://morning-news.bectero.com facebook : https://www.facebook.com/MorningNewsTV3 Twitter : https://twitter.com/MorningNewsTV3 Official LINE : @ruenglao YouTube : https://cutt.ly/MorningnewsTV3",0
ผัวแม่มึงเป็นพม่าหรอ? รักมันจังทำไมไม่ส่งมันกลับไปตายบ้านมัน,1
ฝากแชร์ให้เพื่อนๆชาวพม่าได้อ่านกันด้วยนะคะ ช่วยๆกันยังไงก็คนเหมือนกันเน๊อะ อย่าเพิ่งโทษใคร มาช่วยกันป้องกันก่อนจ้า,0
ความน่าสนใจในงานสเก็ตสดของศิลปินโจ หลังจากชื่นชมมรดกวัฒนธรรมของพม่า 3 วันเต็ม ผมประทับใจกับภาพนี้ เมื่อนาคหนุ่มเลื้อยขึ้นบกถวายสักการะพระโคตมะเพื่อขอบวช ... เราฟังเรื่องนาคมานาน แต่ไม่เคยสื่อด้วยภาพแบบนี้ ขลังและมีมนต์ เหมือนโลกมนุษย์ไม่มีเส้นเบ่งมนุษย์และเดรัจฉาน .... Half human half Naga.,0
เข้ามาหาพ่อเเม่มึงหลอก คนไทยจะตายห่ากันหมดเเล้วเพราะโควิตจากพวกพม่านี้ละ,1
เค้าก็เหมือนกับเรานั้นแหละลำบากกว่าเราด้วยซ้ำเพราะบ้านของเค้ารายได้มันถูกค่าแรงน้อยต่างจากไทยอย่างน้อยบ้านเราทุกวันนี้ค่าแรง300บาทส่วนบ้านของเค้ายังวันล่ะ100กว่าบาทยุเลยอีกอย่างเงินไทยจะแพงกว่าบ้านเค้าเงิน20บาทเราแลกเงินเค้าจะได้25บาทครับจิงทำให้ประเทศเพื่อนบ้านไม่ว่าจะพม่าหรือกำพูชานั้นอยากเสี่ยงดวงเข้ามาหางานนั้นเองเพราะบางคนไม่มีเงินทำวีซ่าจึงต้องหลบหนีเข้ามาโดยผิดกดหมายเพราะถ้าทำอย่างน้อยต้องใช้เงินไม่ต่ำกว่า5_6หมื่นต่อคนแล้วที่ไทยหางานง่ายได้เงินง่าย,0
ไอส้นตีนพม่าตายๆไปให้หมด,1
ทุกคนไทยและพม่าต้องร่วมมือกันแล้วจะอยู่ด้วยกันได้สู้ๆ,0
เมืองไทยใจดีคนไทยตายเลียบเหลือแต่พม่า,1
เลิกโยนความผิดให้คนอื่น แล้วหันมาดูตัวเองบ้าง ว่าทำหน้าที่ดีหรึอยัง ไม่ว่าไทยหรึอพม่า สุดท้ายก็เรียก มนุษย์ เหมือนกัน,0
ยุทธศาสตร์ บุตรพรม เอ่อ? ที่ผ่านมามีแต่อเมริกากล่าวหาไม่มีหลักฐาน? และอีกเรื่องรัสเซียปัญหาก็กับเพื่อนบ้านมันก็เหมือนกับทุกประเทศในโลกที่มีปัญหาเพื่อนบ้านตามชายแดนเหมือนไทย?มี พม่า? เขมร? ไม่ใช่ก้าวก่ายข้ามโลกไปทุกชาติในโลกเหมือนอเมริกาน่ะ,0
พม่าแม่งเห็นแก่ตัวไอ้พวกนรกเข้ามาสร้างแต่ความซิปหายไอ้พวกเวรคนไทยตัวใหญ่แม่งเห็นแก่เงินไอ้สัสถ้าแม่งให้พม่าเข้ามาพ่อแม่มึงต้องตายก่อนสาธุ,1
ดีใจแทนพี่น้องชาวพม่าด้วยค่ะ. ใจเขาใจเรายามยากช่วยเหลือกัน,0
"ลงชื่อสนับสนุนโครงการรณรงค์ วันสากลในการป้องกันการใช้กำลังทหารและระบอบเผด็จการอำนาจนิยม ได้ที่ลิงค์ (ลงชื่อเป็นภาษาอังกฤษ) https://docs.google.com/forms/d/e/1FAIpQLSfEpYoN6quG23Cr6N-TcK6Ai37ZEontcaYEwOS0dROmr0PkNQ/viewform . ที่มาของโครงการรณรงค์ วันสากลในการป้องกันการใช้กำลังทหารและระบอบเผด็จการอำนาจนิยม เกิดขึ้นโดยเครือข่ายการขับเคลื่อนประชาธิปไตยและสิทธิมนุษยชน โดยมีองค์กร the May18 Memorial Foundation จากเมืองกวางจู ประเทศเกาหลีใต้ และองค์กร the Asian Human Rights Commission ในฮ่องกง ซึ่งมีองค์กรและประเทศภาคีร่วมรณรงค์ทั้งหมด 22 องค์กรใน 20 ประเทศ ทั้งประเทศไทย, ญี่ปุ่น, สหรัฐอเมริกา, เยอรมนี, คองโก, บูกิน่าร์ ฟาโซ่, ไนจีเรีย, เคนย่า, ศรีลังกา, กัมพูชา, บังคลาเทศ, เนปาล, อินเดีย, อินโดนีเซีย, อัฟกานิสถาน, ฟิลิปปินส์, ปากีสถาน, พม่า, มีลดีฟและบุรุนดี . การรณรงค์มีเป้าหมายเพื่อสร้างแรงผลักดันทางประชาธิปไตยและสิทธิมนุษยชนในบริบทเวทีโลก รายชื่อทั้งหมดจะถูกรวบรวมและส่งไปที่สหประชาชาติ (UN) เพื่อเรียกร้องให้วันที่ 18 พฤษภาคมของทุกปีเป็น วันสากลในการป้องกันการใช้กำลังทหารและระบอบเผด็จการอำนาจนิยม . จากการต่อสู้เพื่อต่อต้านอำนาจเผด็จการทหารของชาวเมืองกวางจูในปี 1980 สู่การต่อสู้เพื่อประชาธิปไตยในระดับสากลปี 2020-2021 ชาวกวางจูยังให้ความสำคัญกับการผลักดันประชาธิปไตยตลอดมา ซึ่งพบว่าการผลักดันประชาธิปไตยในหลายประเทศ รูปแบบของเผด็จการมีการปรับรูปแบบภายใต้ระบอบอำนาจนิยมผ่านการถืออำนาจในโครงสร้างทางการเมือง ชาวกวางจูมีความเชื่อมาตลอดว่าหลักประชาธิปไตยเป็นหนึ่งในคุณค่าสำคัญของการรักษาเกียรติยศเพื่อนมนุษย์และให้นับถือคุณค่าความเป็นมนุษย์ภายใต้หลักการสิทธิมนุษยชน เสียงและเกียรติของทุกคนจะถูกได้ยินภายใต้หลักการประชาธิปไตย . สิ่งหนึ่งที่พี่น้องและเพื่อนพ้อง ชาวกวางจูเน้นย้ำกับทุกคนที่กำลังต่อสู้เพื่อความเท่าเทียมคือเราไม่ได้ต่อสู้เพื่อประชาธิปไตยอย่างโดดเดี่ยว แต่กำลังมุ่งหน้าอย่างแน่วแน่ไปสู่สังคมที่มีสิทธิ เสรีภาพ และเสมอภาคร่วมกัน ?",0
พม่า?ไม่?ต้อง?เอา?ปืน?ใหญ่?มายิงประเทศ?ไทย?อีกแล้ว?เอาโรคมาปล่อย?ก็?ชนะ?ขาด?,1
จากใจ...ถึงกับจุกอก!!! สาวพม่า แรงงานในสมุทรสาคร ยกมือไหว้ ร้องไห้สะอื้น ขอพี่น้องหยุดด่าทอ ไม่มีใครอยากเป็นโควิด-19 เราก็รักประเทศไทย (คลิป) #สาวพม่า #แรงงานสมุทรสาคร #ยกมือไหว้,0
มึงบอกปิดประเทศ จะอดตายก็เรื่องของพม่า ให้รัฐบาลมันแก้ปัญหาเอง รับเข้ามาทำห่าอะไร,1
ขอบคุณมากนะครับที่พี่ช่วยเหลือชาวเมียนมาร์ผมดีใจกับชาวพม่าทุกคนด้วยนะครับ,0
สรุปพม่าเผาสมุทรสาคร ไม่เผาอยุธยา,1
สมัยพ่องแพ้นายกญ.เลยปล่อยน้ำให้ท่วมทั้งปท. พอมายุคลูกแพ้ม็อบมุ้งมิ้ง เลยปล่อยให้พม่ามาแพร่โควิดให้กระจายไปทั้งปท.อีก ตระกูลปีศาจกลับชาติมาเกิดจริงๆไอ้โรคจิตวิปริตอำมหิตผิดมนุษย์!!!,1
คนที่มันจะเป็นโควิทมันเป็นได้ทุกคนไม่ใช่แต่คนพม่าน่าสงสารพวกเขาจังไอ้เหี้ยผุ้จัดการโรงงานทำได้ไงเลวยิ่งกว่าสัตว์,0
ถึงจะเป็นพม่าแต่พวกก็คนเหมือนกันกับพวกเรานี่แหละค่ะสงสารเขา,0
ไม่เคยได้ยินว่าโทษพวกพม่าเอาโควิคมาซ้ากคำ ทีกับคนไทยละก็จะเอากนให้ตาย สึด,1
ลุงจะทำอะไรก็รีบทำเถอะอย่ารอช้าเลย. จะตายทั้งแผ่นดินแล้วพม่ามันยึดประเทศแล้วลุง.,0
ส่งมันกลับไปตายประเทศมัน พม่าหัวควย,1
เราสงสารนะคนพม่าเมียนมา,0
โอ้ยๆๆๆน้อ ทำไมให้พวกพม่าเข้าประเทศไทยไล่ออกไปให้หมดเลย รอบแรกยังตั้งหลักไม่ได้ มาอีกแล้วตายๆๆๆ,1
ถ้าเห็นแก่ประเทศชาติบ้านเมืองเลิกจ้างเถอะค่ะแรงงานพม่าให้โควิทป่านพ้นไปก่อนเอาเชื้อมาปล่อยฆ่าคนทั้งชาติงดได้งดเลย,1
ขอภาวนาว่า อย่าเป็นเรื่องจริงเลย ประวัติศาสตร์ พม่าเคยขยี้ไทย มาครานี้ อย่าบอกนะว่า พร้อมขยี้อีก ถ้าคุณให้เขามาเมื่อไร ไทยตายกับฝีมือพม่า ตามรอยประวัติศาสตร์แน่ๆ,0
