text,label
สู้ๆๆนะคะลาว.พม่า.กัมพูชา.ไทยก็พี่น้องกัน,0
เป็นกำลังใจให้เพื่อนๆชาวพม่านะจากเด็กไทย,0
ผู้ชายคนนี้ทำงานประมงร่วมกับแรงงานพม่าเพื่อนร่วมงานที่เป็นชาวพม่าตรวจพบโควิด แล้วจะให้คนอื่นเขาวินิจฉัยว่าอะไรล่ะครับ,0
ประเทศพม่าโรคสงบแล้วเพราะพวกพม่ามันปล่อยเข้ามาอยู่ในไทยกันหมดแล้วกลายเป็นประเทศพม่าแห่งที่2เลยตายๆ,1
ตอนนี้พม่าเป็นน้อยมากแต่คนไทยเป็นเยอะเพราะไม่ค่อยเชื่อฟังช่วยเหลือสู้ๆครับ,0
จุดไหนที่มีพม่าเยอะๆอีกหน่อยมันก็จะจี้จะฆ่าจะปล้นคนไทยเพราะจะไม่มีอะไรกินอีกหน่อยคนไทยจะตายเพราะพม่า,1
พม่ามาไทย ก็เป็นเพื่อน เป็นพี่น้องกัน อย่าคิดแบ่งคน แบ่งชนชั้น แบ่งประเทศ คน เหมือนกัน อย่าว่าเขาเลยครับ เพื่อนๆ ร่วมทุกข์ ร่วมสุขกันมาหลายๆปีแล้ว จงช่วยกันครับ เจ็บป่วยดูแล ดีที่สุด,0
ขอเป็นกำลังใจให้ทุกคนนะขอให้ผ่านช่วงนี้ไปได้ด่วยดีคะ ไม่ว่าจะเป็นคนประเทศไหนชีวิตคนสำคัณเสมอ ใครๆก็รักชีวิตตัวเอง อย่ามองคนต่างด้าวแบบไร้ค่า อย่าดูถูกเพื่อนร่วมโลก เราก็เป็นคนต่างด้าว เป็นคนลาวที่มาอยู่ไทย เป็นกำลังใจให้ทุกคนทุกประเทศที่เจอเหตุการแบบนี้ เราไม่ได้ติดโควิด แต่เราก็ตกงานเหมือนกัน ถ้าพวกเขาหรือเรารวย คงไม่มาทำงานหาเงินที่ประเทศไทยหรอกค่าของเงินมันต่างกัน อย่ารังเกียจคนต่างด้าว ถ้าพวกคุณยังกินเงินเดือนยังเดินดิน เพราะคนต่างด้าวก็มีชีวิตมีหัวใจ เห็นในกลุ่มอื่นๆเพจอื่นๆที่เขาลงข่าวว่าเมียนมาติดโควิด ด่าพวกเขาสาระพัดสัส แต่ไม่เคยโทษคนประเทศตัวเองเลยที่นำพวกเขามา บางคนรับเขามาก็มาปล่อยตามข้างทาง ทำเหมือนพวกเขาไม่ใช่คน ทำแค่ได้เงินจนไม่สนใจชีวิตของพวกเขา อยากจะบอกคนที่ดูถูกต่างด้าวนะคะ เมื่อพวกคุณยังมีชีวิตมีลมหายใจเดินดินกินเงินเดือน อย่าไปด่าคนอื่นอย่สไปดูถูกประเทศอื่นว่าเป็นประเทศที่สกรปกว่าเขาต่ำ เพราะคนเหล่านั่นแหละที่ทำให้ประเทศไทยมีตึกมีคอนโดมีอพาร์ทเม้น มีทางด่วน มีถนนที่สอาด มีผลไม้ มีอาหารทะเลให้พวกคุณได้ใช้ได้กินได้หลับนอน เพราะนายจ้างส่วนใหญ่เขาจ้างคนพวกนั้นเข้ามาทำงาน ที่พวกคนไทยไม่ยอมทำเลือกแต่งานสบายเงินเดือนหลักแสนนั่งตากแอร์ คนพม่า เมียนมา กัมพูชา ลาวเขาก็คน เหมือนกับพวกคุณ,0
ประกาศล๊อกคาวเลยผู้ว่า เดี๋ยวตายเยอะจะเป็นปัญหาแก้ยาก ต้องเอาเงินไปเผาพม่าอีกให้อยู่แต่ในห้องอย่าให้ออกมาเด็ดขาด,1
คนเหมือนกันแท้ แค่เค้าพูดคนละภาษา แต่อย่างว่าละ พม่า ลาว เวียดนาม เขมร เข้ามาทำงานให้เรายังเรียกต่างด้าว. เยอรมัน สหรัฐฯ อื่นๆเรียกต่างชาติ ต่างกันจริงๆ ทำกับเค้าได้นะ ไม่สงสาร,0
นี้แหละเขาว่าพม่าฆ่าไทย,1
Tonrak Suknakorn เอาจริงๆนี่ถ้าเป็นพม่าติดโควิดอยู่ในไทยตอนนี้ จะโทรบอกเพื่อนว่า มาเลยมึง จ่ายค่าหัวละข้ามมาไม่ได้น่ากลัวอย่างที่คิด เตียงนุ่มนอนสบายมีข้าวมาเสิร์ฟทุกมื้อ เดี๋ยวก็หาย หายแล้วเขาส่งกลับบ้านด้วย คนไทยนี่น่ารักจริงๆ,0
เข้มงวดที่ชายแดนพม่าให้หนักๆใครโผล่มายิงทิ้งให้หมด,1
ส่งมันกลับพม่าเลยเอาตัวไปรวมกันไล่มันข้ามแม่น้ำกลับไปมาทางไหนไปทางนั้นไม่สัส,1
ให้มันอดตายชะชาวพม่านะเข้ามาก็เดียดร้อน,1
ยิงทิ้งเหมือนเกาหลีเลยเอาเข้ามาเป็นภาระสิ้นเปลืองปล่าวเอาที่เข้ามาถูกต้องไม่ว่าไทยหรือพม่าที่เข้ามาไม่ถูกต้องยิงทิ้งอย่างเดียว,1
สุรีย์ มีบุญรอด ไล่กลับให้หมดเลยทั้งฝรั่งลาวพม่าไม่ต้องเอาใครเลยเอาแต่คนไทยอย่างเดียวโอเคเปล่าจบไหม ลูกกูก็คนไทยคนไทยเลี้ยงลูกกูด้วยอ่ะกูก็อยากกลับจะตายอยู่แล้ว,1
พม่าเคยตีกรุงศีอยุดธยาแตกมาครั้งหนึ่งแล้วตอนนี้จะกลับมาตีมหาชัยพวุกเราเข้าหลุมหรบไพดวั่น,1
เศร้าเลยค่ะแอดใกล้เราเข้ามาทุกทีแล้ว!!ป้องกันแทบตายสุดท้ายมาตายเพราะพม่า,1
ต่างด้าวก็คนคือกันนะก่อนจะนำเข้ามาไม่คิดเจอปัญหา?ปล่อยทิ้งข้างถนน? น่าเห็นใจเขานะ? เราไม่ทิ่งกันแต่ผู้ประกอบการ?โรงงาน?อุตสาหกรรม?ทำได้ทิ้งพม่า,0
ปรับมันให้หนักเลยอีพวกพม่าก็ส่งมันกลับประเทศมันหรือให้มันไปกักตัวบ้านไอ้นายกตู้โน่นกรรมที่มันทำกับคนไทยขอให้มันตายไปโควิทโน่นไอ้ดหี้ยตู่ปัญญาอ่อน,1
ทวีศิลป์จะพูดยังไงก็ได้ ทวีศิลป์มีเงินเดือนเงินตำแหน่ง เห็นใจลูกจ้างรายวันไหม ทวีศิลป์มีมาตรการเยียวยาลูกจ้าง และผู้ประกอบการที่จะได้รับผลกระทบรึยัง สั่งล็อกมันง่าย พรก.ฉุกเฉินทำให้ไม่ต้องรับผิดชอบอะไรในคำสั่งตัวเอง รอบที่แล้วยังเห็นน้ำตาคนจนไม่พอ?,0
เชื้อมันตรวจสอบ?ยาก ทิ้งเวลาการฟักตัวหลายวัน เราเห็นการตรวจสอบเข้มงวดอย่างต่อเนื่องในหลายสถานที่สำคั?ญ?ของไทย ยังไงก็ประชาสัมพันธ์?การ์ดอย่าตก ลุงตู่อย่าล็อคดาวน์?อีกเลยสงสารคนต้องทำมาหากินค้าขาย เพราะลุงไม่สามารถเยียวยาเขาได้ทั้งร้อยจากรายได้และความเป็นอยู่?หลายคนในครอบครัว ใครติดต้องรักษา?ตามสภาพแต่ประชาสัมพันธ์?ให้เขาระวังมีวินัยในตัวเองเพิ่มขึ้น ไทยร่วมมืออยู่? เชื่อว่าเราจะก้าวผ่านไปได้และเชื่อว่าไทยมีกำลังรองรับการแพทย์?ได้ดี พม่าที่ติดช่วยเขาแล้วให้เขากลับประเทศ?ไปรักษาตัวเองเพิ่ม เขาไม่มีที่พึงยามล้มป่วย เชื่อว่าคนไทยเข้มแข็ง?และมีน้ำใจ,0
พม่าหรือไทยไม่มีใครอยากเป็นขอพม่าสมุทรสาครสู้ๆจ้า,0
จะเอาไปเผาที่ไหนถ้าหากพม่าจบลงที่4 แสนคน,1
ไม่รู้จะได้เป็นลูกที่ซอและห์ไหม แต่จะทำหน้าที่ลูก อามานะห์ของคนเป็นลูกให้ดีที่สุด ลุกทุกสองชั่วโมงเพื่อเอาเจลประคบหัวเข่าแม่ มาได้ค่อนข้างแล้วแม่ พรุ่งนี้ไปฝึกเดิน เราต้องเดินได้ ท่องไว้เราต้องเดินได้ แล้วเราจะได้กลับบ้านกันซะที 555 พม่ารออยู่ ความอดทน ความมุ่งมั่นจะทำดี เนียตดีด้วยความบริสุทธิ์ใจ เพื่ออัลลอฮ์ เพื่ออัลลอฮ์องค์เดียวเท่านั้น แล้วบททดสอบที่เจอมันจะง่ายขึ้นด้วยอัลลอฮ์ช่วยเหลือ ขอให้แม่ฉันเดินได้ด้วยเถิด อามีน,0
รับพม่าเขัามาคนไทยตายอย่างเดียวไม่เอาพม่าโวยๆๆๆๆ,1
ขายของพม่าค้างหนีหายไปหลายคนแล้ว(เพราะสงสารคำเดียว)ใครช่วยได้บ้าง,0
ปิดตายเลยจังหวัดเดียวอ่ะไม่งั้นกะทำเรือใหญ่ๆเอามันไปไว้กลางน้ำพวกไม่มีจิตสำนึกพม่าหัวควาย,1
แหวะ ตรวจสอบอยู่แล้ว เอาประเทศไทยนี้ ยกให้พวกพม่า มันครอบครองไปเลย ไหนๆ มันก็เคยเผาวัด และฆ่าคนไทย และเอาไปเป็นเชลยมาแล้ว ไง เปรต ไม่ต้องทำห่าอะไรล่ะ กับการดำรงชีวิค,1
ไม่เคยเห็นพม่าใส่แมทสักทีเดินเหมือนอยู่ประเทศมันเลนคนไทยป้องกันแทบตายสุดท้ายมาตายเพราะพม่า,1
ตายเพราะพม่าอีกแล้วเหี้ยเอย,1
เข้มแข็งพุเดียวพุ้นสิเป็นประสาทละ หึย เก่งแต่คำเว้า ประเทศกะบ่ปิด มักไห้คนประเทศอื่นเข้ามา กะว่าละเจ้ามีเงินใช้น้อ ประชาชนนิติจักหนี้รถค่าน้ำค่าไฟ งานกะอยากเหด โควิดกะย้าน ตายก่อนพอดี งึดพวกบริหารประเทศบ่เป็น,0
พม่ามีทั่วในเขตอุตสาหกรรมของประเทศไทย น่ากลัวนะแบบนี้ อีกอย่างพวกมันชอบเคี้ยวหมาก ชอบบ้วนน้ำหมากทิ้งไปทั่วเป็นการกระจายเชื้อได้อย่างรวดเร็ว อีกอย่างตอนนี้อากาศหนาวเย็นเชื้อตายยาก,1
ครั้งก่อนไทยเสียกรุง ให้แก่ พม่า โดนเผาวัด เอาทอง ไป มารอบนี้ พม่า จะตีไทย อีก รอบ โดยใช้อาวุธ ( ไวรัส โควิด ) นี้ประเทศไทย. จะยืนหยัด สู้ได้ไหม. ถ้าปู้นำประเทศยอม คือการชักศึกเข้าบ้าน,0
เจอพม่าที่ไหนยิงกระบาลมัมเลยดูชิว่ามัมจะกล้าอยากมาอีกไหมไทย,1
เอาเข้ามาดิพม่าจะได้พากันตายล้างโลกอ้างแต่แรงงานไม่พอก้ไม่จ้างคนไทยบอกค่าแรงแพงสม,1
ความเห็นแก่ตัว ให้เข้ามา ทำมาหาแดกแล้วยังจะสร้างความเดือนร้อนให้ประเทศกุอีก ให้คนประเทศกุเดือดร้อนอีก นี้จะขอเข้ามาอีก เจ้าหน้าอย่าเห็นแกเงิน5-6พันนะคะ พม่าที่อยู่ไทยให้ออกไปก่อน ประเทศเค้าถ้าเป็นตายอย่างเดียว พอเป็นในประเทศไทยต้องรักษา ถึงอยากมาไทย,1
"ตัวเเทน สาวพม่า ขอโทษคนไทย? หลังถูกสังคมมองเป็นผู้แพร่เชื้อโควิด-19 | BRIGHT TALKเปิดใจตัวแทนสาวพม่า เราแค่อยากมาทำงาน หาเงินส่งกลับให้ญาติพี่น้อง ไม่ได้ตั้งใจจะมาแพร่เชื้อโควิด วอนเพื่อนๆ ชาวต่างด้าว ช่วยทำตามที่รัฐบาลบอก อย่างหนีการตรวจ และเข้าประเทศอย่างถูกกฏหมาย กด Subscribe ติดตามได้ที่นี่ : https://bit.ly/2J82750 เพื่อชมคลิปข่าวเด็ด, สัมภาษณ์ exclusive ก่อนใคร ติดตามช่องทางสื่อสารไบรท์ทีวี Website : https://www.brighttv.co.th Facebook : https://www.facebook.com/BrightTodayOfficial Twitter : https://twitter.com/BrightTodayTh Instagram : https://www.instagram.com/brighttv20 Youtube : https://youtube.com/BrightTV20 ติดต่อโฆษณา โทร. 086-322-6363 ในการถ่ายทำทุกเทป มีมาตรการเว้นระยะห่างทางสังคม (Social Distancing) เพื่อลดอัตราความเสี่ยงการติดเชื้อ (COVID-19) #คนงานพม่า #แรงงานต่างด้าว #โควิดสมุทรสาคร #ประกาศล็อกดาวน์ #COVID19",0
พม่ามาเผากรุงอีกละ,1
จะให้รับเข้ามาทำไมไม่ทราบเยอะขนาดนั้น ถ้ารัฐบาลเรารับเข้ามา ก็เหมือนกับรับเขาเข้ามาฆ่าคนไทย แค่นี้ประเทศเราก็มีภาระหนักมากพอแล้ว ไม่จำเป็นต้องรับเข้ามาให้เป็นภาระของเราเลย คำร้องขอของพม่าเป็นสิ่งที่เห็นแก่ตัวมากกว่า รู้ๆกันอยู่ว่าประเทศตัวเองเป็นแหล่งเพาะเชื้อ ยังจะอยากให้เข้ามาแพร่เชื้อในไทยอีก,1
ไม่ต้องเสียใจพม่า.ไทย พี่น้องกันไม่มีพม่าเราก็แย่คนไทยคร้านงาน หนักไม่เอาเบาไม่สู้ อยู่นะทําให้ถูกกฏหมาย,0
โชติพงศ์ ไชยลุม คิดเหมือนกันเลย ฟังมันตรงนั้นฝังมันทั้งเป็นนั้นแหล่ะ ทีประเทศเรา เอิ่ยชื่อประเทศมันไม่ได้เลยนะพวกพม่า จะเป็นตะตาย,1
ไอ้พม่าไอ้หมาสกปรกยิงแม้งทิ้งไป,1
27 / 12 / 63 เวลา 17.40 น. รับแจ้ง อปพร.บางบอน 2023 / 2085 ตรวจสอบชายทำร้ายตนเองบาดเจ็บ ถนนเอกชัยขาเข้า ในซอยเอกชัย 132 แยกซอยโพธิพุฒตาน เป็นหอพักของโรงงาน มีผู้ได้รับบาดเจ็บชาย 1 ราย ชาวพม่า อาสาสมัครให้การช่วยเหลือปฐมพยาบาล นำส่งโรงพยาบาลหลวงพ่อทวีศักดิ์พื้นที่รับผิดชอบ ส.น.บางบอน,0
เห็นใจ แรงงานพม่า ไม่มีใครขายข้าวให้,0
เปิดรับเข้ามาทำเหี้ยไรละ..คนไทยกิจการเจ๊ง ผู้คอตายพิษเศรษฐกิจเสพยาขโมย..รับพม่าเข้ามาให้ประเทศวอดวายรึไง,1
ศึกครั้งนี้ใหญ่หลวงนัก พวกเรา(คนไทย)ป้องกันเต็มที่ ทางการปล่อยให้พม่าเข้ามา พร้อมเชื้อ คนไทย ตายยยย มีพม่าทุกตลาดค่ะ,1
อินเวสติ้ง คลับ เราตรวจสองครั้งแล้วค่ะตั้งแต่ระบาดรอบแรก และรอบที่สองไปตรวจโควิด100กว่าคนไม่มีใครเสียเลย มีแต่พม่าที่หนีเข้ามาเสียค่าตรวจคนละ2500ค่ะ เพื่อนบ้านก็ไม่เสียเลยค่ะ การไปตรวจคือต้องมีเหตุก่อนไม่ใช่ไปตรวจเพื่อขอใบรับรองเอาไปยื่นธุระส่วนตัวค่ะ,0
สึกพม่าครั้งนี้ ไหย่หลวงนัก เข้ามาพัก เข้ามาอยู่มุ่งจุดหมาย เราเปนไทยอย่าก้มหัวกลัวความตาย ต้องขับไล่ มันไปไห้ไกลตีน,1
