text,label
Toowgnos Gnoormubnarmus สติค่ะ สติ คนสมุทรสาครติดเชื้อเพราะคนพม่า หรือคนจากยุโรป? แยกแยะหน่อย ในเมื่อรัฐบาลยังเปิดให้ต่างชาติเดินทางเข้าไทยโดยมีเงื่อนไขกักตัว 15 วัน เขาใช้เงินเขารักษาตัวค่ะ ไม่ได้ใช้งบของไทย และไม่ใช่ทุกคนที่เดินทางเข้าไทยโดยการกักตัวจะมีเชื้อนะคะ เราก็มีเพื่อนอาศัยอยู่มหาชัย 2 ครอบครัว เรารู้ค่ะว่าเครียดกัน เราก็มีช่วยส่งอาหารและนมไปให้เขาและลูกๆ,0
เมืองไทยก็จะตายอยู่แล้วพม่าจะเอาโรคมาเพิ่มอีกหรือค่ะคนไทยตายกันอยู่แล้วไม่พวกคุณหรือที่พาคนแถวมหาชัยติดกันเป็นว่าเล่นนะพอก่อนเถอะคะ,0
เผาจริงแน่... แต่ละโรงงานพวกคุณต้องช่วยประเทศละคุณมีแรงงานพม่าต้องสั่งห้ามโดยเด็ดขาดห้ามให้ญาติที่มาจากนอกพื้นที่มาพักและไม่รับแรงงานใหม่และคัดเลยว่าแรงงานเดิมมีออกไปพบญาติที่ไหนมาหรือเปล่า ถ้าคุณไม่ช่วยรัฐ คุณก็เจ๋งเหมือนกัน... เพราะรัฐอาจเข้าไปตรวจได้ไม่ทั่วถึงคะ... ช่วยกันเริ่มจากคุณก่อนที่จ้างพวกเขามา,0
ให้มันไปตายยุบ้านมันพุ้นน่ะ #กูซังพม่า,1
ขอบคุณแทนพี่น้องชาวพม่า..ด้วยค่ะ,0
ผู้ว่ามุ้งมิ้ง น่ารัก สู้ๆนะคะชาวสมุทรสาคร และพี่น้องชาวพม่าค่ะ,0
พม่าบุกไทยไม่ต้องใช้อาวุธมันใช้เชื้อโควิดมาบุกประเทศไทยเราเศร้าใจเพราะมีพวกเจ้าหน้าที่ที่เห็นแก่เงินแล้วให้มันเข้ามาใครจะรับผิดชอบโว้ย,1
อยู่ติดกันมันต้องโดนอยู่แล้วเข็ดใหมพี่น้องชาวไทยที่ให้พม่าเข้ามา,0
ไม่ได้รังเกลียดคนพม่านะ แต่ข้อเรียกร้องของพวกคุณมันมากเกินไป จิงๆ พวกคุณก็น่าจะไปขอความช่วยเหลือจากรัฐบาลพม่า ส่วนรัฐบาลไทย ช่วย เท่าที่ทำได้!!!,0
คาสิโตนเนาะอดเอาพี่น้องพม่าสู้ๆๆๆ,0
เพิ่งมาขุดใช่มั้ย...แต่ก่อนละ.ผบตร..ไปขุดอะไรยุ.ขุดปูบ่..วัวหาย.แล้วล้อมคอก.กลยุทธ.ลองเอามาใช้สิคับ..ไอ้พวกลักลอบเข้าเมือง.ไม่ได้กักตัว...มีประเท ศไทยนี่แหละ...มันพากันชักศึกเข้าประเทศ.ขนาดพม่ามันยังกลัวกันเอง...ระยำจริงๆพวกที่เห็นแก่ตัว.ไม่คำนึงถึงประเทศของตัวเอง..ประเทศเพื่อนบ้าน..เขาปิดกั้น.คนในห้ามออก.คนนอกห้ามเข้า..ประเทศกูมี,0
"1.พม่าแอบลอบเข้าประเทศไทยแบบผิดๆ 2.พม่าเอาเชื้อมาแพร่ในประเทศไทย 3.พม่าแอบหนี้,แอบเข้า .(จับพม่าติดคุกหลายๆปีเลยเอาผิดมั้งไม่งั้นทำเลียนแบบกันอีกไม่งั้นแอบเข้ามากันแบบผิดๆแถมยังเอาเชื้อโควิทมาแพร่อีก) เชือดไก่ให้ลืงดู ออกกฎหมายเอาผิดพวกที่แอบเข้าแบบผิดๆ ออกกฎเอาผิดบางเถอะอย่าปล่อยให้มีช่องว่างช่องโว้เยอะขนาดนี้ 1.พวกแอบเข้าประเทศแบบผิดๆๆพวกที่ไม่ตรวจเช๊คผ่านตามช่องทางด่านต่างๆพวกที่ไม่ทำตาม จับติดคุกให้เข็ด,ถ้ามีหน่วยงานราชการไหนที่พาพ่มาเเอบเข้ามาแบบผิดๆๆก็เอาผิดให้หนักกว่าเดิมอย่าปล่อยให้มีประวัติซ่ำลอยอีกเชิดไก่ให้ลิงดู ที่แบบนี้ไม่เปาประกาศเอาผิดพวกแอบเข้าพวกที่ค่อยช่วยเหลือพม่าแอบเข้าออกแบบผิดๆที่กรณีผู้หญิงไทยแอบเข้าออกข่าวจะปรับเข้า20ล้าน ที่เเบบนี้ไม่เห็นเปาประกาศเอาผิดพม่าพวกที่พาเข้าจับติดคุกให้เข็ด",0
ผมก็คนสมุทรสาครครับ อย่าโทษกันเลยนะครับ เรื่องแบบนี้ไม่มีใครอยากให้เกิดขึ้นหรอกครับ ช่วยให้กำลังใจกันดีกว่าครับ เป็นคนเหมือนกัน ผมก็ไม่โทษนะว่า คนพม่ามาแพร่เชื้อ เค้าก็คนเหมือนกัน เค้าก็ต้องทำงานเลี้ยงปากท้องของตัวเอง ช่วยกันป้องกันต่อจากนี้ดีกว่าครับ สู้ๆ,0
ไอ้ชิปหาย มัวแต่เอาทหาร ตำรวจ มาปราบม๊อบ พม่าลอบตีกรุงศรี ตายห่าหมด,1
จะปล่อยให้เข้ามาทำร้ายคนไทยทำไมจะตายเพราะความมักง่ายของพม่า,1
เป็นกำลังใจให้พี่น้องชาวพม่าครับ,0
ปัญหาแรงงานพม่า ที่รัฐไม่เคยจริงจังในการแก้ปัญหา รู้ทั้งรู้พม่าระบาดหนักมาตั้งหลายเดือนแล้ว แรงงานพวกนี้ที่ลักลอบเข้าแบบผิดกฎหมายมีอยู่ตลอด ทำไมไม่เตรียมรับมือตรงนั้น กฎหมายก็อ่อนแอ คนเห็นแก่ได้บางคนอ้างปากท้องตัวเอง หาผลประโยชน์จากแรงงานเถื่อนพวกนี้เพื่อตัวเอง แต่มันไม่เคยคิดมันฆ่าคนไทยอีกกี่คน สำนึกไม่เป็นจริงๆ,1
วันก่อนบอสฉีกหน้าอัยการ วันนี้โควิดฉีกหน้าบ่อน พม่าฉีกหน้าค้ามนุษย์,0
ตายชะพม่า,1
หนีก็ไล่มันกลับไปให้หมดเลย ถึงเวลาที่จะฟื้นฟูประเทศด้วยกำลังตัวเองรึยัง ปล่อยให้พม่าได้สร้างประเทศของเขาเองซะบ้าง ล๊อคตายเลยนะอย่าให้เข้ามาทำงานอีก,1
ยิงแม่งให้หมดพม่า,1
พม่าอยู่มหาขัยไม่รู้ร้อนรู้หนาวไรเลย จะบ้าตาย ปล่อยให้อดตายให้หมด,1
"เหรา? คาย? นาค? เป็นศิลปะ?ที่พบเจอได้ในล้านนา?และล้านช้าง เหรา? เป็นสัตว์?ที่ดุร้าย, ขี้อิจฉา, รุกรานคนอื่น? หมายถึง? พม่า นาค? เป็นสัตว์?ศักดิ์?สิทธ์?ที่ชาวไต(ไท)? นับถือ? และ?กลุ่ม?ชนชาติลาวเองก็ถือตนเองว่าเป็นลูกหลานสืบเชื้อสายมาจากพญานาค? ดั่งนั้น? นาคจึ่งหมายถึงล้านนาและล้านช้าง เหรา? คาย? นาค? จึ่งหมายถึงพม่าที่มารุกรานล้านนามาจนถึงล้านช้าง? เผาเวียงจันทน์?ไปหลายครั้ง? แต่ในที่สุดสองอาณาจักร?พี่น้องนี้ก็เป็นอิสระ?จากพม่า? ดั่งนั้นเหราจึ่งคายนาคออกมา? ไม่ใช่แค่วัดที่เชียงใหม่?วัดที่หลวงพระบางเองก็มีบันไดแบบนี้แทบทุกวัดเลย",0
แข็งแรงๆนะพี่น้องพม่า ทุกคน ถ้าไม่มีคุณ. งาน ก็ไม่เดิน. หายไวๆ เราคนไทยเป็นกำลังใจให้ ทุกคนที่เป็นรึไม่เป็นโควิค ให้กำลังใจทั้งคนไทยและ พม่า,0
บ้วนน้ำตายนี่ที่1เลยบ้วนไปทั่วและพวกพม่ากินหมากไม่ยากจะคิดถ้ามันมีเชื้อมันถ่มน้ำลายบ้วนน้ำหมากขนาดไหน,1
สกุล สกุล ตลา เห็นมีข่าวคนจะฆ่าตัวตายเพราะตกงานบ่อยๆค่ะที่เมืองไทยจนเราคิดว่าคงไม่มีงานให้ทำจริงๆพอมาเจอข่าวแรงงานพม่าทั่วไทยเป็นล้านร้องได้คำเดียวว่าโอ้โหอะไรกันนี่,1
พมาเป็นคนที่ดื้อมากอวดดีอยู่สักปีสองปีอวดเก่งแถวเชียงไหม่นี่ตั้งเป็นแก๊งเลยที่สำคัฯพม้านะมีเงินติดตัวหน่อยเที่ยวไปมาหากันนี่แหละมันจแพร่เชื้อเร็วมากแมสก้อไม่ใส่ทางการต้องจับจริงๆได้แต่รณรงคคนไทยน่ะไห้ความร่วมือทุกอย่างแต่พม่ามันดื้อต้องยิงทิ้งอย่ามัวโลกสวยกัน,1
สู้ๆๆๆๆๆคับผมยุประจวบติดด่านสิงขรเราจะระวังตัวพวกคุณชาวพม่าก็ดูแลตัวเองนะคับสู้ๆๆอย่าท้อ ท้อเอาไว้ให้ลิงถือนะ,0
พูดภาษาพม่าไม่ได้ แต่อยากส่งกำลังใจให้ชาวพม่าที่อาศัยอยู่ในประเทศไทยทุกคนรวมถึงพี่น้องคนไทยทุกคนจงเข้มแข็ง ดูแลสุขภาพตัวเองให้ดี เราช่วยกันป้องกันเพื่อไม่ให้มันแพร่กระจายมากกว่านี้ กาดอย่าตกกันนะคะ,0
นี่อยู่สมุทรสาครคนไทยกลัวแทบตายพม่านี่ชิวมากกกบ้วนหมากถมน้ำลายสบายใจแฮเฮ้ย!!มาอยู่บ้านเค้าทำตัว (ด่าเป็นบางตัวเอ้ยบางคนนะค่ะบางคนเค้าก็ดี),1
พม่า6หมื่นคนจะอดตาย...ขอเข้าประเทศไทย เอิ่มมมมม..คือถ้าพวกมึงเข้ามา พวกตรูก็อดตายเหมือนกัน เข้าใจตรงกันนะอิพวกพม่า อิเวน,1
ลำพังคนไทยก็จะเเย่งข้าวหมาเเดกยุ่เเล้วมาเจอไอ้พม่าอีกตายห่าหมด,0
เรามาหาเงินบ้านเขาเมืองเขาเราตอบแทนสิ่งดีๆแล้วมันก้จะดีขึ้นเองค่ะ..ช่วยกันป้องกันดีแล้ว..อย่าคิดมากนะพี่ๆน้องๆพม่าทุกๆคน..เชื่อว่าใม่มีใครอยากให้เกิดหลอกค่ะ...แต่มันเกิดขึ้นแล้วช่วยกันป้องกันแค่นี้ก้ถือว่าทำดีแล้ว...สู้ๆๆๆค่ะ..??????,0
ในเมื่อเรื่องร้ายๆเกิดขึ้นแล้ว..เราจะก้าวผ่านมันไปด้วยกันครับ...สู้ๆนะครับพี่น้องชาวพม่าทุกๆท่านคนไทยใจดีๆและพร้อมจะร่วมมือสู้ไปด้วยกัน..มีเยอะครับ.ถ้าโทษหาคนผิดก็ตัวใหญ่ๆมีอำนาจสั่งการปล่อยปะละเลยตั้งแต่แรกนั้นแหละ,0
เราเห๊นใจคะแต่เรากลัวโรคติดต่อมาให้ถุกต้องกันนะคะตรวจก่อนแล้วค่อยมาช่วยบอกเพื่อนหรือพี่น้องชาวพม่าอย่าหลบกันนะคะออกมาให้เขาตรวจใม่ต้องกลัวประเทศใม่ใจร้ายคะ,0
สภา โพลิธิคคีย์บอร์ด ควรละทิ้งการเมืองชั่วครู่ หันดูรอบตัว เรามีแรงงานพม่าในระบบชีวตคประจำวันเรากี่คน ...ขายลูกชิ้น ขายไอดิม ขายกุ้งเผา เด็กล้างจาน จับสแกน เราควรรู้แน่ชัดว่าเหล่านี้ไม่เป็นตัวแพร่เชื้อ,1
ตายๆพม่าบุกไทย ตอนนี้เศรษฐกิจไทยก็แย่จนจะตายห่ากันหมด,1
@political_drama ปิดประเทศ ดูแลตัวเองแทบตาย ทำตามนโยบายรัฐที่พวกมึงตั้งมาทุกอย่าง.. มาชิบหายกับไอ้พวกแรงงานพม่า ที่ลักลอบเข้ามา ประเด็นคือมันติดได้ไง ต้นตอมาจากไหน มึงยังใหคำตอบไม่ได้ ไหนๆก้อเป็น page ของรัฐบาลละ ช่วยหาคำตอบหน่อยนะ อย่าเอาแต่ปัญญาอ่อนไปวันๆ #โควิด19สมุทรสาคร #โควิดสมุทรปราการ,1
ไม่ได้รังเกียจแรงงานพม่าหรืออะไรนะคะ เพราะที่ทำงานพ่อก็มีพม่าเหมือนกัน แต่ก็ถ้าจะมาจะไปอยากให้เป็นกันแบบถูกกฎหมายนะคะ สู้ๆ ค่ะ,0
พม่าเผากรุงแบบเนียนๆ,1
เจอก็ยิงแม่งทิ้งดิ้จะได้หยุดโรคไอพวกพม่า,1
เรามีเพื่อนพม่า คุณรู้ไหมเขากลับบ้านทีนึงเขาหอบเงินกลับทีละหลายหมื่น เขามีเงินอยู่ที่ว่าเขาจะซื้อกินไหม,0
ขอบคุณแทนพี่น้องชาวพม่าด้วยค่ะ ขอให้รวยๆเจริญรุ่งเรืองนะค่ะ,0
กลัวเหี้ยไรพม่าต่างด้าวเป็นงัยเอาเข้ามาลักลอบเข้ามาตัวใหญ่ๆกินค่าหัวเอาเข้ามางัยละปิดทั้งประเทศบ้านมันเอาไม่ไหวแล้วเป็นทั้งประเทศยังให้ทันเข้ามาแพร่เชื้ออีกควายแท้ๆเข้ามาตามขายแดนยิงทิ้งให้หมดสมัยก่อนมันเผาบ้านเมืองเรายังกลัวเหี้ยไรอยู่,1
แถวบ้านเวลาทำบุญที่ไทย คนพม่านี่ทำเยอะนะ ถึงขึ้นสร้างวัดสร้างโบสถ์เลยก็มี เค้าก็เหมือนคนไทยหรือคนทุกชาติ มีทั้งดีไม่ดีปะปนกัน ถ้าเราจะเหมารวมทั้งหมดเลย ก็น่าสงสารเค้านะ เวลาต่างชาติเหยียดเรา เรายังรู้สึกเลย ทำไมถึงเวลาทำซะเอง เวลาสถานการณ์มันควรทำให้คนเห็นใจกัน ช่วยเหลือกัน ไม่ใช่เอาแต่ปัดสวะให้พ้นตัว มันเลยเวลาที่จะโทษนั่นนี่มาแล้ว,0
คน จ.อ่างทอง เป็นกำลังใจไห้คนพม่าทุกคนเราเข้าใจและเห็นใจนะสู้ๆไปเดี๋ยวอะไรร้ายๆมันก็ผ่านไปด้วยดี อดทนสู้ๆนะครับ,0
ไม่ต้องสงสาร ไม่ต้องเห็นแก่มนุษยธรรมแล้ว ส่งมันกลับให้หมด ใครไม่กลับ ยิงแม่งทิ้งเลย อยู่แล้วสร้างปัญหา #เลวทั้งพม่าทั้งคนพาเข้ามา,1
ตอนโควิดรอบแรกกลัวตายที่ไทยหนีกลับพม่าพอตอนนี้จะขอเข้ามา่ถุย,1
พม่าเขามาทํางานเขาผิดตรงไหนถ้าไม่ได้พวกเขาแล้วใครจะทํางานให้พวกเราคนไทยเหรอไม่มีใครทําหรอกสงสารเขาอย่าไปรังเกลียดเขาเลยชว่ยกันดูแลเขาไปพรอ้มกลับเรานะ,0
ตามนั้น ถ้าไม่ยิงทิ้งรึว่าส่งกลับ โควิดพุ่ง,1
สู้ๆครับพี่FC จากพม่า,0
ใช่.. พม่าก็คน.. ไทยก็คน.. ต้องช่วยเหลือกันฮะ,0
พม่านี่แสบมาก พวกมึงรุกรานประเทศไทยมานานแสนนาน ถ้าเป็นยุคพระเจ้าตาก พระนเรศวรมึงตาย 5555,1
ครั้งสุดท้ายเราถูกพม่าเผากรุงตอนเสียกรุงครั้ง2นี่เราจะเสียกรุงครั้งที่3หรือแต่พวกมึงต้องข้ามศพกูไปก่อน,1
สงสารเขาเหมือนกันใครสงสารเอาพม่าไปไว้ที่บ้านได้เลยค่ะแต่บ้านฉันคนเยอะเอาไปไว้ที่บ้านไม่ได้ค่ะ,0
