text,label
เรื่องแรกผลักดันให้พม่ากลับบ้านเมืองมันก่อนเถอะเอาไว้ทำไมเงินเอาไว้รักษาคนไทยเถอะถึงไม่ติดโรคก็จะอดตายกันหมด,1
เห็นแก่ตัวชิบหาย ทั้งพม่าที่หนีเข้ามา ทั้งนายหน้า ทั้งเจ้าหน้าที่ที่รับเงิน ประชาชนปกป้องตัวเองแทบตาย ไหนจะค่าแมส ค่าเจล ล้างจนมือจะแหก อดทนทำตามที่ให้ปฎิบัติ และสิ่งต่างๆมันกำลังจะดีอยู่แล้ว ทั้งสถานที่ท่องเที่ยว และภาพรวมต่างๆ ดันมาจบที่พวกเลวๆพวกเหี้ยที่เห็นแก่ตัวเห็นแก่เงิน มึงดูนะสิ่งที่พวกมึงทำส่งผลต่อคนอื่นโดยรวมขนาดไหน.,1
มันเข้าอยู่ในไทยรวมๆแล้วปะมาณ2ล้านกว่าคน ที่เข้ามาถูกต้องมีแค่ปะมาน2-3แสนคน ภาครัฐไม่คิดจะทำอะไรบ้างเลยรึ หรือต้องให้คนไทยไล่ฆ่าพม่า ใครเป็นพม่ายิงทิ้งได้เลย หรือประเทศไทยกลัวประเทศพม่าวะ รถถังอาวุธที่ซื้อไว้เพื่ออะไร หรือเก่งแต่คนไทยในประเทศด้วยกันวะ #ควายตู่,1
ไม่รู้จะได้เป็นลูกที่ซอและห์ไหม แต่จะทำหน้าที่ลูก อามานะห์ของคนเป็นลูกให้ดีที่สุด ลุกทุกสองชั่วโมงเพื่อเอาเจลประคบหัวเข่าแม่ มาได้ค่อนข้างแล้วแม่ พรุ่งนี้ไปฝึกเดิน เราต้องเดินได้ ท่องไว้เราต้องเดินได้ แล้วเราจะได้กลับบ้านกันซะที 555 พม่ารออยู่ ความอดทน ความมุ่งมั่นจะทำดี เนียตดีด้วยความบริสุทธิ์ใจ เพื่ออัลลอฮ์ เพื่ออัลลอฮ์องค์เดียวเท่านั้น แล้วบททดสอบที่เจอมันจะง่ายขึ้นด้วยอัลลอฮ์ช่วยเหลือ ขอให้แม่ฉันเดินได้ด้วยเถิด อามีน,0
Somsakk Rakchareon .จะเอาจริงไหม.ทำไมชอบใช่ร้ายประเทศตัวเอง...พม่า.ปล่อยให้ตายเลย..แม้แต่ปวดท้ิอง.เป็นใส่ติ่ง..ถ้าไม่มีเงิน.ปล่อยให้ตายเลย...ลูกเรา.อยู่แม่สาย.มีลูกจ้าง.เป็นพม่า....พวกเขาบอกหมด..มาเลย์.ลูกสาวเราก็อยู่ที่.กัลลาลัมเปอร์ตอนนี้...หลานเราไปโรงเพื่อนเป็น.ก็ให้หลานเรา.กักตัว.อยู่บ้าน....ลูกคนเล็กเรา.อยู่.นิวยอร์ต...ก็ให้.กักตัว..ที่บ้าน....อย่าอ้างประเทศเขา..ให้โทษ.ตัวเอง.บ้าง...,1
อัญชุลีกร น้ำทองไทย คุมมันไม่ได้หรอกพม่าเหี้ยจะตาย...แม่งยุทุซอกทุมุมเมือนมันยุบ้านมันเลยเมืองปะมงดงพม่า5555,1
สู้ๆครับพี่ๆน้องๆชาวพม่าทุกท่านเราจะสู้ไปด้วยกันครับอย่าท้อครับผมคนไทยจะสู้ไปกับท่านครับ,0
เห้ออ พม่าเค้าก็น่าสงสารนะ หอบลูกเด็กเล็กแดง เพื่อมาหาความมั่นคงกว่าประเทศเค้า ถ้าอะไรๆมันดี เค้าคงไม่หอบลูกมาลำบาก สงสารเด็กน้อย,0
ก็ไปถามไอ้ประยุทธ์กับไอ้ประวิทย์สิว่ามึงใช้ให้ลูกน้องมึงรับเกินจากคนจีนพม่าแรงงานพม่าลาวกัมพูชารับมาจนมึงมึงไม่มีสิทธิ์ที่จะเก็บเงินแล้วมึงมันมนุษย์ใจสัอย่ามาตีหน้าเศร้าเล่าความเท็จเลยเด็กอมตีนเค้าก็ไม่เชื่อมึงมึงแน่จริงมึงลงออกจากรัฐบาลชุดนี้สาตั้งแต่มึงขึ้นมามีแต่ความล่มจมความฉิบหาย,0
มันก็ออกได้เหมือนกันแหละถ้ามีกำแพงออกเข้าได้ เขาก็ ออกไปอยู่แล้วไม่พม่าไทยลาวหรือที่ใหนๆไม่ว่าสัตน์หรือมนุษย์ไม่ต้องการกักกันทั้งสิ้น,0
โรคมันมากับพวกพม่า พวกเราคนไทยตายแน่ๆๆ เอาไม่อยู่แล้ว,1
หนูขอให้ป้าเฮงๆรวยๆเหมือนกันนะคะขอให้ถูกรางวัลที่ 1 เพราะความสงสารสาวพม่าไทยใหญ่เหมือนกันคนต่างด้าวขอบคุณมากๆนะคะคุณป้ามีน้ำใจดีขอให้เฮงๆรวยๆนะคะสาธุสาธุสาธุค่ะ??,0
ไปกันใหญ่แล้ว สงสารพม่าเนอะ เค้าก็คนเหมือนเรานะ ???? ดูแล้วน้ำตาไหลเลย,0
Kachon Natetara คนในประเทศยังเอาม่ายขาดช่วงทีอ่ะ มันฉลาดจะตายออกลูกก้อในไทยแล้วเอากลับไปบ้าน เคยถามพม่าบอกรพ.ดีกว่าบ้านเค้าฟรีด้วยสิทธิปกส.,1
..เสียกรุงศรีฯครั้งแรกให้พระเจ้าบุเรงนอง ..เสียครั้งที่สองโดนเผาไม่เหลือเพราะมีคนปล่อยไส้ศึกเปิดประตูเมืองให้ ..ครั้งนี้เสียสมุทรสาคร ก้อเพราะพวกเห็นแก่เงินทอง ปล่อยพม่ารามัญเข้ามา ..คงอีกเพียงไม่นาน พม่ารามัญก้อคงเข้าประชิดและยึดกรุงเทพฯได้เป็นแน่แท้ ..เพลานี้พวกเจ้าจงเร่งเตรียมเจลแอลกอฮอร์ล้างมือและผ้าปิดจมูกให้พร้อมรับศึกเถิด.. ..สู้ๆนะคนไทยทุกคน???,0
สถานทูตพม่า ช่วยเหลือคนของเขาไม่ได้หรือ,0
แม่เรียม ขนมไทย อีกหน่อยคงติดโควิด และอดตายทั้งประเทศถ้าฉลาดแบบนี้ สู้พม่าไม่ได้มันฉลาดแกมโกง5555,1
นี้แหละผลของการให้พม่าเข้ามาทำงานแบบไม่จำกัดโควต้า แถมต่อวีซ่ากี่ครั้งก็ได้เห็นแก่เงินเล็กๆปล่อยเค้าเข้ามาเยอะเกินความต้องการแรงงานที่ไทยขาดแครนจริงๆ ส่วนที่มาเกินความต้องการนั้นจะไปทำงานอะไรหรอหลักๆก็แย่งงานคนไทยนี้ไงทำเพราะส่วนที่ไทยให้มันทำนั้นเต็มทุกตำแหน่งแบ้วแต่มายังเข้าไทยมาเพิ่มไม่หยุด มันก็หางานที่ว่าตรงไหนรับกูก็ทำโดยไม่สนใจคนไทยจะไปหางานอะไรทำ. แถมอยู่จนมีลูกมีหลานไทยก็ทำใบเกิดให้ปล่อยให้เค้าอยู่แบบอิสระจนมากันหมดญาติพี่น้อง. กะว่ามาปักหลักที่ไทยออกรถมอเตอร์ไซท์ขับกันเพียบใบขับขี่ไม่มีก็เห็นยังขับกันหน้าตาเฉยงานขับรถส่งของก็พม่าเห็นขับเยอะมาก แล้วในเมื่อญาติพี่น้องมันมาอยู่ปักหลักที่นี้แล้วคนที่บ้านเค้าก็ต้องแอบเข้ามาจนได้เพราะพี่น้องเค้าอยู่นี้ แทนที่ไทยจะทำสัญญาจ้าง5-6ปีต่อคนพอครบแล้วก็พลักดันกลับแล้วให้พม่าชุดใหม่เข้ามาทำแทน แล้วก็มีโควต้ารับแรงงานแค่เท่าที่ไทยจำเป็นเท่านั้น ทำแบบประเทศอื่นเค้าทำเห็นไหม ถ้ายังปล่อยไว้แบบนี้ประชาชนคนไทยเตรียมตัวลำบากได้เลย. พม่ายิ่งปล่อยให้มีมากจนเกินไปมียิ่งทำให้เปิดช่องทางลักลอบเข้าคนเถื่อนได้ง่ายยิ่งขึ้นแถมไทยจะคุมประชากรพม่าไม่อยู่ ไม่มีเป็นเทศไหนหรอคนับที่ให้แรงงานต่างชาติเข้ามาทำงานในบ้านตัวเองแค่ชาติเดียวถึง3-4ล้านคนแบบนี้,1
ถ้ามาณ.เพลานี้จะมาพากันติดโรคทั้งไทยทั้งพม่า...จะคุ้มไหมเสียเงินรักษา..กับเงินที่เสียค่าหัวไปแล้วจะมาเสียเพิ่มนะเพราะติดโรคทำงานก็ไม่ได้...อยู่ประเทศยูไปก่อนเถอะ...คงไม่อดตายหรอกพม่ารวยจะตาย...,1
กรุงแตกเพราะพม่า แต่ก็อาจจะเพราะคนไทยเนี้ยแหละ ลักลอบเอาคนงานเข้ามา ใครจะรู้ครับ ฝากทางการใครฝ่าฝืน ยิงโลด กระสุนชายแดนเก็บไว้ทำไมเยอะ,0
พวกพม่าบุกประเทศไทยแล้วนะคลาวนี้ละตายหยังเขียด,1
ติดตามผลงาน24ธันวาคม??น่าสงสาร ชาวพม่า,0
ไม่ว่าจะคนไทยหรือพม่าหรือชที่ไหน ก็คนเหมือนกันครับ คนที่ไม่รู้เรื่องอะไรก็มีเยอะ คนที่รู้ว่าตัวเองเป็นแต่ปกปิดนะมีน้อย คนที่รู้ตัวว่าเป็นแต่ปกปิดผมก็อยากจะประนาม แต่คนที่ไม่ได้เกี่ยวข้องด้วยผมก็ขอให้กำลังใจทุกคนครับ สู้ๆครับ,0
กมธ.การต่างประเทศ สภาผู้แทนราษฎร-รองผู้บัญชาการทัพเรือภาคที่ 3 เผยความคืบหน้าการให้ความช่วยเหลือคนไทยถูกจับกุมเหตุจากเรือ 'โพลาริสวัน' สัญชาติไทยลอยลำล้ำน่านน้ำพม่า ปล่อยตัวนักท่องเที่ยวชาวไทยและจีน จำนวน 20 คนกลับไทยแล้ว ด้านเจ้าของเรือ 1 ราย ลูกเรือชาวไทย 1 ราย ลูกเรือชาวพม่าอีก 2 ราย ที่ไปด้วยกันยังไม่ได้รับการปล่อยตัว จะถูกดำเนินคดีฐานเข้าเมืองผิดกฎหมาย คาดว่าต้องถูกจำคุก 3 เดือน และเสียค่าปรับ,0
จริงๆพม่ามีมารยาท นะคะ เราเคยมีเพื่อนประเทศนี้ แต่2ประเทศนั้น จองหอง มาก,0
ร้านบ.กุ้งเผา สนับสนุนอาหารมื้อเที่ยงให้กับเจ้าหน้าที่เวรยามสะพานมิตรภาพไทย-พม่าเเห่งที่ 2 เป็นกำลังใจในการต่อสู้กับโควิด19 ในครั้งนี้ สู้ๆนะคะ?? เอก เกียรติศักดิ์ แม่สอด,0
"*ติดจริงน่าจะเกิน 5000หรือทะลุ 10,000 คน เพราะพวกพม่ารามัญยกทัพมาตั้งค่ายที่สมุทรสาครเกินหลักล้าน ตอนนี้สมุทรสาครถูกตีแตกไปแล้ว ต่อไปจังหวัดใกล้ๆคงจะถูกพวกพม่ารามัญตีแตกอีกแน่นอน ไทยเราเสียดินแดนให้กับพม่ารามัญในยุครัตนโกสินทร์ก็เพราะคนไทยภายในเป็นใส้ศึกนำพม่ารามัญเข้ามาเอง ช่างน่าเศร้าใจเป็นยิ่งนัก*??????",0
ตายๆไปทั่วประเทศแล้วพม่าเอ้อ,1
สู้ๆๆนะเพือนพม่าเราคนไทยนะจ๊ะ,0
ไอ้พวกพม่าเหี้ย ตามฆ่าแม่ง,1
มนุษย์เหมือนกัน ไม่มีใครอยากติดหรอก สู้ๆ ดูแลตัวเองนะครับพี่น้อง คนไทยหรือพม่าก็คนมีหัวใจเหมือนกัน รักและห่วงทุกคนในประเทศไทย,0
#แชร์ให้ถึงนายก #ช่วยด้วย #โควิด19 #โควิดสมุทสาคร #โควิดสมุทปราการ #ประยุทธ์ #ลุงตู่ ถึงนายก ควรมีการตรวจสอบที่ชายแดน ประกาศ ปรับกฎหมายใครทำผิด จับปรับ 1 ล้านให้หมดเอาเงินเข้าประเทศใครไม่มีตังค์ก็ยิงเป้า *ความเห็นแก่ตัวและความโลภพวกนี้ -พม่าหวังหนีตายมารักษาที่ไทยและแอบลักลอบทำงาน -ทั้งนายหน้าค้ามนุษย์ -เจ้าหน้าที่(รับสินบน) -เจ้าของธุรกิจที่รู้เห็นรับพวกมันเข้ามา ประเทศไทยต้องเดือดร้อนเพราะพวกมัน พวกพม่ามันไม่ระวังตัว ไปทั่วถ่มน้ำลาย ไม่สวมแมท เอาเชื้อมาแพร่ชาวไทย และมาแย่งงานคนไทยอีก ((บางทีชื่นชมการทำงานทรัมนะเค้าเด็จขาด)),1
พี่น้องชาวสมุทรสาครอย่าพึ่งท้อนะครับการ์ดอย่าตกให้กำลังใจทั้งพี่น้องชาวไทยและชาวพม่าครับ??????????,0
ฝากถึงผู้นำของไทยและผู้เกี่ยวข้องนะคะ คุณต้องแก้ไขขั้นเด็ดขาดแล้ว คุณจะปล่อยให้มันมีการลักลอบเข้าบ้านตัวเองแบบนี้อีกไม่ได้ อย่างน้อยส่งหมายไปให้ผู้นำและประชากรของเค้ารับรู้ว่าถ้าฝ่าฝืนทางเรายิงทิ้งหรือส่งกลับหรือบทลงโทษร้ายแรงแน่นอน จะมาปล่อยให้เข้ามาบ้านตัวเองให้เดือดร้อนทำมัย แก้ปันหาได้แล้วค่ะ แค่นี้ประชาชนก็แย่มากแล้ว พวกพม่านะ ฉันไม่สนใจมิตรไมตรีอะไรหรอก เข้ามาก็สร้างแต่ปันหา ตัดขาดไปเลยยิ่งดีค่ะ,1
มันเป็นสิ่งที่จะควบคุมและกักกันเบื้องต้น หลักสิทธิมนุษยชน ก็ควรมี ไม่มีใครอยากให้เกิดขึ้นหรอกครับ คนไทย คนพม่า รึคนไหนๆ ตัด เชื้อชาติออกไป เราคือมนุษย์ด้วยกัน ทั้งนั้น ใจเขาใจเรา วิธีนี้คือการป้องกันแล้วนะครับ,0
Ahe Heaven เยอะจริงค่ะเยอะกว่าเมื่อก่อนมากขนาดเราอยู่ กทมเดินสวนกันตลอดยังคิดว่าคนไทยหรือพม่าวะขนาดนั่งรถสองแถวไปตลาดสดในรถมีเราเป็นคนไทยคนเดียวแถมมีข่าวลูกจ้างพม่าเขียงหมูฆ่ากันตายเพราะเมาแล้วลวนลามผู้หญิงพวกเดียวกันมันปาดคอคนที่มาห้ามมันน่ากลัวมากชาวบ้านที่อยู่ใกล้ตลาดเค้าบอกได้ยินเสียงแต่ไม่มีใครกล้าออกไปดู,0
สงสารชาวพม่าที่สุดเลยค่ะ,0
Somjit Akethongbua ใช่ค่ะ ขนาดคนไทยอยู่ต่างประเทศจะกลับบ้านยังต้องกลับมาแล้วกักตัว มีค่าใช้จ่ายในการกักตัวเอง แต่นี่จะขอเข้ามาเลย ที่ระบาดอยู่นี่ก็ฝีมือคนที่มาจากพม่าไม่ใช่เหรอคะ อยากเข้ามางั้นยอมกักตัว 14 วันโดยออกค่าใช้จ่ายในการกักตัวเองมั้ย....ใครลักลอบเข้ามายิงทิ้งอย่างเดียวแบบนี้ยอมมั้ย,1
อยากรู้ชื่อร้านที่ไล่พม่าจัง...ความเป็นมนุษย์ของมันยังเหลือมั้ย ใครอยากจะเป็นแบบนี้ เขาก็คน ต้องกินข้าวกินน้ำ เขาก็หิวเหมือนคนไทยนี่แหร่ะ ทำแล้วไปตั้งไว้ให้เขามาหยิบไปเองก็ได้ ถ้ากลัวมาก,0
ใช่เลยมึงห่วงพวกมันมากกว่าคนไทยรักษาฟรีมันทำไรให้ประเทศไทยมันหนีมารักษาที่บ้านเราถ้ามันอยู่พม่าตายอย่างเดียว,1
