text,label
มีแต่ทรุด! เจ้าของโรงแรมที่กระบี่วอนรัฐหามาตรการช่วยเหลือเร่งด่วนเพื่อพยุงธุรกิจให้เดินต่อได้ เชื่อไม่นานธุรกิจโรงแรมทยอยปิดแน่ เหตุไม่มีคนจองเข้าพัก เผยทุกวันนี้มียอดจองไม่ถึง 2% เปิดไปก็ขาดทุน . หลังจากที่มีการระบาดของโรคไวรัสโควิด-19 ระลอกใหม่ ส่งผลให้ธุรกิจโรงแรมหลายรายเริ่มมีความกังวลเนื่องจากต้องแบกรับกับภาระที่เกิดขึ้นทั้งค่าน้ำ ค่าไฟ ค่าพนักงาน และค่าดอกเบี้ยที่ต้องผ่อนให้ธนาคาร หากรายใดมีต้นทุนน้อยก็ออกมาตรการเลิกจ้างพนักงานหรือเปิดให้บริการไม่เต็มจำนวนห้องเพื่อประหยัดค่าใช้จ่าย เพราะผู้ประกอบการส่วนใหญ่เริ่มมีผลกระทบมาจากการระบาดตั้งแต่รอบแรก เมื่อเกิดการระบาดระลอกใหม่ทำให้ผลกระทบซ้ำ ตอนนี้สถานการการณ์การท่องเที่ยวมีแต่ทรุด อาการร่อแร่ยิ่งกว่าคนอยู่ในห้องไอซียู ตอนนี้อยู่ได้เนื่องจากมีเครื่องช่วยหายใจเท่านั้น . นายเจริญกิจ คณนาธรรม อายุ 63 ปี ผู้บริหารโรงแรม the gene riverside hotel ตั้งอยู่ในตัวเมืองกระบี่ เปิดเผยว่า จากการระบาดของโรคไวรัสโควิด-19 ระลอกใหม่ที่เกิดขึ้นค่อนข้างจะกระทบรุนแรงมากกว่าการระบาดในครั้งแรก เพราะว่าตั้งแต่มีข่าวว่าประเทศไทยมีคนติดเชื้อโควิด-19 ทำให้นักท่องเที่ยวหยุดการเดินทางมาท่องเที่ยว ส่วนนักท่องเที่ยวที่จองห้องไว้ก่อนหน้านี้ก็มีการยกเลิกห้องพักไปด้วย ตอนนี้ในแต่ละเดือนมียอดการจองห้องเข้ามาไม่เกิน 2% ของจำนวนห้องพักที่มีอยู่กว่าเกือบ 200 ห้อง . ต้องยอมรับว่าการระบาดระลอกใหม่กระทบหนักกว่าครั้งที่ผ่านมามาก ถ้ายังเป็นในลักษณะนี้ไปยาวๆ ผู้ประกอบการโรงแรมก็จะไม่มีปัญญายืนต่อไปได้ถ้าไม่มีมาตรการของรัฐเข้ามาช่วยเหลือ โดยตั้งแต่กลางเดือนธันวาคม 2563 ที่ผ่านมา แทบจะไม่มีการจองห้องพักเข้ามาเลย และนับจากวันนี้ไปจนถึงกลางเดือนหน้า (ก.พ.) ก็ยังไม่มีการจองห้องพักเข้ามาแต่อย่างใด ปรากฏการณ์อย่างนี้ไม่เคยเกิดขึ้นมาก่อน . สำหรับในครั้งแรกที่มีการระบาดจนต้องมีการล็อกดาวน์ เพื่อควบคุมการแพร่ระบาดของโรค แต่เมื่อเปิดล็อก ก็มีนักท่องเที่ยวจองห้องพักเข้ามาและเดินทางเข้ามาท่องเที่ยว แต่ครั้งนี้นักท่องเที่ยวหายไปเลย ถึงแม้ว่าจะไม่มีการล็อกดาวน์ก็ตาม ซึ่งภาครัฐจะต้องยื่นมือเข้ามาช่วยเหลือไม่ว่าจะเป็นในด้านเงินกู้ หรือลดดอกเบี้ย ซึ่งไม่อย่างนั้นแล้วตนเชื่อว่าผู้ประกอบการธุรกิจโรงแรม หรือธุรกิจทัวร์ที่เกี่ยวเนื่องกับการท่องเที่ยวอยู่ไม่ได้อย่างแน่นอน . ทุกวันนี้ที่ยังประกอบธุรกิจอยู่เพราะมีทุนเดิมที่ออมไว้ ถ้าไม่มีทุนเดิมออมไว้ก็คงต้องปิดกิจการตั้งแต่เริ่มเกิดการระบาดระลอกใหม่แล้ว ทุกวันนี้ต้องแบกรับภาระค่าพนักงาน ค่าน้ำ ค่าไฟ และค่าอื่นๆ เฉลี่ยแล้วไม่ต่ำกว่าเดือนละ 1 ล้านบาท ทุนที่มีอยู่เดิมก็หมดไปเรื่อยๆ ซึ่งทางภาครัฐจะต้องรีบหามาตรการให้การช่วยเหลือโดยเร่งด่วนที่สุด ก่อนที่ผู้ประกอบการโรงแรมจะล้ม และเชื่อว่าอีกไม่นานก็จะมีผู้ประกอบการธุรกิจโรงแรมบางรายปิดกิจการอย่างแน่นอน เพราะขณะนี้ทราบว่าบางโรงแรมที่เปิดให้บริการอยู่ก็ไม่ได้เปิดเต็มจำนวนห้องที่มีอยู่ทั้งหมด . ขณะที่ นายเอกวิทย์ ภิญโญธรรมโนทัย ประธานสภาอุตสาหกรรมจังหวัดกระบี่ กล่าวว่า หลังจากทราบข่าวพบผู้ติดเชื้อโควิด-19 เป็นแรงงานต่างด้าวชาวพม่า ทำงานในสถานประกอบการ บริเวณย่านแหล่งท่องเที่ยวอ่าวนาง พบว่า มีนักท่องเที่ยวได้ยกเลิกการจองห้องพักที่จองไว้จำนวนมาก ยอมรับว่าขณะนี้ผู้ประกอบการธุรกิจท่องเที่ยวบอบช้ำกันถ้วนหน้า ยังไม่รู้จะเดินไปข้างหน้าได้อย่างไร เนื่องจากสถานการณ์แย่ลงไปทุกวัน โอกาสที่จะมองเห็นแสงสว่างไม่มี . . . . . ขอบคุณข้อมูลจาก mgronline.com,0
แม่สอดกับพม่า คือค้าขายกับเขาปกติ มีรถบรรทุกส่งสินค้าจากต่างถิ่นเข้ามาในพื้นที่เพื่อมาส่งที่สะพาน2 ญาติพี่น้องท่านใดระวังกันด้วย,0
"เตือนไว้เลยนะครับ ใครมีญาติพี่น้อง คนรู้จัก ฝากบอกเลยว่า , ชาวพม่า ต่างด้าว แถบมหาชัยและใกล้เคียง ชอบนัดชุมนุมพบปะกัน ที่เซ็นทรัล พระราม2 ทุกวันอาทิตย์,เลี่ยงได้ก็เลี่ยงนะครับ",0
พวกพม่าไม่อยากรักษาตัวน่าจะมาทางไม่ถูกต้องถึงกลัว แล้วหนีแบบนี้จะจับได้ไงไปแพร่ถึงใหนละ จับได้ส่งกลับไม่ต้องรักษา เพราะเห็นแกตัวจะให้เราเห็นใจก็แล้วแต่นะ,1
วันนั้น...ดิฉันไปซื้อผัดไทในห้างโลตัส. คนพม่าทำให้ค่ะ ใส่หน้ากาก แต่ใส่ไว้ที่คาง. ใช้มือปล่าวจับมะนาวใส่จาน. ไม่ได้บูลลี่ แต่สถานการแบบนี้ใครเค้าก็กลัวค่ะ. คำที่ว่า. เมตตาธรรมค่ำจุลโลก. คือถ้าศึกษาคำสอนองค์สัมมาสัมพุทธเจ้า ดีๆนะค่ะ. ท่านสอนให้เมตตาได้. ถ้าเราไม่เดือดร้อน เหมือนกับคำที่ว่าทำดีไม่เบียดเบียนใคร แต่อยากให้มองมาที่ประเทศไทย. คนไทยก่อนมั๊ย. เราพร้อมช่วยเหลือคนอื่นหรือเปล่า ในเมื่อคนไทยยังประสบปัญหาต่างๆ อยู่แบบนี้ ลองมองดูประเทศที่เค้าพัฒนาแล้ว หลายๆประเทศ เค้าเอาคนของเค้าก่อน. อีกหนึ่งมุมมองค่ะ. ไม่ได้บูลี่.,0
"บีบีซีฝากถามถึงรัฐบาลอังกฤษด้วยครับ!! ไปปกครองศรีลังกา ก็นำคนเผ่าทมิฬ(นับถือฮินดู)มาจากอินเดีย แรกๆมาเป็นผู้ใช้แรงงานบ้าง, เก็บใบชาในไร่บ้าง, เป็นตำรวจทหารบ้างฯ ให้คนทมิฬอยู่เหนือคนสิงหล(ซึ่งเป็นคนเผ่าดั้งเดิม&amp;เป็นคนส่วนใหญ่ เจ้าของแผ่นดินศรีลังกามาแต่เดิมซึ่งนับถือพุทธ) พออังกฤษให้เอกราชกับศรีลังกา คนสองกลุ่มนี้จึงทำสงครามฆ่ากันเรื่อยมา พอมายึดครองพม่า ก็ใช้หลักการเดียวกันนี้นำคนโรฮิงญา(จากบังกลาเทศนับถืออิสลาม) ให้มาเป็นแรงงานในบังคับบัญชาของอังกฤษ พออังกฤษให้เอกราชกับพม่า ปัญหามันก็เลยเกิดตามมาไม่จบไม่สิ้นซักที ขอถามไปยังรัฐบาลอังกฤษต้นตอของตัวปัญหาทั้งหมดทั้งมวลนี้ พวกคุณจะช่วยแก้ไขปัญหานี้อย่างไรบ้าง??? เข้าไปยึดครองที่ไหนก็เหมือนจะทิ้งระเบิดเวลา(ปัญหา)ไว้ตลอดทุกที่ นี่นะหรือคือผู้ที่ได้ชื่อว่า... 1 ในคณะมนตรีความมั่นคงถาวรของสหประชาชาติ โรฮิงญาที่เข้าไปในมาเลเซียก็ไปขายแรงงานราคาถูก ก็เหมือนคนไทยที่ไปทำงานในเกาหลีนั่นแหละ ...แต่ก็มีปัญหาที่หนักกว่านั้นก็คือ โรฮิงญาที่ถูกหลอกเข้าไปในมาเลเซียเพื่อขายอวัยวะให้กับผู้มีอันจะกินก็มีไม่น้อย บางคนตายฟรีโดยที่ญาติไม่รู้ชะตากรรมด้วยซ้ำ....",0
พม่าขอ เข้าไทย60000คน ตั้งปืนกนยิงไห้หมดครับความคิดส่วนตัวครับ,1
พวกพม่าเข้ามารอบนี้อาจตายทั้งประเทศ..แค่นี้ก้อแย่พอแล้ว,1
เรามีเพื่อนชาวกำพูชาและพม่านอ้งๆนิใสดีทุกคนสู้นะเป็นกำลังใจให้จ้า,0
สวัสดีค่ะ อ ตอนนี้ รอบๆบ้าน..แย่ๆเลยค่ะ เคลียดแล้วละค่ะ จาก บ้านไป ศาลายา ไม่ไกล และ จากบางใหญ่ ก็ไม่ไกล...มีญาติ อยู่ที่ บางเสาธง ตึกที่เค้าล้อม ลวดหนามไว้ พม่า เยอะมาก ทั้งตึกเลย.(.เคยไปดูตลาด ตอนเปิดใหม่เพื่อวางสินค้า แต่ ไม่ตกลง กัน )น่ากลัวจริงๆ..แถวบ้าน ก็มี แรงงานพม่าด้วยค่ะ พรุ่งนี้ว่าจะ โทรไป สน ให้เค้าตรวจสอบดูค่ะ,0
จับคนที่รับพม่าเข้าทำงาน ปรับให้หนัก ถึงเวลานี้แล้วให้คนไทยช่วยกันเป็นหูเป็นตาแจ้งเจ้าหน้าที่ หรือช่วยออกมาช่วยกันขับไล่ เหมือนออกมาไล่ม๊อบกัน มันอยู่ไม่ได้ ทั้งคนจ้างและพวกพม่า ออกมาช่วยกันกดดันขับไล่ อย่ามั่วแต่โทษกันไปกันมา ถ้าเราไม่ช่วยกัน ตาย ตาย เลือกเอา ชีวิตเราหรือพม่า,1
นักแล้วไทยแลนด์ ดูแลไม่ดี ตอนไหน พม่า ดีไทยแตกแน่ ใจเย็นๆนะครับ คนพม่า รัฐบาลไทยก็จะตายแล้ว ??,1
เป็นกำลังใจให้ชาวสมุทรสาคร ไม่รังเกียจพี่น้องชาวสมุทรสาคร แต่รังเกียจพวกนายหน้าที่เอาพม่าเข้ามาผิดกฎหมายแล้วไม่รับผิดชอบ,0
ผมเป็นคนไทยแต่ก้อเห็นใจคนพม่าเสมอสู้ๆนะครับวอนคนไทยอย่าด่าเขาเลยเพราะไม่มีใครอยากให้เกิดขึ้นหรอกครับ,0
สมัยก่อนเกิดไส้ศึกเพราะเงินและยศถาบรรดาศักดิ์ประเทศพัง แต่ขณะนี้เกิดอีกแล้วพาพม่าเข้ามาฆ่าประเทศตัวเองไม่ต่างกันเลยครับ,1
คุณหมอฉลาด....และจิตใจดี. พม่าเขาก้อคนเหมือนเรา. สงส่ารเขาแต่ก้อสงสารคนไทยด้วยนะ. เศรษกิจกำลังฟื้นตัวกลับลงดิ่งอีกครั้ง. ขอให้ทุกคนปลอดภัยทั้งไทยทั้งพม่า,0
ความจริง พม่ากับไทย.เป็นพี่น้องกันจริงๆเลย..ถึงในอดีดจะตีกัน..ปัจุบันเราก็รักกันใด้..(ใจก็ไม่เคยลืมกัน),0
Gulab Jamun 55555 แสดงว่าเป็น1ในกลุ่มคนพม่าที่มาอาศัยแผ่นดินไทย ทำมาหากิน และไม่มีความรับผิดชอบ เห็นแก่ตัว ไม่รับผิดชอบสังคม และกำลังสร้างความเดือดร้อนให้คนไทย ไปทั่วทั้งประเทศ !!!! เอางี้ลองซ้อมยิงหัวมึงเองก่อนเลยนะ เผื่อจะสำนึกได้ว่ามึงไม่ใช่คนไทย!!!!!!,1
แต่ก่อนไทยเสียกรุงให้พม่าเพราะคนไทยเป็นฆ่าศึกเอง แต่ตอนนี้ไทยกำลังเสียกรุงให้ให้พม่าอีกครั้ง โดยที่ไทยมัวแต่รบกันเอง พม่าจึงส่งชาวพม่ามาพร้อมกับโควิดอะคะ,0
ห้ามพม่าใช้รถไฟฟ้า ห้ามพม่าขึ้นรถเมล์ ห้ามพม่าไปตลาด ห้ามพม่าไปห้าง ให้มันอยุ่แค่ในค่ายพักคนงาน อย่าให้ออกมาเพ่นพ่านตามแหล่งชุมชน เจอพม่าให้ยิงทิ้งแก้แค้นที่มันเผาอโยธยาของเรา,1
