text,label
"ช้าไม่ได้แล้ว..... เที่ยวไทยไปด้วยกันจ้า ซุปตาร์ ต๊ะต่อนยอน กับ ทุ่งดอกไม้หลากสี 3 วัน 2 คืน ใจละลายกับทุ่งดอกไม้งาม ณ ไร่ดอกลมหนาว, ทุ่งดอกมากาเร็ต และ I love flower farm สักการะสิ่งศักดิ์คู่บ้านคู่เมือง ณ พระธาตุดอยสุเทพ, วัดอุโมงค์, วัดพระธาตุดอยคำ แกรนด์แคนยอน เชียงใหม่ สัมผัสวิถี Slow life ณ หมู่บ้านแม่กำปอง ช้อปปิ้งของฝาก ณ ตลาดวโรรส พิเศษ!!! รับประทานอาหารเที่ยง ณ มีนา มีข้าว ร้านอาหารที่ ห้อมล้อมไปด้วยธรรมชาติ ราคาเริ่มต้น 9,888 บาท/ท่าน ??เดินทาง 30 ธันวาคม 63  01 มกราคม 64 31 ธันวาคม 63  02 มกราคม 64 01-03 มกราคม 2564 ****************************************************** หัวหิน - ชะอำ 2 วัน 1 คืน ซุปตาร์ ไอ้โบ้ (????) เที่ยวหัวหิน ชะอำ พักโรงแรมหรู 4 ดาว *** พิเศษ สามารถสิทธิ์โครงการเราเที่ยวด้วยกันเป็นส่วนลดได้*** Unseen แม่กลอง ณ ตลาดร่มหุบ ไหว้พระใหญ่ ณ วัดห้วยมงคล พร้อมสักการะสิ่งศักดิ์สิทธิ์ ณ วัดถ้ำเขาย้อย เช็คอินสถานีรถไฟหัวหิน ถ่ายรูป น้อนนน...สุนัขตาหยี พันธุ์ชิบะที่ Inu Caf? ชมพระอาทิตย์ขึ้น เดินสวยๆ ริมชายหาดชะอำ นาตาชม คอฟฟี่ คาเฟ่กลางทุ่งนา และช้อปปิ้งจุใจ ณ 1000 สุขฟาร์มและร้านของฝากประจำจังหวัด ราคาเริ่มต้น 3,999 บาท/ท่าน ??เดินทาง ธันวาคม 63 - กุมภาพันธ์ 64 ******************************************************* ซุปตาร์ ถ้าเขาจะรักอยู่...เลย...เขาก็รัก เลย เชีย ?????????????????????? ขายตั๋วเครื่องบิน รับจัดกรุ๊ปทัวร์ กรุ๊ปส่วนตัว กรุ๊ปดูงาน ประกัน เดินทาง ขอวีซ่า ทิ้งเมลล์ หรือ INBOX ขอรับรายละเอียดเพิ่มเติมได้เลยนะ โทรสอบถามรายละเอียดเพิ่มเติม หรือ ขอรับโปรแกรมได้ที่ เจน 094-196-9459 LINE : jane_pimnapat ใบอนุญาติ ททท.11/08772 https://www.facebook.com/goodbuddytour/ https://www.facebook.com/MineJourneyTravel/ ?#ทัวร์ต่างประเทศ #อัพเดท #ทัวร์สุดคุ้ม ?#ทัวร์จัดเต็ม #ทัวร์ลดราคา #ตั๋วหลุด?#ทัวร์ดีดี #ทัวร์ถูกมาก #เที่ยวทั่วโลก #ทัวร์น่าเที่ยว#ปรับราคา #SALE ?#PROMOTION #จัดกรุ๊ปส่วนตัว? #จองตั๋วเครื่องบิน ?#ทัวร์ไฟไหม้ ?#โปรไฟไหม้ ? #ทัวร์ยุโรป #ทัวร์พม่า?#ทัวร์ตะวันออก#ทัวร์เกาหลี#ทัวร์ญี่ปุ่น?#ลดราคา ?#ลดจัดหนัก#ทำ",0
รัฐบาลเจ้าหน้าที่ท่านนายกและคนไทยคนพม่าคนลาวชาวต่างชาติในไทยสู้ๆๆๆครับ,0
น่าสงสารพม่าม่ช่เป็นกันทุกคนเอาเขามาทิ้งแถมเงินม่จ่ายคิดบ้างมัยว่าเขาจะเอารัยกินเอาจัยเขามาใส่จัยเราบ้าง,0
Tittawat Chotpakditrakul มันมาทำงานนะมันไม่ได้หนีตาย ให้บุกป่าผ่าดงมาดำน้ำเดินเท้ามาเป็นอาทิตย์ๆ 2401 กิโล มันมีจุดที่เดินเท้าเข้ามาได้เเค่ไม่กี่จุดเท่านั้นล่ะ คนในพื้นที่ตำรวจเค้ารู้หมด สงสัยดูหนังจีนอพยพมากไป ถ้ากวดขันจริงๆ มันทำได้ ถ้าเคยมีลูกน้องเป็นพม่าจะรู้คนไทยหากินกับพวกเค้า,1
ผมเป็นคนไทยแต่ผมไม่โทษคนพม่าคับ น่าเห็นใจใครจะอยากให้เกิด,0
ไอ้เหี้ยกูทำงานต้องไส่หน้ากากทุกวันหายไม่สดวกก็ต้องทนไอ้ชาติหมาคนเข้ามามึงก็รู้บ้านเขากำลังระบาดไอ้รัฐยาลหัวควยทไไมไม่ระวังชาติหมาถ้าไม่มีคนมีอำนาจยอมควยในโครงการทร่กูทำงานมันจ่ายเงินก็มาสบายแล้วไอ้เหี้ยมำืำอะใรกันอยุ่วะไอ้สัตวทุกวันก็แย่อยุ่แล้วพวกมึงนัานแหละพาเข้าม่พวงมึงมีอำนาจไงไอ้สัตวเมื่อใรพวกมึงตายห่าเสียมึงไปดูในตลาดทุกแห่งพม่าเป็นเจ้าของหมดแล้วมุงให้เขาเข้ามาแย่งอาชีพคนไทยไอ้ควายกรุงศรีเพราะใครถ้าไม่ใช่คนไทยอบเป็นไส้ศึกก็เหมือนพวกมึงเห็นเงินค่าหัวขนเข้ามาลองพวกทำซิไม่เกินข้ามจังหวัดพวกมึงก็เห็นแล้วควยไม่รู้จะยังมึงไหมเสียหายชิบหายเท่าใรพวกระวังตลอดแต่พวกมึงบอกโควิทกระจอกไอ้เหี้ยบริษัทมึงเทื่อจะชิบห่ยเสียทีมึงรู้พวกลำบากขนาดไหนข้างยนก็ไม่ดูดำดูดีเลยสมแล้วที่เขาด่าควยไอ้รับาลหัวควยกูรอที่ประชาชนลุกหือเท่านั้นควยมึงรู้ไหมชาวบ้านลำบากสุดๆแล้วควยๆๆๆๆๆ,1
แล้วทางรัฐบาลพม่าเขาใม่ออกมาแสดงความคิดเห็นอะใรหรือช่วยเหลือประชาชนของเขาเลยเหรออยากรู้จริงๆเขามองใม่เห็นความเดือดร้อนของประชาชนตาดำดำบ้างเรยรึถ้าเป็นประเทศอื่นรัฐบาลของเขาออกมารับผิดชอบช่วยเหลือแล้ว,1
เป็นไงละสะใจมึงยัง แค่ประเทศมึงยังไม่พออีกหรอ มาแพร่เชื้อประเทศกูอีก กำลังดีขึ้นอยู่แล้วเชียว อีเหี้ยแค่ไม่กี่ตัวเสือกลักลอบเข้ามา พาประเทศกูชิบหายไปกับประเทศมึงอีก อีพม่าส้นตีน ขอให้แม่งตายให้หมดอีกพวกลักลอบ,1
พม่าเผาเมืองเพราะคนไทยเห็นแก่ได้แท้ๆ,1
พยายามมากนะครับ เอามหาชัยกับ พี่น้องพม่าเป็นแพะให้ได้,0
มีข่าวเตือนกันมาเป็นระยะๆว่าโควิคอาจกลับมาเพราะพม่า แถมมันจะเร็วขึ้นแบบไม่ทันตั้งตัว ในที่สุดก็เป็นจริง ไอพวกที่แอบลักรอบหรือสมรู้ร่วมคิดขนพม่าเข้ามา ยิงแม่งเลย ไอ้พวกเห็นแก่เงินเห็นแก่ตัว,1
ยิงแม่งเลย เผากรุงศรี ก่อพม่านี้ละ,1
เราไใม่รังเกียจค่ะ คนพม่าขยันและจำเก่ง เราสงสารเห็นใจค่ะ งานเค๊าคนไทยเราไม่ชอบทำค่ะ แต่ขอให้มาอย่างถูกต้องค่ะ,0
พวกพม่าหนืตายมาจากประเทศมันแต่มันเอาความตายมาให้คนไทย,1
อรวัล เพชรอาวุธ คนไทยไม่ขยันก็มี ที่ขยันก็มี? พม่าก็มี? แต่อยู่ที่ความคิดคนเป็นนายจ้าง? ถ้าเอามาเปรียบเทียบค่าแรงที่จ้างพม่า+ค่าที่พักก็ถือว่าใกล้เคียงกับจ้างคนไทย(แต่ถ้าทำที่พักแบบเป็นคอกสัตว์อยู่รวมกันถือว่าถูกกว่าคนไทย)?แต่คนไทยค่าบ้านค่าน้ำค่าไฟค่าเบ็ตเตล็ดต่างๆที่ต้องจ่ายเอง? และที่สำคัญครอบครัวพ่อแม่พี่น้องเวลาจำเป็นต้องช่วยเหลือนิ่งดูดายไม่ได้ไม่พอก็ต้องกู้ต้องยืม? แต่ไอ้พวกพม่าที่บรรพบุรุษเคยเผาบ้านเผาเมืองเราแทบไม่ต้องจ่ายอะไรเลยสุทธิรับแต่ค่าแรง? จะมีก็แต่ค่ากินจ่ายรายวัน? สุดท้ายก็เหลือเงินส่งกลับบ้าน? คนไทยเรามีมากมายที่ขยันเราเลือกได้ก็เลือกถ้าไม่ดีไม่เหมาะกับงานก็ให้ไปหางานอื่นทำ ยังงัยคุณค่าของคนไทยก็ยังมี? ถ้าเลือกที่จะคิด,0
อดตายแน่รอบนี้ ไอ้พวกพม่านี่แม่ไงก็เหี้ยชอบจริงๆมึงจะแอบกันเข้ามาหาแม่มึงเหรอ,1
ไทยหรือพม่าก็เป็นมนุษย์เมือนกันสู้ๆ,0
ไทย? พม่า? ลาว? เขมร? เพื่อนพี่น้องกัน,0
ชิหายละ จับส่งกลับแม่มให้หมด กักตัวกะเปลืองงบให้ไปพม่าโน่น ตายมาจะได้เจอญาติที่บ้านมัน,1
อีเชรี้ยยยย เผาทิ้งแม่งได้มั้ยอ้ะไอพวกพม่าที่เอามาติดคนอื่นมาแม่งเอ้ยยยยสัสถ่วงประเทศแท้ๆ,1
จริงเราสงสารนะ ถ้าไม่มีชาวพม่าใครจะช่วยงาน ไม่มีใครอยากติด เป็นกำลังใจให้ทุกประเทศนะคะ,0
เป็นปีล่ะบ่ได้ปิกบ้านกูกะอดเอาเพราะกูยุสมุทรสาครทำงานกับพม่าเป็นร้อยๆพ่อแม่นอนโรงบาลกูกะยะยังบ่ได้บ่มีคนดูลูกกูกะฝากญาติปี่น้องเอากูขอระบายกำเตอะอีง่าวบ่มีจิตสำนึก,0
วันหนึ่งถ้าไม่มีคนต่างด้าวคนพม่าวันนั้นคุณจะรู้สึกไม่มีใครอยากเป็นหรอกใครๆเขาก็กลัวกันทั้งนั้นไม่ใช่แค่คนไทยที่กลัวต่างด้าวก็กินข้าวไม่ได้กินขี้เอาแต่ด่าๆต่างด้าวเราทุกคนเราต้องเห็นใจกันให้กำลังใจกันสิคะ,0
นำพม่าเข้ามาไทยตาย,1
มาให้ถุกไครไม่ว่าคับผมไม่เคยมีพี่น้องไิัอ้ต่างดาวคับพม่าพี่น้องผมไม่มีคับ,0
ที่ไทยเป็นแบบนี้เพราะพวกพม่าลักลอบเข้ามา ใครเข้ามายิงทิ้งให้หมด ดูสิจะกล้าเข้ามาไหม,1
"บ้านต้นไม้ ทองผาภูมิ 500 บาท ที่พักลับ กลางป่า! กาญจนบุรี | หมีเที่ยว EP.81#หมีเที่ยว บ้านต้นไม้ทาร์ซาน ทองผาภูมิ  500 บาท หนาวๆแบบนี้ มานอนที่พักลับ! กลางป่า กาญจนบุรี ขับรถขึ้นเขา ชมจุดชมวิว 360 องศา ปังมาก! กาญจนบุรีมีอะไร? ที่ไม่ใช่! นอนแพในเขื่อน นอนแพไทรโยค เหมืองปิล็อก สังขละบุรี มีอะไรอีกบ้าง? ดูคลิปนี้เรามีบอก! เพราะทริปนี้จะพาเพื่อนๆ ไปเที่ยวกาญจนบุรีแบบใหม่ ตะลุยที่เที่ยวลับๆ ทั้งที่พัก กิจกรรม จุดถ่ายรูป เรียกได้ว่าเราค้นหาที่เด็ดแต่ไม่ดังมาฝากเพื่อนๆกันแล้ว และแน่นอน ราคาต้องถูก! ตามมาดูกันเลย! ?? ทริปนี้เราเดินทางโดย Ford Everest Titanium+ ที่มาพร้อม กระจังหน้าดีไซน์ใหม่ มีตัวอักษร EVEREST ที่ฝากระโปรงหน้าเด่นชัด ภายนอกสีใหม่ กับสีน้ำเงินดีพ คริสตัล บลู ทริปนี้เดินทางได้สบายใจหายห่วง ไม่ว่าเส้นทางจะเป็นยังไง ก็ไปถึงจุดหมายแน่นอน มาเริ่มกันที่ อุทยานแห่งชาติ ทองผาภูมิ ขับรถใช้เวลา 4 - 5 ชั่วโมงจากกรุงเทพฯ ก่อนเข้าด้านในต้องเสียค่าเข้า ผู้ใหญ่ 40 บาท เด็ก 20 ค่ารถยนต์คันละ 30 บาท และไปที่จุดบริการนักท่องเที่ยวเพื่อรับกุญแจห้องที่จะพัก ต้องจองห้องมาล่วงหน้าก่อน มีแบบเต้นท์ด้วยนะ สามารถเอามากางได้เลย คนละ 30 บาท เท่านั้น เข้ามาด้านใน ที่พักก็จะติดกับจุดชมวิว ที่นี้จะมีจุดชมวิว 3 จุด สามารถเดินท่องเที่ยวได้เลย ห้องพักของเราเป็นบ้านต้นไม้ทาร์ซานหลังที่ 4 ราคา 1500 บาท นอนได้ 2-3 คน มีห้องน้ำในตัว และมีอีกหลายหลัง ติดต่ออุทยานได้เลย หนีเที่ยวได้ที่ : อุทยานอห่งชาติทองผาภูมิ, ทองผาภูมิ, กาญจนบุรี เบอร์ติดต่อ : 098-252-0359 จองที่พัก พิกัด : https://goo.gl/maps/n1j2Mbk9sCQKUms29 ขับรถออกมาจาก อุทยานก็มุ่งหน้าไปดูพระอาทิตย์ตกกันที่ เนินช้างศึก จุดชมพระอาทิตย์ขึ้นและตก 360 องศา เห็นฝั่งไทย-พม่า ติดกับหมู่บ้านปิล็อก อิต่อง เราเลยแมะมาทานอาหารเย็นที่หมู่บ้านกัน อากาศเย็นๆ ต้องกินหมูกะทะ ราคา 600 บาท ทานได้ 4-5 คน หนีเที่ยวได้ที่ : เนินช้างศึก, ทองผาภูมิ, กาญจนบุรี พิกัด : https://goo.gl/maps/X8zpAkoyBX5uqmgu7 ??ออกจากอุทยาน มีที่เที่ยวอีกที่นึง เขื่อนวชิราลงกรณ์ สถานที่เที่ยววิวสวย ระหว่างที่เราอยู่ ในอุทยานวิวไกลๆ ของเราจะเห็นเป็นเขื่อนวชิราลงกรณ์ สวยมาก เหมือนทะเล เป็นเขื่อนเก็บน้ำขนาดใหญ่ สามารถเข้ามาเที่ยวได้ฟรีๆ เลย! หนีเที่ยวได้ที่ : เขื่อนวชิราลงกรณ์, ทองผาภูมิ, กาญจนบุรี พิกัด : https://goo.gl/maps/azhhu2qS4qhHf9pN7 การเดินทางไปเที่ยวไม่ว่าจะลุยน้ำ บุกป่าที่ไหน ถ้ามีรถยนต์คู่ใจไปไหนก็ไปกัน แบล์อยากจะแนะนำ Ford Everest Titanium+ ให้เพื่อนๆกัน เพราะสัมผัสมาแล้ว ส่วนตัวรถคันนี้ตอบโจทย์เราหลายอย่าง ชอบมาก! ทั้งดีไซน์รถยนต์มีความเท่ สีสวยไม่เหมือนใคร และภายในมีห้องโดยสารกว้างขวาง จอ Multi-Touch สามารถควบคุมเครื่องปรับอากาศ สั่งการด้วยเสียง รองรับ Apple CarPlay มีครบทั้ง Bluetooth และ Wi-Fi เปิดเพลงฟังคือ ดีมาก ลำโพงตั้ง 8 จุดรอบคัน และมีระบบรักษาความปลอดภัยรอบคัน นอกจากนั้น ตอนนี้เค้ามีฟรีรับประกันเครื่องยนต์และระบบส่งกำลังนาน 10 ปี หรือ 150,000 กม ด้วยนะ บอกเลยว่า คันนี้ตอบโจทย์สายเที่ยวแน่นอน รับรอง! ใครอยากดูรายละเอียดเพิ่มเติมเข้าไปดูได้ที่ https://www.ford.co.th/suvs/everest/ สามารถติดตามพวกเราผ่านช่องทาง หนีเที่ยว ต่อไปนี้ Facebook : https://bit.ly/2SFis0R YouTube : http://bit.ly/SneakOutYouTubeS LINE@ : https://bit.ly/2Qv5ml3 Instagram : https://bit.ly/2VxlEh0 FB Group กลุ่มคนหนีเที่ยว : https://bit.ly/2FjnTPj FB Group กลุ่มตลาดนัดคนหนีเที่ยว : https://bit.ly/2Fhn09U #FordEverestTitanium #Sneakoutหนีเที่ยว #ทองผาภูมิ #กาญจนบุรี",0
ที่ไหนมีพม่าที่นั้นมีโควิดตายยยยยย,1
เพื่อนสลิ่มผมก็รับลูก โทษชาวบ้านกันเอง ไหนละรั้วของชาติ นี่ถ้าพม่าพกระเบิดมาคนละลูก ระเบิดกรุงเป็นผงไปละ ไม่ต้องไปซื้อ เรือดำน้ำ ให้ใครเกรงใจหรอก เพื่อนสลิ่มก็โง่ดักดานเชียร์ว่า ต้องซื้อเพื่อปกป้องแผ่นดิน จะบอกว่าปล่อยตายบ้าง ที่ตายคงไม่ใช่สลิ่ม พวกนี้ตายยาก พวกพันธ์สัตว์เลื้อยคลาน อึดทน,0
เป็นกำลังใจให้ผู้ว่าคนเก่ง เป็นกำลังใจให้พี่น้องชาวสมุทรสาคร พี่น้องชาวพม่าทุกคน,0
ว่าแต่พม่าเจาของติกยังเอาไปใส่คนพี่น้องชิาตเดียวกันติดแลัวชิอยากไปเทียวเห็งยังหืนงึก,0
นี่พึ่งตื่นเหรอ ลุง พม่าจะมาเผาเมืองอยู่แล้ว เด่วก็ตรวจไม่เจอเหมือนหวยขายเกินราคา พัทยาไม่มีผู้หญิงขายบริการอีก ถ้าเอาจริงตั้งแต่แรก ไม่มีเหตุการณ์มาถึงวันนี้หรอก ??,1
เป็นกําลังใจให้พี่น้องพม่าทุกคนค่ะ,0
ยิงหัวพม่าที่ลักลอบเข้าเมือง พร้อมทั้งแจกตะกร้อครอบปากพวกมือไม่พายด้วยค่ะ เป็นกำลังใจให้นายกลุงตู่ค่ะ,1
