text,label
ทำมัยถึงคิดว่า นายกต้องทำนั่นทำนี่ตามที่เราคิด ปัจจัยที่เราไม่รู้คือ.นายกมีอำนาจจริงมั้ย ตั้งทีมอาจาร์.วิชา สอบคดี ลูกกระทิงแดง ผิดตั้งแต่ตำรวจ อัยการ กมธ.กฏหมายรัฐสภา #ก็ทำอะไรไม่ได้ นายก.ประยุทธ์ มุ่งทำสิ่งเดียวคือเรื่องพัฒนาประเทศ สาธารณูประโภค ขนส่ง สวัสดิการประชาชน ประยุทธ์ ไม่เอื้อประโยชน์ให้cp #บัตรประชารัฐไม่อนุญาติให้กลุ่มทุนเข้าร่วม กำหนดชัดเจนห้ามร้านค้าปลีกขนาดใหญ่ที่มีสาขา กับ โมเดิ้ลเทรด ซึ่งเป็นเงินรัฐที่ใช้ขับเคลื่อนเศษฐ์กิจทำให้ โรงงานกระปิ น้ำปลา ปลาป๋อง ข้าว แฟบ สบู่ ยังมีการจ้างงานมันเป็นฟันเฟืองของชาติ โควิสถ้าปล่อยให้โรงงานปิดตัวจะมีคนอดตายจนต้องปล้นกันกินมันไม่กลียุครึ อย่าเอาปัจจัยเราเป็นตัวตั้งความต้องการของประเทศ.มันแคบครับ ต่างตนต่างความต้องการ มองว่าบริหารอย่างไรให้ชาติไปได้ บ่อน.แรงงานเถื่อน มันมีมานานมากแล้วตั้งแต่สมัยทักษิณ สั่งปิดรัฐกันชนทำให้มอญ กะเหลี่ยง ไทยใหญ่ เปิดทางพม่ากวาดล้างทำให้เกิดแรงงานทะลักเข้าไทยเพราะหนีตายพม่า ทักษิณทำเพื่อสัมปทานสื่อสารในพม่า ประวัติศาสตร์มันบอกอะไรบางอย่าง นายก.ประยุทธ์ เข้ามา เราปลด เทีย3 ค้ามนุษย์ ปลด iko เชื่อมเส้นทางรถไฟฟ้าใต้ดิน ทำสนามบินอู่ตะเภาเป็นสนามบินนานาชาติ ตกลงสร้างรถไฟเชื่อมสามสนามบิน พัฒนาเขตอุสาหกรรมจะนะ สังเกตุมั้ยท่านไม่สนใจเรื่องเล็กๆระดับ รมต ที่ดูแล เพราะจะเป็นการ ก่าวก่ายหน้าที่ ตามที่ท่านตำหนิส่วนใหญ่งานของ รมต ทั้งนั้นถ้ามอบหมายงานไปแล้วๆเราเข้าไปวุ่นวาย รมต มันจะยอมรึ ช่วยกันด่า รมต ดีกว่าครับมันนักการเมืองทั้งนั้น ดูตัวอย่างไอ้นี่ก็พอเข้าใจนะว่าปัญหา ระบบจับปล่อยๆ เป็นเพราะมันรึป่าว,0
สงสารรัฐบาลจริงๆทั้งมอบทั้งพม่า,0
อ้าวเห้ยเลยทำตามก็จบแบบนี้ก่อการร้ายหรือป่าวพม่าจงใจส่งมาให้คนไทยติดเชื้อหรือป่าวแบบนี้ใช้ปืนยิงเลย,1
"Gravity Game Tech เปิดให้บริการเกม THE LORD เรียกข้าว่าท่านลอร์ด เอาใจคอ Strategy RPG พร้อมเปิดลงทะเบียนต้อนรับผู้บุกเบิกรับไอเทมล่วงหน้า =========== Gravity Game Tech ผู้ให้บริการเกมชื่อดังอย่าง Ragnarok Online เปิดให้บริการเกมใหม่ Mobile Version กับเกม THE LORD เรียกข้าว่าท่านลอร์ด เอาใจสาวกเกมแนว Strategy RPG ชวนคุณมาสวมบทบาทวางแผนเพื่อช่วงชิงความเป็นที่ 1 ขึ้นเป็นท่านลอร์ดปกครองอาณาจักร ด้วยจุดเด่นเนื้อเรื่องที่ไม่เคยพบเห็นมาก่อนกับธีมเกมแนวตะวันตกยุคกลาง ภาพกราฟฟิคคุณภาพสวยสะดุดตา ระบบเกมที่หลากหลายพร้อมด้วยตัวละครกว่า 70 คาแรคเตอร์ให้เลือกสรร เปิดลงทะเบียนล่วงหน้าเป็น ผู้บุกเบิกรับไอเทมสุด Exclusive เตรียมยึดอำนาจชิงบัลลังก์ คอนเทนต์เกมเบื้องต้น ดังนี้  ระบบว่าราชการ แสดงความเป็นหนึ่งด้านการบริหารที่ยอดเยี่ยม  ระบบเลดี้ ที่จะได้ครอบครองสาวงามจากทั่วโลก  ระบบทายาท สร้างความสัมพันธ์กับตระกูลต่างๆ เพื่อขยายอำนาจให้กว้างขวาง  ระบบสภา ระบบการค้า ดูแลบริหารทรัพยากรของอาณาจักรให้อุดมสมบูรณ์  ระบบด่านสู้รบ แสดงศักยภาพทางทหารให้รู้ว่าอาณาจักรของเรายิ่งใหญ่เกรียงไกร เพียงคุณร่วมลงทะเบียนเป็นผู้บุกเบิกได้ที่ https://www.thelord-sea.com/#sec-preregister จะได้รับไอเทมพิเศษเลยทันที จำนวน 8 ไอเทม . และถ้าคุณเชิญเพื่อนมาเป็นผู้บุกเบิกอีก 5 ท่านก็จะได้รับไอเทมพิเศษเพิ่มอีก จำนวน 5 ไอเทม ไม่เพียงเท่านั้นหากมีผู้ลงทะเบียนเป็นผู้บุกเบิกครบตามจำนวนที่กำหนด ผู้บุกเบิกทุกท่านจะได้รับไอเทมเพี่มฟรีอีกยกเซิฟเวอร์ . ประเทศที่เปิดให้บริการเกม THE LORD เรียกข้าว่าท่านลอร์ด มีทั้งหมด 8 ประเทศ ดังนี้ - ประเทศไทย - ประเทศกัมพูชา - ประเทศลาว - ประเทศฟิลิปปินส์ - ประเทศบรูไน - ประเทศมาเลเซีย - ประเทศสิงคโปร์ - ประเทศพม่า . ร่วมสวมบทบาทเป็นอัศวินผู้กล้ายึดครองอาณาจักร ช่วงชิงความเป็นที่ 1 แห่ง The Lord . ติดตามรายละเอียดเพิ่มเติมได้ที่ [Official Website] : https://www.thelord-sea.com/#sec-preregister [Official Facebook Fan page] : https://www.facebook.com/TheLord.THAI [Official Instagram] : https://www.instagram.com/gravitygametech_official/ . ที่มา ข่าวประชาสัมพันธ์ Gravity Game Tech Co.,LTD.",0
คนไทยเราไม่ได้รังเกืยจพม่าหร่อกนะแต่ถ้าใครรู้ตัวว่าติดโควิดแล้วอย่าหนีอย่าเดินทางไปใหนต่อใหนอีกเลยเข้าพบตํารวจหรือหมอก็ได้เขาจะรักษาให้พอมันหายจากโรคโควิดแล้วพวกเราก็จะได้ทํางานกันต่อขอให้พีน้องพม่าทุกคนสู้ๆ,0
ตอนโควิดรอบแรกกลัวตายที่ไทยหนีกลับพม่าพอตอนนี้จะขอเข้ามา่ถุย,1
"ท่านทำถูกแล้ว พม่า,ไทย,ก็คนเหมือนกันครับพวกด่าท่านมึงมีสมองไหมถ้าไม่รักษามันก็แพร่กระจายไปทั้งประเทศ(กำลังใจครับสู้ๆครับ)",0
ฝากถึงผู้นำของไทยและผู้เกี่ยวข้องนะคะ คุณต้องแก้ไขขั้นเด็ดขาดแล้ว คุณจะปล่อยให้มันมีการลักลอบเข้าบ้านตัวเองแบบนี้อีกไม่ได้ อย่างน้อยส่งหมายไปให้ผู้นำและประชากรของเค้ารับรู้ว่าถ้าฝ่าฝืนทางเรายิงทิ้งหรือส่งกลับหรือบทลงโทษร้ายแรงแน่นอน จะมาปล่อยให้เข้ามาบ้านตัวเองให้เดือดร้อนทำมัย แก้ปันหาได้แล้วค่ะ แค่นี้ประชาชนก็แย่มากแล้ว พวกพม่านะ ฉันไม่สนใจมิตรไมตรีอะไรหรอก เข้ามาก็สร้างแต่ปันหา ตัดขาดไปเลยยิ่งดีค่ะ,1
จังหวัดที่ล็อคดาวน์พื้นที่หลักๆคือ สมุทรสาคร และสมุทรสงคราม ในลักษณะจำกัดเวลาและควบคุมพื้นที่ แต่ยังสามารถเดินทางข้ามจังหวัดได้โดยแจ้งจนท.#ไม่มีการปิดเมือง _____ ส่วนพื้นที่พบผู้ติดเชื้อ จะจำกัดเฉพาะจุดเสี่ยง ดังนั้นการเดินทางข้ามจังหวัดในทุกจังหวัดยังสามารถดำเนินการได้ แต่หากสามารถหลีกเลี่ยงไปยังพื้นที่พบผู้ติดเชื้อได้ก็แนะนำให้หลีกเลี่ยงก่อน ______ รถโดยสารสาธารณะ รถไฟ เครื่องบิน ยังเปิดให้บริการปกติ _______ ขอให้มั่นใจมาตรการและบุคลากรด้านสาธารณสุข หน่วยงานที่เกี่ยวข้อง ประเทศไทยผ่านช่วงวิกฤติมาได้แล้ว และจะต้องผ่านช่วงเวลานี้ไปได้อีกครั้ง _______ #สิ่งสำคัญที่สุดคือประชาชน ไปจังหวัดเสี่ยงโปรดแจ้งเจ้าหน้าที่ และจำกัดพื้นที่ของตนเอง ได้โปรดอยู่บ้าน ออกจากบ้านเท่าที่จำเป็น สวมหน้ากากอนามัย เว้นระยะห่างจากทุกคนแม้กระทั่งคนในครอบครัว เป็นระยะเวลา14วัน #อย่าปกปิดข้อมูล สำหรับพื้นที่ชายแดนไทย-มาเลเซีย ...กลับมาต้องเข้ากักตัวที่ศูนย์กักกันที่รัฐจัดให้ทุกครั้งคุณหลบเจ้าหน้าที่ได้ แต่มันจะเป็นตราบาปในใจคุณ หากคุณนำเชื้อมาติดคนในครอบครัวหรือคนในประเทศ และอาจถูกสังคมรังเกียจเหมือนที่แรงงานชาวพม่ากำลังเผชิญอยู่ __________ ถึงเวลาของคนในครอบครัวที่ต้องช่วยปกป้องเพื่อนบ้านของคุณและคนในสังคม อย่าปล่อยให้คนในครอบครัวที่ไม่ผ่านการกักตัวมาพักอาศัยในบ้าน...เพราะหากพบผู้ติดเชื้อจะถือเป็นความผิดร่วม,0
Live ห้องข่าวบันเทิง | บอล นำทีมเพื่อนตลกทำบุญ100 วัน โรเบิร์ต สายควันพร้อมขึ้นบ้านใหม่! . และติดตามประเด็น . - ไอซ์ ปรีชญา แจ้งความ แฟนคลับปลอมเฟชบุ๊คอ้างหลอกยืมเงินชายต่างชาติ - ทำด้วยใจ! อาร์ต พศุตม์ ผัดกะเพรา 325กล่อง แจกแรงงานพม่าที่ถูกกักตัว จ.สมุทรสาคร - ตูน บอดี้แสลม โพสต์ขอโทษ ก้อย ที่เป็นภาระ สัญญาจะแข็งแรงไวๆ - กลัฟ ปลื้ม เชลซี ส่งคำอวยพรวันเกิดให้ โอดโดนยกเลิกงานพิษโควิดรอบ 2 . #ข่าวเวิร์คพอยท์23 #ห้องข่าวบันเทิง ห้องข่าวบันเทิง Live ห้องข่าวบันเทิง | บอล นำทีมเพื่อนตลกทำบุญ100 วัน โรเบิร์ต สายควันพร้อมขึ้นบ้านใหม่!,0
คงต้องเสียเมืองให้พม่าซะแล้วพี่น้องชาวไทย,0
เสียกรุงศรีฯครั้งแรกให้พระเจ้าบุเรงนอง เสียกรุงศรีฯครั้งที่สอง โดนเผาไม่เหลือ เพราะมีไส้ศึกเปิดประตูเมือง?ให้ เพราะเห็นแก่ยศ และเงินทอง คราวนี้เสียสมุทรสาคร ก็เพราะเห็นแก่เงินทอง พาไส้ศึกเข้ามาอีก คงอีกเพียงแค่ชั่วเคี้ยวหมากแหลก พม่ารามัญคงเข้าตีกรุงเทพฯได้สำเร็จเป็นแน่แท้ เพลานี้พวกเจ้าจงเร่งเตรียมผ้าปิดปากแลเจลแอลกอฮอร์ให้พร้อมรับศึกอันใหญ่หลวงเถิด สาธุจ้า #?คณาธิป,1
"30,000 ของอาณาจักรชูลู ที่ใช้หอก.โล่ เข้าตีอังกฤษจนชนะ...(ทำไมชอบว่าจังว่าดาบสู้ปืน) ตอนแรก พม่าเกือบจะว่าได้คือเกือบชนะแล้วนะครับ ตีทหารอังกฤษถอยร่นไปถึงจิตตะกองเลย แต่อังกฤษก็หัวดีแก้ไขด้วยใช้ปืนใหญ่ที่ทันสมัยเข้าสู้แทน และตีไปถึงหลายปีเลยจึงจะยึดพม่าได้ มีเหตุการณ์หนึ่งกษัตริย์พม่าส่งทูตไปหาราชินีอังกฤษก็โดนมองว่าเป็นตัวตลก น่ารังเกียจจน คณะทูตคนนั้นไปร้องไห้ให้กับคณะทูตไทยฟังเลย น่าสงสารพม่าแท้ตอนนั้นพี่แกไม่ได้คิดจะยึดสยามแล้ว พี่เน้นไปปราบปรามทางเหนือคือแคว้นอัสสัม หรือ มณีปุระ .. อ้อมีครั้งหนึ่ง กษัตริย์พม่ามองกษัตริย์สยามว่า ทำไหมน้อ.ไม่มาช่วยเราพี่น้องชาวเอเชียด้วยกัน กับไปเสพสุข เป็นมิตรกับไอ่ฝรั่ง",0
มันก็ขึ้นอยู่กับคนไทยชอบจ้างแรงงานพม่า ด่าว่าคนไทยด้วยกันขี้เกียจ มันก็มีทั้งดีและไม่ดี ต้องให้โอกาสคนไทยบ้าง พม่ามันก็ไม่ได้ดีทั้งหมด บทมันโหดมันฆ่าเจ้านายปล้นเจ้านายก็มีน่ากลัวจะตายพม่าน่ะ,1
สมัยนี้พม่ายังตีไทยอีกนะ,1
ไม่อยากเห็นเลยพวกที่เห็นแก่ตัวอย่างชาวพม่าหรือเวียดนาม ที่มาใช้แรงงานในประเทศไทย อย่างน้อยพวกเธอหรือคุณทั้งหลายน่าจะเห็นใจเพื่อนบ้านกันน่ะที่ยอมให้พวกคุณทั้งหลายเข้ามาประกอบอาชืพไม่ว่าอาชืพอะไรก็ตามพวกคุณก็น่าจะมีความร่วมมือในทุกๆที่น่ะ,0
พวกจิตป่วย ถึงทำได้แบบมือไม่พายเอาเท้าราน้ำจริงๆ คนยิ่งเห็นใจรัฐบาล เพราะห่วงคนจะเดือดร้อนทางเศรษฐกิจซ้ำซ้อน จะ lock ทั้งหมดไม่ได้ การป้องกันทำได้ไม่ยาก แค่พวกเราตั้งการ์ดตัวเองสูงๆ เข้มๆ พยายาม lock down ตัวเอง ออกจากบ้านเท่าที่จำเป็น เราก็จะผ่านมันเหมือนครั้งก่อน ให้กำลังใจคุณหมอทวีศิลป์และครอบครัวค่ะ เดือนที่แล้วเข้าฟังวิชาการ online อจ ทวีศิลป์ เล่าให้ฟัง ทั้งครอบครัวมีทัวร์ไปลงทาง line ด้วย เพียงเพราะ อจ เสียสละมาช่วยชาติ อจ เป็นคนที่สื่อสารได้ ตรงจริง และ soft ที่สุดแล้ว อจ เหมาะที่สุดสำหรับสถานการณ์โควิด ฝากส่งกำลังใจ support อจ และครอบครัว สิ่งดีๆ ที่ อจ สร้างและสะสม จะคุ้มครอง อจ และครอบครัวค่ะ พวกที่ออกมาเห่า ถ้าทำอะไรช่วยประเทศไม่เป็นก็แค่หุบปากก็ถือว่าช่วยได้ระดับหนึ่งละ,0
เอาจริงนะ..คนงานพม่าที่เข้ามาอย่างถูกกฎหมาย ควรที่จะต้องโกรธคนงานที่ลักลอบเข้ามาแบบผิดกฎหมาย และยังนำมาซึ่ง covid ทำให้พวกตนเองซึ่งมิได้มีส่วนเกี่ยวข้องกับโรคระบาดซึ่งเมืองไทยเราควบคุมมันได้ และที่ชั่วร้ายที่สุดก็คือ ผู้ที่ค้ามนุษย์ถือว่าเป็นกลุ่มบุคคลที่เหี้ยที่สุดในเหตุการณ์นี้,0
ขอบคุณพวกท่านมาก ราชสีห์ จิตอาสา พึ่งรายงานเมื่อ2ชม.มานี้ ไม่ได้เหยียดพม่า นะ สงสารด้วย แต่ถ้าเจอต้องห่างไว้ก่อน,0
พม่าลักลอบเข้าไทยผิดกฎหมาย ไม่ใช่มีแค่มหาชัย จว.นครปฐม ในกรุงเทพก็น่าจะมีเยอะกว่า ต่างด้าวที่ลักลอบเข้าไทยมักพูดไทยไม่ได้เลย เข้ามาไทยเพื่อลักลอบทำงาน ต้องมีเพื่อนพม่าที่เข้ามาทำงานในไทยนานแล้วที่พอพูดไทยได้เป็นล่าม พวกนี้แหละอาจเป็นผู้นำพาเชื้อโควิดเข้ามาไทย,1
โอ้ย!!เน๊าะเมืองไทย โดนพม่าฆ่าตายกันทั้งประเทศก็คราวนี้ล่ะ #กรรม,1
ตายทั้งโรงงานหล่ะทีนี้ก฿ไม่อยากนึกภาพนั้นจริง พม่าแมร่งโครตเห็นแก่ตัว,1
เป็นกำลังให้พี่น้องชาวพม่าทุกๆคนครับ เราร่วมสุขก็ต้องร่วมทุกข์ด้วยครับ... หายแล้วก็ลุยงานกันต่อครับ... รักษาสุขภาพกันด้วยครับ,0
เศร้าใจจัง. โควิดรอบแรก. งานยังไม่ใด้ฟื้นตัว เลย. รอบนี้มาอีกละตายสิแบบนี้,1
ให้มันไปตายยุบ้านมันพุ้นน่ะ #กูซังพม่า,1
