text,label
สู้ๆครับพี่FC จากพม่า,0
แต่ก่อนไทยเสียกรุงให้พม่าเพราะคนไทยเป็นฆ่าศึกเอง แต่ตอนนี้ไทยกำลังเสียกรุงให้ให้พม่าอีกครั้ง โดยที่ไทยมัวแต่รบกันเอง พม่าจึงส่งชาวพม่ามาพร้อมกับโควิดอะคะ,0
พี่ยุทช่วยทีตะพม่านั้นคนไทยก้อจะตายกันหมดแล้วแต่ช่วยพม่าก่อนตะเติ้ลจะได้หน้านั้น,0
พม่าเผาเมืองยุค 2020,1
กลัวเหี้ยไรพม่าต่างด้าวเป็นงัยเอาเข้ามาลักลอบเข้ามาตัวใหญ่ๆกินค่าหัวเอาเข้ามางัยละปิดทั้งประเทศบ้านมันเอาไม่ไหวแล้วเป็นทั้งประเทศยังให้ทันเข้ามาแพร่เชื้ออีกควายแท้ๆเข้ามาตามขายแดนยิงทิ้งให้หมดสมัยก่อนมันเผาบ้านเมืองเรายังกลัวเหี้ยไรอยู่,1
พม่าเผาเมือง,1
Toowgnos Gnoormubnarmus สติค่ะ สติ คนสมุทรสาครติดเชื้อเพราะคนพม่า หรือคนจากยุโรป? แยกแยะหน่อย ในเมื่อรัฐบาลยังเปิดให้ต่างชาติเดินทางเข้าไทยโดยมีเงื่อนไขกักตัว 15 วัน เขาใช้เงินเขารักษาตัวค่ะ ไม่ได้ใช้งบของไทย และไม่ใช่ทุกคนที่เดินทางเข้าไทยโดยการกักตัวจะมีเชื้อนะคะ เราก็มีเพื่อนอาศัยอยู่มหาชัย 2 ครอบครัว เรารู้ค่ะว่าเครียดกัน เราก็มีช่วยส่งอาหารและนมไปให้เขาและลูกๆ,0
แข็งแรงๆนะพี่น้องพม่า ทุกคน ถ้าไม่มีคุณ. งาน ก็ไม่เดิน. หายไวๆ เราคนไทยเป็นกำลังใจให้ ทุกคนที่เป็นรึไม่เป็นโควิค ให้กำลังใจทั้งคนไทยและ พม่า,0
จะตายเพราะพม่านี่แหละ,1
กูจะตามไปกะทืบพม่าที่หนีให้ตายคาตีนเลย555555555,1
พม่า อะ กักตัว แล้วปล่อยให้มัน ตายไปเลย ชอบมัว ดีนัก,1
ใช่.. พม่าก็คน.. ไทยก็คน.. ต้องช่วยเหลือกันฮะ,0
คนไทยเสียภาษี ไห้พม่า กับนายจ้าง ขี้โกงหรอ คนที่เสียประกันสังคม เคยคิดจะดูแลมั้ย เข้าประเทศไทย มันง่ายมาก ทำไมต้องแคร์ ต่างด้าวไอเชื้อโรค ใครมีผลประโยชจาก คนพวกนี้ รับไปรักษาเองเลย ขนไปทิ้งข้างทางหรอ สมควรปล่อยไห้ตาย,1
โอ้ยๆๆๆน้อ ทำไมให้พวกพม่าเข้าประเทศไทยไล่ออกไปให้หมดเลย รอบแรกยังตั้งหลักไม่ได้ มาอีกแล้วตายๆๆๆ,1
มึงมันบ้า..มาขอเข้าไทยตอนนี้เนี่ยนะ..มึงแกล้งโง่รึแกล้งหูหนวกตาบอดก็เห็นๆอยู่เพราะแรงงานพม่านี่แหละ..ที่นำเชื้อโรคมาระบาดใหม่ในไทย..คนไทยในประเทศป้องกันกันแทบตาย..มึงยังมาขอให้พม่าเข้ามาในไทย..มึงอย่าเห็นแก่ตัว..,1
ขอบคุณแทนพี่น้องชาวพม่าด้วยค่ะ ขอให้รวยๆเจริญรุ่งเรืองนะค่ะ,0
แล้วทางรัฐบาลพม่าเขาใม่ออกมาแสดงความคิดเห็นอะใรหรือช่วยเหลือประชาชนของเขาเลยเหรออยากรู้จริงๆเขามองใม่เห็นความเดือดร้อนของประชาชนตาดำดำบ้างเรยรึถ้าเป็นประเทศอื่นรัฐบาลของเขาออกมารับผิดชอบช่วยเหลือแล้ว,1
ตายอีกแล้วปีใหม่บ่ได้ไปใสดอกบากเลนมึงเอ้ยฆ่าถิ่มนาพม่า,1
แนะนำให้จับปรับนายจ้าง?แล้วปรับที่พม่า? แล้วส่งออกนอกบ้านเมืองเรา? ปิดประเทศ?ห้ามลักลอบเข้ามา? เจอลักลอบยิงทิ้ง? ไม่สน เจ็บแค้นสมัยกรุงศรี ยังไม่หาย? ยังมีมาตีบ้านเมืองเราแตกอีกจนได้? อีพวกนี้สมควรเอาให้หนัก? สนับสนุนการยิงทิ้ง? ให้หมด? #ถ้าลักลอบเข้ามา,1
พม่าตีกรุงศรีแตกอีกครั้ง,1
ขอบคุณแทนพี่น้องชาวพม่า..ด้วยค่ะ,0
ควยคนไทยตกงานเป็นล้านไม่มีงานทำ ไม่จ้าง แต่ไปเอาพม่ามาทำงาน อยากให้คนไทยอดตายหรอ แล้วให้พวกต่างดาวมาอยู่,1
หนูนิด เข้ารับอิสลาม เห็นเพื่อนชวนทำนูหรี อะไรนี้และค่ะ พอถามเพื่อนว่าคืออะไร ทำบุญรวมญาติให้โต๊ะ หรือบรรพบุรุษ ค่ะ (แต่เมื่อตอนบ่ายเราลองทักไปถามน้องที่อยู่แหลมโพธิ์ เห็นว่าพม่าเข้ามาจะข่มขืนค่ะ ไม่เกียวอะไรกันเลยกับข่าว ส่งสารจ้ะเขานะค่ะ),0
May Oo Paoh คนไทยส่วนใหญ่ใจดีนะคะ ขอให้กำลังใจพี่น้องชาวพม่าทุกคน สู้ๆนะคะ,0
ทำดีแทบตาย?สุดท้าย?พม่า?มาทำพัง?,1
ขอให้พี่น้องชาวพม่า และชาวไทยร่วมมือกับภาครัฐ ในการให้ความร่วมมือ รับรองหมอไทยเอาอยู่ อย่าหนีอย่าแพร่เชื้อให้ระบาด ให้ยากแก่การควบคุมนะครับ,0
ขอบคุณkหมอที่พูดแทนคนไทยในสิ่งดีๆให้พี่น้องพม่าสู้กับโควิตสู้เว๊ย,0
โอ้ย!!!!!ๆๆๆๆเนอะพักหัวขวานเอ้ยไปตายพม่าเลย,1
ปิดพรมแดนด้านพม่าทุกจุดเข้า ยิง,1
ฉิ๊ปหายละคราวนี้คนไทยตายแน่พม่ามายึดประเทศไทยแล้วคราวนี้,0
พูดภาษาพม่าไม่ได้ แต่อยากส่งกำลังใจให้ชาวพม่าที่อาศัยอยู่ในประเทศไทยทุกคนรวมถึงพี่น้องคนไทยทุกคนจงเข้มแข็ง ดูแลสุขภาพตัวเองให้ดี เราช่วยกันป้องกันเพื่อไม่ให้มันแพร่กระจายมากกว่านี้ กาดอย่าตกกันนะคะ,0
พม่านี่แสบมาก พวกมึงรุกรานประเทศไทยมานานแสนนาน ถ้าเป็นยุคพระเจ้าตาก พระนเรศวรมึงตาย 5555,1
นักแสดงชาย อาร์ต พศุตม์ ได้ลงมือเข้าครัวทำผัดกะเพรา 352 กล่อง เพื่อนำไปแจกให้กับแรงงานชาวเมียนมา ที่ถูกกักตัวที่สนามกีฬาจ.สมุทรสาคร ที่กำลังได้รับผลกระทบอยู่ในขณะนี้ . ซึ่งหนุ่มอาร์ต ได้โพสต์คลิปในอินสตาแกรมส่วนตัว พร้อมเขียนแคปชั่นว่า วันนี้ไปให้แรงงานพม่าที่ ที่ถูกกักตัวสนามกีฬาสมุทรสาครคับ #ทำดีสร้างภาพ #โควิท #covid_19 ซึ่งมีแฟนๆเข้ามาคอมเมนต์ ชื่นชมในความใจดีมีน้ำใจช่วยเหลือเพื่อนมนุษย์ในยามประสบภาวะวิกฤต . ภาพจาก IG: @art_phasut98 #อาร์ตพศุตม์ #อาร์ต #พศุตม์บานแย้ม #โควิด19 #โควิด,0
ถ้าประเทศไทยยังจะรับพม่าเข่ามาอีกก็คงตอ้งเรียกว่าโง่ประเทศของมันก็มีก็ไห้พวกมันตายที่บา้นเมืองของม้นเอาเข่ามาก็จะมาสางควมเดือดไห้คนไทยอีก,1
ปล่อยให้เข้ามากันไม่ดูแลกันเลยไม่นึกถึงคนไทยกันเลยเห็นแก่ตัวกันจริงๆไม่ใช่น้อยๆไม่รุ้จะเดินไปทางไหนเลยพม่าจะชนตาย,1
ตอนนี้คือจิตตกแล้วตกงานมาก็จะปีแล้วจะอดตายแล้วยังมามีรอบสองรอบนี้คือตายทั้งขึ้นทั้งร่องเอาพม่ากลับบ้านเกิดเลยค่ะมาทางไหนก็กลับไปก่อนเลยป้องกันใส่แมสจะตายทุกวันสุดท้ายเสียเปล่ามาก,1
คิดที่จะบิน อย่าลืมดินที่เคยเดิน เป็นผมก่มาครับ อยู่พม่าถ้าติดรอเวลาตาย แต่ถ้าข้ามมาได้ ทั้งตรวจฟรี รักษาฟรี อยู่ฟรีกินฟรีอีกคัยมันจะไม่มา555,1
เพิ่งมาขุดใช่มั้ย...แต่ก่อนละ.ผบตร..ไปขุดอะไรยุ.ขุดปูบ่..วัวหาย.แล้วล้อมคอก.กลยุทธ.ลองเอามาใช้สิคับ..ไอ้พวกลักลอบเข้าเมือง.ไม่ได้กักตัว...มีประเท ศไทยนี่แหละ...มันพากันชักศึกเข้าประเทศ.ขนาดพม่ามันยังกลัวกันเอง...ระยำจริงๆพวกที่เห็นแก่ตัว.ไม่คำนึงถึงประเทศของตัวเอง..ประเทศเพื่อนบ้าน..เขาปิดกั้น.คนในห้ามออก.คนนอกห้ามเข้า..ประเทศกูมี,0
พม่าเผาเมืองเพราะคนไทยเห็นแก่ได้แท้ๆ,1
เรามาหาเงินบ้านเขาเมืองเขาเราตอบแทนสิ่งดีๆแล้วมันก้จะดีขึ้นเองค่ะ..ช่วยกันป้องกันดีแล้ว..อย่าคิดมากนะพี่ๆน้องๆพม่าทุกๆคน..เชื่อว่าใม่มีใครอยากให้เกิดหลอกค่ะ...แต่มันเกิดขึ้นแล้วช่วยกันป้องกันแค่นี้ก้ถือว่าทำดีแล้ว...สู้ๆๆๆค่ะ..??????,0
น่าสงสารคนพม่าเหมือนกันนะคับคนพม่าไม่ได้ผิดทุกคนนะอย่าเหมารวมเขามาทำงานให้คนไทยเพราะคนไทยเลือกงานเองเขาคือแรงงานของคนไทยคับอย่าไปหาแพะรับบาปเลยมันไม่สมควร,0
ผมเคยอยู่ระนอง ไปทำเรือประมงหาปลาในน่านน้ำพม่า เดินในถนนปากคลอง แถวท่าเรือประมงตอนกลางคืน ถ้าเดินไม่ดีถูกพม่าตีตายครับ พอมีเรื่องขึ้นมามันก็หนีลงเรือหางยาวไปเกาะสองแล้ว พวกมันหาว่าคนไทยชอบเอาเปรียบ แต่พวกมันบางคนเบิกเงินล่วงหน้าเเล้วหนีก็เยอะ ทำอะไรมันไม่ได้หรอก,1
พม่าบุกขี่โค.มาทำศืกครั้งนี้ กรุงไม่แตก แต่ตายหมู่ทั้งประเทศ,1
ผมเป็นคนไทยแต่ก้อเห็นใจคนพม่าเสมอสู้ๆนะครับวอนคนไทยอย่าด่าเขาเลยเพราะไม่มีใครอยากให้เกิดขึ้นหรอกครับ,0
พม่าสกปรกจะตาย..บ่วนน้ำหมากเกลื่อนเมือง อย่างนี้ใส่แมส มีความหมายอะไร,1
คนไทยไม่รับทำงานจะเอาแต่พม่าเป็นไงละจะตายก้อเพราะพม่ากรรม,1
ไม่ว่าจะคนไทยหรือพม่าหรือชที่ไหน ก็คนเหมือนกันครับ คนที่ไม่รู้เรื่องอะไรก็มีเยอะ คนที่รู้ว่าตัวเองเป็นแต่ปกปิดนะมีน้อย คนที่รู้ตัวว่าเป็นแต่ปกปิดผมก็อยากจะประนาม แต่คนที่ไม่ได้เกี่ยวข้องด้วยผมก็ขอให้กำลังใจทุกคนครับ สู้ๆครับ,0
โคโรนา อาร์ ใครอยากให้เขามาแพร่เชื้อครับ เขาลักลอบเข้ามาและคนที่เขามาก่อนเขาก็ไม่ใด้มีเชื้อบางคนก็ติดอย่างว่าเพราะเป็นญาติกัน พม่าในไทย2ล้านคนติด1พันคนไม่มีใครอยากติดไม่มีใครอยากเป็นหรอกครับ เพราะฉะนั้นมนยุคปัจจุบันต้องช่วยๆกันครับ,0
ยังมีคนไทยอีกหลายคนที่พร้อมจะปกป้อง และดูแลพวกเธอ ให้ดี เหมือนกับเป็นญาติคนหนึ่ง อดทนหน่อยนะ อย่าเชื่อตำรวจ ถ้าเค้ายอกว่าจะพาพวกเธอกลับบ้าน ขอให้พวกเธอ ติดต่อกงศุลพม่า ประจำประเทศไทยทันที แล้วบอกเค้า ว่าอยู่ที่ไหน เบอร์โทร มีอยู่ในกูเกิ้ลและด้านหลังของปกพาสปอร์ต อย่าร้องนะ ยิ้มสู้,0
"1.พม่าแอบลอบเข้าประเทศไทยแบบผิดๆ 2.พม่าเอาเชื้อมาแพร่ในประเทศไทย 3.พม่าแอบหนี้,แอบเข้า .(จับพม่าติดคุกหลายๆปีเลยเอาผิดมั้งไม่งั้นทำเลียนแบบกันอีกไม่งั้นแอบเข้ามากันแบบผิดๆแถมยังเอาเชื้อโควิทมาแพร่อีก) เชือดไก่ให้ลืงดู ออกกฎหมายเอาผิดพวกที่แอบเข้าแบบผิดๆ ออกกฎเอาผิดบางเถอะอย่าปล่อยให้มีช่องว่างช่องโว้เยอะขนาดนี้ 1.พวกแอบเข้าประเทศแบบผิดๆๆพวกที่ไม่ตรวจเช๊คผ่านตามช่องทางด่านต่างๆพวกที่ไม่ทำตาม จับติดคุกให้เข็ด,ถ้ามีหน่วยงานราชการไหนที่พาพ่มาเเอบเข้ามาแบบผิดๆๆก็เอาผิดให้หนักกว่าเดิมอย่าปล่อยให้มีประวัติซ่ำลอยอีกเชิดไก่ให้ลิงดู ที่แบบนี้ไม่เปาประกาศเอาผิดพวกแอบเข้าพวกที่ค่อยช่วยเหลือพม่าแอบเข้าออกแบบผิดๆที่กรณีผู้หญิงไทยแอบเข้าออกข่าวจะปรับเข้า20ล้าน ที่เเบบนี้ไม่เห็นเปาประกาศเอาผิดพม่าพวกที่พาเข้าจับติดคุกให้เข็ด",0
จ้างโจรใต้ยิงพม่าดิรัฐบาล,1
