text,label
Kittiya แจ้งข่าว แก่พี่น้องชาวแพร่ ( ข้อมูล ณ วันที่ 23 ธันวาคม 2563 ) จากสถานการณ์โควิด - 19 ที่กำลังเป็นที่สนใจในตอนนี้นั้น มีคำตอบมาคลายความสงสัย ดังนี้... ถาม : มาจากต่างจังหวัด ต้องกักตัว 14 วัน หรือไม่? ตอบ : #ไม่ต้องกักตัว แต่ หากมาจากพื้นที่เสี่ยงควรเฝ้าระวังตนเองอย่างเคร่งครัด .. #ผู้ที่มาจากสมุทรสาครทุกคน #ต้องรายงานตัวกับผู้ใหญ่บ้าน_อสม_จนทสาธารณสุข #เจ้าหน้าที่สาธารณสุขจะได้ลงไปประเมินความเสี่ยงว่าจะต้องกักตัวหรือไม่ ถาม : มีการปิดบ้าน ปิดเมือง (ล็อคดาวน์) หรือไม่? ตอบ : ณ ขณะนี้ ยังไม่ ล็อคดาวน์ เดินทางได้ปกติ แต่ #ต้องปฏิบัติตัวเพื่อป้องกันอย่างเคร่งครัด ถาม : กรณีข่าวและเล่ากันว่า แม่ค้าของทะเลที่ติดเชื้อ จ.อุตรดิตถ์ มาขายของที่ตลาดแห่งหนึ่งใน อ.สูงเม่นนั้น จริงหรือไม่? ตอบ : ไม่จริง !!..ได้สอบถามแม่ค้าโดยตรงแล้ว บอกว่า ขายแต่ที่ตลาดป่าขนุนเท่านั้น ถาม : เมืองแพร่มีคนงานพม่า และ แม่ค้าของทะเล ได้ดำเนินการอย่างไร? ตอบ : เจ้าหน้าที่สาธารณสุข ได้ลงสุ่มตรวจในคนงานพม่า และ แม่ค้าของทะเล เพื่อค้นหาผู้ป่วยเชิงรุก (Active case finding) ตามหลักการทางวิทยาการระบาด เพื่อป้องกันและควบคุมโรคต่อไป จึงขอให้ทุกท่านได้ทราบ ทั้งนี้ #เน้นย้ำให้ป้องกันตัวเองอย่างเคร่งครัด!!! โดย... 1. สวมหน้ากากอนามัย/หน้ากากผ้าเสมอ 2. ไม่ไปที่แออัด 3. ล้างมือ/เช็ดมือด้วยแอลกอฮอล์ หลีกเลี่ยงการจับ สัมผัสสิ่งต่าง ๆ 4. เว้นระยะห่าง 2 เมตร 5. ปฏิบัติตามข้อกำหนดของสถานที่ต่าง ๆ โดยเคร่งครัด ไม่บิดพลิ้ว 6. สแกนไทยชนะ ร่วมด้วย ช่วยกันครับ เราจะผ่านไปด้วยกัน,0
ทำไมไม่ทำรั้ว ลวด ติดกระดิ่ง ตรวจเจอ จับส่งกลับ ไม่กลับ ยิงทิ้งไปเลย พม่า ทำความเดือดร้อนให้คนไทยเท่าไร ทั้ง ขี่รถ ไม่สนใจใคร เมายา เล่นยา ขนยา มาอยู่แล้ว สกปรกทิ้งขยะ ไม่เป็นที่ คนกทมไม่าดู นายยก นายตำรวจ เคยใส่ใจไหม เรื่องให้ แรงงานพม่าเข้า มา ความสะอาด ไม่ได้ เป็นภาหะโรคต่างๆ เอาแต่งินค่าวีซ่า ทำงาน ไม่ใส่จเลย ว่าเขาเข้ามาแล้วทำลายสิ่งเเวดล้อม ทางบกทางทะเลเท่าไรแล้ว พวก เรือประมง สนใจรายละอียด พวกนี้บ้างนะ ส่วน โควิท รับรอง เกิน3000 แน่นอน,1
"โควิดมา...ก็เพื่อนายทุนใหญ่ เพจ Paisal Puechmongkol ? โคขวิดระบาดเที่ยวนี้ มาจากอินเดีย สู่บังคลาเทศเข้าพม่า ระบาดเข้าทางภาคเหนือของไทย และ ศูนย์กลางการระบาดคือสมุทรสาครและโกดังในเครือข่ายภาคตะวันออก!!! 1 โคขวิดเดินทางมาเอง โดยไม่มีใครขนแรงงานเถื่อนเข้ามาที่ภาคเหนือจนถึงสมุทรสาคร 2 โคขวิดไม่ได้เดินทางจากบ่อนภาคตะวันออก แต่เป็นการเดินทางออกจากโกดังหลายแห่ง เพราะประเทศไทยไม่มีบ่อน 3 โคขวิดเลือกระบาดเฉพาะ กับประชาชนทั่วไปไม่ระบาดกับกิจการ ขนาดใหญ่ของ 5 นายทุนของชาติ 4 สาเหตุ ที่โคขวิดระบาดเพราะประชาชนการ์ดตก ไม่เกี่ยวกับรัฐบาล 5 แม้ประกาศการใช้ยา ลงวันที่ 29 มีนาคม เคยพิสูจน์ความสำเร็จในการรักษา covid หายมาแล้ว 3,500 รายในเวลาราวเดือนเดียว แต่เราก็ ยกเลิกประกาศนั้นเสียและใช้ประกาศ 1 พฤษภาคม 63 ซึ่งใช้ยารักษาปอดบวมแทนที่ยาค้อกเทล 6 แม้โรงพยาบาลเอกชนที่มีมาตรฐานจะสามารถนำเข้าวัคซีนได้ทันที แต่เราก็จะรอวัคซีน ที่ได้จองซื้อจากฝรั่งไว้ 20 ล้านโดส เราต้องเสียสละรอวัคซีนนั้น จะป่วยจะตายสักเท่าใดก็ต้องเสียสละ นี่คือสภาพที่เป็นอยู่ในบ้านเมืองของเราในขณะนี้ ...................... Paisal Puechmongkol 3? เพื่อหยุดยั้งหายนะของชาติ จากการระบาดของโคขวิดขอเรียกร้องดังนี้ 1 ให้รีบนำประกาศการใช้ยาของกระทรวงสาธารณสุขลงวันที่ 29 มีนาคม 63 กลับมาใช้ใหม่เพราะมีผลพิสูจน์แล้วว่ารักษาให้หายได้เร็วมาก ช่วงเดือนมีนาคม 2563 มีผู้ป่วย 3,500 คนรักษาหายในเวลาราวเดือนเดียว และให้ยกเลิกประกาศลงวันที่ 1 พฤษภาคมทันที เพราะผลการรักษาพิสูจน์แล้วว่าหายช้ามาก ทั้งนี้โดยใช้ยารักษาปอดบวมเป็นตัวสำคัญ 2 รีบทำความเข้าใจกับประชาชนว่าโคขวิดเป็นโรคระบาดที่รักษาให้หายได้ในเวลาเพียง 48 ชั่วโมงถึง 4 วัน โดยให้นำตัวเลขการหายป่วยของทั่วโลกและของประเทศไทย มาทำความเข้าใจโดยรวดเร็ว เพื่อลดความแตกตื่นตกใจ ที่กำลังทำลายบ้านเมืองอยู่ในขณะนี้ 3 ใช้อำนาจพิเศษตามกฎหมายฉุกเฉิน อนุญาตให้สภากาชาดไทย โรงพยาบาลของรัฐและโรงพยาบาลเอกชนที่มีมาตรฐานนำเข้าวัคซีนจากต่างประเทศมาใช้ทันที เพราะโรงพยาบาลทั้งหลาย มีพันธะในการค้ำประกันการรักษาผู้ป่วยอยู่แล้ว และมีความรู้ความสามารถในการหายาและใช้ยาไม่แพ้หน่วยงานใด!!!! จะต้องไม่ใช้ความคิดเอาชีวิตคนไทยเป็นตัวประกัน หรือความคิด ที่จะทำมาหากินกับชีวิตและหายนะของชาติทันที",0
เยอะเงินทั้งแจกทั้งทุ่มทุนรักษาให้ดีๆพม่าจะได้เผาบ้านเผาเมืองตอนหายแล้ว,1
อุทัยธานีน้อมรำลึกในพระมหากรุณาธิคุณฯ จัดพิธีถวายราชสักการะสมเด็จพระเจ้าตากสินมหาราช เทิดทูนสถาบันพระมหากษัตริย์ วันที่ 28 ธันวาคม 63 ที่อาคารสำนักงานเหล่ากาชาด จังหวัดอุทัยธานี นายณรงค์ รักร้อย ผู้ว่าราชการจังหวัดอุทัยธานี เป็นประธานในพิธีถวายราชสักการะสมเด็จพระเจ้าตากสินมหาราช เพื่อน้อมรำลึกในพระมหากรุณาธิคุณฯ รวมถึงแสดงความจงรักภักดี เทิดทูนต่อสถาบันพระมหากษัตริย์และน้อมรำลึกถึงพระมหากรุณาธิคุณอันยิ่งใหญ่ของสมเด็จพระเจ้าตากสินมหาราช ที่ทรงมีต่อพสกนิกรชาวไทย โดยมีนายอลงกต วรกี และนายพีระพล ตัณฑโอภาส รองผู้ว่าราชการจังหวัดอุทัยธานี หัวหน้าส่วนราชการ หน่วยงานรัฐวิสาหกิจ เหล่ากาชาด ชมรมแม่บ้านมหาดไทย ทหาร ตำรวจ และประชาชนทุกหมู่เหล่า เข้าร่วมพิธี ทั้งนี้ ในวันที่ 28 ธันวาคม ของทุกปี นับเป็นวันสำคัญของประวัติศาสตร์ชาติไทย เนื่องจากเป็นวันคล้ายวันปราบดาภิเษกสมเด็จพระเจ้าตากสินมหาราช (วันที่ 28 ธันวาคม 2310) พระมหากษัตริย์แห่งกรุงธนบุรีเพียงพระองค์เดียว โดยตลอดรัชสมัยของสมเด็จพระเจ้าตากสิน พระองค์ได้ทำสงครามกับพม่าถึง 9 ครั้งและทรงได้รับชัยชนะทุกครั้ง รวมทั้งทรงทำศึกกับเขมร 3 ครั้ง ส่วนพระราชกรณียกิจด้านอื่น ๆ นอกจากการเมืองและการศึกสงครามแล้ว พระองค์ทรงฟื้นฟูด้านเศรษฐกิจ การคมนาคม การบำรุงการศึกษาตามวัด การรวบรวมพระไตรปิฎก อัญเชิญพระแก้วมรกต และพระบางจากเวียงจันทน์ กลับมายังกรุงธนบุรี บูรณะปฏิสังขรณ์วัดวาอารามต่ง ๆ ด้วยพระราชทรัพย์ส่วนพระองค์ ด้วยพระราชกรณียกิจเหล่านี้ แสดงให้เห็นถึงพระปรีชาสามารถรอบด้านของพระองค์ ด้วยเหตุนี้ คณะรัฐมนตรีจึงประกาศให้วันที่ 28 ธันวาคมของทุกปี ซึ่งเป็นวันที่พระองค์ทรงปราบดาภิเษกเป็นพระมหากษัตริย์ เป็น วันสมเด็จพระเจ้าตากสิน และถวายพระราชสมัญญานามว่า สมเด็จพระเจ้าตากสินมหาราช ภาพ/ข่าว ส.ปชส.อุทัยธานี,0
@Julie Miller ธุรกิจขนาดเล็ก ไม่กระทบเท่าไหร่หรอก ลอง เป็นธุรกิจ จนาดใหญ่ ดูสิ รายได้ ไม่เข้า รายจ่าย ต่อเดือน หลายล้าน พูด เอาแต่ทางตัวเอง ธุรกิจโรงแรมหลายที่ต้องปิดตัว กระทบต่อไป คือ ลูกจ้าง หลายพัน คนต้องตกงาน คราวนี้กระทบวงกว้างแน่ ลูกเมีย เค้า คนไทยทั้งนั้นที่กระทบ ให้คุณขยันทำงาน ให้ได้ตลอดนะ ถ้าเศรษกิจมาหาภาค มันแย่ อีกไม่นาน ก็อกระทบ คุณ อยู่ดี ไม่ทางตรงก้อทางอ้อม เพราะอยู่ประเทศ เดียวกัน ใช้อัตรา เงิน บาทเดียวกัน แต่พม่า มันไม่ได้เดือดร้อน อะไรเลย เอะอะ ก็มีแต่คนช่วยเหลือ เรียกร้องนานาประเทศ ช่วยเหลือ คุณ ก้อมีบรรพบุรุษเป็นพม่า สินะ รัฐบาลไทย ไม่มีเงินซื้อวัคซีน ที่เพียงพอต่อคนไทยทั้งประเทศ นะ ได้ดูข่าวบ้างรึป่าว แต่เอาเงิน มาจากไหน เยอะแยะ มารัษา พวกพม่า แทนที่จะเอาเงิน รักษา ควบคุม การเกิดโควิท ภายในประเทศ ให้ได้ เศรษฐกิจระดับมหาภาค ไม่กระทบมาก รัฐบาล ก้อยังคง มีเงิน ใช้ซื้อวัคซีนที่เพียงพอ ต่อประชากร คนในประเทศ รัฐบาลไทย มีเงินซื้อวัคซีน รักษาโควิท แค่ 19% คนไทยมี ประชากร ประมาณ 70 ล้านคน ละคาดว่า วัคซีนนี้ไม่ถึง คุณ หรอก คงได้ แค่ ชุด รัฐบาล และกลุ่มชนชั้น นำ และบุคลากรการแพทย์ คนธรรมดา มีตังหน่อย ก้อบินไปต่างประเทศ เพื่อ ฉีดมัน ส่วนคนที่เหลือ ก้อ ติดกันเรื่อยๆ ใครอ่อนแอ ก้อตายไป ถ้าคนไทยติดเชื้อมากขึ้นเรื่อยๆ อุปกรณ์ การแพทย์ บุคคลากรทางแพทย์ แม้แต่ที่ตรวจ โรค ก้อ อาจจะไม่พอ เชื่อรัฐ บาล หลอกคนโง่ไป วันๆ คนทำงานในโรคพยาบาล เค้า เริ่มพูดออกมาแล้วแล้ว อุปกรณ์ การแพทย์ ที่มี รองรับ ไม่ถึงแสน คนหรอก ถ้าหากคนติดเชื้อมากๆ รัฐบาลก็ออกมาขอบริจาคอีก วัคซีนก้อขอบริจาค แต่ ทำไม มีให้คนพม่า,0
ขอให้ไปตรวจแถว ชุมชนคอนโด เพชรเกษม 114 มีพม่าเข้าไปพักกับญาติ เยอะมากครับ,0
ทำไมชอบไปเอาพวกพม่ามาทำงานก้อรุ้ว่าประเทศพม่าโควิดระบาดก้อไปเอามาใช้งานอีกคนเถื่อนพวกมึงก้อรับเดียวมันก้อฆ่าคนจ้างหรอก555555555555,1
เลิกเอามาเข้าประเทศเถอะดีสุด ทั้งที่มีใบอนุญาติและไม่มีใบอนุญาติไม่เคยอ่านข่าวดีๆจากพม่าเลย ทั้งฆ่าคนจ้างบ้าง แทงกันเองบ้าง นู้นนี้นั้น ล่าสุด ติดโควิคหนีกักตัวเดือดร้อนทั้งประเทศทศ จะบ้าตาย,1
แรงงานพม่าจะไม่หนีถ้ารัฐออกมาตรการช่วยเหลือเขาบ้าง เช่นไม่เอาผิดกรณีเข้ามาไม่ถูกต้องเฉพาะกรณีพิเศษ ให้เขามั่นใจ ในการเข้ารับการตรวจเชื้อและกักตัว นายกฯเล่นขู่โรงงานที่มีแรงงานเถื่อน หรือทางการจะจัดการอย่างนั้นอย่างนี้ พวกเขาจะกลัวแล้ววงก็แตกกระจาย ทีนี้ลองคิดดูเชื้อมันจะกระจายไปแค่ไหน ไม่คุ้มเลยครับ,0
กูเกลียดเข้ากระดูกคือพม่าแม่งจากอดีตจนปัจจุบันตายยุประเทศมึงนั้นหละ,1
เบิดร์ น่ะเอ๊ง จะใครอีก นิสัยคนไทยโควิดระบาด.ไปโทษ##พม่าโทษตลาดกุ้งดูถั่วยุโรปไม่มีพม่าไม่มีตลาดกุ้ง ไวรัสยิ่งเลวร้ายกว่ากว่าประเทศเอเซียอีก อย่าโยนความผิดไปให้เขา##คนไทยก็มนุษย์เหมือนกันมีโอกาสติดหรือแผ้เชื้อได้,0
กูที่อยู่บ้านแพ้วเสียวสันหลังเลยสัสพม่าเหี้ยยิงทิ้งไปเถอะ,1
บ้านฉันนั้นอยู่ยากแล้ว? มหาชัย? เราชาวสมุทรสาคร?ต้องผ่านมันไปให้ได้? เมื่อวานผ่านตลาดกุ้งก็สงสารพวกมอญพม่ายังกับติดคุก?,0
อส กูเกลียดพม่า พม่าพ่องตาย กุเหยียดพวกมึง พวกโง่ ทำให้กุต้องกักตัวควายเอ๋ออีกและ เหนแก่ตัว อส อห #กูติดยังวะ,1
ส่งมันกลับไปตายพม่าจะใด้ไม่เสียเงินคนไทย ไม่ต้องไปจับคนขับรถตู้ นึกถึงตอนเอามันมาสิมายังไง,1
ชาวพม่า เขาก็น่าสงสารนะคะ เขาอยากเข้ามาทำงานในบ้านเรา ส่วนคนไทยเราไม่อยากทำงานแล้วยังเลือกงานอีกด้วย แล้วจะเอาเงินที่ไหนมาใช้ พอไม่มีเงินก็โทษแต่รัฐบาล เฮ้อ น่าเบื่อ,0
ประกาศของให้พี่น้องชาวไทยใหย่หรือพม่าสุขภาพดีทุกคน,0
ขอให้กําลังใจคุณหมอ ทวีศิลป์ ครับ สู้ๆๆๆ,0
พม่าหรือประเทศเพื่อนบ้านโดยเฉพาะชนชั้นแรงงานเรียกเขา ต่างด้าว แต่พอฝรั่งตาน้ำข้าว หรือ ดูมีฐานะหน่อย เรียกต่างชาติ #อิหยังวะ,1
ชีวิตมนุษย์ ผ่านมาเพื่อพบเจอ ผมแค่แปลกใจ ที่พม่าปล่อยให้ปกครองตนเอง ทั้งที่เมืองอื่น พม่าไม่ปล่อยครับ,1
สวัสดีค่ะ อ ตอนนี้ รอบๆบ้าน..แย่ๆเลยค่ะ เคลียดแล้วละค่ะ จาก บ้านไป ศาลายา ไม่ไกล และ จากบางใหญ่ ก็ไม่ไกล...มีญาติ อยู่ที่ บางเสาธง ตึกที่เค้าล้อม ลวดหนามไว้ พม่า เยอะมาก ทั้งตึกเลย.(.เคยไปดูตลาด ตอนเปิดใหม่เพื่อวางสินค้า แต่ ไม่ตกลง กัน )น่ากลัวจริงๆ..แถวบ้าน ก็มี แรงงานพม่าด้วยค่ะ พรุ่งนี้ว่าจะ โทรไป สน ให้เค้าตรวจสอบดูค่ะ,0
พม่าบุก ถึงเมืแงหลวงแล้ว. ตายๆ,1
เอาหน่วยแม่นปืนไปซุ่มรอ เห็นกำลังหลบหนียิงทิ้งแม่งเลย ทำมาดียุแล้วคนไทย มากรุงแตกเพราะพม่า,1
เอ็นดูพม่า ระวัง...ตายกันทั้งจังหวัด(ครึ่งประเทศ),1
