text,label
"จังหวัดกระบี่บูรณาการตรวจแรงงานและเฝ้าระวังการแพร่ระบาดโรคติดเชื้อไวรัสโคโรนา 2019 ในเรือประมง วันที่ 22 ธ.ค.63 นายสิทธิพล เมืองสง ผู้อำนวยการศูนย์ป้องกันและปราบปรามประมงทะเลกระบี่ กองตรวจการประมง กรมประมง พร้อมเจ้าหน้าที่ประจำเรือ นำเรือตรวจประมงทะเล 606 ร่วมตรวจบูรณาการแรงงานและเฝ้าระวังการแพร่ระบาดโรคติดเชื้อไวรัสโคโรน่า 2019 ตามแผนงานยุทธศาสตร์จัดการปัญหาแรงงานต่างด้าวและการค้ามนุษย์ โครงการจัดการปัญหาแรงงานต่างด้าวและการค้ามนุษย์ด้านการประมง กิจกรรมจัดการปัญหาแรงงานต่างด้าวและการค้ามนุษย์ด้านการประมง พื้นที่จังหวัดกระบี่ โดยมีนายอนุวรรตน์ โหมดพริ้ง รองผู้ว่าราชการจังหวัดกระบี่ เป็นประธานร่วมตรวจฯ กับหน่วยงานต่างๆ ซึ่งประกอบด้วย เจ้าหน้าที่จากสำนักงานสวัสดิการและคุ้มครองแรงงานจังหวัดกระบี่, สำนักงานประมงจังหวัดกระบี่ ,สำนักงานเจ้าท่าภูมิภาค สาขากระบี่, สำนักงานประชาสัมพันธ์จังหวัดกระบี่,กรม ร ๒ พล.นย. , สำนักงานตรวจคนเข้าเมืองจังหวัดกระบี่, สำนักงานแรงงานจังหวัดกระบี่, สำนักงานจัดหางานจังหวัดกระบี่, ศูนย์ควบคุมความมั่นคงท่าเรือจังหวัดกระบี่, สำนักงานประกันสังคมจังหวัดกระบี่ และศูนย์อำนวยการรักษาผลประโยชน์ของชาติทางทะเลจังหวัดกระบี่ ผลการตรวจสอบเรือประมง จำนวน 6 ลำ ประกอบด้วยคนไทย 188 คน, พม่า 52 คน, อื่นๆ 7 คน รวมทั้งสิ้น 177 คน จากการตรวจสอบเอกสาร/ใบอนุญาต/เครื่องมือประมง คนประจำเรือถูกต้องไม่พบการกระทำผิด และประชาสัมพันธ์มาตรการป้องกันการแพร่ระบาดของโรคติดเชื้อไวรัสโคโรนา 2019",0
พวกลักลอบเข้ามาพม่ามันก็ช่วยกันแอบซุกกันไว้ ไล่กลับไปตายบ้านมันให้หมด aecแผนขายชาติชัดๆ,1
ขอให้พี่น้องชาวพม่า และชาวไทยร่วมมือกับภาครัฐ ในการให้ความร่วมมือ รับรองหมอไทยเอาอยู่ อย่าหนีอย่าแพร่เชื้อให้ระบาด ให้ยากแก่การควบคุมนะครับ,0
ยุคนี้พม่าไม่ต้องใช้อาวุธเข้าตีวงในของไทยจนทุกฝ่ายสับสนไม่หมดแล้ว จะฆ่าก็ไม่กล้า จะไล่ออกไปก็เสียดายค่าหัวคิว ชาวพม่ากำลังแห่จองบูชาพระรุ่นนี้กันยกใหญ่ รุ่นพม่าโควิด เจ้าหน้าแถบชายแดนจ้องหาพระรุ่นนี้กันตาเป็นมันเลย,0
เริ่มผวาอิกรอบโควิดหนักเลยรอบนี้ทีีสำคัญพม่าเต็มทุกพื้นที่นายจ้างบางคนก็ยังไม่พาตรวจให้ทำงานปกติมันเสี่ยงจริงๆกับคนรอบข้างบางทีเพื่อนฝูงพม่ามาหาแบบนี้เข้าๆออกๆต้องเข้มงวดกับเรื่องต่างด้าวละรัฐบาล,0
ตายห่ากันหมดเที่ยวนี้แหล่ะ พม่า หัว ค,1
ส่งพม่ากลับประเทศพม่าให้หมดตอนที่ไทยระบาดมันอยากกลับประเทศมันรู้ทุกคนกลัวแต่ตอนนี้ประเทศกูก็กลัวพวกมึงเหมือนกันอย่ามาสร้างความเดือดร้อนกับประเทศกูเลย,1
อย่ารังเกียจกันเลยค่ะ พม่าก็คนเหมือนกัน ไม่มีใครอยากให้เรื่องแบบนี้เกิดหรอกค่ะ ลองคิดกลับกันถ้าเป็นคนไทยที่นำเชื้อไปแพร่ประเทศอื่นแล้วโดนเขารังเกียจบ้างคุณจะรุ้สึกยังไง ใจเขาใจเรา สงสารเขาเถอะค่ะ,0
ให้พม่ากลับบ้านให้หมดทำได้ไหมล่ะ,1
ชิบหายไปกันหมดแล้วจ้า ถ้าเข้ามาแบบผ่านstate quarantine ก็จะไม่มีเรื่องนี้เกิดขึ้นเลยถ้ามีจิตสำนึกสักหน่อย มึงไม่กลัวตายแต่คนอื่นเค้ากลัว ถ้ามีคนตายจากเรื่องนี้คนที่หนีเข้ามาจากพม่ามึงนั้นแหละที่ฆ่าเค้า,1
ทีเฝ้าชายแดนระวังพม่าเข้ามา เจ้าหน้าที่ไม่พอ ทีมาจับที่นี่ทำไมมากันเยอะจัง เคัาช่วยพี่น้องขายกุ้ง มันก็เป็นเรื่องที่ดี รู้จักแยกแยะบ้างสิ จะจับอย่างเดียว ดูเหตุ ดูผลเค้ามั่ง,0
ควยคนไทยตกงานเป็นล้านไม่มีงานทำ ไม่จ้าง แต่ไปเอาพม่ามาทำงาน อยากให้คนไทยอดตายหรอ แล้วให้พวกต่างดาวมาอยู่,1
ทำดีแทบตาย?สุดท้าย?พม่า?มาทำพัง?,1
ผมมีเพื่อนพม่าครับเป็นกำลังใจให้ชาวพม่านะครับ,0
คาเซอิ โอบะกิ คนไทยแท้ๆที่ถูกแบ่งแยกดินแดนไปก็มีเยอะเช่นคนไทยใหญ่ไม่เห็นรัฐบาลไหนนึกถึงและเข้าไปช่วยเหลือและนำเค้ามาทำงานและดูแลพวกเค้าเลย ถ้ารัฐบาลไทยจะรอให้รัฐบาลพม่าส่งแรงงาน MOU เข้ามา รัฐบาลพม่าก็ต้องเลือกเอาแต่คนพม่าของเค้า คนไทยใหญ่ไม่มีหวังหลักค่ะ ตังแต่ไหนแต่ไรมาละ เดี๋ยวนี้พม่าจะมาครองเมืองไทยอยู่แล้วค่ะ แถมเดี๋ยวนี้ยังมีเพจที่แอบอ้างว่าเป็นคนไทย แต่หน้าตาและโคตรเหง้าสายเดี่ยวไม่ใช่ไทยละ ยังมีน่ามีวิจารรัฐบาล ไม่ดีโน่นนี่นั่นอีก แบบนี้มันเข้ามาก่อกวนชัดๆ ไม่แน่รัฐบาลเค้าอาจสอนให้มาก่อกวนในประเทศไทยก็เป็นได้ค่ะ อยากให้ระหวังให้ดีให้พวกพม่านี้ เวลาประเทศเราแข็งแกร่ง พวกมันจะทำตัวอ่อนแอมาขอความช่วยเหลือ แต่เมื่อไหร่เราอ่อนแอพวกมันพร้อมกันจะเหยียบซ้ำเราได้ทุกเมื่อเลยนะค่ะ,0
อีพวกนี้ดื้อมึนจริงๆนะ แมกส์มันก็ไม่ใส่กัน ถ้าฆ่าคนตายแล้วไม่ผิดกฏหมายจะฆ่าพม่านี่แหละเสียงดังก็ดังพูดไม่รู้ภาษาคน มึนอย่างเดียว,1
ทำไหมชอบมาสั่งแต่ประชาชน. สั่งรัฐบาลก่อนไหมคับหมอ. บอกให้มันปิดประเทศก่อน. รักษาคนในประเทศก่อนแล้วก็ขนพวกพม่าให้กลับประเทศตัวเองไปก่อน ดูแลคนไทยก่อนเพราะคนไทยไม่ใช่ต้นเหตุกับโควิดรอบนี้ (ผมก็ไม่ยากโทษพี่น้องชาวพม่านะ แต่ต้นเหตุมันก็มาจากพวกพม่าจริงๆๆถ้าอยากจะแสดงความรับผิดชอบ ขอแนะนำให้กลับประเทศท่านไปก่อน. เหตุการดีขึ้น ค่อยกลับมาทำไหม,0
ยิงทิ้งให้หมดพม่า,1
ไม่มีทางทำมาหากินแล้ว.หรอก็ตายๆไปซะ.อย่ามาทำให้คนอื่นเดือดร้อน?แค่นี้พม่าก็จะเต็มประเทศไทย.เดินไปทางใหนมีแต่พม่า.ไอ้ควาย,1
มันจะเนี่ย ช่วยกั๋นเป็นหู เป็นตา ให้เจ้าหน้าที่ตวยเน้อ .....ที่จังหวัดชลบุรี ชาวเมียร์มา หนีมาจากสมุทรสาคร 3 คน ไปหาเพื่อนที่ห้องแถวบริเวณพันเสด็จนอก ชลบุรี ซึ่งเป็นพม่าด้วยกัน ขณะนี้ทางเจ้าหน้าที่ได้ล็อกตัว ไปตรวจคัดกรองหาเชื้อโรคแล้ว ---- cr.ประภาส มหาเมฆ  ไม่พลาดข่าวเพจนี้ CM108 การตั้งค่าการติดตาม - รายการโปรด คุณจะเห็นโพสต์แสดงอยู่สูงกว่าในฟีดข่าวของคุณ รับรองไม่พลาดเรื่องราว-ข่าวสารจากเพจนี้ ---------  ข่าวย้อนหลัง : CM108.com  กลุ่มเฟซบุ๊ก CM108 : https://www.facebook.com/groups/cm108/  LINE CM108 : line.me/ti/g2/OGUXX9M6K3  Instagram : instagram.com/chiangmai108/  YouTube : youtube.com/channel/UCCPu1rZLTp9Y0eMlrTStULQ/  Tiktok : www.tiktok.com/@cm108.com,0
โอ้ย!!!!!ๆๆๆๆเนอะพักหัวขวานเอ้ยไปตายพม่าเลย,1
ดีมากครับคุณหมอเป็นอีกหนึ่งกำลังใจให้ครับสู้ๆนะพี่น้องเราไม่ว่าจะเป็นพม่าลาวเขมรก็เป็นพี่น้องกัน,0
ตายทั้งโรงงานหล่ะทีนี้ก฿ไม่อยากนึกภาพนั้นจริง พม่าแมร่งโครตเห็นแก่ตัว,1
ผมเคยอยู่ระนอง ไปทำเรือประมงหาปลาในน่านน้ำพม่า เดินในถนนปากคลอง แถวท่าเรือประมงตอนกลางคืน ถ้าเดินไม่ดีถูกพม่าตีตายครับ พอมีเรื่องขึ้นมามันก็หนีลงเรือหางยาวไปเกาะสองแล้ว พวกมันหาว่าคนไทยชอบเอาเปรียบ แต่พวกมันบางคนเบิกเงินล่วงหน้าเเล้วหนีก็เยอะ ทำอะไรมันไม่ได้หรอก,1
ใกล้บ้าละคนพม่าก็คนนะเขาไม่ได้เป็นทุกคนไม่มีใครอยากเป็นเห็นใจกันเอาไว้,0
"*PTL-EV02* *ทัวร์รถตู้ อุดรธานี 3 วัน 1 คืน* *วังนาคินทร์คำชะโนด* เดินทาง ม.ค. - มี.ค. 64 ราคาเริ่มต้น 3,988 บาท วัดป่าภูก้อน วัดผาตากเสื้อ วัดโพธิ์ชัย (หลวงพ่อพระใส) ตลาดท่าเสด็จ วังนาคินทร์คำชะโนด พิพิธภัณฑ์เมืองอุดรธานี โปรแกรม : shorturl.at/BDIS6 ?????????????????????? ขายตั๋วเครื่องบิน รับจัดกรุ๊ปทัวร์ กรุ๊ปส่วนตัว กรุ๊ปดูงาน ประกัน เดินทาง ขอวีซ่า ทิ้งเมลล์ หรือ INBOX ขอรับรายละเอียดเพิ่มเติมได้เลยนะ โทรสอบถามรายละเอียดเพิ่มเติม หรือ ขอรับโปรแกรมได้ที่ เจน 094-196-9459 LINE : jane_pimnapat ใบอนุญาติ ททท.11/08772 https://www.facebook.com/goodbuddytour/ https://www.facebook.com/MineJourneyTravel/ ?#ทัวร์ต่างประเทศ #อัพเดท #ทัวร์สุดคุ้ม ?#ทัวร์จัดเต็ม #ทัวร์ลดราคา #ตั๋วหลุด?#ทัวร์ดีดี #ทัวร์ถูกมาก #เที่ยวทั่วโลก #ทัวร์น่าเที่ยว#ปรับราคา #SALE ?#PROMOTION #จัดกรุ๊ปส่วนตัว? #จองตั๋วเครื่องบิน ?#ทัวร์ไฟไหม้ ?#โปรไฟไหม้ ? #ทัวร์ยุโรป #ทัวร์พม่า?#ทัวร์ตะวันออก#ทัวร์เกาหลี#ทัวร์ญี่ปุ่น?#ลดราคา ?#ลดจัดหนัก#ทำ",0
ถ้าล๊อคเมือง พ่อค้าแม่ขาย ชาวบ้านก็ตายเพราะเศรษฐกิจ ... ยิ่งช่วงนี้ส่งท้ายปีเก่า ต้อนรับปีใหม่ คนไทยหลายคน อยากฉลอง อยากเที่ยว อยากกลับบ้าน เม็ดเงินก็ยังพอหมุนเวียน ถ้าห้าม เดี๋ยวมีกระแสต่อต้าน ไปรวมกับม๊อบอีก หลังปีใหม่ ก็ค่อยมาแก้เป็นจุดไป ผู้ติดโควิดไม่แสดงอาการ ก็ไม่ป่วย ไม่ต้องเข้าโรงพยาบาล ... ทางรัฐคงมองว่า สามารถหายได้เอง บางรายกินพาราฯ ก็หาย ? ตรวจแบบแยงจมูก ต้นทุนค่าตรวจ 2 พันบาท รัฐคงไม่ค่อยมีงบ ... อยากตรวจไปตรวจเอง เสียเงินเอง ในต่างประเทศ หลายประเทศเคยไม่ปิดประเทศ เพื่อกระตุ้นเศรษฐกิจ ... แต่สุดท้ายพัง ยอดผู้ป่วยทะลักล้นเตียงโรงพยาบาล? หลายประเทศปิดประเทศ ให้คนในประเทศเที่ยว ใช้จ่ายกันเอง และค่อยๆตรวจปูพรมในประเทศ ? ประเทศไทย ต่างชาติเคยชมว่า รัฐบาลควบคุมได้ดี หากเลขพุ่ง คงกลัวเสียหน้า ? ไม่ตรวจ ไม่เจอ ไม่พบ ... และอาจเป็นโชคดีของคนไทย ที่มีภูมิร่างกายดี กดไวรัสโควิดไว้ไม่ให้แสดงอาการ - แต่ มาเจอไวรัสสายพันธุ์อินเดีย ผ่านมาทางแรงงานพม่า ... ติดง่าย แพร่เร็ว เลยออกอาการ ? อังกฤษกำลังเจอวิกฤตไวรัสกลายพันธุ์ แสดงอาการรุนแรง.... หลายประเทศในยุโรป ประกาศห้ามเที่ยวบินจากอังกฤษเข้าประเทศ แต่ของไทย ยังคงมีเที่ยวบินจากต่างประเทศ พาคนไทย และต่างชาติกลับเข้ามาทุกคืน นึกๆ ดูก็สนุกดีนะครับ ทั้งไวรัสอู่ฮั่นดั้งเดิมที่แฝงอยู่ในไทย มาเจอสายพันธุ์อินเดีย ไหนจะมีตัวกลายพันธุ์แรงๆจากอังกฤษ สุดท้ายทำอะไรพี่น้องคนไทยไม่ได้ จะมีก็แต่ผู้ที่อ่อนแอ และป่วยอยู่ก่อน ถึงแสดงอาการ,0
อุเทน รู้ธรรม ทุกวันนี้ยังไม่มีคนมารับผิดชอบเรื่องที่ปล่อยให้พม่าลักลอบเข้ามาจากช่องทางธรรมชาติและไม่กักตัว ทั้งที่ประเทศเรามันกำลังจะดีขึ้น กลายเป็นตอนนี้แย่หมด น่าเห็นใจประชาชนตาดำๆแบบเราจริงๆ ค่ะ,0
หากมาแรงขนาดนี้ผมคงตกงานเป็นแน่แท้...ปากเกร็ดครับชาวพม่าเยอะด้วยสิ...ตายแน่กรู,1
ครั้งนี้ใหญ่หลวงนักพม่าจะตีไทยตายห่าอยู่แล้ว????,0
นักแสดงชาย อาร์ต พศุตม์ ได้ลงมือเข้าครัวทำผัดกะเพรา 352 กล่อง เพื่อนำไปแจกให้กับแรงงานชาวเมียนมา ที่ถูกกักตัวที่สนามกีฬาจ.สมุทรสาคร ที่กำลังได้รับผลกระทบอยู่ในขณะนี้ . ซึ่งหนุ่มอาร์ต ได้โพสต์คลิปในอินสตาแกรมส่วนตัว พร้อมเขียนแคปชั่นว่า วันนี้ไปให้แรงงานพม่าที่ ที่ถูกกักตัวสนามกีฬาสมุทรสาครคับ #ทำดีสร้างภาพ #โควิท #covid_19 ซึ่งมีแฟนๆเข้ามาคอมเมนต์ ชื่นชมในความใจดีมีน้ำใจช่วยเหลือเพื่อนมนุษย์ในยามประสบภาวะวิกฤต . ภาพจาก IG: @art_phasut98 #อาร์ตพศุตม์ #อาร์ต #พศุตม์บานแย้ม #โควิด19 #โควิด,0
เกิดหรือยังเปิดประตูเทืองให้พม่ามาฆ่าคนไทย-ตอนนี้ก็เหมือนๆกัน,0
พม่าส่งมันกลับเลยเอาไวัไหัตายทังเมืองหลือไง,1
สู้ๆทุกคน อดทนหน่อย พ่อเขาเป็นพม่าก็จริง แต่ก็เป็นมนุษย์เหมือนเราไหม อีกอย่างถ้าเขาไม่รักประเทศไทย เขาคงไม่มายืนอยู่จุดจุดนี้หรอก น้ำใจคนไทย มันหายไปไหนหมด ถึง เขาจะเป็นยังไง ผมเชื่อว่าคนไทยทุกคน จะไม่มีวัน ทิ้งกันแน่นอน สู้ๆ รักพี่ ที่อยู่พม่า ผมเอาใจช่วย????????,0
พม่า อะ กักตัว แล้วปล่อยให้มัน ตายไปเลย ชอบมัว ดีนัก,1
Juneny Tanyaprach Kiatchirakavin นี่ผมจะบอกอะไรให้ขำๆนะมีพี่ที่ผมรู้จักเป็นลูกค้าผมเขาได้เมียเป็นคนลาวเขาบอกเลยว่าเพื่อนเมียเขาก็ลักลอบเข้ามาเพราะถ้าเบ้าปกติ โดนกักตัว 14วัน ถ้าอย่างพม่าผมก็ไม่แปลกใจครับ โลกไม่ได้สวยครับถ้าให้เงินผมนำแรงงานต่างด้าวเข้าประเทศผมก็เอาครับมีใครบ้างไม่เอาเงิน แล้วอีกอย่างนะงานบางประเภทคนไทยไม่ทำครับ ผมคนนึงก็ไม่ทำ ยกตัวอย่าง โรงไก่ตรง ม.กรุงเทพฯ ก็มีแต่แรงงานต่างด้าวครับ มันเหม็นมากคุณจะทำป่าวละ,0
