text,label
จัดการขั้นเด็ดขาดด้วยนะคะ ใช่เอาแต่ออกกฏนั้น กฏนี้ออกมาทุกวัน แต่ทำอะไรบ้างไหมค่ะ คนไทยป้องกันแทบตาย แต่ยังมีคนไทยบางกลุ่ม เห็นแก่ตัวเอาแรงงานต่างด้าวเข้ามาทำงาน แล้วใครที่ไหน ตัดการได้ล่ะคะ เศรษฐกิจกำลังจะดีขึ้น พอจะลืมตาอ้าปากได้ แต่ด้วยคนไร้จิตสำนึกแค่บางกลุ่ม สร้างความเสียหายทั้งบาง มาดูแถวบางขุนเทียน14บางบอน1-5 พม่าเต็มเมืองค่ะ ถนนสกปรก บ้านเช่าทั้งกลิ่นเหม็น ทั้งบ้วยหมากเกลี่ยนถนน สกปรกสุดๆ ถามเถอะคะใครจะจัดการได้คะ คนไทยกลัวแต่พม่าเข้ามาเต็มเมือง เอ้อ!!!,1
ถ้าเป็นเรื่องจริงสงสารจังเราเป็นพม่าแต่หน้าตาเหมือนคนจีนเลยไม่โดนเหมือนเขาเป็นกำลังใจให้คนพม่าทุกคนขอให้ตั้งใจทำงานสักวันกล้บบ้านเรากันนะไม่ต้องอยู่ให้คนไทยบ้างดูถูกเพราะเราลูกมีพ่อมีแม่เหมือนกัน,0
สงสารคุณหมอและพยาบาลต้องมารักษาโควิตให้คนไทยอีกหลายๆคนที่ติดโควิตระบาดรอบสองรักษาให้คนไทยไม่พอยังต้องมารักษาพวกพม่าในเงินภาษีคนไทยอีกแต่คนไทยติดโควิตต้องเสียค่าตรวจเองค่ารักษาเองคนไทยเป็นหมาพม่าเป็นคนประเทศกูมีค่ะพม่ารักษาฟรีกินฟรีอยู่ฟรีสบาย.ห.ไปเลยค่ะคนไทยหาแดกเองๆพม่าฟรีไสตร์สบายๆทุกอย่างๆประเทศนี้ช่างไม่มีความยุติธรรมเลยค่ะ,0
ถ้ามาณ.เพลานี้จะมาพากันติดโรคทั้งไทยทั้งพม่า...จะคุ้มไหมเสียเงินรักษา..กับเงินที่เสียค่าหัวไปแล้วจะมาเสียเพิ่มนะเพราะติดโรคทำงานก็ไม่ได้...อยู่ประเทศยูไปก่อนเถอะ...คงไม่อดตายหรอกพม่ารวยจะตาย...,1
แฮ็ค คับ พม่าขาย ๆยังเดียวคงจะเป็นพม่า มัวถึงกับ เดือดร้อนตัว เหนอะ แล้วก็พม่าก็รักเล็กขโมยน้อย ฆ่านายจ้างตายมาหลายมากมาย เป็นอีไอ้แอบ รักลอบ เข้ามาในไทย เอกสารก็ไม่มี ส่วนใหญก็เปอีไอ้แอบ คนไทยทั่วประเทศทำงานหนักทำงานๆ ถ้าจะขาย ก็ของคนบางคน นะ แต่เอาที่เห็นๆมา พวกพม่า แอบขายๆๆๆๆๆ ก็มีหน่า อย่าหาว่าแต่คนไทย คนบางคนเลย ฉันเองอายุก็ปาน จะ 70 แล้ว บางทีเดินไป ซื้อกับอะไรเดินผ่าน ยังได้ยินภาษา พม่า เลย อย่ามา ทำเป็นคนไทยขายๆอะไรๆ ไม่ได้ไปหนัก กระหัวพ่อใครๆ ถ้าคนไทยยางคนเขาจะขาย ก็เรื่องของเขา แต่ที่แก่ พูดมาอย่าดัดจริต เป็นพม่า จะเป็นไทย จะเป็นไทย เป็นพม่ามาอยู่บ้านเมืองเขา ต้องระวังปากบ้างนะ อย่า รีอ่าน โกหกตอแหล เพราะว่าพม่าเป็น อีแอบ มากมายอย่าให้บอกนะว่าที่ไหน ไม่ อยาก สร้างสถานการณ์ เพียงอยากช่วยเหลือ คนไทยด้วยกันที่ตกงานและ โควิดที่พวก พม่าเอามา ปล่อยให้ประชาชนคนไทยทั่วต้องรับผิดชอบรับกรรม อยู่นี่งัย อย่าเสือกสะระแหน่ปั่นป่วนเห่าหอนไปวันๆ กลับไป พม่าได้แล้ว,1
พม่าเผากรุงอีกครั้ง,1
จากคนเหนือนะคะพม่าก็เลือกงานอยู่นะคะ หาคนงานยากค่ะ ค่าแรงถูกก็ไม่เอา ต้องค่าแรงได้มากกว่าคนไทย ไปทำงานอะไรต้องเอากลุ่มเพื่อนเค้าไปด้วยค่ะ หยุดบ่อยด้วยค่ะทุกวันพระใหญ่ แต่ลูกจ้างคนไทยไม่ค่อยหยุดค่ะ นอกจากเจ็บป่วย ลาตามกฏแรงงาน มองให้มันกว้างๆค่ะ ที่นี่คนกวาดถนน ทำถนนก็ใช้แรงงานไทยปนกับพม่าอยู่ค่ะ,0
ขี่ควายสุ้พม่ามึงตาย,1
มันจะมาฆ่าคนไทยแน่พม่าคุ้มไม่ยุ่หรือที่คุ้มชุมนุมประท้วงใช้ความรุนแรงได้นี้เอามาตการเข้มจัดการไปเลยกบพวกพม่า,1
#ระยองรอด หลังนาวาพร้อมลูกเรือ35 คนจากมหาชัย ผลตรวจหาเชื้อโควิด-19 เป็นลบ พ่อเมืองวอนชาวระยองอย่าตื่นตระหนก ให้ตระหนักในการป้องกันตัว ไม่ประมาท และการ์ดอย่าตก.... ////เมื่อเวลา 15.00 น.วันที่ 21 ธ.ค.ที่ห้องประชุมศาลากลางจังหวัดระยอง ต.เนินพระ อ.เมือง จ.ระยอง นายชาญนะ เอี่ยมแสง ผู้ว่าราชการจังหวัดระยอง นายแพทย์สุนทร เหรียญภูมิการกิจ นายแพทย์สาธารณสุขจังหวัดระยอง ร่วมแถลงถึงสถานการณ์และมาตรการควบคุมการป้องกันโรคโควิด-19 กรณีการแพร่ระบาดที่จังหวัดสมุทรสาคร ซึ่งมีเรือประมง ก.โชคบุศราพรชัย 444 ของจังหวัดระยอง พร้อมลูกเรือ จำนวน 37 คน สัญชาติไทย 5 คน พม่า 30 คน และลาว 2 คน เดินทางจากเขื่อนกันคลื่นมหาชัย จ.สมุทรสาคร มาเทียบท่าที่แพปลาใน ต.ปากน้ำ อ.เมือง จ.ระยอง เมื่อเวลา 05.00 น.วันที่ 19ธ.ค.ที่ผ่านมา หลังทราบข่าวทีมเจ้าหน้าที่สาธารณสุข ลงพื้นที่สอบสวนโรคและเก็บตัวอย่างหาเชื้อจากลูกเรือ 35 คน ผลตรวจยืนยันเป็นลบ และให้ลูกเรือทั้งหมดกักตัวอยู่บนเรือ ส่วนลูกเรืออีก 2 คน ได้เดินทางกลับไปที่จังหวัดสมุทรสาคร จึงแจ้งให้เจ้าหน้าที่ติดตามตัวแล้ว ด้านนายชาญนะ เอี่ยมแสง ผู้ว่าราชการจังหวัดระยอง กล่าวว่า มีประชาชนที่ได้รับทราบข่าวและประกาศของจังหวัดระยอง กรณีเดินทางไปตลาดเสี่ยงในจังหวัดสมุทรสาคร เข้ามารายงานตัวและขอคำปรึกษาทางโทรศัพท์ 53 ราย และมาขอตรวจที่โรงพยาบาลระยองเพิ่มอีก 10 ราย ผลตรวจหาเชื้อไม่พบ นอกจากนั้งมีประชาชนที่เดินทางไปตลาดกลางกุ้งมหาชัยจังหวัดสมุทรสาคร 2 ราย เก็บตัวอย่างส่งตรวจหาเชื้อแล้วผลตรวจไม่พบเชื้อเช่นกัน อย่างไรก็ตามขอให้ชาวระยอง ได้ร่วมใจเระวังและตื่นตัวกับสถานการณ์ตลอดเวลา การแพร่ระบาดของโรคโควิด-19(ระบาดรอบใหม่)ขอให้ป้องกันตัวเอง อย่าตื่นตระหนกกับเหตุการณ์ที่เกิดขึ้น และขอให้ตระหนักในการป้องกันตัวเอง สวมหน้ากา/ล้างมือ/เว้นระห่าง/ติดตามข่าวสารอย่างต่อเนื่องจากเหตุการณ์ที่เกิดขึ้นไม่ประมาท การ์ดอย่าตก ส่วนมาตรการที่เกี่ยวกับแรงงานต่างด้าวที่เข้ามาใหม่ตั้งแต่วันที่ 1 ธ.ค.เป็นต้นไป ต้องรายงานตัวกับสาธารณสุขทุกคน เพื่อดำเนินการคัดกรองโรคป้องการการแพร่ระบาด ส่วนกรณีการจัดงานรื่นเริงต่างๆ โดยเฉพาะงานวันสมเด็จพระเจ้าตากสินมหาราช หรืองานปีใหม่,0
ตรวจเจอโควิดถ้าเป็นพม่าปล่อยแม่งให้ตายไม่ต้องไปรักษามันรักษาแต่คนไทยพอ,1
@teeratr ไอแม้วกับไอทอนแน่ๆเลย ตอนเสียกรุงครั้งที่2มันเคยใช้วิธีนี้ ให้อีช่อดูต้นทางสั้งไอบุตรเปิดประตูให้พม่าเข้ามาเผา เลวจริงๆ,0
ทำเหี้ยอะไรกันบ้างไอ้นายกควาย ไอ้รัฐมนตรี กช ญาติพี่น้องกูในจังหวัดนั้น เอาต่างด้าวเข้ามาเพื่อทำให้คนในประเทศกลายเป็นคนถูกรังเกียจ cp มึงควรเลิกเห็นแก่ตัวเอาแรงงานกลับประเทศไปก่อน มึงควรเบิกผลิต ปิดโรงงาน เลิกอ้างว่างานแบบนี้คนไทยไม่ทำ กูก็เคยทำโรงงานมึงตั้งแต่ยุคไม่มีพม่า แต่เรื่องผลประโยชน์ที่มึงขัดกับค่าแรงขั้นต่ำ300 มึงจึงเปลี่ยนหางไปเอาเผด็จการ เลียทุกรัฐบาล เพื่อผลประโยชน์ตัวเอง ออกข่าวทำดีเพื่อสังคม แต่กูว่าเพราะมึงเลย ไอ้โรงงานเฮงซวย,0
แอร์อัดจะตาย มีแต่พม่าอยู่,1
พวกชักศึกหรือสมัยโบราณเรียกพวกไส้ศึก เปิดประตูเมืองให้พม่าลักเข้าเมืองพร้อมอาวุธร้ายแรง คืออาวธเชื้อโรค พวกนี้ต้องยิงเป้าอย่างเดียวครับ,0
พม่าเขาก็ไมอยากติดโรคนี้หรอกแต่เกิดขึ้นแล้วไม่ใช่ด่าเขารัวเกียจเขานึกถึงพี่น้องเองมั้งตะถ้าเกิดขึ้นกับพี่น้องเราเขาทํากับเราละคิดถึงใจเขาใจเรามั้งนํ้าใจมีกันมั้งตะ,0
ตายกันหมดเพราะพวกพม่า,1
พม่าทำงานที่.นึง แต่ พักอาศัย อีกแห่งนึง อย่ามองข้ามนะเจ้านาย และ ชาวพม่าวันหยุดเขามักจะไปทำบุญ ที่วัดครับ และไปเที่ยวหาญาติ รวมถึง พม่าที่ทำงานเป็นเด็กติดรถ แต่มีทีพักเดียวกับผู้ติดเชื่อ รวมถึง ล้งแกะกุ้ง.มีกระจ่ายทั่วจังหวัด,1
ว่ากันไป จะ จะหมอ ดูแลกันเอง อยู่ดี เห็นแก่เศษเงินให้ พวกพม่า มันเข้ามา สุดท้าย ก็ต้องรับ กันไป เบื่อฉิบหาย จะอดตายกันอยู่แล้ว,1
@political_drama ปิดประเทศ ดูแลตัวเองแทบตาย ทำตามนโยบายรัฐที่พวกมึงตั้งมาทุกอย่าง.. มาชิบหายกับไอ้พวกแรงงานพม่า ที่ลักลอบเข้ามา ประเด็นคือมันติดได้ไง ต้นตอมาจากไหน มึงยังใหคำตอบไม่ได้ ไหนๆก้อเป็น page ของรัฐบาลละ ช่วยหาคำตอบหน่อยนะ อย่าเอาแต่ปัญญาอ่อนไปวันๆ #โควิด19สมุทรสาคร #โควิดสมุทรปราการ,1
รบกวนหน่วยงานไปตรวจชุมชนคอนโดเพชรเกษม 114 มีพม่าเดินทางมาพักกับญาติ,0
น่าเศร้าที่ฝ่ายกุมอำนาจยังคงดูเบาพวกอคม. เอาแต่ดุดาย ไม่ต่างกับทหารยุคกรุงศรีดูถูกพม่าว่า พวกมันต้องหนีน้ำหลาก สุดท้ายตายยกเมือง ถ้าไม่เปนไปตามนี้ฝ่ายมั่นคงต้องมาตามแก้ความเสียหายวุ่นวายที่เกิดจากพวกมันอีก เศร้า #หมดแรงเชียร์ลุง,0
ทุกด้านมีทั้งดีและไม่ดีจงอย่าเห็นคนอื่นมีค่าต่ำกว่าตัวเองคนทุกคนเสมอภาคไม่ว่าเขาเหล่านั้นจะมาจากที่ไหนเราเป็นเจ้าบ้านก็ควรรับเขาด้วยไมตรีจิตเขามาก็เพราะเพื่อปากทอ้งเพื่ออานาคตของครอบครัวไม่มีใครอยากเกิดเรื่องแบบนี้สิ่งที่เกิดขึ่นเราต้องมองในภาพรวมว่าปัญหามันเกิดจากตรงไหนความเอาใจใส่ของรัฐดีพอหรือยังทำมัยถึงเกิดปัญหาแรงงานหนีผ่านมาและระบบคัดกรองทำมัยไม่ดีนี่คือสิ่งที่เราควรพูดถึงไม่ใช่พี่น้องแรงงานไม่มีใครรู้ว่าจะเกิดการระบาดรอบสองแล้วทีรัฐปล่อยคนระดับวีไอพีแข้ามาแล้วเป็นโรคติดต่อทำมัยไม่พูดถึงทุกอย่างเกิดจากความหละหรวมของรัฐควรออกมารับผิดชอบไม่ใช่ผักความรับผิดชอบให้กับประชาชนหรือแรงงานต่างชาติ..เขาไม่ควรถูกเรียกแรงงานต่างด่าวด้วยซ้ำไปเขาควรถูเรียกว่าแรงงานข้ามชาติที่ประเทศใหญ่เขามาทำมาหากินในชาติมาทำผิดกฏหมายมาเป็นมาเฟียทำมัยเราเรียกคนกลุ่มนี้ว่าชาวต่างชาติ..ทำมัยไม่เรียกแรงงานชาวพี่น้องเพื่อนบ้านของเราใหเเหมือนกัน..ขอบคุณและขอเป็นกำลังใจให้พี่น้องชาวพม่าและทุกๆชาติในเพื่อนบ้านที่เข้ามาทำงานในไทยทุกคนครับ,0
แม่เรียม ขนมไทย อีกหน่อยคงติดโควิด และอดตายทั้งประเทศถ้าฉลาดแบบนี้ สู้พม่าไม่ได้มันฉลาดแกมโกง5555,1
@political_drama ปิดประเทศ ดูแลตัวเองแทบตาย ทำตามนโยบายรัฐที่พวกมึงตั้งมาทุกอย่าง.. มาชิบหายกับไอ้พวกแรงงานพม่า ที่ลักลอบเข้ามา ไอ้พวกเจ้าหน้าที่ก็ปล่อยปละละเลย รับเงิน แดกกันไป! ประเด็นคือมันติดได้ไง ต้นตอมาจากไหน มึงยังใหคำตอบไม่ได้ #โควิด19สมุทรสาคร #โควิดสมุทรปราการ #โควิด19 #รัฐบาลส้นตีน,1
