text,label
ใจเขาใจเรา ถ้าเราตกอยู่ในสถานะอย่างเขา เราจะรู้สึกอย่างไร เราคนไทยขึ้นชื่อว่ามีพุทธศาสนาเป็นศาสนาประจำใจ พระพุทธเจ้าทรงสอนให้เรามีเมตตาต่อสรรพสัตว์ ชาวพม่าที่เข้ามาทำงานในบ้านเรา เขาลำบากจึงดั้งด้นเข้ามาเมืองไทยเพื่อหางานทำเลี้ยงชีพ และหลายคนยังต้องเลี้ยงดูครอบครัวที่อยู่พม่าอีก พวกเขาอดทนทำงานเพื่อชีวิต เราอย่ารู้สึกรังเกียจชาวพม่าเลยครับ การช่วยเหลือผู้อื่นเป็นคุณธรรมที่ดีสำหรับทุกคน เราช่วยเขา เขาช่วยเรา ต่างฝ่ายต่างได้ประโยชน์สุข,0
ตามนั้น ถ้าไม่ยิงทิ้งรึว่าส่งกลับ โควิดพุ่ง,1
พยายามมากนะครับ เอามหาชัยกับ พี่น้องพม่าเป็นแพะให้ได้,0
ขายของพม่าค้างหนีหายไปหลายคนแล้ว(เพราะสงสารคำเดียว)ใครช่วยได้บ้าง,0
ปัญหาแรงงานพม่า ที่รัฐไม่เคยจริงจังในการแก้ปัญหา รู้ทั้งรู้พม่าระบาดหนักมาตั้งหลายเดือนแล้ว แรงงานพวกนี้ที่ลักลอบเข้าแบบผิดกฎหมายมีอยู่ตลอด ทำไมไม่เตรียมรับมือตรงนั้น กฎหมายก็อ่อนแอ คนเห็นแก่ได้บางคนอ้างปากท้องตัวเอง หาผลประโยชน์จากแรงงานเถื่อนพวกนี้เพื่อตัวเอง แต่มันไม่เคยคิดมันฆ่าคนไทยอีกกี่คน สำนึกไม่เป็นจริงๆ,1
เห?นแก่ตัว? จริงๆไม่อยากด่าพม่านะคะ? เพราะเค้าทำงานที่คนไทยไม่ทำ? แต่นี่เกินเยียวยาจริงๆคนพวกนี้? จับได้น่าจะยิงทิ้ง,1
นงนุช ลิ้มยิ่งเจริญ รู้เยอะเพราะอยู่หมอชิต สวนจตุจักรพม่าทั้งนั้น อตกก็เยอะ สี่มุมเมือง ตลาดไทยพม่านั้น มีทั้งบัตรเเละไม่มีถามว่าเจ้าหน้าที่มันก็รุ้ทำมัยยังปล่อยเพราะคนใหญ่คนโตมันค้ามนุษย์เองงัย ละพวกนี้มาใันก็ต้องหาห้องเช่าป่าว เหมือนคนไทยอะไปเเบบผิดกฎหมายก็มีเยอะเเยะ งี้ไม่มีห้องเช่าสงสัยได้นอนข้างถนน คนทำบ้านเช่าส่วนใหญ่ ก่อนเข้าเค้าขอดูพาสปอตอย่างเเรกอยู่เเล้ว ตำรวจอะมันจมูกดีมันรุ้ตรงใหนมีคนต่างด้าวมันชอบไปไถเอาตัวไป สน ได้เเล้ว5000 ขนาดมีบัตรด้วย เลวตั้งเเต่ตัวใหญ่ เหี้ยยันขี้ข้าค่ะจะบอกให้ เราอะต้องป้องกันตัวเองเอา,0
ไปตายซะพม่าระยำ,1
มีทุกที่แหละค่ามนุษย์เพิ่มสินก็มีเขตสายไหมแขกขายโรตีพาพม่าเขามา,0
แบบพม่าเผากรุงศรี,1
ยุคนี้พม่าไม่ต้องใช้อาวุธเข้าตีวงในของไทยจนทุกฝ่ายสับสนไม่หมดแล้ว จะฆ่าก็ไม่กล้า จะไล่ออกไปก็เสียดายค่าหัวคิว ชาวพม่ากำลังแห่จองบูชาพระรุ่นนี้กันยกใหญ่ รุ่นพม่าโควิด เจ้าหน้าแถบชายแดนจ้องหาพระรุ่นนี้กันตาเป็นมันเลย,0
ใกล้บ้าละคนพม่าก็คนนะเขาไม่ได้เป็นทุกคนไม่มีใครอยากเป็นเห็นใจกันเอาไว้,0
ถ้าล๊อคเมือง พ่อค้าแม่ขาย ชาวบ้านก็ตายเพราะเศรษฐกิจ ... ยิ่งช่วงนี้ส่งท้ายปีเก่า ต้อนรับปีใหม่ คนไทยหลายคน อยากฉลอง อยากเที่ยว อยากกลับบ้าน เม็ดเงินก็ยังพอหมุนเวียน ถ้าห้าม เดี๋ยวมีกระแสต่อต้าน ไปรวมกับม๊อบอีก หลังปีใหม่ ก็ค่อยมาแก้เป็นจุดไป ผู้ติดโควิดไม่แสดงอาการ ก็ไม่ป่วย ไม่ต้องเข้าโรงพยาบาล ... ทางรัฐคงมองว่า สามารถหายได้เอง บางรายกินพาราฯ ก็หาย ? ตรวจแบบแยงจมูก ต้นทุนค่าตรวจ 2 พันบาท รัฐคงไม่ค่อยมีงบ ... อยากตรวจไปตรวจเอง เสียเงินเอง ในต่างประเทศ หลายประเทศเคยไม่ปิดประเทศ เพื่อกระตุ้นเศรษฐกิจ ... แต่สุดท้ายพัง ยอดผู้ป่วยทะลักล้นเตียงโรงพยาบาล? หลายประเทศปิดประเทศ ให้คนในประเทศเที่ยว ใช้จ่ายกันเอง และค่อยๆตรวจปูพรมในประเทศ ? ประเทศไทย ต่างชาติเคยชมว่า รัฐบาลควบคุมได้ดี หากเลขพุ่ง คงกลัวเสียหน้า ? ไม่ตรวจ ไม่เจอ ไม่พบ ... และอาจเป็นโชคดีของคนไทย ที่มีภูมิร่างกายดี กดไวรัสโควิดไว้ไม่ให้แสดงอาการ - แต่ มาเจอไวรัสสายพันธุ์อินเดีย ผ่านมาทางแรงงานพม่า ... ติดง่าย แพร่เร็ว เลยออกอาการ ? อังกฤษกำลังเจอวิกฤตไวรัสกลายพันธุ์ แสดงอาการรุนแรง.... หลายประเทศในยุโรป ประกาศห้ามเที่ยวบินจากอังกฤษเข้าประเทศ แต่ของไทย ยังคงมีเที่ยวบินจากต่างประเทศ พาคนไทย และต่างชาติกลับเข้ามาทุกคืน นึกๆ ดูก็สนุกดีนะครับ ทั้งไวรัสอู่ฮั่นดั้งเดิมที่แฝงอยู่ในไทย มาเจอสายพันธุ์อินเดีย ไหนจะมีตัวกลายพันธุ์แรงๆจากอังกฤษ สุดท้ายทำอะไรพี่น้องคนไทยไม่ได้ จะมีก็แต่ผู้ที่อ่อนแอ และป่วยอยู่ก่อน ถึงแสดงอาการ,0
ส่งพม่ากลับประเทศพม่าให้หมดตอนที่ไทยระบาดมันอยากกลับประเทศมันรู้ทุกคนกลัวแต่ตอนนี้ประเทศกูก็กลัวพวกมึงเหมือนกันอย่ามาสร้างความเดือดร้อนกับประเทศกูเลย,1
ยิงแม่งให้หมดพม่า,1
พม่าลักลอบและพวกที่เห็นแก่ตัวผิดที่สุดค่ะ ขอประนามคนพวกนี้ มีบทเรียนแล้วไม่รู้จักจำ ทุกคนก็อยากมีงานมีเงิน แต่พวกนี้เปนพวกช้างเน่าตัวเดียวตายทั้งฝูง,1
"ผบ.ตร.ประชุมด่วนวางแผนรับมือโควิด พล.ต.ต.ยิ่งยศ เทพจำนงค์ โฆษก ตร.เปิดเผยว่า สืบเนื่องจากมีการตรวจพบประชาชนและแรงงานต่างด้าวในพื้นที่จังหวัดสมุทรสาครติดเชื้อโควิดจำนวนกว่าห้าร้อยรายนั้น พล.ต.อ.สุวัฒน์ แจ้งยอดสุข ผบ.ตร.ได้เรียกประชุมด่วนกรณีการตรวจพบการแพร่ระบาดโควิดในพื้นที่จังหวัดสมุทรสาคร พร้อมกำชับแนวทางการปฏิบัติในส่วนของสำนักงานตำรวจแห่งชาติ พล.ต.ต.ยิ่งยศฯ โฆษก ตร.กล่าวว่า วันนี้ ๒๐ ธ.ค.๖๓ เวลาประมาณ ๑๐.๐๐ น.พล.ต.อ.สุวัฒน์ฯ ผบ.ตร.ได้มีวิทยุสั่งการด่วนเรียกประชุม ศูนย์ปฏิบัติการแก้ไขสถานการณ์ฉุกเฉินด้านความมั่นคง สำนักงานตำรวจแห่งชาติ ณ ห้องประชุม ศปก.ตร.ชั้น ๒๐ อาคาร ๑ ตร. เพื่อสั่งสรุปสถานการณ์และกำหนดแนวทางการปฏิบัติในการแก้ไขปัญหาสถานการณ์โควิด โดยการเข้าควบคุมพื้นที่ร่วมกับหน่วยปฏิบัติอื่นๆ ในการสกัดกั้นการเข้าออกของบุคคลที่มีความเสี่ยงการแพร่ระบาดของโรค การสอบสวนโรค และการตรวจหาผู้ที่อยู่ในพื้นที่เฝ้าระวังพิเศษ โดยเนื้อหาการประชุมได้แก่ การรายงานสถานการณ์การแพร่ระบาดในภาพรวม, สถานการณ์การแพร่ระบาดในพื้นที่ จว.สมุทรสาคร และพื้นที่ใกล้เคียง ต่อมา พล.ต.อ.สุวัฒน์ฯ ผบ.ตร.ได้มีข้อห่วงใยอย่างยิ่ง ทั้งในส่วนของพี่น้องประชาชนและในส่วนกำลังพลตำรวจ โดยได้สั่งการในหัวข้อหลักๆ สามประเด็นได้แก่ การเตรียมความพร้อมด้านการปฏิบัติและการบริหารเหตุการณ์, ความพร้อมด้านกำลังพล และความพร้อมด้านงบประมาณ โดยมีสาระสำคัญ ดังนี้ -เตรียมความพร้อมในด้านการบริการประชาชน โดยการให้จุดบริการต่างๆ ที่จะต้องสัมผัสใกล้ชิดกับประชาชน เช่น ห้องรับแจ้งความ ฯลฯ ให้ดำเนินการตามมาตรการในช่วงโควิดอย่างเข้มข้น โดยให้สำนักงานแพทย์ใหญ่เป็นหน่วยหลักในการสำรวจความพร้อม และให้พื้นที่อื่นๆ ประสานงานกับสาธารณสุขพื้นที่ร่วมสำรวจ -สำรวจข้อมูลกำลังพล อุปกรณ์-วัสดุทางการแพทย์ ที่จะต้องดูแลผู้ใต้บังคับบัญชา ได้แก่ หน้ากาก เจลล้างมือ น้ำยา -สำรวจความพร้อมของสถานที่ราชการ ยานพาหนะ และที่พักตำรวจ ให้เป็นไปตามมาตรการการป้องกันโรค -ในการออกคำสั่งทางราชการต่างๆ โดยเฉพาะด้านสิทธิกำลังพลให้ดูแลให้เป็นไปด้วยความเรียบร้อย -ให้ทุก บช.ตรวจสอบพื้นที่รับผิดชอบว่ามีสถานที่เสี่ยงใดบ้าง ไม่ว่าจะเป็นสถานที่ชุมนุมหรือโรงงาน ศึกษาวงจรชีวิตของแรงงานพม่า เช่น การเดินทางของแรงงานไปตามสถานที่ต่างๆ โดยเฉพาะอย่างย่ิง ในพื้นที่สิบจังหวัดชายแดนภาคตะวันตก ได้แก่ กาญจนบุรี ชุมพร เชียงราย เชียงใหม่ ตาก ประจวบคีรีขันธ์ เพชรบุรี แม่ฮ่องสอน ระนอง และราชบุรี โดยให้ปรึกษาหารือกับสาธารณสุขในพื้นที่ เพื่อเตรียมการณ์ในด้านการสำรวจและการตั้งจุดสกัด หากทางรัฐบาลมีการยกระดับสถานการณ์ หรือผู้ว่าราชการจังหวัดเห็นว่าควรตั้งจุดตรวจ จะได้สามารถพิจารณาดำเนินการได้ทันที -การจราจรบางเส้นทางที่เกี่ยวข้องกับพื้นที่ที่มีความเสี่ยงเจ้าหน้าที่ตำรวจร่วมกับหน่วยงานที่เกี่ยวข้องอาจมีความจำเป็นจะต้องตั้งจุดตรวจเพื่อควบคุมโรค -ให้ระดับผู้บังคับการและรองผู้บังคับการ ต้องออกไปตรวจเยี่ยมผู้ใต้บังคับบัญชาอย่างใกล้ชิด โดยเฉพาะพื้นที่เสี่ยง และหากมีเหตุจำเป็นเร่งด่วนให้รายงานทางโทรศัพท์ทันที -ให้หน่วยงานในสังกัดสำนักงานตำรวจแห่งชาติงดการจัดงานปีใหม่ หรืองานรื่นเริงที่มีโอกาสเสี่ยงต่อการแพร่ระบาดของโรค ท้ายที่สุดได้กล่าวว่า ตำรวจพร้อมเป็นเครื่องมือสนับสนุนการทำงานของจังหวัด และหน่วยราชการที่เกี่ยวข้อง ในการควบคุมป้องกันโรคแก้ไขสถานการณ์โควิดในครั้งนี้",0
ไม่ต้องสงสาร ไม่ต้องเห็นแก่มนุษยธรรมแล้ว ส่งมันกลับให้หมด ใครไม่กลับ ยิงแม่งทิ้งเลย อยู่แล้วสร้างปัญหา #เลวทั้งพม่าทั้งคนพาเข้ามา,1
เกิดหรือยังเปิดประตูเทืองให้พม่ามาฆ่าคนไทย-ตอนนี้ก็เหมือนๆกัน,0
HW Win แต่มันไม่แฟร์ค่ะสำหรับคนไทยที่เราช่วยกันอดทนมาแทบตายตลอดเกือบปี? แล้วคิดว่าปีใหม่เราจะได้ลืมตาได้บ้างแต่ทุกอย่างล้มคลืนลงเพราะความเห็นแก่ตัวของคนบางกลุ่มและคนพม่าที่เข้ามา,1
สู้ๆทุกคน อดทนหน่อย พ่อเขาเป็นพม่าก็จริง แต่ก็เป็นมนุษย์เหมือนเราไหม อีกอย่างถ้าเขาไม่รักประเทศไทย เขาคงไม่มายืนอยู่จุดจุดนี้หรอก น้ำใจคนไทย มันหายไปไหนหมด ถึง เขาจะเป็นยังไง ผมเชื่อว่าคนไทยทุกคน จะไม่มีวัน ทิ้งกันแน่นอน สู้ๆ รักพี่ ที่อยู่พม่า ผมเอาใจช่วย????????,0
พ่องตายไอ้ควาย.......ไปตรวจสิพม่าที้ทำงานมีใบอนุญาติกี่คนไอ้เหี้ย,1
Juneny Tanyaprach Kiatchirakavin นี่ผมจะบอกอะไรให้ขำๆนะมีพี่ที่ผมรู้จักเป็นลูกค้าผมเขาได้เมียเป็นคนลาวเขาบอกเลยว่าเพื่อนเมียเขาก็ลักลอบเข้ามาเพราะถ้าเบ้าปกติ โดนกักตัว 14วัน ถ้าอย่างพม่าผมก็ไม่แปลกใจครับ โลกไม่ได้สวยครับถ้าให้เงินผมนำแรงงานต่างด้าวเข้าประเทศผมก็เอาครับมีใครบ้างไม่เอาเงิน แล้วอีกอย่างนะงานบางประเภทคนไทยไม่ทำครับ ผมคนนึงก็ไม่ทำ ยกตัวอย่าง โรงไก่ตรง ม.กรุงเทพฯ ก็มีแต่แรงงานต่างด้าวครับ มันเหม็นมากคุณจะทำป่าวละ,0
สงสารผู้ประกอบ..ที่มีรัฐบาลเฮงซวยเช่นนี้ ไม่ล่าตัวเจ้าหน้าที่กระทำผิดที่มีการลักลอบพม่าเข้ามา,0
ประเทศไทยควรรักษาคน ในประเทศไทยก่อนไม่ควรให้พม่าเข้ามาเวลาประเทศไทยเป็นโควิดหนีตายกลับบ้านพอประเทศเองเป็นจะหนีตายเข้าประเทศเพื่อน เห็นแก่ตัวแรง ถ้าเป็นคนไทยไปอยู่ประเทศมันกดขี่ขมแหงแรงกว่าที่อยู่ประเทศเราอีก รัฐบาลอย่าให้เข้ามา คนไทยไม่ตอนรับคนเห็นแก่ตัว,1
January Love ใช้คนหาเช้ากินค่ำจะตายกันหมดเเล้วข้าวของก็แพงขึ้นทุกวันยังจะมาล็อคดาวเองถ้ารัฐบาลมาช่วยเหลืองพอว่าครั้งแรกโควิดมาก็พวกท่านพามาจากต่างประเภทให้ประชาชนอยู่บ้านทำงาน15วันนายจ้างจ่ายครึงเดียวตั้งสามเดือนเคยมาช่วยไม่ขอถามหน่อยประกันสังคมทีส่งไปทุกเดือนมาช่วยไม่ไม่มาเลยเงินเก็บอยู่ทีไหนต้องออกมากินเพือความอยู่รอดแม้แต่พระเครืองเคยสะสมไว้ต้องออกมาขายเพือความอยู่รอดครั้งทีสองก็ส่งทหารนอกมาฝึกมึงไทยพาเชื้องมาอีกพอโควิดหายไปได้สักพักก็พาคนพม่าเข้ามาอีกอย่างมาอ้างว่าป้องกันดีถ้าไม่มีคนพามามันจะมาถึงกทมหรือครับทางดีแก้ไข้ไม่ได้ก็เงียบไปเถอะปล่อยให้ตัวใครตัวมัน,0
ไม่มีแต่พม่าหลอกค่ะแถวนั้นก็คนไทยหลายยุสู้ๆๆค่ะ,0
เอาพม่าออกไป ให้คนให้ได้ทำมาหากิน ไม่ใช่ปิดตายปากท้องแบบนี้ ใครแบกรับค่าใช้จ่าย ตอบที พม่าหรอ,1
คิดไปคิดมากลับบ้านเราดีกว่า อย่างน้อยๆก็มีข้าวให้กิน สู้ให้ถึงที่สุด พี่น้อง #พม่า และ พี่น้อง #ไทยใหญ่ ของเรา,0
สงสารคนพม่าเลย ถ้าเจ้าของกิจการไม่ต้องการแรงงานพม่า เค้าจะเข้ามาได้เยอะขนาดนี้รึไง ยามดีใช้ ยามไข้ก็ต้องรักษานะ นึกถึงพวกไทยหนีไปเกาหลีญี่ปุ่นคงสภาพเดียวกัน,0
